George Godula,https://www.crunchbase.com/person/george-godula,Individual/Angel,43,5,"Shanghai, Shanghai, China",Asia-Pacific (APAC),"Cross-border angel / early stage investor with portfolio of 40+ startup companies and as of currently 4 exits, 4 unicorns & counting. Georg...",30,2,,,,,https://angel.co/p/george-godula,https://www.linkedin.com/in/georgegodula/,,,,,,Early Stage Venture,,,,"37,056"
Inventures SA,https://www.crunchbase.com/organization/inventures-sa,Venture Capital,43,4,"Brussels, Brussels Hoofdstedelijk Gewest, Belgium","European Union (EU), Europe, Middle East, and Africa (EMEA)","Inventures is the first European crowd-venturing impact fund, a venture capital based in Belgium investing in early stage impact businesses",24,,4,Active,2011-06-01,day,http://inventures.fund,https://www.linkedin.com/company/inventures-fund/,"Business Development, Crowdfunding, Finance, Financial Services, Impact Investing, Venture Capital","Financial Services, Lending and Investments, Professional Services",5,"Charles-Albert de Radzitzky, Gilles van der Meerschen, Guillaume Desclée, José Zurstrassen, Olivier de Duve",1-10,Early Stage Venture,,,Private,"46,723"
Pays de la Loire Participations,https://www.crunchbase.com/organization/pays-de-la-loire-participations,Private Equity Firm,43,1,"Nantes, Pays de la Loire, France","European Union (EU), Europe, Middle East, and Africa (EMEA)","Pays de la Loire Participations provides finance innovation, productivity and development, especially in a banking context.",38,,5,Active,,,http://www.plp-participations.fr/,https://www.linkedin.com/company/pays-de-la-loire-participations/,"Finance, Financial Services",Financial Services,,,1-10,"Private Equity, Seed",,,Private,"47,974"
Microsoft Accelerator Seattle,https://www.crunchbase.com/organization/microsoft-ventures-accelerator-seattle,Accelerator,43,13,"Redmond, Washington, United States","Greater Seattle Area, West Coast, Western US","Launched in 2014, Microsoft Ventures Accelerator Seattle funds and supports new technologies for home improvement and automation.",41,,3,Closed,2014-01-01,year,https://www.microsoftaccelerator.com/locations/seattle,,Smart Home,"Consumer Electronics, Real Estate",1,Arturo Devesa,101-250,Seed,,,Private,"52,981"
ABAB (Atlantic Business Angels Booster),https://www.crunchbase.com/organization/abab-atlantic-business-angels-booster,Angel Group,43,5,"Nantes, Pays de la Loire, France","European Union (EU), Europe, Middle East, and Africa (EMEA)",ABAB aims to unite businesses with projects and business angels.,42,,,Active,2008-01-01,year,http://www.businessbooster.fr,https://www.linkedin.com/company/abab-atlantique-business-angels-booster/?lipi=urn%3Ali%3Apage%3Acompanies_company_about_index%3B1e8417f0-30b0-4ed3-bf46-4b8ac18955e6,,,1,Gerard Estival,11-50,Seed,,,Private,"67,323"
TRGC,https://www.crunchbase.com/organization/trg-token-research-group,"Hedge Fund, Venture Capital",43,,"Amsterdam, Noord-Holland, The Netherlands","European Union (EU), Europe, Middle East, and Africa (EMEA)",TRGC is a digital asset fund focused on investment opportunities that will spark the internet’s next paradigm shift.,41,,1,Active,2018-01-01,day,http://trgc.io/,https://www.linkedin.com/company/trgc/,"Asset Management, Blockchain, Ethereum, Financial Services, Web3","Blockchain and Cryptocurrency, Financial Services, Internet Services, Other",1,Etienne vantKruys,1-10,"Early Stage Venture, Late Stage Venture, Seed, Venture",,,Private,"105,342"
Globivest,https://www.crunchbase.com/organization/globivest,Venture Capital,43,1,"Beirut, Beyrouth, Lebanon","Europe, Middle East, and Africa (EMEA), Middle East, Middle East and North Africa (MENA)",Globivest is a private investment firm that invests in early stages technology start-ups and sustainable businesses.,39,,,Active,2016-11-10,day,http://www.globivest.com,https://www.linkedin.com/company/globivest/,"Big Data, FinTech, Impact Investing, Information Technology, Product Design, Real Estate Investment","Data and Analytics, Design, Financial Services, Information Technology, Lending and Investments, Real Estate",1,Jasmine Busson,1-10,"Early Stage Venture, Seed",,,Private,"106,100"
MPGI,https://www.crunchbase.com/organization/mpgi-2,"Family Investment Office, Private Equity Firm, Venture Capital",43,5,"London, England, United Kingdom","Europe, Middle East, and Africa (EMEA)","MPGI is the investment arm of Mato Perić. Its portfolio companies raised $5bn+ in capital and employ 15,000+ people across 6 continents.",38,,3,Closed,2015-01-09,day,http://www.mpgi.co/,https://www.linkedin.com/company/mpgi/,"Financial Services, Venture Capital","Financial Services, Lending and Investments",1,Mato Perić,11-50,"Early Stage Venture, Late Stage Venture, Private Equity, Seed",For Profit,,Private,"129,358"
Moonwhale Ventures,https://www.crunchbase.com/organization/moonwhale-ventures,"Hedge Fund, Private Equity Firm",43,1,"London, West Virginia, United States",Southern US,Moonwhale Ventures is providing STO advisory to existing businesses and startups.,43,,2,Active,2017-10-01,month,https://moonwhale.io/,https://www.linkedin.com/company/moonwhalebv,"Blockchain, Consulting, Financial Services, Funding Platform, Incubators, Information Technology","Blockchain and Cryptocurrency, Financial Services, Information Technology, Lending and Investments, Other, Professional Services",1,Stefan Bergström,1-10,"Early Stage Venture, Private Equity",,,Private,"185,906"
Arrington Capital,https://www.crunchbase.com/organization/arrington-capital-9858,Venture Capital,42,4,"Seattle, Washington, United States","Greater Seattle Area, West Coast, Western US",Arrington Capital is a thesis-driven firm invests in digital assets.,39,4,10,Active,,,https://www.arringtoncapital.com/,https://www.linkedin.com/company/arrington-capital,,,1,Michael Arrington,11-50,"Early Stage Venture, Seed, Venture",,,Private,615
PeakBridge,https://www.crunchbase.com/organization/peakbridge,Venture Capital,42,1,"Valletta, NA - Malta, Malta","European Union (EU), Middle East and North Africa (MENA), Europe, Middle East, and Africa (EMEA)","PeakBridge is a global impact VC that funds and connects the people, technology and processes that will shape the future of food.",32,,21,Active,2017-01-01,year,https://peakbridge.vc,https://www.linkedin.com/company/peakbridge/?viewAsMember=true,"Financial Services, Food and Beverage, Venture Capital","Financial Services, Food and Beverage, Lending and Investments",2,"Erich Sieber, Nadav Berger",11-50,"Early Stage Venture, Late Stage Venture, Seed",,,Private,"1,044"
Karma Ventures,https://www.crunchbase.com/organization/karma-ventures,Venture Capital,42,5,"Tallinn, Harjumaa, Estonia","European Union (EU), Europe, Middle East, and Africa (EMEA)",Backing deep tech software start-ups in Europe at late Seed and Series A.,26,,26,Active,2016-01-01,year,http://www.karma.vc,https://www.linkedin.com/company/karma-ventures,"Finance, Financial Services, Venture Capital","Financial Services, Lending and Investments",3,"Kristjan Laanemaa, Margus Uudam, Tommi Uhari",1-10,"Early Stage Venture, Seed, Venture",,,Private,"1,173"
Swift Ventures,https://www.crunchbase.com/organization/swift-ventures,Venture Capital,42,2,"Lafayette, California, United States","San Francisco Bay Area, West Coast, Western US","Early Stage Venture Capital for AI, Automation, B2B SaaS Companies",30,,3,Active,2021-01-01,year,https://www.swift.vc/,https://www.linkedin.com/company/swift-ventures/,,,2,"Brett Wilson, John Hughes",1-10,Early Stage Venture,,,Private,"1,752"
Early Game Ventures,https://www.crunchbase.com/organization/early-game-ventures,Venture Capital,42,1,"Bucharest, Bucuresti, Romania","European Union (EU), Europe, Middle East, and Africa (EMEA)",Early Game Ventures invests in startups in the emerging markets of Europe.,28,,30,Active,2018-01-01,year,https://earlygame.vc,https://www.linkedin.com/company/early-game-ventures,Venture Capital,"Financial Services, Lending and Investments",2,"Cristian Munteanu, Dan Calugareanu",1-10,"Early Stage Venture, Seed",,,Private,"1,915"
Chorus One,https://www.crunchbase.com/organization/chorus-one,Private Equity Firm,42,1,"Rockville, Maryland, United States","Washington DC Metro Area, East Coast, Southern US",Chorus One is building validation and staking infrastructure for Proof-of-Stake networks.,42,,,Active,2018-02-01,day,https://www.chorus.one,https://www.linkedin.com/company/chorus-one/,"Blockchain, Cryptocurrency, Financial Services, FinTech, Internet, Internet of Things, Telecommunications","Blockchain and Cryptocurrency, Financial Services, Hardware, Internet Services, Other, Payments, Software",2,"Brian Fabian Crain, Meher Roy",51-100,,,,Private,"2,291"
SmartFin,https://www.crunchbase.com/organization/smartfin,"Private Equity Firm, Venture Capital",42,8,"Brussels, Brussels Hoofdstedelijk Gewest, Belgium","European Union (EU), Europe, Middle East, and Africa (EMEA)",SmartFin invests in B2B technology companies,27,1,17,Active,2014-06-01,day,http://www.smartfinvc.com,https://www.linkedin.com/company/smartfin-capital,Venture Capital,"Financial Services, Lending and Investments",6,"Bart Luyten, Jürgen Ingels, Mark Ziering, PHILIPPE MAUCHARD, Thomas Depuydt, Wim De Waele",11-50,"Early Stage Venture, Late Stage Venture, Private Equity, Seed, Venture",,Made Acquisitions,Private,"2,459"
IW Capital,https://www.crunchbase.com/organization/iw-capital,"Private Equity Firm, Venture Capital",42,1,"London, England, United Kingdom","Europe, Middle East, and Africa (EMEA)",IW Capital is a leading private investment house facilitating both debt and equity investment.,26,,33,Active,2011-01-01,year,http://iwcapital.co.uk/,https://www.linkedin.com/company/iw-capital,"Finance, Financial Services, Venture Capital","Financial Services, Lending and Investments",1,Luke Davis,11-50,"Early Stage Venture, Private Equity, Seed, Venture",,Made Acquisitions,Private,"2,477"
New Form Capital,https://www.crunchbase.com/organization/new-form-capital,Venture Capital,42,4,"New York, New York, United States","Greater New York Area, East Coast, Northeastern US",Early stage VC fund focused on the intersection of blockchain technology and financial markets,37,,5,Active,2019-01-01,year,http://www.newformcap.com,https://www.linkedin.com/company/30645606,"Blockchain, FinTech, Internet, Venture Capital","Blockchain and Cryptocurrency, Financial Services, Internet Services, Lending and Investments, Other",1,Alex Marinier,1-10,"Early Stage Venture, Initial Coin Offering, Seed, Venture",,,Private,"2,485"
Differential Ventures,https://www.crunchbase.com/organization/differential-ventures,Venture Capital,42,6,"New York, New York, United States","Greater New York Area, East Coast, Northeastern US",Differential Ventures is a seed-stage vc fund that invests in b2b data-oriented technology solutions.,29,,14,Active,2017-01-01,year,http://www.differential.vc,https://www.linkedin.com/company/differential-ventures/,"Artificial Intelligence (AI), Big Data, Cyber Security, FinTech, Machine Learning","Artificial Intelligence (AI), Data and Analytics, Financial Services, Information Technology, Privacy and Security, Science and Engineering, Software",2,"David Magerman, Nick Adams",1-10,"Early Stage Venture, Grant, Seed, Venture",,,Private,"2,736"
January Ventures,https://www.crunchbase.com/organization/january-ventures,Venture Capital,42,2,"Boston, Massachusetts, United States","Greater Boston Area, East Coast, New England",January Ventures is an early stage VC fund. We are replacing the friends & family round and re-writing the networks in venture.,35,,,Active,2018-01-01,year,http://january.ventures,https://www.linkedin.com/company/january-ventures/,"Finance, Financial Services, Venture Capital","Financial Services, Lending and Investments",2,"Jennifer Keiser Neundorfer, Maren Thomas Bannon",1-10,"Early Stage Venture, Seed",,,Private,"2,913"
Capital Q® Ventures Inc.,https://www.crunchbase.com/organization/capital-q-ventures,Venture Capital,42,,"Maitland, Florida, United States","East Coast, Southern US","Capital Q Ventures is an investment firm that specializes Tri-Party Venture Funds®, Private BDCs and Specialty Hedge Funds",42,,5,Active,2017-01-03,day,https://capitalqventures.com,https://www.linkedin.com/company/capital-q-ventures,Venture Capital,"Financial Services, Lending and Investments",2,"Bruno Quatrini, Michael ""Q"" Quatrini",11-50,"Early Stage Venture, Seed, Venture",,,Private,"5,247"
Moneta VC,https://www.crunchbase.com/organization/moneta-seeds,Venture Capital,42,6,"Tel Aviv-yafo, Tel Aviv, Israel","Europe, Middle East, and Africa (EMEA), Middle East, Middle East and North Africa (MENA)","An Israeli VC specializing in Fintech and Insurtech, investing globally from seed to growth stages",28,1,12,Active,2015-01-01,year,https://www.monetavc.com/,https://www.linkedin.com/company/monetavc/,"Financial Services, FinTech, Insurance, InsurTech, Venture Capital","Financial Services, Lending and Investments",2,"Adoram Ga'ash, Meirav Har Noy",1-10,"Early Stage Venture, Late Stage Venture, Seed",,,Private,"6,161"
BaltCap,https://www.crunchbase.com/organization/baltcap,Private Equity Firm,42,10,"Tallinn, Harjumaa, Estonia","European Union (EU), Europe, Middle East, and Africa (EMEA)",BaltCap is a private equity firm focusing on small and midmarket buyout and expansion capital investments in the Baltic States.,36,,26,Active,1995-01-01,year,http://www.baltcap.com,http://www.linkedin.com/company/baltcap-management,"Finance, Financial Services, Venture Capital","Financial Services, Lending and Investments",1,Kristjan Kalda,11-50,"Early Stage Venture, Private Equity, Seed",,Made Acquisitions,Private,"7,471"
Asahi Kasei,https://www.crunchbase.com/organization/asahi-kasei,Venture Capital,42,4,"Tokyo, Tokyo, Japan",Asia-Pacific (APAC),"Asahi Kasei provides solutions based in chemistry and materials science to a range of markets, including fibers, chemicals,",39,1,9,Active,1931-01-01,year,https://www.asahi-kasei.com,https://www.linkedin.com/company/asahi-kasei/,"Advanced Materials, Chemical, Industrial","Manufacturing, Science and Engineering",1,Shitagau Noguchi,10001+,,For Profit,Made Acquisitions,Public,"14,978"
MatterScale Ventures,https://www.crunchbase.com/organization/matterscale-ventures,Venture Capital,42,1,"New York, New York, United States","Greater New York Area, East Coast, Northeastern US",MatterScale Ventures invests in early stage Latin founders doing things that matter and that scale.,32,,5,Active,2020-08-01,month,https://www.matterscale.com,https://www.linkedin.com/company/matterscale,"Finance, Financial Services, Venture Capital","Financial Services, Lending and Investments",5,"Adriana Suarez, Antonio Lück, Fernando Fabre, Gabriela Macagni, Roberto Charvel",1-10,"Early Stage Venture, Seed",,,Private,"16,742"
#Angels,https://www.crunchbase.com/organization/-angels,Angel Group,42,9,"San Francisco, California, United States","San Francisco Bay Area, West Coast, Western US",#Angels is a team of operators collaborating to invest in great ideas and teams.,38,2,2,Active,2015-03-04,day,https://hashtagangels.com/,https://www.linkedin.com/company/-angels/,"Angel Investment, Podcast, Venture Capital","Financial Services, Lending and Investments, Media and Entertainment, Music and Audio",6,"April Underwood, Chloe Sladden, Jana Messerschmidt, Jessica Verrilli, Katie Stanton, Vijaya Gadde",11-50,Early Stage Venture,,,Private,"18,528"
Korys,https://www.crunchbase.com/organization/korys,Family Investment Office,42,9,"Halle, Vlaams-Brabant, Belgium","European Union (EU), Europe, Middle East, and Africa (EMEA)","Korys is an investment management company focusing on investing in the life sciences, conscious consumer, and energy transition sectors.",32,2,19,Active,2011-01-01,year,http://www.korys.be/,https://www.linkedin.com/company/korys,"Finance, Financial Services, Impact Investing, Venture Capital","Financial Services, Lending and Investments",1,Dirk Creado,11-50,"Late Stage Venture, Private Equity, Seed",,Made Acquisitions,Private,"19,767"
FAST — by GETTYLAB,https://www.crunchbase.com/organization/f-st,Venture Capital,42,2,"San Francisco, California, United States","San Francisco Bay Area, West Coast, Western US","Backing engineers building awe, wonder, speed.",38,,,Active,,,https://f-st.com,https://linkedin.com/company/f-st,,,1,Aniq Kassam,1-10,Early Stage Venture,,,Private,"19,830"
Concrete Rose Capital,https://www.crunchbase.com/organization/concrete-rose-capital,Venture Capital,42,3,"Menlo Park, California, United States","San Francisco Bay Area, Silicon Valley, West Coast",Concrete Rose Capital operates as an early-stage investment platform that primarily invests in companies serving underrepresented consumers.,34,,2,Active,2019-01-01,year,https://www.concreterosecapital.com/,https://www.linkedin.com/company/concreterose/,"Finance, Financial Services, FinTech, Venture Capital","Financial Services, Lending and Investments",3,"Jason Norman, Jason Norman, Sean Mendy",11-50,"Early Stage Venture, Seed",,,Private,"20,973"
Join Capital,https://www.crunchbase.com/organization/join-capital,Venture Capital,42,5,"Berlin, Berlin, Germany","European Union (EU), Europe, Middle East, and Africa (EMEA)",Join Capital is a Berlin-based early stage venture capital firm investing in enterprise technology and industry 4.0 startups.,30,,24,Active,2015-01-01,year,http://www.join.capital/,https://www.linkedin.com/company/10208448,"B2B, Enterprise Software, Venture Capital","Financial Services, Lending and Investments, Other, Software",3,"Jan Borgstaedt, Sebastian Ribbentrop, Tobias Schirmer",1-10,"Early Stage Venture, Seed, Venture",,,Private,"22,752"
Artificial Intelligence Factory,https://www.crunchbase.com/organization/artificial-intelligence-factory,Accelerator,42,,"Besiktas, Istanbul, Turkey","Europe, Middle East, and Africa (EMEA), Middle East, Middle East and North Africa (MENA)",Artificial Intelligence Factory focus on cooperation and investment with Turkish AI initiatives.,41,,5,Active,2023-01-01,year,https://yapayzekafabrikasi.com.tr/,https://www.linkedin.com/company/ai-startup-factory-yapay-zeka-giri%C5%9Fim-fabrikas%C4%B1,,,,,11-50,,,,Private,"23,354"
Core Vision Investments,https://www.crunchbase.com/organization/core-vision-investments,Venture Capital,42,,"Riyadh, Ar Riyad, Saudi Arabia","Europe, Middle East, and Africa (EMEA), Gulf Cooperation Council (GCC), Middle East",Core Vision Investments operates as a venture capital firm.,41,,9,Active,2023-01-01,year,https://corevision.sa,https://www.linkedin.com/company/core-vision/,,,,,1-10,Seed,,Made Acquisitions,Private,"23,514"
Chile Ventures,https://www.crunchbase.com/organization/chile-ventures,Venture Capital,42,3,"Santiago, Region Metropolitana, Chile",Latin America,Chile Ventures is a VC firm that invests in early-stage SaaS and subscription based startups.,39,,15,Active,2015-01-01,year,http://www.chileventures.vc,https://www.linkedin.com/company/chile-ventures,"SaaS, Software, Subscription Service","Other, Software",1,Felipe Matta Navarro,1-10,"Early Stage Venture, Seed",,,Private,"25,017"
Nick Candito,https://www.crunchbase.com/person/nick-candito,Individual/Angel,42,5,"United States, North America",,Enterprise software executive and startup investor/advisor in over 150 companies. He is currently the co-founder of ACOF (www.angelcollecti...,40,,,,,,https://netshire.co/,https://www.linkedin.com/in/candito,,,,,,Early Stage Venture,,,,"25,120"
GELLIFY,https://www.crunchbase.com/organization/gellify,,42,7,"Bologna, Emilia-Romagna, Italy","European Union (EU), Europe, Middle East, and Africa (EMEA)",GELLIFY is the first B2B innovation platform able to connect B2B digital startups and traditional companies.,39,1,2,Active,2017-09-01,day,http://www.gellify.com/,https://www.linkedin.com/company/gellify/?originalSubdomain=in,"B2B, Internet, Software","Internet Services, Other, Software",4,"Fabio Nalucci, Gianluigi Martina, Massimo Cannizzo, Michele Giordani",101-250,,For Profit,,Private,"25,395"
Ryan Merket,https://www.crunchbase.com/person/ryan-merket,Individual/Angel,42,8,"Austin, Texas, United States",Southern US,"I work with high-potential startups at Microsoft, identifying and empowering top AI startups to achieve more. With over 12 years of experien...",42,,,,,,http://www.ryanmerket.com,http://www.linkedin.com/in/ryanmerket,,,,,,Seed,,,,"25,694"
TGM ventures,https://www.crunchbase.com/organization/tgm-ventures,"Angel Group, Venture Capital",42,6,"Santa Monica, California, United States","Greater Los Angeles Area, West Coast, Western US",TGM ventures mainly focuses on early stage internet companies including social media companies.,42,1,,Active,2006-01-01,year,http://tgm.com/,https://www.linkedin.com/company-beta/729867/,Financial Services,Financial Services,1,Thomas McInerney,11-50,"Early Stage Venture, Seed",,,Private,"26,074"
DOB Equity,https://www.crunchbase.com/organization/dob-equity,"Private Equity Firm, Venture Capital",42,,"Veessen, Gelderland, The Netherlands","European Union (EU), Europe, Middle East, and Africa (EMEA)","DOB Equity is an independent, long-term investor in companies in East Africa",30,,24,Active,1997-01-01,year,http://www.dobequity.nl,https://www.linkedin.com/company/dob-foundation,Venture Capital,"Financial Services, Lending and Investments",,,1-10,"Early Stage Venture, Late Stage Venture, Private Equity, Seed, Venture",,Made Acquisitions,Private,"26,542"
Sina Afra,https://www.crunchbase.com/person/sina-afra,Individual/Angel,42,13,"Istanbul, Istanbul, Turkey","Europe, Middle East, and Africa (EMEA), Middle East, Middle East and North Africa (MENA)",Sina Afra is the CEO and Founder of Tiko. He previously worked at Markafoni as a CEO and Founder. Sina Afra attended the University of Münst...,37,1,2,,,,http://www.sinaafra.com,https://www.linkedin.com/in/sinaafra,,,,,,Seed,,,,"26,564"
LeadX Capital Partners,https://www.crunchbase.com/organization/leadx-capital-partners,"Private Equity Firm, Venture Capital",42,4,"Munich, Bayern, Germany","European Union (EU), Europe, Middle East, and Africa (EMEA)",LeadX Capital Partners is an investor backing growth-stage technology companies driving the digital transformation of consumer industries.,40,,2,Active,2016-01-01,year,https://www.leadxcapital.com,https://www.linkedin.com/company/leadx-capital-partners/,"Information Services, Information Technology, Retail","Commerce and Shopping, Information Technology",2,"Hansjorg Sage, James Hook",1-10,"Late Stage Venture, Private Equity",,,Private,"26,921"
FOUNDER.org,https://www.crunchbase.com/organization/founder-org,Venture Capital,42,6,"San Francisco, California, United States","San Francisco Bay Area, West Coast, Western US",Investor and company building program for student entrepreneurs.,39,,22,Active,2012-09-01,day,http://www.founder.org,https://www.linkedin.com/company/founder-org/,"Banking, Finance, Venture Capital","Financial Services, Lending and Investments",1,Michael Baum,11-50,"Early Stage Venture, Seed",,,Private,"27,422"
Misk 500 MENA Accelerator,https://www.crunchbase.com/organization/misk-500-mena-accelerator,Accelerator,42,3,"Riyadh, Ar Riyad, Saudi Arabia","Europe, Middle East, and Africa (EMEA), Gulf Cooperation Council (GCC), Middle East","Misk 500 MENA Accelerator invests in B2B, B2C, e-commerce, fintech, and more, focusing on companies from the MENA region.",40,,16,Active,,,https://programs.500.co/misk500,,,,,,,,,,Private,"27,558"
SeedFolio,https://www.crunchbase.com/organization/seedfolio,Venture Capital,42,,"San Diego, California, United States","Greater San Diego Area, West Coast, Western US",SeedFolio is a seed-stage venture capital firm investing in early-stage companies with impact in life sciences and resource efficiency.,41,,4,Active,2020-01-01,year,https://www.seedfolio.vc,https://www.linkedin.com/company/seedfolio,"Business Development, Financial Services, Life Science, Venture Capital","Biotechnology, Financial Services, Lending and Investments, Professional Services, Science and Engineering",,,1-10,Early Stage Venture,,,Private,"28,292"
Media Ventures,https://www.crunchbase.com/organization/media-ventures,Venture Capital,42,10,"Cologne, Nordrhein-Westfalen, Germany","European Union (EU), Europe, Middle East, and Africa (EMEA)",Media Ventures is an private venture capital company.,36,,30,Active,2000-01-01,year,http://mediaventures.de,,"Finance, Social Media, Venture Capital","Financial Services, Internet Services, Lending and Investments, Media and Entertainment",1,Dirk Ströer,1-10,"Early Stage Venture, Late Stage Venture, Seed",,Made Acquisitions,Private,"29,223"
Aggregate Media,https://www.crunchbase.com/organization/aggregate-media,Venture Capital,42,1,"Stockholm, Stockholms Lan, Sweden","European Union (EU), Nordic Countries, Scandinavia",Aggregate is a venture capital company investing with media as expansion capital - media for equity.,40,,9,Active,2002-01-01,year,http://www.aggregatemedia.com,https://www.linkedin.com/company/aggregate-media?trk=biz-companies-cym,,,3,"Patrik Rosén, Peter Brodén, Peter Brodén",1-10,"Early Stage Venture, Seed, Venture",,,Private,"29,637"
Mola,https://www.crunchbase.com/organization/mola-com,Incubator,42,2,"Palma De Mallorca, Islas Baleares, Spain","European Union (EU), Europe, Middle East, and Africa (EMEA)",Mola is an investment fund based in Spain specializing in technology startup companies at the seed stage in Spain and Latin America.,38,,27,Active,2011-09-10,day,https://www.mola.com/,https://www.linkedin.com/company/mola-com/,"Finance, FinTech, Incubators, Venture Capital","Financial Services, Lending and Investments",2,"Enrique Dubois, Paco Gimena",11-50,"Early Stage Venture, Seed",For Profit,,Private,"32,851"
