Polygon Ventures,https://www.crunchbase.com/organization/polygon-ventures,Venture Capital,65,3,"Tórtola, Castilla-La Mancha, Spain","European Union (EU), Europe, Middle East, and Africa (EMEA)",Polygon Ventures is an investment firm that focuses on early-stage Web3 startups.,9,65,,Active,2022-01-01,year,https://www.p2v.ventures/,,"Blockchain and Cryptocurrency, Internet Services",Web3,,,1-10,"Early Stage Venture, Initial Coin Offering, Seed, Venture",,,Private
seed + speed,https://www.crunchbase.com/organization/seed-speed-ventures,Venture Capital,65,7,"Berlin, Berlin, Germany","European Union (EU), Europe, Middle East, and Africa (EMEA)",seed + speed is a venture capital firm that focuses on seed investments.,19,56,,Active,2016-01-01,year,http://www.seedandspeed.com,https://www.linkedin.com/company/seedandspeed,"Financial Services, Hardware, Software","Enterprise Software, FinTech, Software, Virtual Reality",1,Carsten Maschmeyer,11-50,"Early Stage Venture, Seed",,,Private
bm-t beteiligungsmanagement thuringen,https://www.crunchbase.com/organization/bm-t-beteiligungsmanagement-thüringen,"Private Equity Firm, Venture Capital",65,7,"Erfurt, Thuringen, Germany","European Union (EU), Europe, Middle East, and Africa (EMEA)",bm-t beteiligungsmanagement thüringen is a regional venture capital and private equity company with fokus on Thüringen/ Germany only.,40,47,1,Active,2003-01-01,year,https://www.bm-t.com/,https://www.linkedin.com/company/bm-t-beteiligungsmanagement-th-ringen-gmbh/,"Financial Services, Lending and Investments","Finance, Financial Services, Venture Capital",,,11-50,"Early Stage Venture, Late Stage Venture, Private Equity, Seed, Venture",,,Private
Silverbacks Holdings,https://www.crunchbase.com/organization/silverbacks-holdings,Venture Capital,64,3,"Ebène, Plaines Wilhems, Mauritius","Europe, Middle East, and Africa (EMEA)",Silverbacks Holdings is a venture capital firm that offers financial services.,2,64,2,Active,2001-01-01,year,https://silverbacks.holdings,https://www.linkedin.com/company/silverbacks-holdings,"Financial Services, Lending and Investments, Media and Entertainment","Advice, Financial Services, Venture Capital",,,1-10,,,,Private
Partner Ventures,https://www.crunchbase.com/organization/partner-ventures-llc,Venture Capital,64,7,"Portola Valley, California, United States","San Francisco Bay Area, West Coast, Western US",Partner Ventures is a 'secondary direct' venture capital fund.,1,60,2,Active,2009-10-01,month,http://www.partnervc.com/,https://www.linkedin.com/company/partner-ventures,,,,,1-10,"Early Stage Venture, Late Stage Venture, Venture",,,Private
Delta Blockchain Fund,https://www.crunchbase.com/organization/delta-blockchain-fund,Venture Capital,63,3,"New York, New York, United States","Greater New York Area, East Coast, Northeastern US",Delta Blockchain Fund is an early-stage venture capital fund supporting developers and visionaries building the world of decentralization.,13,59,2,Active,2021-01-01,year,https://www.deltafund.io/,https://www.linkedin.com/company/delta-blockchain-fund/,"Financial Services, Lending and Investments",Venture Capital,1,Kavita Gupta,11-50,Early Stage Venture,,,Private
DvH Ventures,https://www.crunchbase.com/organization/dvh-ventures,Venture Capital,63,6,"Köln, Nordrhein-Westfalen, Germany","European Union (EU), Europe, Middle East, and Africa (EMEA)",Dieter von Holtzbrinck Ventures (DvH Ventures) is one of the leading European early-stage investors.,19,37,,Active,2014-01-01,year,http://dvhventures.de/,https://www.linkedin.com/company/dieter-von-holtzbrinck-ventures-gmbh/,"Education, Financial Services, Health Care, Lending and Investments","Education, FinTech, Health Care, Venture Capital",3,"Duc Quyen Tran, Fabian von Trotha, Peter Richarz",1-10,"Debt, Early Stage Venture, Late Stage Venture, Seed, Venture",,,Private
Porsche Ventures,https://www.crunchbase.com/organization/porsche-ventures,"Corporate Venture Capital, Private Equity Firm",63,6,"Stuttgart, Baden-Wurttemberg, Germany","European Union (EU), Europe, Middle East, and Africa (EMEA)",Porsche Ventures is a venture capital arm of Porsche that invests in companies from early-stage through growth.,18,47,1,Active,2018-01-01,year,https://www.porsche.ventures,https://www.linkedin.com/company/porsche-ventures,"Financial Services, Lending and Investments","Finance, Financial Services, Venture Capital",,,11-50,"Convertible Note, Early Stage Venture, Late Stage Venture, Seed, Venture",,,Private
LIFTT,https://www.crunchbase.com/organization/liftt,Venture Capital,63,2,"Turin, Piemonte, Italy","European Union (EU), Europe, Middle East, and Africa (EMEA)",Tech Transfer Investment Fund,21,50,,Active,2019-01-01,year,https://www.liftt.com,https://www.linkedin.com/company/liftt-spa,,,,,11-50,"Early Stage Venture, Late Stage Venture, Seed",,,Private
Davidovs Venture Collective,https://www.crunchbase.com/organization/davidovs-vc,Venture Capital,63,3,"Los Altos, California, United States","San Francisco Bay Area, Silicon Valley, West Coast",Davidovs Venture Collective is a venture capital firm that focuses on technology investments.,3,57,,Active,2021-01-01,year,https://davidovs.com,https://www.linkedin.com/company/davidovs-vc,"Artificial Intelligence (AI), Data and Analytics, Financial Services, Hardware, Lending and Investments, Science and Engineering, Software","Angel Investment, Artificial Intelligence (AI), Robotics, Venture Capital",2,"Marina Davidova, Nick Davidov",1-10,"Early Stage Venture, Seed",,,Private
The LAO,https://www.crunchbase.com/organization/the-lao,Venture Capital,63,2,"Brooklyn, New York, United States","Greater New York Area, East Coast, Northeastern US","The LAO is a venture capital firm that invests in the cryptocurrency, blockchain, and application software sectors.",2,59,,Active,2019-01-01,year,https://thelao.io/,,"Blockchain and Cryptocurrency, Financial Services, Lending and Investments, Other","Blockchain, Ethereum, Venture Capital",,,1-10,"Convertible Note, Early Stage Venture, Initial Coin Offering, Seed, Venture",,,Private
Burda Principal Investments,https://www.crunchbase.com/organization/burda-principal-investments,Venture Capital,63,6,"Munich, Bayern, Germany","European Union (EU), Europe, Middle East, and Africa (EMEA)","Burda Principal Investments is the growth capital arm of Hubert Burda Media, providing capital and strategic support for growth companies.",24,39,1,Active,2015-01-01,year,http://www.burdaprincipalinvestments.com/,https://www.linkedin.com/company/11065581/,"Financial Services, Lending and Investments",Venture Capital,,,11-50,"Early Stage Venture, Late Stage Venture, Private Equity, Seed, Venture",,,Private
Atlassian Ventures,https://www.crunchbase.com/organization/atlassian-ventures,Corporate Venture Capital,62,7,"Sydney, New South Wales, Australia","Asia-Pacific (APAC), Australasia",Atlassian Ventures invests in early-stage companies focused on building apps for cloud products.,10,57,,Active,2002-01-01,year,https://www.atlassian.com/company/ventures,,"Financial Services, Professional Services","Business Development, Finance, Financial Services",2,"Mike Cannon-Brookes, Scott Farquhar",1-10,"Early Stage Venture, Late Stage Venture, Seed, Venture",,,Private
Ananda Impact Ventures,https://www.crunchbase.com/organization/ananda-ventures-gmbh-social-venture-fund,Venture Capital,62,4,"Munich, Bayern, Germany","European Union (EU), Europe, Middle East, and Africa (EMEA)",Let's build stuff that truly matters! We back game-changing companies across Europe to achieve global impact.,24,44,,Active,2010-01-01,year,https://ananda.vc/,https://www.linkedin.com/company/ananda-impact-ventures,"Financial Services, Lending and Investments","Finance, Impact Investing, Venture Capital",2,"Florian Erber, Johannes Weber",11-50,"Early Stage Venture, Seed, Venture",,,Private
Yes VC,https://www.crunchbase.com/organization/yes-vc,"Micro VC, Venture Capital",62,2,"San Francisco, California, United States","San Francisco Bay Area, West Coast, Western US",A San Francisco-based pre-seed and seed-stage firm.,9,50,,Active,2018-01-01,year,https://yes.vc/,https://www.linkedin.com/company/18449758/,"Financial Services, Lending and Investments",Venture Capital,2,"Caterina Fake, Jyri Engestrom",1-10,"Early Stage Venture, Late Stage Venture, Seed, Venture",,,Private
Creator Fund,https://www.crunchbase.com/organization/creator-fund,Venture Capital,62,2,"London, England, United Kingdom","Europe, Middle East, and Africa (EMEA)",Backing founders building on the frontier of what's possible. Investing in university founders across Europe.,24,49,,Active,2019-09-01,day,https://www.thecreatorfund.com/,https://www.linkedin.com/company/11796947,Financial Services,Financial Services,1,Jamie Macfarlane,11-50,"Early Stage Venture, Seed",,,Private
SevenVentures,https://www.crunchbase.com/organization/sevenventures,"Corporate Venture Capital, Startup Competition, Venture Capital",62,15,"Unterföhring, Bayern, Germany","European Union (EU), Europe, Middle East, and Africa (EMEA)",SevenVentures is a leading venture capital firm that accelerates growth of B2C companies with media and very selected cash investments.,13,53,,Active,2009-01-01,year,http://sevenventures.de,https://www.linkedin.com/company/10262962,"Advertising, Commerce and Shopping, Content and Publishing, Education, Financial Services, Food and Beverage, Health Care, Media and Entertainment, Sales and Marketing","Advertising, E-Commerce, Education, Financial Services, Food and Beverage, Health Care, Medical, Publishing, Retail, Training",1,ProSiebenSat.1 Media SE,11-50,"Early Stage Venture, Late Stage Venture, Seed, Venture",,,Private
ZAKA VC,https://www.crunchbase.com/organization/zaka-startups,"Family Investment Office, Venture Capital",61,,"Prague, Hlavni mesto Praha, Czech Republic","European Union (EU), Europe, Middle East, and Africa (EMEA)","ZAKA VC is a pre-seed and seed-focused VC fund, investing in tech startups in North America and Europe.",10,51,,Active,2019-01-01,year,https://zaka.vc/,https://www.linkedin.com/company/zakastartups/,"Financial Services, Lending and Investments","Financial Services, Venture Capital",1,Jan Kasper,11-50,"Convertible Note, Early Stage Venture, Seed",,,Private
Force Ventures,https://www.crunchbase.com/organization/force-ventures-3142,"Private Equity Firm, Venture Capital",61,3,"Bengaluru, Karnataka, India",Asia-Pacific (APAC),Force Ventures is a multi asset class investment firm.,3,57,,Active,2021-01-01,year,https://forceventures.in/,https://www.linkedin.com/company/forceventures/,,,,,1-10,"Early Stage Venture, Late Stage Venture",,,Private
Impulse VC,https://www.crunchbase.com/organization/impulsevc,Venture Capital,61,10,"Moscow, Moscow City, Russian Federation","Europe, Middle East, and Africa (EMEA)",Impulse VC is a fund for technological internet companies.,16,49,,Closed,2013-01-01,year,http://impulsevc.com,,"Data and Analytics, Financial Services, Internet Services, Other, Sales and Marketing, Software","Big Data, Financial Services, Internet of Things, Marketing, Real Time, SaaS",2,"Grigory Firsov, Kirill Belov",11-50,"Early Stage Venture, Seed",,,Private
Forward Venture Capital,https://www.crunchbase.com/organization/forward-venture-capital,Venture Capital,61,1,"Den Haag, Zuid-Holland, The Netherlands","European Union (EU), Europe, Middle East, and Africa (EMEA)",Forward Venture Capital provides venture capital for startups and scaleups that provide clever solutions for new or existing problems,4,43,,Active,2016-10-14,day,http://forwardvc.com/,https://www.linkedin.com/company-beta/18072245/,,,2,"Ruud Dekker, Vincent Wols",1-10,"Convertible Note, Early Stage Venture, Seed",,,Private
Avalon Wealth Club,https://www.crunchbase.com/organization/avalon-wealth-club,Venture Capital,61,,"Helmshore, Lancashire, United Kingdom","Europe, Middle East, and Africa (EMEA)","Avalon Wealth is a group of marketing experts, blockchain veterans, real estate investors and event organizers.",,60,,Active,2021-01-01,year,https://avalonwealthclub.com/,,,,1,Abdul Qadir,1-10,"Early Stage Venture, Seed, Venture",,,Private
BioGeneration Ventures,https://www.crunchbase.com/organization/biogeneration-ventures,"Micro VC, Venture Capital",60,9,"Naarden, Noord-Holland, The Netherlands","European Union (EU), Europe, Middle East, and Africa (EMEA)",BioGeneration Ventures is investing in the next generation of Life Sciences companies in the Netherlands.,17,42,2,Active,2006-01-01,year,http://www.biogenerationventures.com,http://www.linkedin.com/company/biogeneration-ventures,"Biotechnology, Financial Services, Lending and Investments, Science and Engineering","Financial Services, Life Science, Venture Capital",1,Edward van Wezel,1-10,"Early Stage Venture, Seed",,,Private
Lifetime Ventures,https://www.crunchbase.com/organization/lifetime-ventures,"Incubator, University Program, Venture Capital",60,,"Yokohama, Kanagawa, Japan",Asia-Pacific (APAC),"Lifetime Ventures is a pre-seed vc that invests in earnest, unconventional “talent” to create businesses that will last for 30 years.",41,43,,Active,2017-01-27,day,https://en.lifetime-ventures.com/,https://www.linkedin.com/company/lifetime-ventures,"Financial Services, Lending and Investments","Incubators, Venture Capital",2,"Koshu Kunii, Ryosuke Kimura",11-50,"Early Stage Venture, Seed, Venture",,,Private
Wellstreet,https://www.crunchbase.com/organization/wellstreet,"Accelerator, Venture Capital",60,7,"Stockholm, Stockholms Lan, Sweden","European Union (EU), Nordic Countries, Scandinavia","Wellstreet exist to build and accelerate the innovations and entrepreneurs of today, leading to a better and sounder tomorrow.",25,54,1,Active,2016-02-25,day,http://www.wellstreet.se,https://www.linkedin.com/company/wellstreet,"Financial Services, Lending and Investments, Other, Sales and Marketing","Digital Marketing, Infrastructure, Venture Capital",2,"Mikael Wintzell, Sïmon Saneback",1-10,"Convertible Note, Early Stage Venture, Post-Ipo, Seed, Venture",,Made Acquisitions,Private
Senovo,https://www.crunchbase.com/organization/senovo,Venture Capital,60,9,"München, Bayern, Germany","European Union (EU), Europe, Middle East, and Africa (EMEA)",Senovo focuses on early stage B2B SaaS investments.,23,34,,Active,2013-01-01,year,https://www.senovo.vc/,https://www.linkedin.com/company/senovo-gmbh,"Financial Services, Lending and Investments, Software","Finance, Financial Services, SaaS, Software, Venture Capital",3,"Alexander Buchberger, Frederick Mallinckrodt, Markus Grundmann",1-10,"Early Stage Venture, Late Stage Venture, Seed, Venture",,,Private
Rancilio Cube Sicaf,https://www.crunchbase.com/organization/ranciliocube,"Family Investment Office, Fund Of Funds, Venture Capital",60,18,"Milano, Lombardia, Italy","European Union (EU), Europe, Middle East, and Africa (EMEA)","Rancilio Cube is an Italian family office with an international view: focused on venture, growth and impact investments.",,56,7,Active,2013-12-10,day,http://www.ranciliocubesicaf.com/,https://www.linkedin.com/company/rancilio-cube-srl/,"Financial Services, Lending and Investments","Finance, Financial Services, Impact Investing, Venture Capital",2,"Luca Rancilio, Silvia Rancilio",11-50,"Convertible Note, Early Stage Venture, Late Stage Venture, Private Equity, Seed, Venture",,,Private
Angular Ventures,https://www.crunchbase.com/organization/angular-ventures,Venture Capital,59,3,"London, England, United Kingdom","Europe, Middle East, and Africa (EMEA)",Angular Ventures is a specialist venture capital firm backing early-stage deep technology enterprise companies.,25,36,,Active,2018-01-01,year,http://www.angularventures.com,https://www.linkedin.com/company/angularventures,"Financial Services, Lending and Investments","Finance, Financial Services, Venture Capital",1,Gil Dibner,11-50,"Early Stage Venture, Late Stage Venture, Seed, Venture",,,Private
henQ,https://www.crunchbase.com/organization/henq-invest,Venture Capital,59,10,"Amsterdam, Noord-Holland, The Netherlands","European Union (EU), Europe, Middle East, and Africa (EMEA)",Early-stage funding for the odd ones out in B2B software.,36,37,,Active,2004-01-01,year,https://henq.vc/,http://www.linkedin.com/company/henq-invest,"Apps, Financial Services, Information Technology, Internet Services, Lending and Investments, Other, Software","Angel Investment, B2B, Enterprise Applications, Enterprise Software, FinTech, Information Technology, Internet",2,"Coen van Duiven, Herman Hintzen",11-50,"Early Stage Venture, Late Stage Venture, Seed, Venture",,,Private
Pitchdrive,https://www.crunchbase.com/organization/pitchdrive,Venture Capital,59,3,"Antwerp, Antwerpen, Belgium","European Union (EU), Europe, Middle East, and Africa (EMEA)","Pitchdrive selects (data-driven), funds and supports European early-stage startups. By founders for founders.",24,50,,Active,2018-10-01,month,https://www.pitchdrive.com,https://www.linkedin.com/company/pitchdrive/,"Financial Services, Internet Services","Financial Services, Internet",4,"Boris Bogaert, Koen Christiaens, Lorenz Bogaert, Wim Derkinderen",11-50,"Early Stage Venture, Private Equity, Seed",,,Private
Leo Capital,https://www.crunchbase.com/organization/leo-capital-india,Venture Capital,59,3,"Singapore, Central Region, Singapore","Asia-Pacific (APAC), Association of Southeast Asian Nations (ASEAN), Southeast Asia",Leo Capital is a venture capital fund investing in early stage and technology centric opportunities.,33,43,,Active,2018-06-16,day,http://www.leo.capital,https://www.linkedin.com/company/leodotcapital,"Financial Services, Lending and Investments, Professional Services","Business Development, Financial Services, Venture Capital",2,"Rajul Garg, Shwetank Verma",1-10,Early Stage Venture,,,Private
Revo Capital,https://www.crunchbase.com/organization/revo-capital,Venture Capital,59,8,"Istanbul, Istanbul, Turkey","Europe, Middle East, and Africa (EMEA), Middle East, Middle East and North Africa (MENA)","Largest VC of Turkey with $188M AUM. Investing €90M second fund in tech-driven Series A+ startups in Turkey, Eastern Europe & Baltics.",17,39,,Active,2013-01-01,year,http://www.revo.vc,http://www.linkedin.com/company/3066683,"Artificial Intelligence (AI), Data and Analytics, Financial Services, Health Care, Mobile, Other, Science and Engineering, Software","Artificial Intelligence (AI), B2B, B2C, Big Data, FinTech, mHealth, PaaS",2,"Berkin Toktaş, Cenk Bayrakdar",11-50,"Early Stage Venture, Late Stage Venture, Seed, Venture",,,Private
Re-Pie Asset Management,https://www.crunchbase.com/organization/re-pie-asset-management,"Private Equity Firm, Venture Capital",59,5,"Istanbul, Istanbul, Turkey","Europe, Middle East, and Africa (EMEA), Middle East, Middle East and North Africa (MENA)",Re-Pie is an asset management company.,24,42,1,Active,2014-01-01,year,http://www.re-pie.com/,https://www.linkedin.com/company/re-pie-asset-management,"Administrative Services, Financial Services, Health Care, Lending and Investments, Other","B2B, B2C, Delivery, Financial Services, Home Health Care, Venture Capital",3,"Caner Bingöl, Dr. M. Emre Çamlıbel, Mehmet Ali Ergin",51-100,"Early Stage Venture, Private Equity, Seed",,Made Acquisitions,Private
North Base Media,https://www.crunchbase.com/organization/north-base-media,Venture Capital,59,7,"Singapore, Central Region, Singapore","Asia-Pacific (APAC), Association of Southeast Asian Nations (ASEAN), Southeast Asia",An operator-led investment firm focused on opportunities in digital media in emerging markets.,14,42,1,Active,2014-01-01,year,http://northbasemedia.com,http://www.linkedin.com/company/north-base-media,"Content and Publishing, Events, Gaming, Media and Entertainment, Music and Audio, Sports, Video","Audio, Digital Media, eSports, Events, Journalism, Media and Entertainment, Podcast, Video Games, Video Streaming",2,"Marcus Brauchli, Sasa Vucinic",1-10,"Convertible Note, Early Stage Venture, Late Stage Venture, Non Equity Assistance, Seed, Venture",,,Private
METRO Xcel,https://www.crunchbase.com/organization/techstars-metro,"Accelerator, Incubator, Venture Capital",59,5,"Berlin, Berlin, Germany","European Union (EU), Europe, Middle East, and Africa (EMEA)",METRO Xcel is a selective sales driven program for technology startups targeting hospitality and retail industries.,3,58,,Active,2015-01-01,year,http://www.metroaccelerator.com,https://www.linkedin.com/company/metro-accelerator,"Commerce and Shopping, Hardware, Software, Travel and Tourism","Hospitality, Retail Technology",,,1-10,"Convertible Note, Early Stage Venture, Late Stage Venture, Venture",,,Private
Crossbeam Venture Partners,https://www.crunchbase.com/organization/crossbeam-venture-partners,Venture Capital,58,3,"New York, New York, United States","Greater New York Area, East Coast, Northeastern US",Crossbeam primarily invest in early-stage technology startups.,16,47,,Active,2020-01-01,year,https://crossbeam.vc,https://www.linkedin.com/company/68860416,,,1,Ali Hamed,11-50,"Early Stage Venture, Seed",,,Private
CommerzVentures,https://www.crunchbase.com/organization/commerzventures-gmbh,Venture Capital,58,5,"Frankfurt, Hessen, Germany","European Union (EU), Europe, Middle East, and Africa (EMEA)",CommerzVentures specializes in early- and growth-stage companies in the financial services and insurance sectors.,29,40,1,Active,2014-10-01,day,http://www.commerzventures.com,https://www.linkedin.com/company/commerzventures,"Financial Services, Lending and Investments","Financial Services, FinTech, Insurance, Venture Capital",1,Patrick Meisberger,1-10,"Early Stage Venture, Late Stage Venture, Seed, Venture",,,Private
Network.VC,https://www.crunchbase.com/organization/network-vc-syndicate-fund,"Syndicate, Venture Capital",58,6,"Menlo Park, California, United States","San Francisco Bay Area, Silicon Valley, West Coast",Venture Funds and Operating System for Independent VC Professionals,1,51,,Active,2019-01-01,year,https://network.vc/,https://www.linkedin.com/company/network-vc/,"Apps, Biotechnology, Health Care, Information Technology, Internet Services, Science and Engineering, Software","Apps, Biotechnology, Health Care, Information Technology, Internet, Medical, Software",1,Alexander Soroka,51-100,"Convertible Note, Early Stage Venture, Seed, Venture",,,Private
Triton Capital,https://www.crunchbase.com/organization/kraken-ventures,Venture Capital,57,,"San Francisco, California, United States","San Francisco Bay Area, West Coast, Western US",Triton Capital invests in businesses and projects at the nexus of both the fintech and blockchain/crypto revolutions.,7,51,,Active,2021-01-01,year,https://www.krakenventures.com/,https://www.linkedin.com/company/kraken-ventures/,"Blockchain and Cryptocurrency, Financial Services, Internet Services, Lending and Investments","Finance, Financial Services, FinTech, Venture Capital, Web3",,,11-50,"Early Stage Venture, Initial Coin Offering, Seed",,,Private
BlackFin Capital Partners,https://www.crunchbase.com/organization/blackfin-capital-partners,"Private Equity Firm, Venture Capital",57,9,"Paris, Ile-de-France, France","European Union (EU), Europe, Middle East, and Africa (EMEA)",BlackFin Capital Partners is a private equity and venture capital that provides funding and consulting for financial services companies.,28,39,,Active,2009-01-01,year,https://www.blackfin.com/,https://www.linkedin.com/company/blackfin-capital-partners/,"Financial Services, Lending and Investments","Finance, Financial Services, Venture Capital",4,"Bruno Rostain, Eric May, Laurent Bouyoux, Paul Mizrahi",11-50,"Early Stage Venture, Late Stage Venture, Private Equity, Seed",,Made Acquisitions,Private
Change Ventures,https://www.crunchbase.com/organization/change-ventures,Venture Capital,57,3,"Tallinn, Harjumaa, Estonia","European Union (EU), Europe, Middle East, and Africa (EMEA)","Change Ventures is a pre-seed stage VC fund based in the Baltic states, backing ambitious Baltic founders anywhere in the world.",35,43,,Active,2016-01-01,year,http://www.changeventures.com,https://www.linkedin.com/company/changeventures,"Information Technology, Internet Services, Mobile","Information Technology, Internet, Mobile",3,"Andris K. Berzins, Rait Ojasaar, Yrjö Ojasaar",1-10,"Convertible Note, Early Stage Venture, Seed, Venture",,,Private
Sfermion,https://www.crunchbase.com/organization/sfermion,Venture Capital,57,1,"Chicago, Illinois, United States","Greater Chicago Area, Great Lakes, Midwestern US",Sfermion is an investment firm focused on the immersive internet,8,55,,Active,2019-01-01,year,https://www.sfermion.io/,https://www.linkedin.com/company/sfermion/about/,"Media and Entertainment, Software",Metaverse,1,Andrew Steinwold,11-50,"Early Stage Venture, Seed, Venture",,,Private
Market One Capital,https://www.crunchbase.com/organization/market-one-capital,Venture Capital,57,6,"Luxembourg, Luxembourg, Luxembourg","European Union (EU), Europe, Middle East, and Africa (EMEA)",MOC backs platforms of tomorrow that democratize market access and enhance efficiency through the power of network effects.,20,36,,Active,2017-12-01,month,http://www.moc.vc,https://www.linkedin.com/company/m1c/,"Commerce and Shopping, Financial Services, Internet Services, Lending and Investments","Internet, Marketplace, Venture Capital",4,"Jakub Ślusarczyk, Marcin Kurek, Marcin Zabielski, Michal Skrzyński",11-50,"Convertible Note, Early Stage Venture, Seed, Venture",,,Private
