Adjacent,https://www.crunchbase.com/organization/adjacent-9b5a,Venture Capital,37,3,"New York, New York, United States","Greater New York Area, East Coast, Northeastern US",exploring the adjacent,20,31,,Active,2019-11-01,day,https://adjacent.com/,https://www.linkedin.com/company/adjacentv,,,1,Nico Wittenborn,1-10,"Early Stage Venture, Seed",,,Private
Public,https://www.crunchbase.com/organization/public,Venture Capital,37,2,"London, England, United Kingdom","Europe, Middle East, and Africa (EMEA)",Public is a venture capital firm that supports technology startups aiming to work more deeply with the UK’s public services.,21,36,,Active,2016-01-01,year,http://www.public.io/,https://www.linkedin.com/company/public.io,"Financial Services, Government and Military, Information Technology, Lending and Investments","Financial Services, GovTech, Venture Capital",2,"Alexander de Carvalho, Daniel Korski",51-100,Private Equity,For Profit,Was Acquired,Private
Vitosha Venture Partners,https://www.crunchbase.com/organization/vitosha-venture-partners,"Accelerator, Venture Capital",37,,"Sofia, Grad Sofiya, Bulgaria","European Union (EU), Europe, Middle East, and Africa (EMEA)","EUR 20m acceleration, seed, and post-seed fund based in Sofia, Bulgaria.",27,35,,Active,2020-06-05,day,http://vitosha.vc,https://www.linkedin.com/company/vitoshavp/,,,6,"Erik Anderson, Marin Iliev, Maris Prii, Maxim Gurvits, Nikola Stojanow, Paul Weinberger",1-10,"Early Stage Venture, Seed",,,Private
Chromo Invest,https://www.crunchbase.com/organization/chromo-invest,"Private Equity Firm, Venture Capital",37,4,"Porto Alegre, Rio Grande do Sul, Brazil",Latin America,Chromo Invest is a investment firm focused on alternative business with innovative potential and exponential growth.,14,19,1,Active,2013-01-01,year,http://www.chromoinvest.com,https://www.linkedin.com/company/11406736/,"Financial Services, Lending and Investments, Professional Services","Business Development, Financial Services, Venture Capital",3,"Celso Viegas Portasio, Marcelo Ferreira, Tiago Wallau Kretzmann",1-10,"Debt, Early Stage Venture, Late Stage Venture, Private Equity, Seed",,,Private
BlockVC,https://www.crunchbase.com/organization/blockvc,Venture Capital,37,,"Beijing, Beijing, China",Asia-Pacific (APAC),BlockVC is a leading blockchain investment and advisory firm. The version is to bring blockchain into mainstream.,,36,,Active,2016-06-06,day,https://blockvc.com,https://www.linkedin.com/company/blockvc/,"Blockchain and Cryptocurrency, Financial Services, Lending and Investments, Other","Blockchain, FinTech, Venture Capital",2,"Kevin Hsu, Kira Sun",101-250,,,,Private
Conviction VC,https://www.crunchbase.com/organization/conviction-vc,Venture Capital,36,6,"London, England, United Kingdom","Europe, Middle East, and Africa (EMEA)","Conviction VC offers private patient capital for early-stage, high-growth B2B SaaS businesses in Europe and the UK.",9,30,,Active,2017-11-29,day,https://www.conviction-vc.com/,https://www.linkedin.com/company/conviction-vc/,"Financial Services, Lending and Investments, Other, Software","B2B, Professional Services, SaaS, Venture Capital",4,"Andrew Jenkins, Jeremy Middleton, Jeremy Middleton, Will Orde",1-10,"Early Stage Venture, Late Stage Venture, Seed, Venture",,,Private
Crypto.com Capital,https://www.crunchbase.com/organization/crypto-com-capital,Corporate Venture Capital,36,,"Singapore, Central Region, Singapore","Asia-Pacific (APAC), Association of Southeast Asian Nations (ASEAN), Southeast Asia",Crypto.com Capital is a venture arm dedicated on investing in crypto startups at Seed and Series A stages.,13,34,,Active,2021-03-04,day,https://crypto.com/capital,https://www.linkedin.com/company/cryptocom,"Financial Services, Lending and Investments","Finance, Financial Services, Venture Capital",,,1001-5000,"Early Stage Venture, Private Equity",,,Private
AET Fund,https://www.crunchbase.com/organization/aet-fund,"Micro VC, Venture Capital",36,6,"Tokyo, Tokyo, Japan",Asia-Pacific (APAC),AET Fund is a venture capital fund specializing in the intersection of entertainment and technology,5,28,,Active,2017-10-10,day,https://aet.fund/en/,https://www.linkedin.com/company/aet-fund/,"Financial Services, Information Technology, Lending and Investments, Media and Entertainment","Information Technology, Media and Entertainment, Venture Capital",1,Tomoya Ogawa,1-10,Early Stage Venture,,,Private
EnBW New Ventures,https://www.crunchbase.com/organization/enbw-new-ventures,"Corporate Venture Capital, Venture Capital",36,4,"Karlsruhe, Baden-Wurttemberg, Germany","European Union (EU), Europe, Middle East, and Africa (EMEA)","EnBW New Ventures invest in startups in the converging energy, mobility and urban life markets.",16,21,,Active,2015-01-01,year,https://www.env.vc,https://www.linkedin.com/company/18194553/,"Energy, Financial Services, Lending and Investments, Real Estate","Energy, Financial Services, Smart Cities, Venture Capital",,,11-50,"Early Stage Venture, Seed, Venture",,,Private
UNIQA Ventures,https://www.crunchbase.com/organization/uniqa-ventures,"Corporate Venture Capital, Venture Capital",36,8,"Vienna, Wien, Austria","European Union (EU), Europe, Middle East, and Africa (EMEA)","is an European Venture Capital firm investing in the future of Health, Mobility, Smart Home and Fintech as well as enabling technologies.",11,27,,Active,2016-08-01,day,http://www.uniqaventures.com,https://www.linkedin.com/company/uniqa-ventures-gmbh/,"Energy, Financial Services, Health Care, Software, Sustainability, Transportation","Automotive, Clean Energy, CleanTech, Enterprise Software, FinTech, Health Care, InsurTech, Logistics",1,Andreas Nemeth,11-50,"Convertible Note, Early Stage Venture, Late Stage Venture, Venture",,,Private
British Design Fund,https://www.crunchbase.com/organization/british-design-fund,Venture Capital,36,,"London, England, United Kingdom","Europe, Middle East, and Africa (EMEA)","British Design Fund supports enterprise in the UK by investing in, and supporting, early stage, well designed, product businesses.",25,35,,Active,2016-01-01,year,https://britishdesignfund.co.uk/,https://www.linkedin.com/company/britishdesignfund,,,1,Damon Bonser,11-50,"Early Stage Venture, Seed",,,Private
Silicon Gardens,https://www.crunchbase.com/organization/silicon-gardens,Venture Capital,36,2,"Ljubljana, Ljubljana Urban Commune, Slovenia","European Union (EU), Europe, Middle East, and Africa (EMEA)",The first and only founders for founders venture capital firm in the Adriatic region.,9,31,,Active,2019-11-01,month,http://www.silicongardens.com,https://www.linkedin.com/company/silicon-gardens/,,,1,Andraž Tori,1-10,"Early Stage Venture, Seed",,,Private
Sente Ventures,https://www.crunchbase.com/organization/sente-advisory,"Corporate Venture Capital, Entrepreneurship Program, Venture Capital",36,1,"Chicago, Illinois, United States","Greater Chicago Area, Great Lakes, Midwestern US",Sente is an international startup investment and innovation platform.,4,36,,Active,2008-01-01,year,http://sente.vc,https://www.linkedin.com/company/sente,"Agriculture and Farming, Commerce and Shopping, Financial Services, Food and Beverage, Internet Services, Lending and Investments, Transportation","AgTech, Food and Beverage, Food Processing, Internet of Things, Logistics, Retail, Venture Capital",1,Serhat Cicekoglu,1-10,"Convertible Note, Early Stage Venture, Seed",,,Private
SMRK VC Fund,https://www.crunchbase.com/organization/smrk-vc-fund,Venture Capital,36,2,"Kyiv, Kyyiv, Ukraine","Europe, Middle East, and Africa (EMEA)",SMRK VC Fund is an investment management firm that focuses on investing in information technology startups.,22,21,,Active,2013-11-20,day,http://www.smrk.vc,,"Financial Services, Lending and Investments, Professional Services","Consulting, Financial Services, Venture Capital",2,"Andriy Dovzhenko, Oleksandr Kosovan",11-50,"Early Stage Venture, Seed",,,Private
OCCIDENT,https://www.crunchbase.com/organization/occident-group,"Family Investment Office, Venture Capital",36,3,"Munich, Bayern, Germany","European Union (EU), Europe, Middle East, and Africa (EMEA)",OCCIDENT – The Science Investor.,12,22,,Active,2012-01-01,year,https://www.occident.group,https://www.linkedin.com/company/occidentgroup/,Financial Services,Financial Services,2,"Michael Pauer, Patrizia Schuetzenhoefer",1-10,"Convertible Note, Early Stage Venture, Seed, Venture",,,Private
Digital Future,https://www.crunchbase.com/organization/digitalfuture,"Micro VC, Venture Capital",36,7,"Kyiv, Kyyiv, Ukraine","Europe, Middle East, and Africa (EMEA)",Digital Future is a Ukraine-born VC firm that invests at seed and early stage in international teams targeting global markets.,17,33,,Active,2014-07-09,day,http://digital-future.org/,https://www.linkedin.com/company/digitalfuture,"Financial Services, Lending and Investments, Professional Services","Business Development, Financial Services, Venture Capital",1,Alex Vitchenko,1-10,"Early Stage Venture, Non Equity Assistance, Seed",,,Private
U-Start,https://www.crunchbase.com/organization/u-start,Venture Capital,36,4,"Milan, Lombardia, Italy","European Union (EU), Europe, Middle East, and Africa (EMEA)","U-Start is a professional advisory firm structuring deals with private investors, investing in tech companies across Europe, Israel and US.",2,28,,Active,2012-01-01,year,http://www.u-start.biz/,http://www.linkedin.com/company/u-start,"Financial Services, Lending and Investments, Media and Entertainment","Advice, Venture Capital",1,Andrea Colombo,11-50,Early Stage Venture,,,Private
Tet Ventures,https://www.crunchbase.com/organization/tet-ventures,"Micro VC, Venture Capital",36,2,"Berlin, Berlin, Germany","European Union (EU), Europe, Middle East, and Africa (EMEA)",One of the most active global food-tech VCs. We invest in teams and tech building a better food system.,,34,,Active,2020-09-01,month,https://www.tet.vc/,https://www.linkedin.com/company/tetvc,,,1,Neeraj Berry,1-10,"Early Stage Venture, Seed",,,Private
KPN Ventures,https://www.crunchbase.com/organization/kpn-ventures,Corporate Venture Capital,36,5,"Rotterdam, Zuid-Holland, The Netherlands","European Union (EU), Europe, Middle East, and Africa (EMEA)","KPN Ventures aims to partner with innovative technology companies, providing access to capital, expertise, network, and customer channels.",12,27,,Active,2015-06-01,day,http://www.kpnventures.com,https://www.linkedin.com/company/kpn-ventures,"Data and Analytics, Financial Services, Information Technology, Internet Services, Privacy and Security","Big Data, Cloud Data Services, Finance, Financial Services, FinTech, Information Technology, Internet of Things, Security",,,11-50,"Debt, Early Stage Venture, Late Stage Venture, Seed, Venture",,,Private
LUMO labs,https://www.crunchbase.com/organization/lumo-labs,"Accelerator, Entrepreneurship Program, Incubator, Venture Capital",35,,"Eindhoven, Noord-Brabant, The Netherlands","European Union (EU), Europe, Middle East, and Africa (EMEA)",LUMO Labs is an impact-driven multi-stage (pre-seed through series A) capital fund with a two-year growth program,26,30,,Active,2016-07-01,day,http://www.lumolabs.io,https://www.linkedin.com/company-beta/10821266/,"Education, Financial Services, Health Care, Lending and Investments, Professional Services, Real Estate, Software","Business Development, Construction, Education, Health Care, Incubators, Real Estate, Software, Venture Capital",3,"Andy Lürling, Jordie Geuyen, Sven Bakkes",11-50,"Early Stage Venture, Seed, Venture",,,Private
PT1,https://www.crunchbase.com/organization/proptech1-ventures,Venture Capital,35,,"Berlin, Berlin, Germany","European Union (EU), Europe, Middle East, and Africa (EMEA)",Transformative real asset technologies,18,24,,Active,2018-01-01,day,https://pt1.vc,https://www.linkedin.com/company/18632566/,"Energy, Financial Services, Lending and Investments, Other, Real Estate, Sustainability","Commercial Real Estate, Construction, Energy Efficiency, Energy Storage, Infrastructure, Real Estate, Real Estate Investment, Venture Capital",2,"Anja Rath, Nikolas Samios",11-50,"Convertible Note, Early Stage Venture, Late Stage Venture, Seed",,,Private
FYRFLY Venture Partners,https://www.crunchbase.com/organization/fyrfly-venture-partners,"Angel Group, Venture Capital",35,1,"San Francisco, California, United States","San Francisco Bay Area, West Coast, Western US",FYRFLY Venture Partners is a venture capital firm that focuses on data and intelligence.,13,22,,Active,2015-01-01,year,http://www.fyrfly.vc/,https://www.linkedin.com/company/fyrfly-venture-partners,"Financial Services, Information Technology, Lending and Investments","Finance, Financial Services, Information Technology, Venture Capital",2,"Julie Maples, Philipp Stauffer",1-10,Early Stage Venture,,,Private
Nordstar,https://www.crunchbase.com/organization/nordstar,Venture Capital,35,2,"London, England, United Kingdom","Europe, Middle East, and Africa (EMEA)","Nordstar partners with transformational companies seeking strategic and operational expertise, advice, and capital",7,29,,Active,2020-01-01,year,https://www.nordstar.com/,https://www.linkedin.com/company/nordstar/,"Financial Services, Lending and Investments, Professional Services","Business Development, Financial Services, Venture Capital",2,"Eugen Miropolski, Ole Ruch",11-50,"Early Stage Venture, Late Stage Venture, Seed, Venture",For Profit,,Private
Auxxo,https://www.crunchbase.com/organization/auxxo,Venture Capital,35,1,"Berlin, Berlin, Germany","European Union (EU), Europe, Middle East, and Africa (EMEA)",Auxxo co-invests in female founded companies in pre-seed and seed stages across Europe.,,24,,Active,2019-01-01,year,https://www.auxxo.de/,https://www.linkedin.com/company/auxxo/,"Community and Lifestyle, Financial Services, Lending and Investments, Professional Services","Business Development, Financial Services, Impact Investing, Women's",2,"Bettine Schmitz, Gesa Miczaika",1-10,"Early Stage Venture, Seed, Venture",,,Private
Marathon Venture Capital,https://www.crunchbase.com/organization/marathon-venture-capital,Venture Capital,35,4,"Athens, Attiki, Greece","European Union (EU), Europe, Middle East, and Africa (EMEA)",Marathon Venture Capital is a seed-stage venture capital firm that assists ambitious founders in developing technology companies.,22,21,,Active,2017-03-17,day,https://marathon.vc,https://www.linkedin.com/company/marathon-venture-capital/,"Financial Services, Lending and Investments, Professional Services","Business Development, Finance, Financial Services, Venture Capital",2,"George Tziralis, Panos Papadopoulos",1-10,"Early Stage Venture, Seed",,,Private
Evonik Venture Capital,https://www.crunchbase.com/organization/evonik-venture-capital-gmbh,"Corporate Venture Capital, Venture Capital",35,4,"Hanau, Hessen, Germany","European Union (EU), Europe, Middle East, and Africa (EMEA)","Evonik Venture Capital is the corporate venture arm of Evonik Industries AG, a global specialty chemicals company.",15,25,1,Active,2012-01-01,year,http://venturing.evonik.com,https://www.linkedin.com/company/evonik,"Financial Services, Lending and Investments","Finance, Financial Services, Venture Capital",2,"Ilja Aizenberg, Lars Bönisch",11-50,"Early Stage Venture, Late Stage Venture",,Made Acquisitions,Private
NordicNinja VC,https://www.crunchbase.com/organization/nordicninja-vc,Venture Capital,35,1,"London, England, United Kingdom","Europe, Middle East, and Africa (EMEA)","NordicNinja is the largest Japan-backed VC fund in Europe. Launched in 2019, the fund focuses on scaling companies from Northern Europe.",19,27,,Active,2019-01-01,year,https://nordicninja.com,https://www.linkedin.com/company/nordicninja-vc/,"Financial Services, Lending and Investments",Venture Capital,5,"Claes Mikko Nilsen, Marek Kiisa, Rainer Sternfeld, Shinichi Nikkuni, Tomosaku Sohara",1-10,"Convertible Note, Early Stage Venture, Late Stage Venture, Seed, Venture",,,Private
FinLab,https://www.crunchbase.com/organization/finlab,"Accelerator, Private Equity Firm, Venture Capital",35,8,"Frankfurt, Hessen, Germany","European Union (EU), Europe, Middle East, and Africa (EMEA)",FinLab is a Germany-based investment company engaged in the building of companies in the financial services technologies.,24,28,1,Active,2005-01-01,day,https://www.finlab.de,https://www.linkedin.com/company/finlab-ag,"Blockchain and Cryptocurrency, Financial Services, Lending and Investments, Payments, Software","Cryptocurrency, Finance, Financial Services, FinTech, Incubators, Venture Capital",1,Christian Angermayer,1-10,"Early Stage Venture, Late Stage Venture, Seed, Venture",For Profit,Made Acquisitions,Public
Coinvest Capital,https://www.crunchbase.com/organization/coinvest-capital,Venture Capital,35,,"Vilnius, Vilniaus Apskritis, Lithuania","European Union (EU), Europe, Middle East, and Africa (EMEA)",Coinvest Capital invests in start-ups and companies undergoing business development and growth with groups of business angels.,16,30,,Active,2017-01-01,year,http://coinvest.lt,https://www.linkedin.com/company/koinvesticinis-fondas,,,,,1-10,"Private Equity, Venture",,,Private
Wille Finance,https://www.crunchbase.com/organization/wille-finance,"Family Investment Office, Private Equity Firm, Venture Capital",35,5,"Zürich, Zurich, Switzerland","Europe, Middle East, and Africa (EMEA)","Wille Finance is a multi-family office, focusing on private equity, real estate, digital media and listed assets.",5,30,1,Active,2007-01-01,year,https://www.willefinance.com/,https://in.linkedin.com/company/willefinance,"Financial Services, Real Estate","Asset Management, Finance, Real Estate",,,11-50,"Early Stage Venture, Late Stage Venture, Private Equity, Seed, Venture",,Made Acquisitions,Private
Founders,https://www.crunchbase.com/organization/founders-2,Venture Capital,35,2,"Copenhagen, Hovedstaden, Denmark","European Union (EU), Nordic Countries, Scandinavia","Founders is a thesis-driven, zero to traction, fund. We invest at day zero in healthtech and b2b fintech.",16,20,,Active,2012-01-01,year,http://founders.as/,https://www.linkedin.com/company/3199273,"Financial Services, Lending and Investments, Professional Services","Business Development, Financial Services, Venture Capital",6,"Joshua Karjala-Svendsen, Peter Heering, Sebastian Stockmarr, Simon Sylvest, Stefano Zorzi, Ulrik Trolle",11-50,"Early Stage Venture, Seed",,,Private
Huobi Ventures,https://www.crunchbase.com/organization/huobi-ventures,Venture Capital,35,,"Beijing, Beijing, China",Asia-Pacific (APAC),Huobi Ventures is an investment firm.,2,33,,Active,2021-01-01,year,https://www.htx.com/en-us/huobiventures,,,,,,,"Seed, Venture",,,Private
RI Digital Ventures,https://www.crunchbase.com/organization/ri-digital-ventures,Venture Capital,35,12,"Berlin, Berlin, Germany","European Union (EU), Europe, Middle East, and Africa (EMEA)",Raffay is an investment group with early stage venture capital and real estate as its primary focus.,10,28,1,Active,2011-01-01,year,http://www.raffay.com/business/digital-ventures,https://www.linkedin.com/company/verwaltung-ahg-beteiligungs--und-handelsgesellschaft-mbh,"Financial Services, Lending and Investments, Real Estate","Construction, Real Estate, Venture Capital",1,Jochen Gutbrod,1-10,"Early Stage Venture, Seed",,,Private
Motive Ventures,https://www.crunchbase.com/organization/embedded-capital,Venture Capital,34,,"New York, New York, United States","Greater New York Area, East Coast, Northeastern US",Motive Ventures is the early-stage investment arm of Motive Partners,16,25,,Active,2022-01-01,day,https://www.motivepartners.com,https://www.linkedin.com/company/motiveventures/,Financial Services,"Financial Services, FinTech",2,"Michael Hock, Ramin Niroumand",11-50,"Early Stage Venture, Seed",,Was Acquired,Private
Lunar Ventures,https://www.crunchbase.com/organization/lunar-ventures,Venture Capital,34,,"Berlin, Berlin, Germany","European Union (EU), Europe, Middle East, and Africa (EMEA)","Lunar Ventures is a deep-tech, seed-stage venture fund with a team of 3 deep-tech expert partners in Berlin.",12,24,,Active,2017-01-01,year,http://lunarventures.eu/,https://www.linkedin.com/company/lunar-ventures,"Artificial Intelligence (AI), Data and Analytics, Financial Services, Hardware, Information Technology, Internet Services, Lending and Investments, Privacy and Security, Science and Engineering, Software","Artificial Intelligence (AI), Cloud Computing, Computer Vision, Cyber Security, Finance, Financial Services, Information and Communications Technology (ICT), Machine Learning, Simulation, Venture Capital",3,"Elad Verbin, Luis Shemtov, Mick Halsband",11-50,"Convertible Note, Early Stage Venture, Seed",,,Private
PUSH VC,https://www.crunchbase.com/organization/push-ventures,Venture Capital,34,5,"Vienna, Wien, Austria","European Union (EU), Europe, Middle East, and Africa (EMEA)",Early-stage VC. Pre-Seed and Seed stage. We are investing in Health- & Green Tech start-ups with singificant impact and outstanding teams.,6,26,,Active,2017-01-01,month,https://www.push.vc,https://www.linkedin.com/company/17963492/,"Financial Services, Health Care, Lending and Investments, Sustainability","Finance, GreenTech, Health Care, Venture Capital",2,"Laurenz Simbruner, Lukas Püspök",1-10,"Early Stage Venture, Seed, Venture",,,Private
BonVenture,https://www.crunchbase.com/organization/bonventure,Venture Capital,34,2,"Munich, Bayern, Germany","European Union (EU), Europe, Middle East, and Africa (EMEA)",BonVenture is the first social venture capital fund focusing on social enterprises in the German-speaking area.,15,27,,Active,2003-01-01,year,https://bonventure.de,https://www.linkedin.com/company/bonventure/,"Community and Lifestyle, Financial Services, Lending and Investments, Social Impact","Impact Investing, Social Entrepreneurship, Venture Capital",,,11-50,Early Stage Venture,,,Private
SeaX Ventures,https://www.crunchbase.com/organization/seax-ventures,Venture Capital,34,,"San Francisco, California, United States","San Francisco Bay Area, West Coast, Western US",Southeast Asia Exponential Ventures is a venture capital firm investing globally in early-stage companies,6,31,,Active,2018-10-04,day,https://seaxventures.vc,https://www.linkedin.com/company/seax-ventures/,"Financial Services, Lending and Investments","Financial Services, Venture Capital",2,"Nattaphol Vimolchalao, Supachai Kid Parchariyanon",1-10,Early Stage Venture,,,Private
Seed X Liechtenstein AG,https://www.crunchbase.com/organization/seed-x-liechtenstein,Venture Capital,34,2,"Schaan, Schaan, Liechtenstein","Europe, Middle East, and Africa (EMEA)","Seed X is investing in European early-stage Startups in Fintech, Insurtech and Proptech.",1,26,,Active,2016-01-01,year,https://seedx.li/,https://www.linkedin.com/company/seedx/,"Financial Services, Professional Services, Real Estate","FinTech, InsurTech, Legal Tech, PropTech",2,"Mathias Jaeggi, Prince Maximilian",1-10,"Convertible Note, Early Stage Venture, Seed, Venture",,,Private
AFI Ventures,https://www.crunchbase.com/organization/afi-ventures,Venture Capital,34,2,"Paris, Ile-de-France, France","European Union (EU), Europe, Middle East, and Africa (EMEA)",AFI Ventures is a pre-seed & seed stage venture fund backing impact-driven companies,5,32,,Active,2020-11-16,day,https://allianceforimpact.com/,https://www.linkedin.com/company/afi-ventures/,"Financial Services, Lending and Investments, Other, Social Impact","Finance, Financial Services, Impact Investing, Social Impact, Venture Capital",2,"Audrey Soussan, Charles Fourault",1-10,"Early Stage Venture, Seed, Venture",,,Private
Follow[the]Seed,https://www.crunchbase.com/organization/follow-the-seed,"Micro VC, Venture Capital",34,2,"Sydney, New South Wales, Australia","Asia-Pacific (APAC), Australasia",Follow[the]Seed is a post-seed global algorithmic venture capital fund.,8,31,1,Active,2015-01-01,year,http://followtheseed.vc/,https://www.linkedin.com/company/follow-the-seed/,"Financial Services, Lending and Investments","Finance, Financial Services, Venture Capital",4,"Ajoy Mallik, Andrey Shirben, Curt Shi, Eliav Alaluf",1-10,"Early Stage Venture, Seed",,,Private
River Capital,https://www.crunchbase.com/organization/river-capital-3b1d,"Private Equity Firm, Venture Capital",34,4,"Liverpool, Liverpool, United Kingdom","Europe, Middle East, and Africa (EMEA)",River Capital helps small and medium sized businesses to accelerate their growth and achieve their full potential.,13,29,1,Active,,,https://rivercapitaluk.com/,https://www.linkedin.com/company/rivercapital/,,,,,11-50,"Debt, Private Equity, Seed, Venture",,,Private
Signals Venture Capital,https://www.crunchbase.com/organization/signals-vc,Venture Capital,34,3,"Berlin, Berlin, Germany","European Union (EU), Europe, Middle East, and Africa (EMEA)",Signals Venture Capital is an early stage enterprise & B2B investor.,15,24,1,Active,2017-01-01,year,,https://www.linkedin.com/company/signals-vc/,"Financial Services, Lending and Investments",Venture Capital,1,Christian Weniger,1-10,"Early Stage Venture, Seed",,,Private
MSM,https://www.crunchbase.com/organization/msmfund,Venture Capital,34,2,"Lisbon, Lisboa, Portugal","European Union (EU), Europe, Middle East, and Africa (EMEA)",MSM is an early-stage generalist impact fund that invests all across Europe.,15,28,,Active,2019-10-01,month,https://msm.vc/,https://www.linkedin.com/company/msmfund/,"Financial Services, Lending and Investments, Sustainability","Financial Services, Impact Investing, Sustainability, Venture Capital",2,"Antonio Miguel, Henry Wigan",1-10,"Convertible Note, Early Stage Venture, Seed",,,Private
