Unovis Asset Management,https://www.crunchbase.com/organization/unovis-asset-management-be7b,Venture Capital,39,5,"New York, New York, United States","Greater New York Area, East Coast, Northeastern US",Unovis Asset Management partners with investment firms to develop plant-based and cultivate replacements to animal products.,36,,7,Active,2016-01-01,year,https://www.unovis.vc/,https://www.linkedin.com/company/unovisvc/about/,"Food Processing, Impact Investing, Organic Food","Financial Services, Food and Beverage, Lending and Investments",2,"Kevin Boylan, Kim Anders Odhner",11-50,"Early Stage Venture, Late Stage Venture, Seed, Venture",,,Private,"6,235"
Adjacent,https://www.crunchbase.com/organization/adjacent-9b5a,Venture Capital,39,3,"New York, New York, United States","Greater New York Area, East Coast, Northeastern US",exploring the adjacent,31,,20,Active,2019-11-01,day,https://adjacent.com/,https://www.linkedin.com/company/adjacentv,,,1,Nico Wittenborn,1-10,"Early Stage Venture, Seed",,,Private,"7,241"
Standard Bank,https://www.crunchbase.com/organization/standard-bank,Investment Bank,39,7,"Johannesburg, NA - South Africa, South Africa","Europe, Middle East, and Africa (EMEA)","Standard Bank is a banking company that saving accounts, credit cards, foreign exchange, investment, and digital wallet solutions.",36,6,19,Active,1862-01-01,year,https://www.standardbank.co.za,https://www.linkedin.com/company/standard-bank-south-africa/,"Banking, Finance, Financial Services","Financial Services, Lending and Investments",1,John Paterson,5001-10000,Early Stage Venture,For Profit,Made Acquisitions,Private,"7,561"
Scottish National Investment Bank,https://www.crunchbase.com/organization/scottish-national-investment-bank,"Investment Bank, Private Equity Firm, Venture Debt",39,2,"Edinburgh, Edinburgh, City of, United Kingdom","Europe, Middle East, and Africa (EMEA)",Scottish National Investment Bank invests and provides financial assistance to various business projects and communities.,30,,30,Active,2020-01-01,year,https://www.thebank.scot,https://www.linkedin.com/company/scottish-national-investment-bank,"Banking, Finance, Financial Services","Financial Services, Lending and Investments",,,51-100,"Debt, Private Equity",,,Private,"8,155"
VIVE X,https://www.crunchbase.com/organization/vivex,Accelerator,39,2,"San Francisco, California, United States","San Francisco Bay Area, West Coast, Western US",Global VR/AR Accelerator by HTC Vive,39,1,3,Active,2016-01-01,year,https://www.vive.com/us/vivex/,https://www.linkedin.com/company/htcvive/,"Augmented Reality, Consumer Electronics, Digital Entertainment, Virtual Reality","Consumer Electronics, Hardware, Media and Entertainment, Software",4,"Alvin Wang Graylin, Cher Wang, Marc Metis, Raymond Pao",501-1000,"Early Stage Venture, Seed",,,Private,"8,909"
TechU Ventures,https://www.crunchbase.com/organization/techu-ventures,Venture Capital,39,3,"New York, New York, United States","Greater New York Area, East Coast, Northeastern US",TechU Ventures invests in platform technologies that harness complex science and engineering breakthroughs for enduring global impact.,27,,4,Active,2014-05-01,day,http://techuventures.com/,https://www.linkedin.com/company/techu-vc,"Finance, Financial Services, Venture Capital","Financial Services, Lending and Investments",1,Natanel Barookhian,1-10,"Early Stage Venture, Seed",,,Private,"9,931"
LongJump,https://www.crunchbase.com/organization/longjump-0f56,Venture Capital,39,1,"Chicago, Illinois, United States","Greater Chicago Area, Great Lakes, Midwestern US","LongJump is a first-check venture fund, based in Chicago, designed to invest in the next generation of founders.",38,,11,Active,2017-01-01,year,https://longjump.vc/,https://www.linkedin.com/company/longjumpvc,Venture Capital,"Financial Services, Lending and Investments",5,"Ablorde Ashigbi, Brian Luerssen, Garry Cooper, Kristen Sonday, Tim Grace",1-10,"Early Stage Venture, Seed",,,Private,"12,183"
Coinvest Capital,https://www.crunchbase.com/organization/coinvest-capital,Venture Capital,39,,"Vilnius, Vilniaus Apskritis, Lithuania","European Union (EU), Europe, Middle East, and Africa (EMEA)",Coinvest Capital invests in start-ups and companies undergoing business development and growth with groups of business angels.,33,,18,Active,2017-01-01,year,http://coinvest.lt,https://www.linkedin.com/company/koinvesticinis-fondas,,,,,1-10,"Private Equity, Venture",,,Private,"12,570"
British Design Fund,https://www.crunchbase.com/organization/british-design-fund,Venture Capital,39,,"London, England, United Kingdom","Europe, Middle East, and Africa (EMEA)","British Design Fund supports enterprise in the UK by investing in, and supporting, early stage, well designed, product businesses.",38,,27,Active,2016-01-01,year,https://britishdesignfund.co.uk/,https://www.linkedin.com/company/britishdesignfund,,,1,Damon Bonser,11-50,"Early Stage Venture, Seed",,,Private,"16,111"
BitStone Capital,https://www.crunchbase.com/organization/bitstone-capital,Venture Capital,39,4,"Cologne, Nordrhein-Westfalen, Germany","European Union (EU), Europe, Middle East, and Africa (EMEA)",BitStone Capital an internationally operating venture capital firm investing in Real Estate and Construction Technology startups.,29,,14,Active,2017-01-01,year,https://www.bitstone.capital/,https://www.linkedin.com/company/bitstone-capital/,"Construction, Real Estate, Smart Building, Venture Capital","Financial Services, Lending and Investments, Real Estate",2,"Kai Panitzki, Manfred Heid",1-10,"Early Stage Venture, Seed",,,Private,"16,263"
Heliad AG,https://www.crunchbase.com/organization/heliad-equity-partners,"Private Equity Firm, Venture Capital",39,8,"Frankfurt, Hessen, Germany","European Union (EU), Europe, Middle East, and Africa (EMEA)",Empower Entrepreneurs. And Investors.,27,6,24,Active,2003-01-01,year,http://www.heliad.com,https://de.linkedin.com/company/heliad-ag,"FinTech, Internet, Life Science, Media and Entertainment","Biotechnology, Financial Services, Internet Services, Media and Entertainment, Science and Engineering",1,Falk Simon Schaefers,1-10,"Early Stage Venture, Late Stage Venture, Post-Ipo, Private Equity, Seed",For Profit,Made Acquisitions,Public,"16,471"
Alan Rutledge,https://www.crunchbase.com/person/alan-rutledge-d9c2,Individual/Angel,39,,"California, United States, North America","West Coast, Western US",Alan Rutledge,39,,,,,,,,,,,,,,,,,"17,590"
Knockout Capital,https://www.crunchbase.com/organization/weclikd,"Family Investment Office, Hedge Fund",39,2,"Los Angeles, California, United States","Greater Los Angeles Area, West Coast, Western US",We are a family office investment vehicle for the Osone family.,38,1,,Active,2019-01-01,month,https://knockout.capital,https://www.linkedin.com/company/knockoutfamilyoffice/,"Aerospace, Biotechnology, Energy, Food and Beverage, Robotics, Water Purification","Biotechnology, Energy, Food and Beverage, Hardware, Science and Engineering, Software, Sustainability",2,"Kiyoko Osone, Yoshinori Osone",1-10,"Early Stage Venture, Seed",,,Private,"20,435"
Oasis Capital,https://www.crunchbase.com/organization/oasis-capital-4c81,Venture Capital,39,,"Shanghai, Shanghai, China",Asia-Pacific (APAC),Oasis Capital focuses on blockchain project investment and digital asset management.,33,,7,Active,2020-08-03,day,https://oasiscapital.io/,https://www.linkedin.com/company/oasiscapital,Blockchain,"Blockchain and Cryptocurrency, Other",,,1-10,"Early Stage Venture, Seed, Venture",,,Private,"20,605"
Vestel Ventures,https://www.crunchbase.com/organization/vestel-ventures,Corporate Venture Capital,39,1,"Sisli, Istanbul, Turkey","Europe, Middle East, and Africa (EMEA), Middle East, Middle East and North Africa (MENA)",Vestel Ventures is the corporate investment company of Vestel Group of Companies.,34,,20,Active,2015-01-01,year,http://www.vestelventures.com,https://www.linkedin.com/company/vestel-ventures,Finance,Financial Services,,,1-10,,,,Private,"21,061"
Ram Shriram,https://www.crunchbase.com/person/ram-shriram,"Individual/Angel, Investment Partner",39,13,"Menlo Park, California, United States","San Francisco Bay Area, Silicon Valley, West Coast","Ram Shriram has served as a member of our board of directors since September 1998. Ram has been a managing partner of Sherpalo Ventures, LLC...",36,2,,,,,,,,,,,,Seed,,,,"21,519"
Lansdowne Partners,https://www.crunchbase.com/organization/lansdowne-partners,Private Equity Firm,39,9,"London, England, United Kingdom","Europe, Middle East, and Africa (EMEA)",Lansdowne Partners is an alternative investment management firm that focused on equity portfolios.,30,6,9,Active,1998-01-01,year,http://www.lansdownepartners.com,https://www.linkedin.com/company/lansdowne-partners,"Asset Management, Finance, Financial Services, Venture Capital","Financial Services, Lending and Investments",1,Paul Ruddock,101-250,"Early Stage Venture, Late Stage Venture, Post-Ipo, Private Equity, Venture",,Made Acquisitions,Private,"22,566"
Velo Partners,https://www.crunchbase.com/organization/velo-partners,Venture Capital,39,6,"London, England, United Kingdom","Europe, Middle East, and Africa (EMEA)",Velo Partners is a seed and Series A fund that focuses on the gaming and gambling ecosystems,37,,11,Active,2013-01-01,year,http://www.velopartners.co.uk/,https://www.linkedin.com/company/velo-partners/,Venture Capital,"Financial Services, Lending and Investments",1,Evan Hoff,1-10,Early Stage Venture,,Made Acquisitions,Private,"22,803"
Formic Ventures,https://www.crunchbase.com/organization/formic-ventures,"Family Investment Office, Venture Capital",39,5,"San Francisco, California, United States","San Francisco Bay Area, West Coast, Western US",Formic Ventures is a diversified venture capital firm that makes early-stage investments in biotechnology startups,31,2,1,Active,2014-01-01,year,http://formic.vc,https://www.linkedin.com/company/tubusllc,"Biotechnology, Finance, Financial Services, Venture Capital","Biotechnology, Financial Services, Lending and Investments, Science and Engineering",2,"Matt Shlosberg, Michael Antonov",1-10,"Early Stage Venture, Seed, Venture",,,Private,"24,299"
Charles Delingpole,https://www.crunchbase.com/person/charles-delingpole,Individual/Angel,39,6,"London, England, United Kingdom","Europe, Middle East, and Africa (EMEA)","Charles Delingpole is Founder and CEO of ComplyAdvantage, a technology company focused on wiping out financial crime using Machine Learning....",39,,,,,,https://delingpole.com/,http://www.linkedin.com/in/delingpole,,,,,,,,,,"24,469"
HALA Ventures,https://www.crunchbase.com/organization/hala-ventures,"Private Equity Firm, Venture Capital",39,4,"Khobar, Ash Sharqiyah, Saudi Arabia","Europe, Middle East, and Africa (EMEA), Gulf Cooperation Council (GCC), Middle East",Technology VC that empowers GCC’s startups in their early-growth stages.,30,,3,Active,2018-01-01,year,http://www.hala.vc,https://www.linkedin.com/company/halavc/,,,2,"Ali Abussaud, Hussain Almarhoon",11-50,"Early Stage Venture, Private Equity, Seed",,,Private,"24,476"
Grow,https://www.crunchbase.com/organization/grow-jose-de-mello,Accelerator,39,1,"Lisboa, Lisboa, Portugal","European Union (EU), Europe, Middle East, and Africa (EMEA)",Grow by José de Mello - The perfect ecosystem to develop your startup,39,,,Active,2017-02-01,month,http://grow.josedemello.pt,https://www.linkedin.com/company/growjosedemello/,"Chemical, Medical, Transportation","Health Care, Science and Engineering, Transportation",,,11-50,,For Profit,,Private,"24,682"
1818 Venture Capital,https://www.crunchbase.com/organization/1818-venture-capital,Venture Capital,39,5,"St. Peter Port, NA - Guernsey, Guernsey","Europe, Middle East, and Africa (EMEA)","1818 Venture Capital is an early stage investor, focused on UK & Middle East Fintech companies.",29,,10,Active,2012-01-01,year,https://1818venturecapital.com/,https://www.linkedin.com/company/1818venturecapital,Venture Capital,"Financial Services, Lending and Investments",1,Richard Avery-Wright,1-10,"Early Stage Venture, Secondary Market, Seed, Venture",,,Private,"25,370"
Dubai Angel Investors,https://www.crunchbase.com/organization/dubai-angel-investor,"Angel Group, Micro VC",39,4,"Dubai, Dubai, United Arab Emirates","Europe, Middle East, and Africa (EMEA), Gulf Cooperation Council (GCC), Middle East",Dubai Angel Investors Angel network supporting the startup ecosystem in the MENA region.,31,,10,Active,2016-01-01,year,https://www.dubaiangelinvestors.me/,https://in.linkedin.com/company/dubai-angel-investors,Financial Services,Financial Services,4,"Abdullah Mutawi, Kushal Shah, Mohamed ElSayad, Tarek Amin",51-100,"Early Stage Venture, Seed",,,Private,"25,464"
Nordic Makers,https://www.crunchbase.com/organization/nordic-makers-vc,"Micro VC, Venture Capital",39,4,"Stockholm, Stockholms Lan, Sweden","European Union (EU), Nordic Countries, Scandinavia",We know how much grit and luck it takes to build big companies. That’s why we invest our time and children’s money in ambitious founders.,30,,9,Active,2016-01-01,year,http://www.nordicmakers.vc/,https://www.linkedin.com/company/10939041,Venture Capital,"Financial Services, Lending and Investments",10,"Alexander Aghassipour, David Helgason, Erik Byrenius, Hampus Jakobsson, Klaus Nyengaard, Lars Nielsen, Martin von Haller Groenbaek, Thomas Madsen-Mygdal, Thorvald Stigsen, Tommy Andersen",11-50,"Convertible Note, Early Stage Venture, Seed",,,Private,"26,181"
Endeavour Ventures,https://www.crunchbase.com/organization/endeavour-ventures,"Angel Group, Corporate Venture Capital, Venture Capital",39,7,"London, England, United Kingdom","Europe, Middle East, and Africa (EMEA)",Endeavour is a specialist venture capital organisation which attracts an enviable flow of interesting scalable companies.,28,2,4,Active,2004-09-28,day,http://www.endven.com,https://www.linkedin.com/company/endeavour-ventures-ltd/?viewAsMember=true,"Financial Services, Venture Capital","Financial Services, Lending and Investments",3,"Bill Cunningham, Richard Lawrence Hargreaves, William Cunningham",1-10,"Early Stage Venture, Seed, Venture",,,Private,"27,866"
Chain Capital,https://www.crunchbase.com/organization/chain-capital-a6f6,Venture Capital,39,,"Shanghai, Shanghai, China",Asia-Pacific (APAC),"Chain Capital specializes in investing projects in Blockchain and offers incubation, advisory, and financial services.",37,,6,Active,2015-04-01,month,http://capital-chain.com,https://www.linkedin.com/company/chain-capital/,"Banking, Financial Services, FinTech, Information Technology","Financial Services, Information Technology, Lending and Investments",2,"Changan He, Simon Li",11-50,"Early Stage Venture, Seed, Venture",,,Private,"28,231"
Counterview Capital,https://www.crunchbase.com/organization/bds-venture-fund,Venture Capital,39,10,"New York, New York, United States","Greater New York Area, East Coast, Northeastern US",Counterview Capital is a seed-stage venture capital firm.,30,1,2,Active,2005-01-01,year,http://www.counterview.vc,https://www.linkedin.com/company/counterview-capital/,"Finance, Financial Services, Venture Capital","Financial Services, Lending and Investments",1,Brian Rubenstein,1-10,"Early Stage Venture, Seed",,,Private,"28,391"
TA Capital,https://www.crunchbase.com/organization/atlantic-capital-partners,Venture Capital,39,16,"Houston, Texas, United States","Greater Houston Area, Southern US",TA Capital invests in the growth stage of start-ups with capable teams and strong visions.,31,4,17,Active,2009-01-01,year,http://www.ta.capital/,https://www.linkedin.com/company/ta-capital,"Finance, Financial Services",Financial Services,2,"Dr. Marcus Englert, Moshe Bar",11-50,"Convertible Note, Early Stage Venture, Late Stage Venture, Post-Ipo, Seed",,,Private,"29,408"
Bonsai Venture Capital SCR,https://www.crunchbase.com/organization/bonsai-capital,Venture Capital,39,9,"Madrid, Madrid, Spain","European Union (EU), Europe, Middle East, and Africa (EMEA)",Bonsai venture capital as a result of the entrepreneurial spirit of Javier Cebrián Sagarriga and the diversification of the investments.,31,1,10,Active,1998-01-01,year,http://www.bonsaiventurecapital.com,http://www.linkedin.com/company/bonsai-venture-capital-scr,"Angel Investment, Finance, Venture Capital","Financial Services, Lending and Investments",3,"Javier Cebrián Monereo, Luis González Buendía, Rafael Gutierrez de Calderón",1-10,"Early Stage Venture, Seed",,,Private,"29,705"
ProVenture,https://www.crunchbase.com/organization/proventure-management,Venture Capital,39,8,"Trondheim, Sor-Trondelag, Norway","Nordic Countries, Scandinavia, Europe, Middle East, and Africa (EMEA)",Leading Norwegian seed venture investor currently focused on digital technology startups with sustainable business models.,32,,25,Active,2006-01-01,day,http://proventure.no,https://www.linkedin.com/company/proventure-management,"Information Technology, Oil and Gas, Venture Capital","Energy, Financial Services, Information Technology, Lending and Investments, Natural Resources",2,"Hans Olav Torsen, Herbjørn Skjervold",1-10,"Early Stage Venture, Seed, Venture",,,Private,"29,738"
UCLB,https://www.crunchbase.com/organization/uclb,Venture Capital,39,12,"London, England, United Kingdom","Europe, Middle East, and Africa (EMEA)","UCLB is the commercialisation company of UCL that brings to market truly world-leading, world-changing technologies and innovations.",38,2,,Active,1993-01-01,year,https://www.uclb.com/,https://www.linkedin.com/company/ucl-business-plc/,Finance,Financial Services,,,51-100,,For Profit,,Private,"30,411"
Arts Alliance,https://www.crunchbase.com/organization/arts-alliance,Venture Capital,39,10,"London, England, United Kingdom","Europe, Middle East, and Africa (EMEA)",Arts Alliance is a venture capital organisation supporting a growing network of entrepreneurs.,28,,7,Active,1996-01-01,year,http://www.artsalliance.co.uk,https://www.linkedin.com/company/artsalliance,"Finance, Financial Services, Venture Capital","Financial Services, Lending and Investments",1,Thomas Hoegh,1-10,"Early Stage Venture, Late Stage Venture, Seed",,,Private,"30,468"
Carlson ASI EVIG Alfa VC Fund,https://www.crunchbase.com/organization/evigalfa,Venture Capital,39,,"Poznan, Wielkopolskie, Poland","European Union (EU), Europe, Middle East, and Africa (EMEA)","VC investing in pre-seed, seed stage in AI/ML, ICT, IoT, Medtech, Fintech, Cleantech",39,,35,Active,2019-01-01,year,https://evigalfa.pl/en/,https://www.linkedin.com/company/evig-alfa-sp-z-o-o/,"B2B, B2C, CleanTech, FinTech, Internet of Things, Medical Device, SaaS, Venture Capital","Financial Services, Health Care, Internet Services, Lending and Investments, Other, Software, Sustainability",2,"Dawid Wesołowski, Łukasz Marczuk",1-10,"Early Stage Venture, Grant",,,Private,"31,460"
Head and Heart Capital,https://www.crunchbase.com/organization/head-and-heart-capital,"Angel Group, Venture Capital",39,4,"New York, New York, United States","Greater New York Area, East Coast, Northeastern US",Head and Heart Capital invest in angel and seed stage impact focused ventures.,39,2,,Active,2018-01-01,year,https://www.headandheart.capital/,https://www.linkedin.com/company/head-and-heart-capital/,Venture Capital,"Financial Services, Lending and Investments",,,1-10,"Early Stage Venture, Seed",,,Private,"31,664"
New Business Venture Fund,https://www.crunchbase.com/organization/new-business-venture-fund,Venture Capital,39,3,"Reykjavík, Gullbringusysla, Iceland","Nordic Countries, Scandinavia, Europe, Middle East, and Africa (EMEA)","New Business Venture Fund is an Icelandic, state-owned, ever-green investment fund focused on innovation and startup companies.",31,,25,Active,1998-10-01,day,http://www.nyskopun.is,https://www.linkedin.com/company/1037205/,"Biotechnology, Finance, Financial Services, FinTech, Information Technology, Pharmaceutical","Biotechnology, Financial Services, Health Care, Information Technology, Science and Engineering",,,1-10,"Early Stage Venture, Seed",,,Private,"32,003"
Expansion Capital,https://www.crunchbase.com/organization/expansion-capital,Venture Capital,39,1,"Riga, Riga, Latvia","European Union (EU), Europe, Middle East, and Africa (EMEA)",Expansion Capital AIFP plans to participate in Latvian state-owned development finance institution ALTUM organized next generation.,38,,32,Active,,,http://www.excap.lv/,https://www.linkedin.com/company/expansion-capital-aifp/,Financial Services,Financial Services,,,1-10,Venture,,,Private,"33,401"
Levensohn Venture Partners,https://www.crunchbase.com/organization/levensohn-venture-partners,Venture Capital,39,16,"Los Altos, California, United States","San Francisco Bay Area, Silicon Valley, West Coast",Levensohn Venture Partners manages both biotech and information technology portfolios with an emphasis on breakthrough technologies.,24,3,10,Active,1996-06-01,day,http://www.pascallevensohn.com,https://www.linkedin.com/company/levensohn-venture-partners/about/,Venture Capital,"Financial Services, Lending and Investments",1,Pascal Levensohn,1-10,"Early Stage Venture, Seed",,,Private,"34,758"
Renaissance Capital Partners,https://www.crunchbase.com/organization/renaissance-capital-partners,Venture Capital,39,5,"London, England, United Kingdom","Europe, Middle East, and Africa (EMEA)","Renaissance Capital Partners invests funds in high-growth, innovative, and entrepreneurial businesses and also built environment projects.",21,2,,Active,2008-01-01,year,http://www.rcpinvest.com,https://www.linkedin.com/company/renaissance-works/,"Business Development, Financial Services, Venture Capital","Financial Services, Lending and Investments, Professional Services",1,Mark Randall,1-10,"Early Stage Venture, Seed",,,Private,"35,543"
Jeff Bezos,https://www.crunchbase.com/person/jeff-bezos,"Individual/Angel, Investment Partner",39,14,"Seattle, Washington, United States","Greater Seattle Area, West Coast, Western US",Jeffrey Preston Bezos is the Founder of Blue Origin. He previously worked at Cashican People LLC as an Investor. Jeff Bezos attended Princet...,30,5,5,,,,,https://www.linkedin.com/showcase/jeff-bezos-newslines,,,,,,Seed,,,,"35,961"
Agencia Córdoba Innovar y Emprender,https://www.crunchbase.com/organization/agencia-córdoba-innovar-y-emprender,Accelerator,39,,"Córdoba, Cordoba, Argentina",Latin America,La Agencia Córdoba Innovar y Emprender es parte de los actores que trabajan para mejorar el desempeño de nuestro ecosistema emprendedor,38,,,Active,2016-01-01,year,https://innovaryemprendercba.com.ar,https://www.linkedin.com/company/agenciaiye,,,,,,Seed,For Profit,,Private,"36,189"
88mph.ac,https://www.crunchbase.com/organization/88mph-ac,Accelerator,39,1,"Nairobi, Nairobi Area, Kenya","Europe, Middle East, and Africa (EMEA)",88mph invests in early-stage web and mobile companies in the African market.,36,,10,Active,2011-01-01,year,http://www.88mph.ac,https://in.linkedin.com/company/88mph-ac,"Financial Services, Mobile, Web Browsers","Financial Services, Internet Services, Mobile, Software",1,Kresten Buch,1-10,Seed,,,Private,"38,820"
DigitalCPR,https://www.crunchbase.com/organization/digitalcpr,"Accelerator, Entrepreneurship Program, Incubator",39,,"Waterloo, Ontario, Canada",Great Lakes,DigitalCPR is a software development firm and creative studio that also runs its own startup pre-accelerator,38,,4,Active,,,https://www.digitalcpr.net/for-startups,,"Blockchain, Digital Marketing, FinTech, Software Engineering","Blockchain and Cryptocurrency, Financial Services, Other, Sales and Marketing, Science and Engineering, Software",,,11-50,Seed,For Profit,,Private,"46,743"
Hiten Shah,https://www.crunchbase.com/person/hiten-shah,Individual/Angel,39,10,"Redwood City, California, United States","San Francisco Bay Area, Silicon Valley, West Coast","Hiten Shah is the Co-Founder and CEO of Nira. He attended the University of California, Berkeley.",38,,,,,,http://hiten.com,http://www.linkedin.com/in/hnshah,,,,,,Seed,,,,"74,501"
Jabbar Internet Group,https://www.crunchbase.com/organization/jabbar-internet-group,Venture Capital,39,3,"Dubai, Dubai, United Arab Emirates","Europe, Middle East, and Africa (EMEA), Gulf Cooperation Council (GCC), Middle East",Jabbar is a leading investor in the MENA region with the biggest exits so far (maktoob.com to Yahoo) and (Souq.com to Amazon) .,24,,6,Active,2009-01-01,year,http://www.jabbar.com,http://www.linkedin.com/company/jabbar-internet-group,"E-Commerce, Finance, Internet, Venture Capital","Commerce and Shopping, Financial Services, Internet Services, Lending and Investments",2,"Hussam Khoury, Samih Toukan",251-500,"Convertible Note, Early Stage Venture, Seed, Venture",,,Private,"115,474"
Fraunhofer Venture,https://www.crunchbase.com/organization/fraunhofer-venture-gruppe,Venture Capital,39,5,"Munich, Bayern, Germany","European Union (EU), Europe, Middle East, and Africa (EMEA)","Fraunhofer Venture acts as a partner of founders, start-up companies, Fraunhofer institutes and investors.",34,,6,Active,2001-01-01,year,http://www.fraunhoferventure.de,https://www.linkedin.com/company/fraunhoferventure/,"Financial Services, Venture Capital","Financial Services, Lending and Investments",,,11-50,Seed,For Profit,Made Acquisitions,Private,"120,034"
Alan Howard,https://www.crunchbase.com/person/alan-howard-2,Individual/Angel,39,3,,,Alan Howard is a British billionaire hedge fund manager and co-founder of Brevan Howard Asset Management.,36,1,9,,,,,,,,,,,Seed,,,,"161,937"
