Startupbootcamp Australia,https://www.crunchbase.com/organization/startupbootcamp-energy-australia,"Accelerator, Angel Group, Venture Capital",135,3,"Melbourne, Victoria, Australia","Asia-Pacific (APAC), Australasia",Startupbootcamp Australia is the leading global accelerator for innovative startups solving problems that make the world a better place.,29,134,1,Active,2018-01-01,year,https://www.startupbootcamp.com.au,https://www.linkedin.com/showcase/startupbootcamp-australia,"Energy, Financial Services, Food and Beverage, Natural Resources, Sports, Sustainability","Clean Energy, Energy, Energy Efficiency, Energy Storage, FinTech, Food and Beverage, Renewable Energy, Solar, Sports, Wind Energy",3,"Richard Celm, Ruud Hendriks, Trevor Townsend",11-50,"Early Stage Venture, Seed",,,Private
6th Man Ventures,https://www.crunchbase.com/organization/6th-man-ventures,Venture Capital,134,4,"New York, New York, United States","Greater New York Area, East Coast, Northeastern US","6th Man Ventures is investing in Web3 projects, protocols, and companies.",13,125,,Active,2021-03-01,month,https://www.6thman.ventures,https://www.linkedin.com/company/6mv/?viewAsMember=true,,,2,"Mike Dudas, Serge Kassardjian",1-10,"Early Stage Venture, Seed",,,Private
Connect Ventures,https://www.crunchbase.com/organization/connect-ventures,"Micro VC, Venture Capital",134,19,"London, England, United Kingdom","Europe, Middle East, and Africa (EMEA)","Connect Ventures invests in the best product-led companies in Europe at seed stage. Categories: Consumer, Health, Fintech, SaaS",70,95,,Active,2012-01-01,day,http://www.connectventures.co/,https://www.linkedin.com/company/connect-ventures/,"Financial Services, Lending and Investments","Finance, Financial Services, Venture Capital",1,Pietro Bezza,1-10,Seed,,Was Acquired,Private
Hedosophia,https://www.crunchbase.com/organization/hedosophia,Venture Capital,134,21,"London, England, United Kingdom","Europe, Middle East, and Africa (EMEA)",Hedosophia is a global investment firm supporting category defining technology companies,62,117,14,Active,2012-01-01,year,http://www.hedosophia.com,https://www.linkedin.com/company/hedosophia,"Financial Services, Lending and Investments","Finance, Financial Services, Venture Capital",1,Ian Osborne,51-100,"Early Stage Venture, Late Stage Venture, Seed",,,Private
Fin Capital,https://www.crunchbase.com/organization/fin-venture-capital,"Private Equity Firm, Venture Capital",133,10,"San Francisco, California, United States","San Francisco Bay Area, West Coast, Western US",Fin is an asset management firm specializing in B2B Fintech Software,41,101,1,Active,2018-06-01,month,https://fin.capital/,https://www.linkedin.com/company/finvc/,"Financial Services, Lending and Investments, Software","Enterprise Software, Financial Services, FinTech, SaaS, Venture Capital",1,Logan Allin,11-50,"Convertible Note, Debt, Early Stage Venture, Late Stage Venture, Private Equity, Secondary Market, Seed, Venture",,,Private
Owl Ventures,https://www.crunchbase.com/organization/owl-ventures-lp,Venture Capital,133,15,"San Francisco, California, United States","San Francisco Bay Area, West Coast, Western US",Owl Ventures is a venture capital fund that invests in education technology companies.,75,91,,Active,2014-01-01,year,http://www.owlvc.com,http://www.linkedin.com/company/3855155,"Financial Services, Lending and Investments","Finance, Financial Services, Venture Capital",2,"Jed Smith, Tory Patterson",11-50,"Convertible Note, Early Stage Venture, Late Stage Venture, Private Equity, Seed, Venture",,,Private
FinTech Collective,https://www.crunchbase.com/organization/fintech-collective,Venture Capital,132,12,"New York, New York, United States","Greater New York Area, East Coast, Northeastern US","FinTech Collective is a New York-based venture capital fund, focused exclusively on financial services technology companies.",39,85,1,Active,2012-09-01,day,http://www.fintech.io,http://www.linkedin.com/company/fintech-collective,"Financial Services, Lending and Investments","Financial Services, FinTech, Venture Capital",2,"Brooks Gibbins, Gareth Jones",11-50,"Early Stage Venture, Initial Coin Offering, Late Stage Venture, Private Equity, Seed, Venture",,Made Acquisitions,Private
Berkeley SkyDeck Fund,https://www.crunchbase.com/organization/berkeley-skydeck-fund,"Accelerator, University Program, Venture Capital",132,4,"Berkeley, California, United States","San Francisco Bay Area, West Coast, Western US",Berkeley SkyDeck Fund is an investment Arm Behind UC Berkeley's SkyDeck Accelerator.,14,121,,Active,2017-10-01,month,http://www.skydeck.vc/,,"Financial Services, Lending and Investments","Finance, Financial Services, Venture Capital",3,"Chon Tang, Gopakumar Balakrishnan, Todd Roberts",1-10,Seed,,,Private
March Capital,https://www.crunchbase.com/organization/march-capital-partners,Venture Capital,132,19,"Santa Monica, California, United States","Greater Los Angeles Area, West Coast, Western US",March Capital is a venture growth firm that seeks to invest in the digital transformation of cloud-based software.,60,83,3,Active,2014-06-30,day,http://www.marchcp.com,https://www.linkedin.com/company/march-capital,"Financial Services, Information Technology, Lending and Investments, Professional Services","Business Development, Information Technology, Venture Capital",5,"Gregory Milken, Jamie Montgomery, Jim Armstrong, Richard Rice, Sumant Mandal",11-50,"Early Stage Venture, Late Stage Venture",,,Private
Dolby Family Ventures,https://www.crunchbase.com/organization/dolby-family-ventures,Venture Capital,132,20,"San Francisco, California, United States","San Francisco Bay Area, West Coast, Western US",Dolby Family Ventures is an early stage venture firm focused on building great technology companies.,9,88,6,Active,2014-01-01,year,http://dolbyventures.com,https://www.linkedin.com/company/dolbyventures/,"Financial Services, Lending and Investments, Media and Entertainment","Angel Investment, Digital Media, Venture Capital",,,1-10,"Early Stage Venture, Late Stage Venture, Seed, Venture",,,Private
Portfolia,https://www.crunchbase.com/organization/portfolia,Venture Capital,131,15,"Palo Alto, California, United States","San Francisco Bay Area, Silicon Valley, West Coast","Portfolia is an investment funds designed for women, backing innovative companies for returns and impact",2,100,3,Active,2013-01-01,year,https://www.portfolia.co,http://www.linkedin.com/company/portfolia,"Financial Services, Lending and Investments","Finance, Financial Services, Venture Capital",1,Trish Costello,101-250,"Early Stage Venture, Late Stage Venture, Seed, Venture",For Profit,,Private
Third Prime,https://www.crunchbase.com/organization/third-prime,Venture Capital,131,9,"New York, New York, United States","Greater New York Area, East Coast, Northeastern US",A venture capital firm that partners with exceptional entrepreneurs from the earliest stage,49,89,1,Active,2016-01-01,day,http://www.thirdprime.vc,https://www.linkedin.com/company/15189541,"Financial Services, Lending and Investments, Manufacturing","Finance, Financial Services, Industrial, Venture Capital",2,"Keith Hamlin, Wes Barton",1-10,"Early Stage Venture, Seed, Venture",,,Private
BMW i Ventures,https://www.crunchbase.com/organization/bmw-ventures,Corporate Venture Capital,131,23,"Mountain View, California, United States","San Francisco Bay Area, Silicon Valley, West Coast",BMW i Ventures focuses on BMW’s current and future business in the technology and service space.,46,82,8,Active,2011-02-01,day,http://www.bmwiventures.com,https://www.linkedin.com/company/bmw-i-ventures,"Financial Services, Lending and Investments, Transportation","Automotive, Finance, Venture Capital",,,11-50,"Debt, Early Stage Venture, Late Stage Venture, Seed, Venture",,,Private
TQ Ventures,https://www.crunchbase.com/organization/tq-ventures,Venture Capital,130,11,"New York, New York, United States","Greater New York Area, East Coast, Northeastern US",TQ Ventures is an investment firm that focuses on early-stage and growth-stage companies.,21,95,2,Active,2018-01-01,year,https://www.tqventures.com/,,"Financial Services, Lending and Investments","Finance, Financial Services, Venture Capital",3,"Andrew Marks, Schuster Tanger, Scooter Braun",1-10,"Early Stage Venture, Late Stage Venture, Seed, Venture",,,Private
Mobile Internet Capital,https://www.crunchbase.com/organization/mobile-internet-capital,Venture Capital,130,25,"Tokyo, Tokyo, Japan",Asia-Pacific (APAC),Mobile Internet Capital (MIC) invests in mobile internet technologies.,28,104,12,Active,1999-11-11,day,http://www.mickk.com,https://www.linkedin.com/company/mobile-internet-capital-inc./,"Financial Services, Hardware, Lending and Investments, Mobile, Science and Engineering","Mobile, Semiconductor, Venture Capital",,,1-10,Late Stage Venture,,,Private
Toba Capital,https://www.crunchbase.com/organization/toba-capital,Venture Capital,130,29,"San Francisco, California, United States","San Francisco Bay Area, West Coast, Western US",Toba Capital is an investment firm committed to helping create incredible technology companies.,52,78,3,Active,2012-01-01,year,http://tobacapital.com,http://www.linkedin.com/company/toba-capital,"Financial Services, Information Technology, Lending and Investments","Information Technology, Venture Capital",2,"Steve Goodman, Vinny Smith",11-50,"Early Stage Venture, Late Stage Venture, Private Equity, Seed, Venture",,,Private
Addition,https://www.crunchbase.com/organization/addition-7af4,"Private Equity Firm, Venture Capital",129,8,"New York, New York, United States","Greater New York Area, East Coast, Northeastern US","Addition invests in founder-led, technology-enabled companies.",71,75,2,Active,2019-09-01,month,https://addition.com,https://www.linkedin.com/company/additionvc,"Financial Services, Lending and Investments","Finance, Financial Services, Venture Capital",1,Lee Fixel,11-50,"Early Stage Venture, Private Equity",,,Private
Eight Capital,https://www.crunchbase.com/organization/eight-capital,Venture Capital,129,13,"Mumbai, Maharashtra, India",Asia-Pacific (APAC),Eight Capital to invest in distressed and special situation opportunities in India.,8,126,11,Active,2005-01-01,year,http://www.eightcapital.com/,https://www.linkedin.com/company/eight-capital,"Financial Services, Lending and Investments","Finance, Financial Services, Impact Investing, Venture Capital",1,Vikram Chachra,1-10,"Late Stage Venture, Post-Ipo, Venture",,,Private
Pillar VC,https://www.crunchbase.com/organization/pillar-companies-2,Venture Capital,128,14,"Boston, Massachusetts, United States","Greater Boston Area, East Coast, New England","Pillar VC invests in seed-stage companies, supporting unstoppable founders with capital, connections, coaching, and peer support.",22,80,3,Active,2016-01-01,year,http://pillar.vc/,https://www.linkedin.com/company/pillar-vc/,"Financial Services, Lending and Investments","Finance, Financial Services, Venture Capital",5,"Ash Ashutosh, Jamie Goldstein, Russ Wilcox, Sarah Hodges, Yvonne Hao",11-50,"Early Stage Venture, Late Stage Venture, Seed, Venture",,,Private
Felix Capital,https://www.crunchbase.com/organization/felix-capital,Venture Capital,128,12,"London, England, United Kingdom","Europe, Middle East, and Africa (EMEA)","Felix Capital is a venture fund that focuses on digital commerce, digital media, and information technology companies.",47,68,3,Active,2014-01-01,year,http://www.felixcap.com,https://www.linkedin.com/company/felix-capital,"Financial Services, Lending and Investments, Professional Services","Consulting, Finance, Financial Services, FinTech, Venture Capital",3,"Abir Basak, Antoine Nussenbaum, Frederic Court",11-50,"Early Stage Venture, Late Stage Venture, Private Equity, Seed, Venture",,,Private
R/GA Ventures,https://www.crunchbase.com/organization/r-ga-ventures,Corporate Venture Capital,128,23,"New York, New York, United States","Greater New York Area, East Coast, Northeastern US",R/GA Ventures is R/investment GA's arm that assists industry leaders in capitalizing on disruptive technologies.,2,119,1,Active,2013-08-01,day,https://ventures.rga.com,https://www.linkedin.com/company/rgaventures,"Financial Services, Lending and Investments, Professional Services","Business Development, Finance, Financial Services, Venture Capital",1,Nick Coronges,11-50,"Convertible Note, Early Stage Venture, Seed, Venture",,,Private
ParaFi Capital,https://www.crunchbase.com/organization/parafi-capital,"Hedge Fund, Private Equity Firm, Venture Capital",128,3,"Greenwich, Connecticut, United States","East Coast, New England, Northeastern US",ParaFi is an alternative asset management and technology firm operating liquid and venture strategies focused on the digital asset ecosystem,39,117,2,Active,2018-01-01,year,https://www.parafi.com,https://www.linkedin.com/company/paraficapital/,"Blockchain and Cryptocurrency, Financial Services, Lending and Investments, Other","Blockchain, Decentralized Finance (DeFi), Finance, Financial Services, Venture Capital",1,Benjamin Forman,11-50,,For Profit,,Private
BREEGA,https://www.crunchbase.com/organization/breega-capital,Venture Capital,127,15,"Paris, Ile-de-France, France","European Union (EU), Europe, Middle East, and Africa (EMEA)","Backing bold founders from pre-Seed to Series A+ in Digital, Climate & Deep Tech across Europe & Africa. €700M AUM. Built by entrepreneurs.",95,93,,Active,2013-04-01,day,https://www.breega.com/,https://www.linkedin.com/company/breega,"Financial Services, Lending and Investments","FinTech, Impact Investing, InsurTech, Venture Capital",3,"Ben Marrel, Francois Paulus, Maximilien Bacot",11-50,"Convertible Note, Early Stage Venture, Seed, Venture",,,Private
Credo Ventures,https://www.crunchbase.com/organization/credo-ventures,Venture Capital,127,16,"Prague, Hlavni mesto Praha, Czech Republic","European Union (EU), Europe, Middle East, and Africa (EMEA)",Credo Ventures is a venture capital company focused on early stage investments in Central and Eastern Europe.,48,78,1,Active,2009-03-02,day,http://www.credoventures.com,http://www.linkedin.com/company/credo-ventures,"Financial Services, Information Technology, Internet Services, Lending and Investments","Finance, Financial Services, Information Technology, Internet, Venture Capital",2,"Jan Habermann, Ondrej Bartos",1-10,"Convertible Note, Early Stage Venture, Late Stage Venture, Seed, Venture",,,Private
Expa,https://www.crunchbase.com/organization/expa,"Accelerator, Incubator, Venture Capital",127,14,"San Francisco, California, United States","San Francisco Bay Area, West Coast, Western US","Expa is a venture studio and VC fund that supports early-stage startups through expertise, access, and funding.",22,86,,Active,2013-05-02,day,http://www.expa.com,http://www.linkedin.com/company/expa,"Commerce and Shopping, Financial Services, Internet Services, Software","Consumer Software, Developer Tools, E-Commerce Platforms, Enterprise Software, FinTech",1,Garrett Camp,11-50,"Convertible Note, Early Stage Venture, Late Stage Venture, Seed",For Profit,,Private
Portage Ventures,https://www.crunchbase.com/organization/portag3-ventures,Venture Capital,126,10,"Toronto, Ontario, Canada",Great Lakes,Portage Ventures is a global fintech-focused venture capital investor.,46,87,1,Active,2016-01-01,year,https://portageinvest.com/,https://www.linkedin.com/company/portagevc,"Financial Services, Lending and Investments","Financial Services, FinTech, Venture Capital",3,"Adam Felesky, Juliette Souliman, Paul Desmarais III",51-100,"Early Stage Venture, Late Stage Venture, Seed, Venture",,,Private
Episode 1,https://www.crunchbase.com/organization/episode,Venture Capital,126,8,"London, England, United Kingdom","Europe, Middle East, and Africa (EMEA)","Episode1 Ventures is a venture capital fund set up to invest in early-stage technology companies based in London, UK.",51,67,,Active,2013-01-01,year,http://www.episode1.com,http://www.linkedin.com/company/3242579,"Financial Services, Lending and Investments, Software","Enterprise Software, Finance, Financial Services, Venture Capital",3,"Adrian Lloyd, Damien Lane, Simon Murdoch",1-10,"Convertible Note, Early Stage Venture, Seed, Venture",For Profit,,Private
SGH CAPITAL,https://www.crunchbase.com/organization/sgh-capital,Venture Capital,126,32,"Luxembourg, Luxembourg, Luxembourg","European Union (EU), Europe, Middle East, and Africa (EMEA)",SGH Capital operates as a platform of funds that supports technology driven companies.,5,113,2,Active,2014-01-01,day,https://www.sghcapital.com,https://www.linkedin.com/company/sgh-capital,"Financial Services, Information Technology, Lending and Investments","Financial Services, Information Technology, Venture Capital",1,Alexandre Azoulay,1-10,"Convertible Note, Early Stage Venture, Late Stage Venture, Seed, Venture",,,Private
TusStar,https://www.crunchbase.com/organization/tusstar,"Accelerator, Entrepreneurship Program, Incubator, Venture Capital",126,7,"Beijing, Beijing, China",Asia-Pacific (APAC),TusStar is an investment firm that integrates innovation services and building business platforms.,38,115,5,Active,1999-01-01,year,http://www.tusstar.com/,https://www.linkedin.com/company/%E5%90%AF%E8%BF%AA%E4%B9%8B%E6%98%9F/,"Financial Services, Lending and Investments","Finance, Financial Services, Incubators",1,Jinsheng Zhang,101-250,"Early Stage Venture, Seed",,,Private
Acton Capital,https://www.crunchbase.com/organization/acton-capital-partners,Venture Capital,124,42,"München, Bayern, Germany","European Union (EU), Europe, Middle East, and Africa (EMEA)","Acton Capital is a leading growth venture capital investor in tech-enabled business models, headquartered in Munich, Germany.",52,85,6,Active,1999-01-01,year,http://www.actoncapital.com,http://www.linkedin.com/company/acton-capital-partners,"Financial Services, Lending and Investments, Software","Financial Services, FinTech, SaaS, Venture Capital",4,"Christoph Braun, Frank Seehaus, Jan-Gisbert Schultze, Paul-Bernhard Kallen",11-50,"Early Stage Venture, Late Stage Venture, Venture",,,Private
LongHash Ventures,https://www.crunchbase.com/organization/longhash,"Accelerator, Venture Capital",124,3,"Singapore, Central Region, Singapore","Asia-Pacific (APAC), Association of Southeast Asian Nations (ASEAN), Southeast Asia",LongHash Ventures is a global blockchain accelerator and VC fund.,25,114,,Active,2018-01-01,year,https://www.longhashventures.com,https://www.linkedin.com/company/longhashventures,"Financial Services, Information Technology, Internet Services","Financial Services, Information Technology, Internet",1,Emma Cui,11-50,"Early Stage Venture, Grant, Seed, Venture",,,Private
AVP,https://www.crunchbase.com/organization/axa-strategic-ventures,Venture Capital,123,17,"Paris, Ile-de-France, France","European Union (EU), Europe, Middle East, and Africa (EMEA)","AVP is an independent global investment platform dedicated to high-growth, tech (from deep-tech to tech-enabled) companies.",66,84,1,Active,2016-01-01,year,https://www.avpcap.com ,https://www.linkedin.com/company/avpcap,"Financial Services, Lending and Investments","Finance, Financial Services, Venture Capital",2,"Francois Robinet, Imran Akram",51-100,"Debt, Early Stage Venture, Late Stage Venture, Private Equity, Seed, Venture",,,Private
Mubadala Capital Ventures,https://www.crunchbase.com/organization/mubadala-ventures,"Corporate Venture Capital, Fund Of Funds, Venture Capital",122,25,"San Francisco, California, United States","San Francisco Bay Area, West Coast, Western US",Mubadala Ventures is the venture capital arm of Mubadala that focuses on advanced technology.,29,83,15,Active,2017-10-01,month,https://www.mubadala.com/,https://www.linkedin.com/company/mubadala/,"Financial Services, Government and Military, Lending and Investments","Asset Management, Government, Venture Capital",,,501-1000,"Early Stage Venture, Late Stage Venture, Post-Ipo",,Made Acquisitions,Private
HashKey Capital,https://www.crunchbase.com/organization/hashkey-capital-9c60,"Hedge Fund, Venture Capital",122,4,"Hong Kong, Hong Kong Island, Hong Kong",Asia-Pacific (APAC),"HashKey Capital is an institutional asset manager investing exclusively in blockchain technology, fintech technology and digital assets.",14,114,1,Active,2018-01-01,year,https://hashkey.capital,https://www.linkedin.com/company/hashkeycapital/,,,,,51-100,"Early Stage Venture, Grant, Initial Coin Offering, Private Equity, Seed, Venture",,,Private
Mountain Partners,https://www.crunchbase.com/organization/mountain-partners,"Fund Of Funds, Venture Capital",122,31,"Zürich, Zurich, Switzerland","Europe, Middle East, and Africa (EMEA)",Mountain Partners is a globally operating company builder that invests in technology companies.,18,108,4,Active,2005-01-01,day,https://mountain.partners/,https://www.linkedin.com/company/mountain-partners-group,"Financial Services, Lending and Investments, Professional Services","Asset Management, Business Development, Venture Capital",3,"Christine Schmitz-Riol, Daniel S. Wenzel, Dr. Cornelius Boersch",11-50,"Early Stage Venture, Seed, Venture",,Made Acquisitions,Private
Genblock Capital,https://www.crunchbase.com/organization/genblock-capital,Venture Capital,121,,"San Francisco, California, United States","San Francisco Bay Area, West Coast, Western US","Genblock Capital invests exclusively in blockchain and cryptocurrency, with a focus on decentralized finance.",5,119,,Active,2017-01-01,year,https://genblock.capital/,https://www.linkedin.com/company/genblock-capital,,,1,Bilal Junaid,1-10,"Early Stage Venture, Seed",,,Private
Playground Global,https://www.crunchbase.com/organization/playground-global,Venture Capital,120,17,"Palo Alto, California, United States","San Francisco Bay Area, Silicon Valley, West Coast",Playground is an early-stage deep tech venture capital firm backing technical and scientific founders,54,68,1,Active,2015-01-06,day,http://playground.vc,https://www.linkedin.com/company/playground-global,"Artificial Intelligence (AI), Data and Analytics, Financial Services, Hardware, Information Technology, Lending and Investments, Science and Engineering, Software","Artificial Intelligence (AI), Information Technology, Robotics, Software, Venture Capital",4,"Bruce Leak, Matt Hershenson, Peter Barrett, Peter Barrett",11-50,Early Stage Venture,,,Private
Capnamic,https://www.crunchbase.com/organization/capnamic-ventures,Venture Capital,118,19,"Cologne, Nordrhein-Westfalen, Germany","European Union (EU), Europe, Middle East, and Africa (EMEA)",Capnamic is a venture capital firm investing in outstanding early-stage companies within Europe.,50,70,,Active,2012-01-01,year,http://capnamic.com,https://www.linkedin.com/company/capnamic/,"Financial Services, Lending and Investments","Finance, Financial Services, Venture Capital",4,"André Christ, Christian Siegele, Jorg Binnenbrucker, Jörg Beyer",11-50,"Early Stage Venture, Late Stage Venture, Seed",,,Private
Lemniscap,https://www.crunchbase.com/organization/lemniscap,"Hedge Fund, Venture Capital",118,1,"George Town, Midland, Cayman Islands",,Lemniscap is an investment firm specializing in investments in emerging cryptoassets and blockchain companies,47,107,,Active,2017-11-01,month,https://lemniscap.com,https://linkedin.com/company/Lemniscap,"Blockchain and Cryptocurrency, Financial Services, Lending and Investments, Other, Payments, Software","Bitcoin, Blockchain, Cryptocurrency, Ethereum, Hedge Funds, Venture Capital",1,Roderik van der Graaf,1-10,"Early Stage Venture, Initial Coin Offering, Late Stage Venture, Private Equity, Seed, Venture",,,Private
Mechanism Capital,https://www.crunchbase.com/organization/mechanism-capital,Venture Capital,118,2,"Singapore, Central Region, Singapore","Asia-Pacific (APAC), Association of Southeast Asian Nations (ASEAN), Southeast Asia",Mechanism Capital is an investment firm that invests in the cryptocurrency industry with a focus on decentralized finance or DeFi.,28,108,,Active,2020-01-01,year,https://www.mechanismcapital.co,https://www.linkedin.com/company/mechanism-capital/,"Blockchain and Cryptocurrency, Financial Services, Lending and Investments, Payments, Software","Cryptocurrency, Decentralized Finance (DeFi), Finance, Financial Services, Venture Capital",1,Andrew Kang,11-50,"Early Stage Venture, Secondary Market, Venture",,,Private
Kurma Partners,https://www.crunchbase.com/organization/kurma-life-science-partners,Venture Capital,117,13,"Paris, Ile-de-France, France","European Union (EU), Europe, Middle East, and Africa (EMEA)",Kurma Partners is a management company specializing in the financing of innovation in healthcare and biotechnology.,58,61,5,Active,2009-07-01,month,http://www.kurmapartners.com,https://www.linkedin.com/company/3107240/,"Biotechnology, Financial Services, Health Care, Science and Engineering","Biotechnology, Financial Services, Health Care, Health Diagnostics, Life Science",1,Thierry Laugel,1001-5000,"Convertible Note, Debt, Early Stage Venture, Late Stage Venture, Post-Ipo, Seed, Venture",,Was Acquired,Private
HOF Capital,https://www.crunchbase.com/organization/hof-capital,Venture Capital,117,8,"New York, New York, United States","Greater New York Area, East Coast, Northeastern US",HOF Capital is a global multistage VC firm with $1 billion in AUM that partners with ambitious entrepreneurs from idea to IPO.,13,87,4,Active,2016-01-01,year,http://www.hofcapital.com,https://www.linkedin.com/company/hof-capital/,"Financial Services, Lending and Investments",Venture Capital,3,"Fady Yacoub, Hisham Elhaddad, Onsi Sawiris",11-50,"Early Stage Venture, Initial Coin Offering, Late Stage Venture, Private Equity, Secondary Market, Seed, Venture",,,Private
