Organization/Person Name,Organization/Person Name URL,Investor Type,Number of Investments,Number of Exits,Location,Regions,Description,Number of Lead Investments,Number of Portfolio Organizations,Number of Exits (IPO),Operating Status,Founded Date,Founded Date Precision,Website,LinkedIn,Industry Groups,Industries,Number of Founders,Founders,Number of Employees,Investment Stage,Company Type,Acquisition Status,IPO Status
Techstars,https://www.crunchbase.com/organization/techstars,"Accelerator, Venture Capital","6,187",527,"Boulder, Colorado, United States","Greater Denver Area, Western US",Techstars is an accelerator that provides pre-seed investment and mentoring for various early stage startups.,"3,257","4,714",15,Active,2006-08-01,day,https://www.techstars.com,https://www.linkedin.com/company/techstars,"Financial Services, Lending and Investments, Professional Services","Consulting, Finance, Financial Services, FinTech, Incubators",5,"Brad Feld, David Brown, David Cohen, Jared Polis, Mike Romano",251-500,"Convertible Note, Early Stage Venture, Non Equity Assistance, Seed, Venture",For Profit,Made Acquisitions,Private
500 Global,https://www.crunchbase.com/organization/500-startups,"Accelerator, Angel Group, Micro VC, Venture Capital","3,179",399,"San Francisco, California, United States","San Francisco Bay Area, West Coast, Western US",500 Global is a multi-stage venture capital firm that invests in founders building fast-growing technology companies.,485,"2,435",20,Active,2010-07-30,day,http://500.co,https://www.linkedin.com/company/500global,"Financial Services, Internet Services, Lending and Investments","Finance, Financial Services, Funding Platform, Internet, Venture Capital",2,"Christine Tsai, Kai Roh",251-500,"Early Stage Venture, Late Stage Venture, Seed, Venture",For Profit,,Private
SOSV,https://www.crunchbase.com/organization/sosv,"Accelerator, Venture Capital","2,884",80,"Princeton, New Jersey, United States","East Coast, Northeastern US",SOSV is a deep tech venture firm that invests from a startup's inception.,"1,149","1,445",8,Active,1995-01-01,year,https://sosv.com,https://www.linkedin.com/company/sosv,"Financial Services, Lending and Investments","Finance, Financial Services, Venture Capital",1,Sean O'Sullivan,51-100,"Early Stage Venture, Seed",,,Private
New Enterprise Associates,https://www.crunchbase.com/organization/new-enterprise-associates,Venture Capital,"2,235",611,"Menlo Park, California, United States","San Francisco Bay Area, Silicon Valley, West Coast",New Enterprise Associates is a venture capital firm that focuses on investments in technology and healthcare startups.,792,"1,197",219,Active,1977-01-01,day,http://www.nea.com,https://www.linkedin.com/company/new-enterprise-associates,"Financial Services, Health Care, Lending and Investments, Other","Consumer, Finance, Financial Services, Health Care, Venture Capital",3,"Chuck Newhall, Frank A. Bonsal, Richard Kramlich",101-250,"Convertible Note, Debt, Early Stage Venture, Late Stage Venture, Post-Ipo, Venture",,Made Acquisitions,Private
Bossa Invest,https://www.crunchbase.com/organization/bossanova-investimentos,Venture Capital,"2,205",229,"São Paulo, Sao Paulo, Brazil",Latin America,Bossa Invest manages investment portfolios and provides asset management services to clients in various sectors.,58,"1,671",23,Active,2011-01-01,year,http://www.bossainvest.com,https://www.linkedin.com/company/bossanova-investimentos,"Financial Services, Lending and Investments","Finance, Financial Services, Venture Capital",2,"Joao Kepler Braga, Pierre Schurmann",11-50,"Early Stage Venture, Seed, Venture",,,Private
Accel,https://www.crunchbase.com/organization/accel,Venture Capital,"2,179",394,"Palo Alto, California, United States","San Francisco Bay Area, Silicon Valley, West Coast",Accel is an seed and growth-stage venture capital firm that helps a global community of entrepreneurs.,881,"1,060",68,Active,1983-01-01,year,http://www.accel.com,https://www.linkedin.com/company/accel-vc,"Financial Services, Lending and Investments","Finance, Financial Services, Venture Capital",2,"Arthur Patterson, Jim Swartz",101-250,"Convertible Note, Early Stage Venture, Late Stage Venture, Private Equity, Seed, Venture",,Made Acquisitions,Private
Sequoia Capital,https://www.crunchbase.com/organization/sequoia-capital,Venture Capital,"2,129",421,"Menlo Park, California, United States","San Francisco Bay Area, Silicon Valley, West Coast","Sequoia Capital is a VC firm that invests in startups in the energy, financial, enterprise, healthcare, internet, and mobile industries.",794,"1,192",129,Active,1972-11-01,day,http://www.sequoiacap.com,http://www.linkedin.com/company/sequoia,"Financial Services, Lending and Investments","Finance, Financial Services, Venture Capital",2,"Donald Valentine, W. M. Coughran",101-250,"Crowdfunding, Early Stage Venture, Initial Coin Offering, Late Stage Venture, Post-Ipo, Seed, Venture",,,Private
Plug and Play,https://www.crunchbase.com/organization/plug-and-play-ventures,"Accelerator, Co-Working Space, University Program, Venture Capital","2,005",194,"Sunnyvale, California, United States","San Francisco Bay Area, Silicon Valley, West Coast",Plug and Play is an innovation platform bringing together startups and large corporations.,236,"1,628",11,Active,2006-01-01,year,https://www.plugandplaytechcenter.com,https://www.linkedin.com/company/plug-and-play-tech-center,"Commerce and Shopping, Financial Services, Lending and Investments, Real Estate","Financial Services, FinTech, InsurTech, Retail, Smart Cities, Venture Capital",4,"Ali Safavi, Jackie Hernandez, Jojo Flores, Saeed Amidi",501-1000,"Early Stage Venture, Non Equity Assistance, Private Equity, Seed",,,Private
Alumni Ventures,https://www.crunchbase.com/organization/alumni-ventures-group,"Angel Group, Hedge Fund, Micro VC, Venture Capital","1,979",176,"Manchester, New Hampshire, United States","East Coast, New England, Northeastern US",Alumni Ventures Group is an venture capital investment firm that manages fund families that invest in a portfolio of companies.,411,"1,484",22,Active,2014-01-01,year,http://www.av.vc,https://www.linkedin.com/company/alumniventures,"Financial Services, Lending and Investments, Professional Services","Angel Investment, Business Development, Venture Capital",3,"Luke Antal, Michael Collins, Michael Madden",251-500,"Convertible Note, Early Stage Venture, Initial Coin Offering, Late Stage Venture, Seed, Venture",,,Private
Antler,https://www.crunchbase.com/organization/antler-be9c,Venture Capital,"1,737",11,"Singapore, Central Region, Singapore","Asia-Pacific (APAC), Association of Southeast Asian Nations (ASEAN), Southeast Asia",Antler is a venture capital firm that focuses on early stage investments for startups.,762,"1,490",,Active,2018-01-01,year,https://antler.co,https://www.linkedin.com/company/antlerglobal,"Financial Services, Lending and Investments","Finance, Financial Services, Venture Capital",20,"Adryz Arriffin, Crystal Kendzior, Daniel Dudas- Schwarz, Dilan Mizrakli Landgraff, Edwin Fong, Fridtjof Berge, Hoang Tran, Juan Barragan, Jussi Salovaara, Khie Sydney Udag, Magnus Grimeland, Oswaldo Alvarez, Philip Causgrove, Rajesh Rai, Rudine Mottaghian, Sam Hogan, Sereen Teoh, Stefan Jung, Tristan Marino, Vegard Medbo",251-500,"Early Stage Venture, Seed, Venture",For Profit,,Private
Andreessen Horowitz,https://www.crunchbase.com/organization/andreessen-horowitz,Venture Capital,"1,684",248,"Menlo Park, California, United States","San Francisco Bay Area, Silicon Valley, West Coast",Andreessen Horowitz is a stage-agnostic venture capital firm with assets under management across multiple funds.,757,935,39,Active,2009-06-01,month,http://www.a16z.com,https://www.linkedin.com/company/a16z,"Financial Services, Lending and Investments","Angel Investment, Finance, Financial Services, Venture Capital",2,"Ben Horowitz, Marc Andreessen",251-500,"Early Stage Venture, Late Stage Venture, Seed, Venture",,Made Acquisitions,Private
Intel Capital,https://www.crunchbase.com/organization/intel-capital,Corporate Venture Capital,"1,606",508,"Santa Clara, California, United States","San Francisco Bay Area, Silicon Valley, West Coast","Intel Capital invests in innovative startups targeting cloud and AI infrastructure, cybersecurity, and other disruptive technologies.",560,"1,063",89,Active,1991-01-01,year,http://www.intelcapital.com,https://www.linkedin.com/company/intelcapital,"Financial Services, Lending and Investments","Finance, Financial Services, Venture Capital",3,"Dave Johnson, Les Vadasz, Peter Levin",51-100,"Convertible Note, Early Stage Venture, Late Stage Venture, Post-Ipo, Private Equity, Seed, Venture",,,Private
FJ Labs,https://www.crunchbase.com/organization/fj-labs,"Micro VC, Venture Capital","1,564",111,"New York, New York, United States","Greater New York Area, East Coast, Northeastern US",FJ Labs is a stage-agnostic investment firm that focuses on marketplaces and consumer facing startups.,60,"1,009",17,Active,2015-01-01,year,http://www.fjlabs.com,https://www.linkedin.com/company/fj-labs,"Financial Services, Lending and Investments","Finance, Financial Services, Venture Capital",2,"Fabrice Grinda, Jose Marin",11-50,"Early Stage Venture, Late Stage Venture, Seed, Venture",,,Private
Lightspeed Venture Partners,https://www.crunchbase.com/organization/lightspeed-venture-partners,Venture Capital,"1,493",250,"Menlo Park, California, United States","San Francisco Bay Area, Silicon Valley, West Coast","Lightspeed Venture Partners is a venture capital firm that engages in consumer, enterprise, technology, and cleantech markets.",541,840,37,Active,2000-01-01,year,http://lsvp.com,http://www.linkedin.com/company/lightspeed-venture-partners,"Financial Services, Lending and Investments","Finance, Financial Services, Venture Capital",4,"Barry Eggers, Christopher Schaepe, Peter Nieh, Ravi Mhatre",101-250,"Early Stage Venture, Late Stage Venture, Seed",,,Private
Bessemer Venture Partners,https://www.crunchbase.com/organization/bessemer-venture-partners,Venture Capital,"1,461",314,"San Francisco, California, United States","San Francisco Bay Area, West Coast, Western US","Bessemer Venture Partners is a venture capital firm that invests in enterprise, consumer, and healthcare early-to-late stage startups.",515,769,67,Active,1911-01-01,year,http://www.bvp.com,https://www.linkedin.com/company/bessemer-venture-partners,"Financial Services, Lending and Investments","Finance, Financial Services, FinTech, InsurTech, Venture Capital",1,Henry Phipps,101-250,"Early Stage Venture, Late Stage Venture",,Made Acquisitions,Private
General Catalyst,https://www.crunchbase.com/organization/general-catalyst-partners,Venture Capital,"1,455",217,"San Francisco, California, United States","San Francisco Bay Area, West Coast, Western US",General Catalyst collaborates with founders to support resilience and applied AI from seed to growth stages.,602,831,30,Active,2000-01-01,day,http://www.generalcatalyst.com,https://www.linkedin.com/company/general-catalyst,"Financial Services, Lending and Investments","Finance, Financial Services, Venture Capital",3,"David Fialkow, David Orfao, Joel Cutler",101-250,"Convertible Note, Debt, Early Stage Venture, Late Stage Venture, Post-Ipo, Private Equity, Seed, Venture",,Made Acquisitions,Private
Kleiner Perkins,https://www.crunchbase.com/organization/kleiner-perkins-caufield-byers,Venture Capital,"1,448",348,"Menlo Park, California, United States","San Francisco Bay Area, Silicon Valley, West Coast","Kleiner Perkins is a venture capital firm that specializes in investing in early-stage, incubation, and growth companies.",413,734,111,Active,1972-03-01,day,https://www.kleinerperkins.com,https://www.linkedin.com/company/kleinerperkins,"Financial Services, Lending and Investments","Finance, Financial Services, Incubators, Venture Capital",4,"Brook Byers, Eugene Kleiner, Frank Caufield, Tom Perkins",11-50,"Early Stage Venture, Late Stage Venture, Private Equity, Seed, Venture",,,Private
Right Side Capital Management,https://www.crunchbase.com/organization/right-side-capital-management,"Micro VC, Venture Capital","1,382",216,"San Francisco, California, United States","San Francisco Bay Area, West Coast, Western US",Right Side Capital Management is a technology startup investment firm focused exclusively on the pre-seed stage.,55,"1,312",2,Active,2010-01-01,day,http://rightsidecapital.com,https://www.linkedin.com/company/right-side-capital-management,"Financial Services, Lending and Investments","Finance, Financial Services, Venture Capital",2,"Dave Lambert, Kevin Dick",1-10,"Convertible Note, Early Stage Venture, Seed, Venture",,,Private
Newchip Accelerator,https://www.crunchbase.com/organization/newchip,"Accelerator, Incubator, Venture Capital","1,285",13,"Austin, Texas, United States",Southern US,Newchip is a global remote startup accelerator.,26,"1,281",,Active,2016-01-01,year,https://www.newchip.com,https://www.linkedin.com/company/newchip/,"Apps, Commerce and Shopping, Software","Apps, Retail, Software",4,"Andrew Ryan, Andrew Ryan, Nihar Patel, Travis Brodeen",51-100,"Early Stage Venture, Seed",,,Private
Khosla Ventures,https://www.crunchbase.com/organization/khosla-ventures,Venture Capital,"1,282",178,"Menlo Park, California, United States","San Francisco Bay Area, Silicon Valley, West Coast","Khosla Ventures provides venture assistance to entrepreneurs in AI, sustainability, enterprise, consumer, health and frontier technologies.",475,663,31,Active,2004-01-01,year,http://www.khoslaventures.com,https://www.linkedin.com/company/khosla-ventures,"Financial Services, Lending and Investments","Finance, Financial Services, Venture Capital",2,"Samir Kaul, Vinod Khosla",101-250,"Early Stage Venture, Late Stage Venture, Post-Ipo, Seed, Venture",,,Private
Index Ventures,https://www.crunchbase.com/organization/index-ventures,Venture Capital,"1,210",260,"San Francisco, California, United States","San Francisco Bay Area, West Coast, Western US",Index Ventures is a venture capital firm that helps the entrepreneurs turn bold ideas into global businesses.,483,653,52,Active,1996-01-01,year,http://www.indexventures.com,http://www.linkedin.com/company/index-ventures,"Financial Services, Lending and Investments","Angel Investment, Finance, Financial Services, Venture Capital",4,"David Rimer, Giuseppe Zocco, Neil Rimer, Terrence Rohan",101-250,"Early Stage Venture, Late Stage Venture, Seed, Venture",,,Private
Tiger Global Management,https://www.crunchbase.com/organization/tiger-global,"Hedge Fund, Private Equity Firm, Venture Capital","1,206",169,"New York, New York, United States","Greater New York Area, East Coast, Northeastern US",Tiger Global Management is an investment firm that invests in global public and private companies.,698,787,84,Active,2001-03-01,month,https://www.tigerglobal.com,https://www.linkedin.com/company/tiger-global-management,"Financial Services, Lending and Investments","Finance, Financial Services, Hedge Funds, Venture Capital",1,Chase Coleman,101-250,"Early Stage Venture, Late Stage Venture, Post-Ipo, Private Equity, Secondary Market, Seed",,,Private
Google Ventures,https://www.crunchbase.com/organization/google-ventures,"Corporate Venture Capital, Venture Capital","1,184",266,"San Francisco, California, United States","San Francisco Bay Area, West Coast, Western US","Google Ventures is an investment arm of Alphabet that provides seed, venture, and growth-stage funding to technology companies.",342,703,66,Active,2009-01-01,year,http://www.gv.com,https://www.linkedin.com/company/googleventures,"Financial Services, Lending and Investments","Finance, Financial Services, Venture Capital",1,Bill Maris,251-500,"Convertible Note, Crowdfunding, Early Stage Venture, Late Stage Venture, Post-Ipo, Private Equity, Seed, Venture",,,Private
European Innovation Council,https://www.crunchbase.com/organization/european-innovation-council,"Accelerator, Venture Capital","1,154",30,"Brussels, Brussels Hoofdstedelijk Gewest, Belgium","European Union (EU), Europe, Middle East, and Africa (EMEA)","The European Innovation Council aims to support top-class innovators, entrepreneurs, small companies and researchers with bright ideas.",841,659,9,Active,1957-03-25,day,https://eic.ec.europa.eu,https://www.linkedin.com/company/eismea,"Administrative Services, Community and Lifestyle, Government and Military, Social Impact","Government, Office Administration, Social Entrepreneurship",,,501-1000,"Early Stage Venture, Grant",For Profit,,Private
Liquid 2 Ventures,https://www.crunchbase.com/organization/liquid2-ventures,Venture Capital,"1,143",103,"San Francisco, California, United States","San Francisco Bay Area, West Coast, Western US","Liquid 2 Ventures is an investing firm that focuses on investing in Seed, Early Stage companies.",14,894,3,Active,2015-01-01,year,http://liquid2.vc,https://www.linkedin.com/company/liquid-2-ventures,"Financial Services, Lending and Investments","Financial Exchanges, Impact Investing, Venture Capital",4,"Joe Montana, Michael Ma, Mike Miller, Nathaniel Montana",1-10,"Early Stage Venture, Late Stage Venture, Seed",,,Private
Wayra,https://www.crunchbase.com/organization/wayra,Corporate Venture Capital,"1,136",52,"Madrid, Madrid, Spain","European Union (EU), Europe, Middle East, and Africa (EMEA)",Wayra connects Telefonica and technological disruptors around the world.,81,684,1,Active,2011-01-01,year,https://www.wayra.com,https://www.linkedin.com/company/wayra,"Financial Services, Lending and Investments, Professional Services","Business Development, Incubators, Innovation Management",1,Marta Antunez,101-250,"Early Stage Venture, Non Equity Assistance, Seed, Venture",For Profit,,Private
HSG,https://www.crunchbase.com/organization/hsg-cap,"Private Equity Firm, Venture Capital","1,125",110,"Hong Kong, Hong Kong Island, Hong Kong",Asia-Pacific (APAC),"HSG is a leading venture capital and private equity firm investing globally in the technology, healthcare, and consumer sectors.",506,790,86,Active,2005-09-01,month,https://www.hsgcap.com/,https://www.linkedin.com/company/hong-shan/,"Financial Services, Lending and Investments","Finance, Financial Services, FinTech, Venture Capital",1,Neil Shen,251-500,"Early Stage Venture, Late Stage Venture, Private Equity, Seed, Venture",For Profit,Made Acquisitions,Private
Innovate UK,https://www.crunchbase.com/organization/innovate-u-k-,"Entrepreneurship Program, Venture Capital","1,124",68,"Swindon, Wiltshire, United Kingdom","Europe, Middle East, and Africa (EMEA)","Innovate UK holds funding competitions for businesses and research organizations in sectors, including emerging technologies.",826,902,29,Active,1959-07-01,day,http://www.innovateuk.gov.uk,https://www.linkedin.com/company/innovateuk,"Financial Services, Government and Military","Finance, Financial Services, Government",1,Richard J Hebdon,101-250,Grant,For Profit,,Private
Global Founders Capital,https://www.crunchbase.com/organization/global-founders-capital,"Private Equity Firm, Venture Capital",996,104,"Berlin, Berlin, Germany","European Union (EU), Europe, Middle East, and Africa (EMEA)",GFC is a venture fund that supports entrepreneurs at any stage in their business development across global markets.,255,698,11,Active,2013-01-01,year,https://www.globalfounderscapital.com,https://www.linkedin.com/company/global-founders-capital,"Financial Services, Lending and Investments","Finance, Financial Services, Impact Investing, Venture Capital",1,Oliver Samwer,11-50,"Early Stage Venture, Private Equity, Seed",,,Private
High-Tech Gruenderfonds,https://www.crunchbase.com/organization/high-tech-gründerfonds,Venture Capital,942,125,"Bonn, Nordrhein-Westfalen, Germany","European Union (EU), Europe, Middle East, and Africa (EMEA)",High-Tech Gruenderfonds is a financial services company that specializes in investments and financing for various sectors.,256,658,4,Active,2005-09-01,day,https://www.htgf.de,http://www.linkedin.com/company/high-tech-grunderfonds,"Financial Services, Hardware, Health Care, Lending and Investments, Software","Hardware, Health Care, Software, Venture Capital",1,Alexander von Frankenberg,101-250,"Early Stage Venture, Late Stage Venture, Seed, Venture",,,Private
FasterCapital,https://www.crunchbase.com/organization/fastercapital,"Accelerator, Micro VC, Venture Capital",935,9,"Dubai, Dubai, United Arab Emirates","Europe, Middle East, and Africa (EMEA), Gulf Cooperation Council (GCC), Middle East",FasterCapital is an online startup incubator and accelerator that helps entrepreneurs build and grow their businesses.,700,875,2,Active,2010-01-01,year,http://www.fastercapital.com,https://www.linkedin.com/company/fastercapital,"Design, Financial Services, Internet Services, Lending and Investments, Other, Professional Services, Sales and Marketing, Software","Business Development, Digital Marketing, Incubators, SEO, Small and Medium Businesses, Software, Venture Capital, Web Design, Web Development",1,Hesham Zreik,251-500,"Convertible Note, Early Stage Venture, Grant, Late Stage Venture, Non Equity Assistance, Private Equity, Seed, Venture",,,Private
Battery Ventures,https://www.crunchbase.com/organization/battery-ventures,Venture Capital,873,226,"Boston, Massachusetts, United States","Greater Boston Area, East Coast, New England",Battery Ventures is an investment firm that focuses on technology.,338,452,34,Active,1983-01-01,year,http://www.battery.com,http://www.linkedin.com/company/battery-ventures,"Financial Services, Lending and Investments","Finance, Financial Services, Venture Capital",1,Rick Frisbie,101-250,"Early Stage Venture, Late Stage Venture, Private Equity, Seed",,Made Acquisitions,Private
Gaingels,https://www.crunchbase.com/organization/gaing,"Syndicate, Venture Capital",872,67,"Burlington, Vermont, United States","New England, Northeastern US",Gaingels provides funding to startup companies and supports diversity and inclusion within the entrepreneurial ecosystem.,10,758,8,Active,2014-01-01,year,https://gaingels.com,https://www.linkedin.com/company/gaingels,"Data and Analytics, Financial Services, Lending and Investments, Professional Services","Business Development, Data Governance, Finance, Financial Services, Venture Capital",2,"David Beatty, Paul Grossinger",11-50,"Early Stage Venture, Late Stage Venture, Seed, Venture",,,Private
Canaan Partners,https://www.crunchbase.com/organization/canaan-partners,Venture Capital,813,172,"Menlo Park, California, United States","San Francisco Bay Area, Silicon Valley, West Coast",Canaan is an early-stage venture capital firm that invests in visionaries with transformative ideas.,271,420,40,Active,1987-01-01,year,http://www.canaan.com,http://www.linkedin.com/company/canaan-partners,"Financial Services, Lending and Investments","Finance, Financial Services, FinTech, Venture Capital",2,"Eric Young, Harry T. Rein",11-50,"Early Stage Venture, Late Stage Venture, Seed, Venture",,,Private
Salesforce Ventures,https://www.crunchbase.com/organization/salesforce-ventures,Corporate Venture Capital,795,162,"San Francisco, California, United States","San Francisco Bay Area, West Coast, Western US",Salesforce Ventures invests in enterprise tech to help companies connect with their customers in entirely new ways.,171,507,25,Active,2009-01-01,year,https://www.salesforceventures.com,https://www.linkedin.com/company/salesforce-ventures,"Financial Services, Lending and Investments, Software","Enterprise Software, Finance, Financial Services, SaaS, Venture Capital",2,"Marc Benioff, Parker Harris",11-50,"Convertible Note, Early Stage Venture, Late Stage Venture, Post-Ipo, Private Equity, Secondary Market, Seed, Venture",,,Private
Redpoint,https://www.crunchbase.com/organization/redpoint-ventures,Venture Capital,790,172,"San Mateo, California, United States","San Francisco Bay Area, Silicon Valley, West Coast","Redpoint is a venture capital firm that invests in retail, electronic, and technology companies.",245,410,35,Active,1999-01-01,year,http://redpoint.com,http://www.linkedin.com/company/redpointventures,"Financial Services, Lending and Investments","Finance, Financial Services, Venture Capital",6,"Brad Jones, Geoff Yang, John Walecka, Timothy Haley, Tom Dyal, Travis Bryant",11-50,"Early Stage Venture, Late Stage Venture, Seed, Venture",,,Private
Goodwater Capital,https://www.crunchbase.com/organization/goodwater-capital,Venture Capital,789,25,"Burlingame, California, United States","San Francisco Bay Area, West Coast, Western US",Goodwater Capital is a consumer tech investor that empowers exceptional entrepreneurs everywhere to change the world for the better.,94,656,,Active,2014-01-01,year,http://www.goodwatercap.com,https://www.linkedin.com/company/goodwater-capital,"Financial Services, Lending and Investments","Angel Investment, Finance, Financial Services, FinTech, Venture Capital",2,"Chi-Hua Chien, Eric J. Kim",51-100,"Convertible Note, Early Stage Venture, Late Stage Venture, Non Equity Assistance, Seed, Venture",,,Private
ZhenFund,https://www.crunchbase.com/organization/zhenfund,"Entrepreneurship Program, Venture Capital",789,57,"Beijing, Beijing, China",Asia-Pacific (APAC),"ZhenFund invests in future technology, AI, enterprise service, healthcare, new consumption, and mobile internet among other sectors.",176,546,22,Active,2011-12-14,day,http://www.zhenfund.com,https://www.linkedin.com/company/zhenfund/,"Financial Services, Lending and Investments","Financial Services, Venture Capital",2,"Bob Xiaoping Xu, Victor Wang",101-250,"Early Stage Venture, Seed",,,Private
