Bright Pixel (formerly Sonae IM),https://www.crunchbase.com/organization/sonae-im,Corporate Venture Capital,81,16,"Maia, Porto, Portugal","European Union (EU), Europe, Middle East, and Africa (EMEA)","Venture capital company with a global aim, financially driven and oriented to make businesses prosper.",61,,33,Active,2015-10-01,month,https://brpx.com/,https://www.linkedin.com/company/brightpixelcapital/,"Cloud Infrastructure, Cyber Security, Financial Services, IT Infrastructure, Telecommunications, Venture Capital","Financial Services, Hardware, Information Technology, Internet Services, Lending and Investments, Privacy and Security",,,1001-5000,"Early Stage Venture, Seed",,Made Acquisitions,Private,"12,500"
Rheingau Founders,https://www.crunchbase.com/organization/rheingau-founders,Venture Capital,81,12,"Berlin, Berlin, Germany","European Union (EU), Europe, Middle East, and Africa (EMEA)",Rheinhau Founders is a Berlin&Munich based venture capital firm,48,3,22,Active,2011-01-01,year,http://rheingau-founders.com,http://www.linkedin.com/company/rheingau-founders,"Finance, Financial Services, FinTech, Incubators, Media and Entertainment, SaaS, Venture Capital","Financial Services, Lending and Investments, Media and Entertainment, Software",5,"Johann Reich, Kai Hansen, Marius Weber, Philipp Hartmann, Tobias Johann",11-50,"Early Stage Venture, Late Stage Venture, Seed, Venture",,,Private,"22,482"
Distributed Global,https://www.crunchbase.com/organization/distributed-global,"Hedge Fund, Venture Capital",80,5,"Los Angeles, California, United States","Greater Los Angeles Area, West Coast, Western US",Distributed Global is an investment firm focused on the blockchain and digital asset ecosystem.,71,,22,Active,2017-06-01,month,http://www.distributedglobal.com,,"Blockchain, Cryptocurrency, Finance","Blockchain and Cryptocurrency, Financial Services, Other, Payments, Software",2,"Johnny Steindorff, Tucker Waterman",1-10,"Early Stage Venture, Initial Coin Offering, Late Stage Venture, Seed, Venture",,,Private,"21,803"
S28 Capital,https://www.crunchbase.com/organization/spectrum-28,Venture Capital,79,16,"San Francisco, California, United States","San Francisco Bay Area, West Coast, Western US",S28 Capital is an early-stage venture fund with $170M under management.  We're a team of founders and early startup employees.,52,,19,Active,2015-08-01,day,http://www.S28capital.com,https://www.linkedin.com/company/spectrum-28,Venture Capital,"Financial Services, Lending and Investments",1,Kent Ho,1-10,"Early Stage Venture, Late Stage Venture, Seed, Venture",,,Private,"14,649"
Manta Ray Ventures,https://www.crunchbase.com/organization/manta-ray-ventures,Venture Capital,77,4,"London, England, United Kingdom","Europe, Middle East, and Africa (EMEA)","Manta Ray Ventures provides flexible and patient capital, leveraging time, resources, and networks to support its portfolio companies.",56,,5,Active,2017-01-01,year,https://mantaray.vc/,https://www.linkedin.com/company/mantarayvc/,"Finance, Financial Services, Venture Capital","Financial Services, Lending and Investments",1,Sebastian Kulczyk,1-10,"Convertible Note, Early Stage Venture, Late Stage Venture, Seed",,Made Acquisitions,Private,"19,298"
Demium Capital,https://www.crunchbase.com/organization/think-bigger-capital,Venture Capital,76,,"Valencia, Comunidad Valenciana, Spain","European Union (EU), Europe, Middle East, and Africa (EMEA)",We invest in the earliest stages of a startup –pre-seed and seed stages–.,65,,50,Active,2020-01-17,day,https://demium.com/demium-capital/,https://www.linkedin.com/company/demium/,,,1,Jorge Dobon,51-100,"Early Stage Venture, Seed",,,Private,"14,109"
Presto Ventures,https://www.crunchbase.com/organization/presto-ventures,Venture Capital,75,2,"Prague, Hlavni mesto Praha, Czech Republic","European Union (EU), Europe, Middle East, and Africa (EMEA)",Presto Ventures is a venture capital fund empowering talented CEE start-up founders.,59,,37,Active,2016-01-01,year,https://www.prestoventures.com/,https://www.linkedin.com/company/b-vc/,"Business Development, Finance, Venture Capital","Financial Services, Lending and Investments, Professional Services",1,Přemysl Rubeš,11-50,"Early Stage Venture, Seed, Venture",,,Private,"2,966"
Innovation Nest,https://www.crunchbase.com/organization/innovation-nest,"Micro VC, Venture Capital",75,8,"Kraków, Malopolskie, Poland","European Union (EU), Europe, Middle East, and Africa (EMEA)",Innovation Nest invests in early-stage European B2B Software companies.,55,1,12,Active,2010-01-01,year,http://www.innovationnest.co,http://www.linkedin.com/company/2279786,"B2B, Finance, SaaS, Software, Venture Capital","Financial Services, Lending and Investments, Other, Software",2,"Marek Kapturkiewicz, Piotr Wilam",1-10,"Early Stage Venture, Seed",,,Private,"22,340"
Giant Ventures,https://www.crunchbase.com/organization/giant-ventures-global,Venture Capital,74,4,"London, England, United Kingdom","Europe, Middle East, and Africa (EMEA)",Giant backs purpose-driven founders building companies that matter.,52,,30,Active,2020-01-01,year,https://www.giant.vc,https://www.linkedin.com/company/giantventures,"Finance, Financial Services, Venture Capital","Financial Services, Lending and Investments",2,"Cameron McLain, Tommy Stadlen",11-50,"Early Stage Venture, Late Stage Venture, Seed, Venture",,,Private,229
Michelson Impact Ventures,https://www.crunchbase.com/organization/michelson-impact-ventures,Venture Capital,74,7,"Culver City, California, United States","Greater Los Angeles Area, West Coast, Western US","Michelson Impact Ventures is a social change fund deploying impact investment capital into mission-aligned, for-profit start-ups.",70,,1,Active,2016-01-01,year,https://www.michelson.vc/,https://www.linkedin.com/company/michelson-impact-ventures,"EdTech, Education, Health Care, Higher Education, Impact Investing, Pet, Plant-Based Foods, Veterinary, Virtual Workforce","Administrative Services, Community and Lifestyle, Education, Financial Services, Food and Beverage, Health Care, Lending and Investments, Software",1,Gary K. Michelson,1-10,"Convertible Note, Early Stage Venture, Seed, Venture",,,Private,"25,775"
Nina Capital,https://www.crunchbase.com/organization/nina-capital,"Micro VC, Venture Capital",72,3,"Barcelona, Catalonia, Spain","European Union (EU), Europe, Middle East, and Africa (EMEA)",Investing in healthcare transformation powered by information technology led by need-driven founders.,50,,29,Active,2019-01-01,year,https://www.nina.capital/,https://www.linkedin.com/company/ninacapital/,"Analytics, Artificial Intelligence (AI), Data Visualization, Electronic Health Record (EHR), Health Care, Internet of Things, Medical Device, Sensor, Software, Wearables","Artificial Intelligence (AI), Consumer Electronics, Data and Analytics, Design, Hardware, Health Care, Information Technology, Internet Services, Science and Engineering, Software",1,Marta G. Zanchi,11-50,"Convertible Note, Early Stage Venture, Seed",,,Private,"2,139"
Finch Capital,https://www.crunchbase.com/organization/finch-capital,Venture Capital,72,13,"Amsterdam, Noord-Holland, The Netherlands","European Union (EU), Europe, Middle East, and Africa (EMEA)",Finch Capital is a series A/B investor in growth financial technologies companies.,44,,38,Active,2013-01-01,year,http://finchcapital.com,https://www.linkedin.com/company/27059481/,"Financial Services, FinTech, InsurTech, Venture Capital","Financial Services, Lending and Investments",2,"Hans de Back, Radboud Vlaar",11-50,Late Stage Venture,,,Private,"4,922"
10x Founders,https://www.crunchbase.com/organization/10x-founders,Venture Capital,70,1,"Munich, Bayern, Germany","European Union (EU), Europe, Middle East, and Africa (EMEA)",10x Founders is a network-driven European early-stage investor backed by over 200 entrepreneurs and angels.,51,,13,Active,2021-01-01,year,https://www.10xfounders.com/,https://www.linkedin.com/company/10x-founders/,,,3,"Claudius Jablonka, Felix Haas, Jan Reichelt",11-50,"Early Stage Venture, Seed, Venture",,,Private,"1,002"
KAYA,https://www.crunchbase.com/organization/kaya-8ed9,Venture Capital,68,10,"Prague, Hlavni mesto Praha, Czech Republic","European Union (EU), Europe, Middle East, and Africa (EMEA)","KAYA is an early-stage VC fund with roots in CEE, investing in intrepid founders across Europe since 2010.",44,,17,Active,2010-01-01,year,https://www.kaya.vc/,https://www.linkedin.com/company/kayavc/,"Finance, Financial Services, Venture Capital","Financial Services, Lending and Investments",5,"Pavel Mucha, Pavel Mucha, Radek Svec, Radovan Nesrsta, Tomas Cupr",1-10,"Early Stage Venture, Late Stage Venture, Seed",,,Private,"2,475"
PortfoLion Capital Partners,https://www.crunchbase.com/organization/portfolion,"Private Equity Firm, Venture Capital",68,8,"Budapest, Budapest, Hungary","European Union (EU), Europe, Middle East, and Africa (EMEA)",Portfolion is the venture capital and private equity arm of OTP Bank Plc. The CEE-focused multi-stage investor has EUR 400 AUM.,50,,29,Active,2010-01-01,year,https://www.portfolion.hu/en/,https://www.linkedin.com/company/portfolion-venture-capital-fund-management-plc-/,Venture Capital,"Financial Services, Lending and Investments",,,11-50,"Early Stage Venture, Late Stage Venture",,,Private,"6,549"
Starta Accelerator,https://www.crunchbase.com/organization/starta-accelerator,"Accelerator, Venture Capital",65,2,"New York, New York, United States","Greater New York Area, East Coast, Northeastern US",Starta Accelerator is an Accelerator specializing in technology startups with European R&D roots.,65,,20,Active,2015-12-01,day,http://startaventures.com/startaaccelerate/,https://www.linkedin.com/company/starta-capital/,"Angel Investment, Finance, Financial Services, Impact Investing, Venture Capital","Financial Services, Lending and Investments",2,"Alexey Girin, Katya Dorozhkina",11-50,"Early Stage Venture, Seed",,,Private,"27,329"
Partner Ventures,https://www.crunchbase.com/organization/partner-ventures-llc,Venture Capital,64,7,"Portola Valley, California, United States","San Francisco Bay Area, West Coast, Western US",Partner Ventures is a 'secondary direct' venture capital fund.,60,2,1,Active,2009-10-01,month,http://www.partnervc.com/,https://www.linkedin.com/company/partner-ventures,,,,,1-10,"Early Stage Venture, Late Stage Venture, Venture",,,Private,"28,942"
KittyHawk,https://www.crunchbase.com/organization/kittyhawk-ventures,Venture Capital,63,7,"Los Angeles, California, United States","Greater Los Angeles Area, West Coast, Western US","KittyHawk, an investment firm focused on leading edge seed to late stage pre-IPO companies.",53,2,21,Active,2015-01-01,year,http://www.kittyhawkvc.com,https://www.linkedin.com/company/kittyhawk-ventures/about/,"Business Development, Financial Services, Venture Capital","Financial Services, Lending and Investments, Professional Services",1,Will Weisman,1-10,"Early Stage Venture, Secondary Market, Seed",,,Private,"14,142"
Verissimo Ventures,https://www.crunchbase.com/organization/verissimo-ventures,Venture Capital,63,6,"Bedford, New Hampshire, United States","East Coast, New England, Northeastern US",Verissimo Ventures invest in early-stage technology companies.,54,,1,Active,2020-01-01,year,https://verissimo.vc/,https://www.linkedin.com/company/verissimo-ventures,,,2,"Alex Oppenheimer, David Oppenheimer",1-10,"Early Stage Venture, Seed",,,Private,"21,088"
Inovo.vc,https://www.crunchbase.com/organization/inovo-vc,Venture Capital,62,4,"Warsaw, Mazowieckie, Poland","European Union (EU), Europe, Middle East, and Africa (EMEA)",Inovo.vc invests up to $4M in founders from Central and Eastern Europe all over the world at pre-seed & seed.,48,2,32,Active,2012-01-01,day,http://inovo.vc/,https://www.linkedin.com/company/i18s/about/,Venture Capital,"Financial Services, Lending and Investments",1,Tomasz Swieboda,11-50,"Early Stage Venture, Seed",,,Private,597
Atlassian Ventures,https://www.crunchbase.com/organization/atlassian-ventures,Corporate Venture Capital,62,7,"Sydney, New South Wales, Australia","Asia-Pacific (APAC), Australasia",Atlassian Ventures invests in early-stage companies focused on building apps for cloud products.,57,,10,Active,2002-01-01,year,https://www.atlassian.com/company/ventures,,"Business Development, Finance, Financial Services","Financial Services, Professional Services",2,"Mike Cannon-Brookes, Scott Farquhar",1-10,"Early Stage Venture, Late Stage Venture, Seed, Venture",,,Private,"1,453"
Tera Ventures,https://www.crunchbase.com/organization/tera-ventures,Venture Capital,61,8,"Tallinn, Harjumaa, Estonia","European Union (EU), Europe, Middle East, and Africa (EMEA)",Tera Ventures is an international investment firm based in Estonia.,37,,41,Active,2016-01-01,year,https://tera.vc/,https://www.linkedin.com/company/10881003/,"Artificial Intelligence (AI), B2B, Cyber Security, E-Commerce, Enterprise Software, Finance, Financial Services, Legal Tech, Product Design, PropTech","Artificial Intelligence (AI), Commerce and Shopping, Data and Analytics, Design, Financial Services, Information Technology, Other, Privacy and Security, Professional Services, Real Estate, Science and Engineering, Software",4,"Andrus Oks, Eamonn Carey, James McDougall, Stanislav Ivanov",1-10,"Convertible Note, Early Stage Venture, Seed, Venture",,,Private,"2,914"
ZAKA VC,https://www.crunchbase.com/organization/zaka-startups,"Family Investment Office, Venture Capital",61,,"Prague, Hlavni mesto Praha, Czech Republic","European Union (EU), Europe, Middle East, and Africa (EMEA)","ZAKA VC is a pre-seed and seed-focused VC fund, investing in tech startups in North America and Europe.",51,,10,Active,2019-01-01,year,https://zaka.vc/,https://www.linkedin.com/company/zakastartups/,"Financial Services, Venture Capital","Financial Services, Lending and Investments",1,Jan Kasper,11-50,"Convertible Note, Early Stage Venture, Seed",,,Private,"3,839"
500 Emerging Europe,https://www.crunchbase.com/organization/500-emerging-europe,Venture Capital,61,7,"San Francisco, California, United States","San Francisco Bay Area, West Coast, Western US",500 Emerging Europe assists emerging European founders expand globally.,53,,16,Active,2016-01-01,year,https://500ee.co/,https://www.linkedin.com/company/500ee/,"Artificial Intelligence (AI), Developer Tools, Enterprise Software, Gaming, Machine Learning, SaaS","Artificial Intelligence (AI), Data and Analytics, Gaming, Science and Engineering, Software",,,11-50,"Early Stage Venture, Seed",,,Private,"5,809"
Blizzard Fund,https://www.crunchbase.com/organization/blizzard-fund,Venture Capital,59,2,"New York, New York, United States","Greater New York Area, East Coast, Northeastern US",Blizzard Fund is a venture capital fund managed by AVA Labs.,56,,10,Active,2021-01-01,year,https://www.blizzard.fund/,https://www.linkedin.com/company/blizzardfund/,,,,,1-10,"Early Stage Venture, Initial Coin Offering, Seed, Venture",,,Private,"14,085"
Market One Capital,https://www.crunchbase.com/organization/market-one-capital,Venture Capital,57,6,"Luxembourg, Luxembourg, Luxembourg","European Union (EU), Europe, Middle East, and Africa (EMEA)",MOC backs platforms of tomorrow that democratize market access and enhance efficiency through the power of network effects.,36,,20,Active,2017-12-01,month,http://www.moc.vc,https://www.linkedin.com/company/m1c/,"Internet, Marketplace, Venture Capital","Commerce and Shopping, Financial Services, Internet Services, Lending and Investments",4,"Jakub Ślusarczyk, Marcin Kurek, Marcin Zabielski, Michal Skrzyński",11-50,"Convertible Note, Early Stage Venture, Seed, Venture",,,Private,"12,636"
GSD Venture Studios,https://www.crunchbase.com/organization/gsd-venture-studios,"Accelerator, Entrepreneurship Program, Venture Capital",56,1,"Menlo Park, California, United States","San Francisco Bay Area, Silicon Valley, West Coast",Venture studio specializing in helping resilient entrepreneurs #GoGlobal,56,,1,Active,2019-05-01,month,https://www.gsdvs.com,https://www.linkedin.com/company/gsd-venture-studios/,"Cloud Computing, Cyber Security, Financial Services, FinTech, Mobile Apps, Venture Capital","Apps, Financial Services, Information Technology, Internet Services, Lending and Investments, Mobile, Privacy and Security, Software",2,"Derek Distenfield, Gary A. Fowler",1-10,"Early Stage Venture, Initial Coin Offering, Late Stage Venture, Private Equity",,,Private,"23,040"
SET Ventures,https://www.crunchbase.com/organization/set-ventures,Venture Capital,55,9,"Amsterdam, Noord-Holland, The Netherlands","European Union (EU), Europe, Middle East, and Africa (EMEA)",Venture capital firm focused on digital technologies for a carbon-free energy system,30,,22,Active,2007-01-01,year,http://www.setventures.com/,https://www.linkedin.com/company/setventures/,"CleanTech, Energy, Finance, Financial Services, Venture Capital","Energy, Financial Services, Lending and Investments, Sustainability",2,"Rene Savelsberg, Wouter Jonk",11-50,"Early Stage Venture, Late Stage Venture, Seed, Venture",,,Private,"4,627"
Sisu Game Ventures,https://www.crunchbase.com/organization/sisu-game-ventures,Venture Capital,55,5,"Helsinki, Southern Finland, Finland","European Union (EU), Nordic Countries, Scandinavia",Sisu Game Ventures is a Pre-Seed and Seed fund funding the next generation of founders in games.,43,,10,Active,2014-01-01,year,https://sisu.vc/,https://www.linkedin.com/company/sisu-game-ventures/about/,"Gaming, Media and Entertainment, Video Games","Gaming, Media and Entertainment",4,"Kalle Kaivola, Moaffak Ahmed, Paul Bragiel, Samuli Syvähuoko",1-10,"Early Stage Venture, Late Stage Venture, Seed, Venture",,,Private,"6,906"
SpeedUp Venture Capital Group,https://www.crunchbase.com/organization/speedup-venture-capital-group,Venture Capital,54,6,"Poznan, Wielkopolskie, Poland","European Union (EU), Europe, Middle East, and Africa (EMEA)","We're a leading group of venture capital funds, investing in people who develop new technologies.",51,,12,Active,2009-09-01,month,http://speedupgroup.com,http://www.linkedin.com/company/speedup-group,"Artificial Intelligence (AI), Energy Storage, Finance, Financial Services, Medical, Medical Device, Renewable Energy, Venture Capital","Artificial Intelligence (AI), Data and Analytics, Energy, Financial Services, Health Care, Lending and Investments, Science and Engineering, Software, Sustainability",4,"Arkadiusz Piechocki, Bartlomiej Gola, Michal Lehmann, Rene Xavier Gerard",11-50,"Early Stage Venture, Seed",,,Private,"8,196"
Lighthouse Ventures,https://www.crunchbase.com/organization/lighthouse-ventures-6458,"Accelerator, Venture Capital",53,3,"Prague, Hlavni mesto Praha, Czech Republic","European Union (EU), Europe, Middle East, and Africa (EMEA)",An Early-Stage and Acceleration Venture Capital,46,,31,Active,2018-09-27,day,https://lhv.vc,https://www.linkedin.com/company/lighthouse-ventures-prague,,,4,"Jiri Janku, Michal Zalesak, Ravit Avidor, Vladislav Vintner",1-10,"Early Stage Venture, Seed",,,Private,"12,855"
Black Pearls VC,https://www.crunchbase.com/organization/black-pearls,Venture Capital,53,2,"Gdansk, Pomorskie, Poland","European Union (EU), Europe, Middle East, and Africa (EMEA)",Early stage VC firm focused on investing in leading tech startups with defensible technology and the potential to become market leaders.,44,1,36,Active,2014-01-01,year,http://blackpearls.vc/,https://www.linkedin.com/company/black-pearls-vc/,"Artificial Intelligence (AI), Enterprise Software, FinTech, Health Care, Life Science","Artificial Intelligence (AI), Biotechnology, Data and Analytics, Financial Services, Health Care, Science and Engineering, Software",2,"Alexander Lubański, Marcin Kowalik",11-50,"Convertible Note, Early Stage Venture, Seed",,,Private,"20,265"
Lightning Ventures,https://www.crunchbase.com/organization/lightning-ventures-a525,"Angel Group, Micro VC, Syndicate, Venture Capital",53,,"New York, New York, United States","Greater New York Area, East Coast, Northeastern US",We Invest in Bitcoin Companies!,39,,4,Active,2023-04-28,day,https://ltng.ventures,https://www.linkedin.com/company/lightning%E2%9A%A1%EF%B8%8Fventures/,"Bitcoin, Blockchain, Cryptocurrency","Blockchain and Cryptocurrency, Financial Services, Other, Payments, Software",1,Mike Jarmuz,1-10,"Crowdfunding, Early Stage Venture, Late Stage Venture, Seed, Venture",,,Private,"23,814"
Blocksync Ventures,https://www.crunchbase.com/organization/blocksync-ventures,Venture Capital,53,,,,Blocksync Ventures is a venture capital firm focusing exclusively on decentralized ledger technology.,52,,,Active,2020-01-01,year,https://blocksync.ventures/,,"Blockchain, Consulting, Financial Services, Funding Platform, Information Technology","Blockchain and Cryptocurrency, Financial Services, Information Technology, Lending and Investments, Other, Professional Services",,,1-10,Seed,,,Private,"38,145"
CV VC,https://www.crunchbase.com/organization/cv-vc,Venture Capital,52,1,"Zug, Zug, Switzerland","Europe, Middle East, and Africa (EMEA)","CV VC is an investment company, where cutting-edge blockchain technology meets traditional venture capital.",46,,8,Active,2018-09-20,day,https://cvvc.com/,https://www.linkedin.com/company/cvvc/,"Blockchain, Venture Capital","Blockchain and Cryptocurrency, Financial Services, Lending and Investments, Other",4,"Marco Bumbacher, Mathias Ruch, Olaf Hannemann, Ralf Glabischnig",11-50,"Early Stage Venture, Seed",,,Private,"12,536"
NetEase,https://www.crunchbase.com/organization/netease-com,Corporate Venture Capital,51,7,"Tokyo, Tokyo, Japan",Asia-Pacific (APAC),NetEase is a internet technology company dedicated to providing premium online services.,45,2,28,Active,1997-06-01,month,https://www.neteasegames.com,https://www.linkedin.com/company/netease,"Advertising, Gaming, Mobile, Mobile Apps, Music, PC Games, Venture Capital, Wireless","Advertising, Apps, Financial Services, Gaming, Hardware, Lending and Investments, Media and Entertainment, Mobile, Music and Audio, Sales and Marketing, Software",1,William Ding,10001+,,For Profit,Made Acquisitions,Public,"2,448"
Fulgur Ventures,https://www.crunchbase.com/organization/fulgur-venture,Venture Capital,51,2,"Wilmington, Delaware, United States","Greater Philadelphia Area, East Coast, Southern US",We invest in early stage startups focused on Bitcoin and the Lightning Network,44,1,7,Active,2019-01-01,year,https://fulgur.ventures,https://www.linkedin.com/company/fulgurventures,,,,,1-10,"Convertible Note, Crowdfunding, Early Stage Venture, Seed, Venture",,,Private,"21,809"
Hubraum,https://www.crunchbase.com/organization/hub-raum,"Accelerator, Incubator, Venture Capital",51,8,"Berlin, Berlin, Germany","European Union (EU), Europe, Middle East, and Africa (EMEA)","Hubraum connects tech entrepreneurs and startup companies with the network, capital and business opportunities of Deutsche Telekom.",48,,22,Active,2012-01-01,year,http://hubraum.com,https://www.linkedin.com/company/2952666/,"Finance, Incubators, Telecommunications, Venture Capital","Financial Services, Hardware, Lending and Investments",2,"Gilli Cegla, Peter Borchers",11-50,"Debt, Early Stage Venture, Seed",,,Private,"23,829"
Story Ventures,https://www.crunchbase.com/organization/story-ventures,Venture Capital,50,4,"New York, New York, United States","Greater New York Area, East Coast, Northeastern US",Story Ventures is an NY-based VC fund. We focus on entrepreneurs with big visions that leverage technology and improved data processing.,31,,9,Active,2016-06-30,day,http://storyventures.vc,https://www.linkedin.com/company/10696297,Venture Capital,"Financial Services, Lending and Investments",2,"Brian Yormak, Jacob Yormak",1-10,"Early Stage Venture, Seed",,,Private,"4,489"
KR1,https://www.crunchbase.com/organization/kr1,"Hedge Fund, Venture Capital",46,,"Douglas, NA - Isle of Man, Isle of Man","Europe, Middle East, and Africa (EMEA)",KR1 plc (KR1:AQSE) is Europe's leading digital asset investment company focused on decentralised and open-source blockchain networks.,41,,18,Active,2016-03-08,day,https://KR1.io/,https://www.linkedin.com/company/kr1plc,"Asset Management, Blockchain, Finance, Hedge Funds, Venture Capital","Blockchain and Cryptocurrency, Financial Services, Lending and Investments, Other",2,"George McDonaugh, Keld van Schreven",1-10,"Early Stage Venture, Private Equity, Secondary Market, Seed, Venture",,,Private,"20,065"
SMOK Ventures,https://www.crunchbase.com/organization/smok-ventures,Venture Capital,45,,"Warsaw, Mazowieckie, Poland","European Union (EU), Europe, Middle East, and Africa (EMEA)",SMOK Ventures is a venture capital fund investing 100k-1M USD in early stage startups in Poland and CEE region.,35,,26,Active,2019-03-01,day,http://smok.vc/,https://www.linkedin.com/company/smok-ventures/,Financial Services,Financial Services,3,"Borys Musielak, Diana Koziarska, Paul Bragiel",1-10,"Early Stage Venture, Seed",,,Private,"7,295"
Leap Venture Studio,https://www.crunchbase.com/organization/leap-venture-studio,"Accelerator, Corporate Venture Capital, Venture Capital",43,1,"Los Angeles, California, United States","Greater Los Angeles Area, West Coast, Western US",Leap Venture Studio is a pet care startup accelerator that focuses on accelerating innovation in the expanding pet ecosystem.,42,,23,Active,2018-03-07,day,https://www.leapventurestudio.com,https://www.linkedin.com/company/leapventure/,"Health Diagnostics, Nutrition, Pet, Service Industry, Veterinary","Community and Lifestyle, Food and Beverage, Health Care, Other",2,"Stephen Plumlee, Winson Wong",1-10,"Early Stage Venture, Seed",,,Private,"16,113"
