Venture Round - ProGlove,https://www.crunchbase.com/funding_round/proglove-series-unknown--9be96d58,ProGlove,https://www.crunchbase.com/organization/proglove,Venture - Series Unknown,2022-01-01,,,,,,Nordic Capital,"473,146",,,,,"ProGlove develops innovative industrial wearables that enable manufacturing and logistics staff to work faster, safer, and easier.","Automotive, Industrial, Logistics, Manufacturing, Supply Chain Management, Wearables","Munich, Bayern, Germany, Europe",https://www.proglove.com,$10M to $50M,49076900,USD,49076900,M&A,7,1,,Yes,
"Venture Round - GetSocial, a Keywords Studios",https://www.crunchbase.com/funding_round/gramble-world-series-unknown--e26e89cc,"GetSocial, a Keywords Studios",https://www.crunchbase.com/organization/gramble-world,Venture - Series Unknown,2016-01-22,2500000,USD,2500000,,,,"476,118",,,,,"A SAAS for mobile apps empowering marketing and product teams with growth tools to maximize user acquisition, engagement, and retention.","Android, Information Technology, iOS, Marketing Automation, Mobile, Mobile Apps, SaaS, Software","Den Haag, Zuid-Holland, The Netherlands, Europe",https://www.getsocial.im,$1M to $10M,3500000,USD,3500000,M&A,3,,,Yes,
Series B - BOOK A TIGER,https://www.crunchbase.com/funding_round/book-a-tiger-series-b--dd64d109,BOOK A TIGER,https://www.crunchbase.com/organization/book-a-tiger,Series B,2017-11-15,8000000,EUR,9426803,,,"Atami Capital, Davidson Technology Growth Debt Fund, DN Capital, German Media Pool, Target Global","480,741",,,,Early Stage Venture,"BOOK A TIGER is an online booking platform that matches customers with an interviewed, background-checked and tested professional cleaner.","Customer Service, E-Commerce, Internet","Berlin, Berlin, Germany, Europe",https://www.bookatiger.com,$10M to $50M,40585365,USD,40585365,Early Stage Venture,7,5,2,Yes,
Venture Round - Endource,https://www.crunchbase.com/funding_round/endource-limited-series-unknown--6ea183e8,Endource,https://www.crunchbase.com/organization/endource-limited,Venture - Series Unknown,2017-01-01,750000,GBP,926175,,,,"483,894",,,,,Endource.com is the pinnacle of curated fashion. We scour the most influential fashion sources to bring you the fashion that's made the cut.,"E-Commerce, Fashion","London, England, United Kingdom, Europe",http://www.endource.com,$1M to $10M,2250000,GBP,3208425,,3,,,Yes,
Venture Round - CodeCheck,https://www.crunchbase.com/funding_round/codecheck-info-series-unknown--1f6e2325,CodeCheck,https://www.crunchbase.com/organization/codecheck-info,Venture - Series Unknown,2017-11-17,2000000,CHF,2022112,,,"Alpana Ventures, MGO Digital Ventures, Polytech Ventures, Technology Fund","489,552",,,,,CodeCheck is the leading mobile shopping assistant for healthy and sustainable food and cosmetics in German-speaking countries.,"Apps, E-Commerce, Nutrition, Product Search, Retail Technology, Shopping, Social Impact, Sustainability","Zürich, Zurich, Switzerland, Europe",http://codecheck-app.com/,$1M to $10M,4400000,CHF,4569817,M&A,3,4,,Yes,
Venture Round - Wizata,https://www.crunchbase.com/funding_round/wizata-series-unknown--b743bf33,Wizata,https://www.crunchbase.com/organization/wizata,Venture - Series Unknown,2021-06-01,1200000,EUR,1466100,,,"Finindus, KBC Focus Fund, Volta Ventures","522,978",,,,,Wizata is make sense of your data and discover unique solutions and unexploited opportunities.,"Food and Beverage, Health Care, Industrial, Information Technology, Manufacturing, Software","Capellen, Luxembourg, Luxembourg, Europe",http://www.wizata.com/,$1M to $10M,5400000,EUR,6242511,,3,3,,Yes,
Venture Round - Reve,https://www.crunchbase.com/funding_round/r-ve-series-unknown--fe5e6171,Reve,https://www.crunchbase.com/organization/r-ve,Venture - Series Unknown,2017-04-06,8000000,SEK,886482,,,"Daniel Pilotti, Erik Lindgren, Martin Randel, Patrik Hamilton, Paul Fischbein","490,342",,,,,Reve was a direct-to-consumer marketplace in where brands got on-boarded to sell directly to consumers with no integration.,"Apps, Computer Vision, E-Commerce, Marketplace, Mobile, Search Engine, Shopping","Stockholm, Stockholms Lan, Sweden, Europe",https://reveapp.com,$100M to $500M,16300000,SEK,1948056,M&A,4,5,,Yes,
Series A - Jobbio,https://www.crunchbase.com/funding_round/jobbio-series-a--f7682224,Jobbio,https://www.crunchbase.com/organization/jobbio,Series A,2017-09-27,10000000,USD,10000000,,,"Balderton Capital, Enterprise Ireland, Grafton Group, NJF Capital, Smurfit Kappa","490,867",,,,Early Stage Venture,Jobbio is a beautifully simple careers platform connecting talent and companies directly and privately.,"Employment, Human Resources, Marketplace, Recruiting, Search Engine","Dublin, Dublin, Ireland, Europe",https://jobbio.com/,$10M to $50M,18426183,USD,18426183,Early Stage Venture,4,5,1,Yes,
Venture Round - Watgrid,https://www.crunchbase.com/funding_round/watgrid-series-unknown--0235c516,Watgrid,https://www.crunchbase.com/organization/watgrid,Venture - Series Unknown,2021-07-30,,,,,,Portugal Ventures,"459,200",,,,,Watgrid is a high tech Start-up company providing innovative products for liquid quality and quantity assessment.,"Internet of Things, Professional Services, Wine And Spirits","Aveiro, Aveiro, Portugal, Europe",https://watgrid.com/,Less than $1M,836429,EUR,967438,,5,1,,Yes,
Venture Round - Kopjra,https://www.crunchbase.com/funding_round/kopjra-series-unknown--f1b1f199,Kopjra,https://www.crunchbase.com/organization/kopjra,Venture - Series Unknown,2017-06-21,310000,EUR,346170,,,"Casalini Zambon, Club Digitale, Stefano Previti","500,416",,,,,Making the Internet a safer place,"Cyber Security, Law Enforcement, Legal Tech","Bologna, Emilia-Romagna, Italy, Europe",https://www.kopjra.com/,Less than $1M,616000,EUR,693687,,7,3,,Yes,
Series B - CloudMargin,https://www.crunchbase.com/funding_round/cloudmargin-series-b--e00e53a3,CloudMargin,https://www.crunchbase.com/organization/cloudmargin,Series B,2020-09-22,15000000,USD,15000000,,,"Citi, Deutsche Bank, Deutsche Borse","525,638",,,,Early Stage Venture,CloudMarginwas is the cloud-based collateral management solution.,"Finance, Financial Services, Software","London, England, United Kingdom, Europe",http://www.cloudmargin.com,$10M to $50M,25000000,USD,25000000,Early Stage Venture,3,3,3,Yes,
Venture Round - Lone Rooftop,https://www.crunchbase.com/funding_round/lone-rooftop-series-unknown--49f6d811,Lone Rooftop,https://www.crunchbase.com/organization/lone-rooftop,Venture - Series Unknown,2018-11-07,2200000,EUR,2515206,,,Nimbus Ventures,"525,756",,,,,Lone Rooftop develops products to optimise big office buildings for hospitality and sustainability,"Internet, Internet of Things, Location Based Services","Amsterdam, Noord-Holland, The Netherlands, Europe",http://www.lonerooftop.com,Less than $1M,3015206,USD,3015206,M&A,2,1,1,Yes,
Venture Round - Decelera,https://www.crunchbase.com/funding_round/menorca-millennials-series-unknown--2b6ed8ea,Decelera,https://www.crunchbase.com/organization/menorca-millennials,Venture - Series Unknown,2019-04-24,1000000,EUR,1115349,,,"George Anson, Juan Carlos Ureta, Lucas Carne, Moussa Karim, Tammy Beaulieu","526,513",,,,,Decelera focuses on generating differential value through a deceleration methodology for its stakeholders.,"Big Data, Impact Investing, Social Entrepreneurship, Sustainability","Mahón, Islas Baleares, Spain, Europe",http://www.decelera.com/,,1015000,EUR,1131678,,2,5,,Yes,
Venture Round - StyleLounge,https://www.crunchbase.com/funding_round/stylelounge-series-unknown--5ae8ee56,StyleLounge,https://www.crunchbase.com/organization/stylelounge,Venture - Series Unknown,2016-08-25,,,,,,"Astutia Ventures, Axivate Capital, Global Founders Capital, Rocket Internet, TA Ventures","526,829",,,,,StyleLounge offers you a large and varied selection of well-known brands and shops.,"E-Commerce, Fashion","Hamburg, Hamburg, Germany, Europe",http://www.stylelounge.io,Less than $1M,2300000,EUR,2539784,M&A,3,5,,Yes,
Venture Round - Looop Online Limited,https://www.crunchbase.com/funding_round/looop-online-series-unknown--5fac6836,Looop Online Limited,https://www.crunchbase.com/organization/looop-online,Venture - Series Unknown,2018-08-24,,,,,,Ascension,"467,352",,,,,"Looop LMS — guaranteed performance at the speed, scale, and quality your business needs.","Corporate Training, E-Learning, SaaS, Software, Training","London, England, United Kingdom, Europe",http://www.looop.co,$1M to $10M,2000000,USD,2000000,M&A,3,1,,Yes,
Venture Round - Bidvine,https://www.crunchbase.com/funding_round/bidvine-series-unknown--298c277f,Bidvine,https://www.crunchbase.com/organization/bidvine,Venture - Series Unknown,2017-10-01,1400000,GBP,1875497,,,,"467,835",,,,,Bidvine is a marketplace connecting consumers and businesses with professionals.,Information Services,"London, England, United Kingdom, Europe",https://www.bark.com/,$1M to $10M,6346473,USD,6346473,,4,,,Yes,
Series A - Saphetor,https://www.crunchbase.com/funding_round/saphetor-series-a--e7cfd6f6,Saphetor,https://www.crunchbase.com/organization/saphetor,Series A,2020-03-27,4000000,CHF,4203447,,,,"468,269",,,,Early Stage Venture,Saphetor is a personalised medicine company.,"Biotechnology, Electronic Health Record (EHR), Health Care, Medical","Lausanne, Vaud, Switzerland, Europe",http://saphetor.com,$1M to $10M,6400000,CHF,6634220,Early Stage Venture,5,,,Yes,
Series A - The Data Appeal Company,https://www.crunchbase.com/funding_round/travel-appeal-series-a--88981801,The Data Appeal Company,https://www.crunchbase.com/organization/travel-appeal,Series A,2018-10-02,3000000,EUR,3465164,,,,"479,321",,,,Early Stage Venture,The Data Appeal Company democratises and facilitates the use and understanding of data.,"Analytics, Artificial Intelligence (AI), Big Data, Finance, Predictive Analytics, Retail, Software, Travel","Firenze, Toscana, Italy, Europe",https://datappeal.io/,$1M to $10M,4050000,EUR,4599916,M&A,4,,,Yes,
Series A - Finsquare,https://www.crunchbase.com/funding_round/finsquare-series-a--23b5b42b,Finsquare,https://www.crunchbase.com/organization/finsquare,Series A,2015-06-01,,,,,,,"486,038",,,,Early Stage Venture,Finsquare is a short term loan specialist platform.,"Financial Services, Internet, Web Hosting","Paris, Ile-de-France, France, Europe",http://www.finsquare.fr,,,,,M&A,2,,,Yes,
Venture Round - LifeTime,https://www.crunchbase.com/funding_round/connected-health-series-unknown--b28d36b6,LifeTime,https://www.crunchbase.com/organization/connected-health,Venture - Series Unknown,2017-08-01,,,,,,,"489,183",,,,,LifeTime offers a solution for the digital delivery of documents in medical practices and medical facilities.,"Developer Tools, Health Care, Information Technology, Mobile Devices, Software","Hamburg, Hamburg, Germany, Europe",https://lifetime.eu,$1M to $10M,,,,,3,,,Yes,
Venture Round - CarPrice.ru,https://www.crunchbase.com/funding_round/carprice-ru-series-unknown--0d43cb63,CarPrice.ru,https://www.crunchbase.com/organization/carprice-ru,Venture - Series Unknown,2020-01-23,,,,,,Baring Vostok Capital Partners,"491,176",,,,,"CarPrice develops technology, infrastructure and services for used cars transactions between private sellers and professional buyers.","Automotive, Big Data, Direct Sales, E-Commerce","Moscow, Moscow City, Russian Federation, Europe",https://www.carprice.ru/,$1M to $10M,48000000,USD,48000000,,4,1,,Yes,
Venture Round - Sportlala,https://www.crunchbase.com/funding_round/sportlala-series-unknown--b2ff1d0c,Sportlala,https://www.crunchbase.com/organization/sportlala,Venture - Series Unknown,2017-01-18,5000000,SEK,558562,,,,"529,663",,,,,Sportlala is an online shopping club for sporting goods,"E-Commerce, Shopping, Sports","Göteborg, Vastra Gotaland, Sweden, Europe",https://www.sportlala.se/,$1M to $10M,1258562,USD,1258562,,2,,,Yes,
Series A - Undagrid,https://www.crunchbase.com/funding_round/undagrid-series-a--2575716b,Undagrid,https://www.crunchbase.com/organization/undagrid,Series A,2017-08-22,,,,,,"Innovation Industries, Mainport Innovation Fund","530,610",,,,Early Stage Venture,Undagrid is a wireless Internet of Things network.,"Computer, Internet of Things, Wireless","Schiphol, Noord-Holland, The Netherlands, Europe",https://www.undagrid.com,,30000,EUR,37358,M&A,4,2,,Yes,
Series A - UgenTec,https://www.crunchbase.com/funding_round/ugentec-series-a--7643acee,UgenTec,https://www.crunchbase.com/organization/ugentec,Series A,2018-03-29,7500000,EUR,9226817,,,"Annie Vereecken, Gemma Frisius Fund, Herman Verrelst, imec, KU Leuven, Limburgse Reconversie Maatschappij","533,658",,,,Early Stage Venture,UgenTec delivers an independent diagnostic platform to help molecular labs with their DNA (PCR) analyses.,"Biotechnology, Hospital, Medical","Hasselt, Limburg, Belgium, Europe",http://ugentec.com,$10M to $50M,11150000,EUR,13138586,Early Stage Venture,5,6,,Yes,
Series A - VIGGA,https://www.crunchbase.com/funding_round/vigga-us-series-a--23ac2abb,VIGGA,https://www.crunchbase.com/organization/vigga-us,Series A,2018-04-01,,,,,,,"538,201",3200000,EUR,3940251,Early Stage Venture,"The world’s first international marketplace, enabling parents to subscribe to the use of high-quality maternity and children’s wear.","E-Commerce, Fashion, GreenTech, Recycling, Women's","Amsterdam, Noord-Holland, The Netherlands, Europe",https://www.vigga.us,,,,,Early Stage Venture,2,,,Yes,
Venture Round - Wheelys Café,https://www.crunchbase.com/funding_round/wheelys-series-unknown--2225e9af,Wheelys Café,https://www.crunchbase.com/organization/wheelys,Venture - Series Unknown,2017-07-01,,,,,,SoGal Ventures,"541,179",,,,,"Wheelys is a chain of organic bicycle cafés and shops, enabling people (ALL people) to start their own businesses.","Coffee, Food and Beverage, Food Processing, Organic Food","Stockholm, Stockholms Lan, Sweden, Europe",http://www.wheelyscafe.com/,$1M to $10M,3444431,USD,3444431,,4,1,,Yes,
Venture Round - Qucit,https://www.crunchbase.com/funding_round/qucit-series-unknown--57328c6c,Qucit,https://www.crunchbase.com/organization/qucit,Venture - Series Unknown,2018-08-30,1700000,EUR,1983180,,,"Bpifrance, Pi2invest, Third Sphere, URBAN-X","541,501",,,,,Qucit is a quantified city that improves well-being in cities using artificial intelligence.,"Artificial Intelligence (AI), CivicTech, Logistics, Software","Bègles, Aquitaine, France, Europe",http://www.qucit.com/,$1M to $10M,1700000,EUR,1983180,,2,4,1,Yes,
Series B - Opinum,https://www.crunchbase.com/funding_round/opinum-series-b--bca599eb,Opinum,https://www.crunchbase.com/organization/opinum,Series B,2017-06-30,1000000,EUR,1142700,,,,"541,608",,,,Early Stage Venture,"Opinum has created and ensures the continuous development of the ""Opinum Data Hub"" platform, designed for energy and environmental actors.","Big Data, Cloud Data Services, Information Technology","Mont-saint-guibert, Brabant Wallon, Belgium, Europe",http://www.opinum.com/,$1M to $10M,2770505,EUR,3118558,M&A,4,,,Yes,
Venture Round - Touchize,https://www.crunchbase.com/funding_round/touchize-series-unknown--4def385f,Touchize,https://www.crunchbase.com/organization/touchize,Venture - Series Unknown,2017-02-24,15000000,SEK,1658045,,,Wellstreet,"544,795",,,,,"Touchize is an e-commerce and touch-based application for faster, simpler, and a truly mobile shopping experience.","E-Commerce, Internet, iOS, Mobile Apps, Retail, Shopping, Software","Malmö, Skane Lan, Sweden, Europe",https://touchize.com/,Less than $1M,15000000,SEK,1658045,,2,1,,Yes,
Venture Round - Daatrics,https://www.crunchbase.com/funding_round/daatrics-series-unknown--8f7dad6b,Daatrics,https://www.crunchbase.com/organization/daatrics,Venture - Series Unknown,2019-04-01,,,,,,Wavemaker Partners,"545,110",,,,,"Daatrics is a technology company that specializes in bringing creative, advanced technological solutions to caregivers and families.","Child Care, Health Care, Information Technology, Medical Device, Software, Wearables","London, England, United Kingdom, Europe",http://daatrics.com/,Less than $1M,,,,,4,1,,Yes,
Venture Round - Wazypark,https://www.crunchbase.com/funding_round/wazypark-series-unknown--5c1e78a3,Wazypark,https://www.crunchbase.com/organization/wazypark,Venture - Series Unknown,2018-01-01,,,,,,BStartup,"545,332",,,,,Wazypark is an application to communicate with car drivers to find parking spots.,"Apps, Navigation, Parking, Software, Transportation","Madrid, Madrid, Spain, Europe",http://wazypark.com/,Less than $1M,100000,EUR,110128,,3,1,,Yes,
Venture Round - Sportego,https://www.crunchbase.com/funding_round/sportego-series-unknown--928012c9,Sportego,https://www.crunchbase.com/organization/sportego,Venture - Series Unknown,2017-01-22,1000000,EUR,1071365,,,Enterprise Ireland,"546,222",,,,,"Sportego delivers digital analytic and engagement solutions for fans, sponsors, and clubs.","Analytics, Big Data","Kilkenny, Kilkenny, Ireland, Europe",http://sportego.ie/,Less than $1M,1101365,USD,1101365,,2,1,1,Yes,
Venture Round - Innovation 360,https://www.crunchbase.com/funding_round/innovation-360-2-series-unknown--24182299,Innovation 360,https://www.crunchbase.com/organization/innovation-360-2,Venture - Series Unknown,2016-12-16,10000000,SEK,1070263,,,"Backstage AB, Thord Wilkne","547,177",,,,,"Innovation 360 Group help companies to sharpen their innovation capability, generate and re-innovate their value propositions.","Association, Consulting, Information Technology, Innovation Management, Product Research","Stockholm, Stockholms Lan, Sweden, Europe",http://innovation360group.com/,$10M to $50M,1430263,USD,1430263,,2,2,,Yes,
Venture Round - Gridbee Communications,https://www.crunchbase.com/funding_round/gridbee-communications-series-unknown--13bd19a2,Gridbee Communications,https://www.crunchbase.com/organization/gridbee-communications,Venture - Series Unknown,2015-05-22,2000000,EUR,2202456,,,"Foreis, Paca Investissement, R2V","547,692",,,,,Gridbee Communications provides M2M wireless modules to connect IOT with secured transmissions.,"Internet of Things, Network Security, Telecommunications, Wireless","Grasse, Provence-Alpes-Cote d'Azur, France, Europe",http://www.gridbeecom.com/,$1M to $10M,2000000,EUR,2202456,,2,3,,Yes,
Venture Round - Laundrapp,https://www.crunchbase.com/funding_round/laundrapp-series-unknown--2fa4016c,Laundrapp,https://www.crunchbase.com/organization/laundrapp,Venture - Series Unknown,2019-06-27,,,,,,"Hargreave Hale Aim VCT, Henkel, Rocket Internet, Toscafund Asset Management","551,021",,,,,"Laundrapp is the UK’s leading online laundry and dry cleaning service, offering unparalleled levels of quality cleaning right across London.","Apps, Consumer, Service Industry","London, England, United Kingdom, Europe",http://www.laundrapp.com,$1M to $10M,14500000,GBP,19678670,M&A,6,4,,Yes,
Venture Round - Nuritas,https://www.crunchbase.com/funding_round/nuritas-series-unknown--ba2b17d2,Nuritas,https://www.crunchbase.com/organization/nuritas,Venture - Series Unknown,2015-01-01,,,,,,Keiretsu Forum,"556,549",,,,,Nuritas combines artificial intelligence and genomics to discover and unlock natural bioactive peptides with extraordinary health benefits,"Artificial Intelligence (AI), Bioinformatics, Biotechnology, Data Mining","Dublin, Dublin, Ireland, Europe",https://www.nuritas.com,$1M to $10M,148487668,USD,148487668,Late Stage Venture,9,1,,Yes,
Venture Round - Wunderflats,https://www.crunchbase.com/funding_round/wunderflats-series-unknown--3ebaa80a,Wunderflats,https://www.crunchbase.com/organization/wunderflats,Venture - Series Unknown,2020-01-01,,,,,,"IBB Ventures, ICLUB VC, PT1","557,087",,,,,Wunderflats is an online platform that enables users to find and rent furnished apartments.,"Information Services, Real Estate, Rental Property","Berlin, Berlin, Germany, Europe",https://wunderflats.com,$10M to $50M,33970218,USD,33970218,Late Stage Venture,7,3,,Yes,
Venture Round - 3D Sound Labs,https://www.crunchbase.com/funding_round/3d-sound-labs-series-unknown--fe24606f,3D Sound Labs,https://www.crunchbase.com/organization/3d-sound-labs,Venture - Series Unknown,2015-03-12,1100000,EUR,1168365,,,I-Source Gestion,"559,724",,,,,3D Sound Labs develops 3DAudio software technologies as well as hardware to enable immersive and realistic audio experiences for movies.,"Audio, Augmented Reality, Software, Virtual Reality","Paris, Ile-de-France, France, Europe",http://www.3dsoundlabs.com,$1M to $10M,1100000,EUR,1168365,M&A,2,1,1,Yes,
Series A - StyleLounge,https://www.crunchbase.com/funding_round/stylelounge-series-a--6243cfe4,StyleLounge,https://www.crunchbase.com/organization/stylelounge,Series A,2015-08-11,2300000,EUR,2539784,,,"Astutia Ventures, Axivate Capital, Felix Jahn, TA Ventures","560,361",,,,Early Stage Venture,StyleLounge offers you a large and varied selection of well-known brands and shops.,"E-Commerce, Fashion","Hamburg, Hamburg, Germany, Europe",http://www.stylelounge.io,Less than $1M,2300000,EUR,2539784,M&A,3,4,,Yes,
Series A - Ogury,https://www.crunchbase.com/funding_round/ogury-series-a--e55854e5,Ogury,https://www.crunchbase.com/organization/ogury,Series A,2015-03-04,3400000,USD,3400000,,,"Alclan, AMA Holdings, FACRO INVEST, Ventech","561,024",,,,Early Stage Venture,"Ogury is building a world of highly effective and sustainable advertising, anchored in consumer privacy protection.","Advertising, Big Data, Data Mining, Mobile","Paris, Ile-de-France, France, Europe",https://www.ogury.com,$10M to $50M,92000000,USD,92000000,Private Equity,5,4,1,Yes,
Series A - Wyden,https://www.crunchbase.com/funding_round/algotrader-series-a--3a1d4bbf,Wyden,https://www.crunchbase.com/organization/algotrader,Series A,2020-12-11,1500000,CHF,1686125,,,"EOS VC Fund, FinLab","561,650",,,,Early Stage Venture,"Wyden is a fintech company that provides digital asset trading services for institutions, funds, and asset managers.","Banking, Bitcoin, Blockchain, Cryptocurrency, Financial Services, FinTech, Trading Platform","Zürich, Zurich, Switzerland, Europe",https://www.wyden.io/,$1M to $10M,23859350,USD,23859350,Early Stage Venture,4,2,1,Yes,
Venture Round - Bubblo,https://www.crunchbase.com/funding_round/bubblo-bubblescene-ltd-series-unknown--82a27469,Bubblo,https://www.crunchbase.com/organization/bubblo-bubblescene-ltd,Venture - Series Unknown,2016-08-13,2250000,USD,2250000,,,"Brand Capital, Times Business Solutions","562,244",3500000,USD,3500000,,Bubblo is an artificial Intelligence based virtual reality discovery app and marketing platform.,"Advertising, Advertising Platforms, Artificial Intelligence (AI), Machine Learning, Software, Virtual Reality","London, England, United Kingdom, Europe",https://bubbloapp.com/,$1M to $10M,2836483,USD,2836483,,4,2,,Yes,
Venture Round - Codasip,https://www.crunchbase.com/funding_round/codasip-series-unknown--34b7692c,Codasip,https://www.crunchbase.com/organization/codasip,Venture - Series Unknown,2016-07-01,2500000,USD,2500000,,,"Credo Ventures, Eduard Kucera, Pavel Baudis, RSJ Investments SICAV a.s.","562,989",,,,,Codasip is a processor solutions company which uniquely helps developers to differentiate their products,"Embedded Systems, Hardware, Internet of Things, RISC, Semiconductor","Munich, Bayern, Germany, Europe",http://codasip.com,$10M to $50M,34572941,USD,34572941,,7,4,1,Yes,
Venture Round - Code Institute,https://www.crunchbase.com/funding_round/code-institute-series-unknown--e155875b,Code Institute,https://www.crunchbase.com/organization/code-institute,Venture - Series Unknown,2017-11-30,,,,,,Enterprise Ireland,"563,309",,,,,Code Institute delivers intensive Full Stack web development training programmes.,"EdTech, Education, Higher Education, Training","Dublin, Dublin, Ireland, Europe",http://www.codeinstitute.net/,,1700000,EUR,1876137,,3,1,1,Yes,
Venture Round - Goodwall,https://www.crunchbase.com/funding_round/goodwall-series-unknown--709d07e2,Goodwall,https://www.crunchbase.com/organization/goodwall,Venture - Series Unknown,2023-03-06,,,,,,"EMURGO, EMURGO MEA","564,015",,,,,Goodwall is a social development platform for young people to connect over shared interests and discover opportunities.,"Career Planning, Education, Internet, Robotics, Social Entrepreneurship, Social Network","Genève, Geneve, Switzerland, Europe",https://www.goodwall.io,$1M to $10M,16321252,USD,16321252,,10,2,1,Yes,
Venture Round - Farmy.ch,https://www.crunchbase.com/funding_round/farmy-ch-series-unknown--6f7eaa81,Farmy.ch,https://www.crunchbase.com/organization/farmy-ch,Venture - Series Unknown,2017-07-05,5000000,CHF,5184469,,,"Fabio Borzatta, Ruedi Noser, SICTIC","564,918",,,,,"Farmy.ch is an online marketplace for local and organic food, sourced directly from farmers and food makers.","Agriculture, E-Commerce, Farmers Market, Food and Beverage, Food Delivery, Organic Food","Zürich, Zurich, Switzerland, Europe",https://www.farmy.ch/,$1M to $10M,34220964,USD,34220964,,6,3,,Yes,
Venture Round - Bikemap,https://www.crunchbase.com/funding_round/bikemap-series-unknown--3a1821c6,Bikemap,https://www.crunchbase.com/organization/bikemap,Venture - Series Unknown,2018-03-01,1200000,EUR,1472501,,,,"565,302",,,,,"Bikemap is a provider of cycling map & navigation service in the world. Mobile subscription for offline, routing, map features.","Navigation, Sports, Travel","Vienna, Wien, Austria, Europe",https://www.bikemap.net,Less than $1M,2600000,EUR,3016926,Early Stage Venture,6,,,Yes,
Venture Round - Panaseer,https://www.crunchbase.com/funding_round/panaseer-series-unknown--0be99b95,Panaseer,https://www.crunchbase.com/organization/panaseer,Venture - Series Unknown,2018-01-25,,,,,,Upscale,"565,663",,,,,"Panaseer helps businesses make informed, risk-based security decisions.","Big Data, Cyber Security, Enterprise Software, Information Technology","London, England, United Kingdom, Europe",http://www.panaseer.com,$1M to $10M,42000000,USD,42000000,Early Stage Venture,7,1,,Yes,
