Series C - KONUX,https://www.crunchbase.com/funding_round/konux-series-c--e70c146b,KONUX,https://www.crunchbase.com/organization/konux,Series C,2021-01-14,65000000,EUR,78980208,,Sanno Capital,"DI Technology, New Enterprise Associates, Richard Kramlich, Sanno Capital","237,115",,,,Late Stage Venture,"KONUX is the first AI scale-up offering predictive maintenance, network usage, monitoring and planning solutions for railway infrastructure.","Artificial Intelligence (AI), Information Technology, Machine Learning, Railroad, Software","Munich, Bayern, Germany, Europe",http://konux.com,$10M to $50M,130614117,USD,130614117,Late Stage Venture,11,4,3,Yes,
Series A - Lingokids,https://www.crunchbase.com/funding_round/lingokids-series-a--0a228de5,Lingokids,https://www.crunchbase.com/organization/lingokids,Series A,2018-10-02,6000000,USD,6000000,Women Founded,HV Capital,"Acurio Ventures, Athos Capital, Big Sur Ventures, Gwynne Shotwell, HV Capital, JME Ventures, John Danner, Reach Capital, Sabadell Venture Capital","235,757",,,,Early Stage Venture,Helping families around the world raise amazing kids.,"Children, Digital Media, Education, Family, Language Learning, Parenting, Training","Madrid, Madrid, Spain, Europe",https://www.lingokids.com/,Less than $1M,62400000,USD,62400000,Late Stage Venture,7,9,1,Yes,
Series B - Beamery,https://www.crunchbase.com/funding_round/beamery-series-b--18ec3434,Beamery,https://www.crunchbase.com/organization/beamery,Series B,2018-06-20,28000000,USD,28000000,,EQT Ventures,"AngelPad, Edenred Capital Partners, EQT Ventures, Index Ventures, M12 - Microsoft's Venture Fund","236,462",,,,Early Stage Venture,Workforce Intelligence,"Enterprise Software, Human Resources, Marketing Automation, Recruiting, SaaS","London, England, United Kingdom, Europe",http://beamery.com,$1M to $10M,223000000,USD,223000000,Late Stage Venture,7,5,4,Yes,
Series A - AimBrain,https://www.crunchbase.com/funding_round/aimbrain-series-a--a1beec2c,AimBrain,https://www.crunchbase.com/organization/aimbrain,Series A,2017-06-19,4000000,GBP,5092272,,Business Growth Fund,"Business Growth Fund, Charlie Songhurst, Chris Mairs, Delin Ventures, Entrepreneurs First, Episode 1, Simon Rozas","238,692",,,,Early Stage Venture,"AimBrain helps organisations detect and prevent fraud. Anomaly detection, behavioural biometrics & 3 active biometric authentication modules","Biometrics, Cyber Security, FinTech, Fraud Detection","London, England, United Kingdom, Europe",https://aimbrain.com/,$1M to $10M,4365000,GBP,5636348,M&A,4,7,3,Yes,
Venture Round - Nozzle.ai,https://www.crunchbase.com/funding_round/nozzle-ai-series-unknown--22263b0c,Nozzle.ai,https://www.crunchbase.com/organization/nozzle-ai,Venture - Series Unknown,2018-02-26,2000000,GBP,2792801,,UCL Technology Fund,"Michael Bristow, Parkwalk Advisors, UCL Technology Fund","239,809",,,,,Nozzle.ai is an eCommerce and advertising optimization platform for Amazon.,"Advertising, E-Commerce, Software","London, England, United Kingdom, Europe",https://nozzle.ai/,$1M to $10M,7888620,USD,7888620,M&A,6,3,2,Yes,
Series A - Holidu,https://www.crunchbase.com/funding_round/holidu-series-a--3e01e00e,Holidu,https://www.crunchbase.com/organization/holidu,Series A,2018-01-11,,,,,EQT Ventures,"EQT Ventures, Loric Ventures, Senovo, Venture Stars","239,879",,,,Early Stage Venture,Holidu is a travel technology company focused on the search and booking of vacation rentals.,"Search Engine, Travel, Travel Accommodations, Vacation Rental","Munich, Bayern, Germany, Europe",http://www.holidu.com,$100M to $500M,252297999,USD,252297999,,10,4,4,Yes,
Series B - BMLL Technologies,https://www.crunchbase.com/funding_round/bmll-technologies-series-b--5744a84e,BMLL Technologies,https://www.crunchbase.com/organization/bmll-technologies,Series B,2022-10-25,26000000,USD,26000000,,,"FactSet, IQ Capital, Nasdaq Ventures","240,778",,,,Early Stage Venture,"BMLL Technologies is the leading, independent provider of Level 3 Historical Data and Analytics for Capital Markets participants.","Analytics, Big Data, Cloud Computing, Machine Learning, Software","London, England, United Kingdom, Europe",https://www.bmlltech.com,Less than $1M,59054081,USD,59054081,Early Stage Venture,7,3,,Yes,
Series C - Tylko,https://www.crunchbase.com/funding_round/tylko-2-series-c--2b7e827c,Tylko,https://www.crunchbase.com/organization/tylko-2,Series C,2021-03-23,22000000,EUR,26047371,,"Evli Growth Partners, Pitango VC","Brian C. Walker, Evli Growth Partners, Experior Venture Fund, Mark Williamson, Pitango VC, TDJ Pitango Ventures","241,269",,,,Late Stage Venture,"Tylko is D2C brand offering high-quality, perfectly fitting shelving that can be ordered in the easiest way possible. ","E-Commerce, Furniture, Mobile","Warsaw, Mazowieckie, Poland, Europe",http://tylko.com/,$10M to $50M,40800000,EUR,46670455,Late Stage Venture,5,6,5,Yes,
Series B - KONUX,https://www.crunchbase.com/funding_round/konux-series-b--2f7af874,KONUX,https://www.crunchbase.com/organization/konux,Series B,2018-04-19,20000000,USD,20000000,,"MIG Capital, New Enterprise Associates","DI Technology, Green Bay Ventures, MIG Capital, New Enterprise Associates","241,378",,,,Early Stage Venture,"KONUX is the first AI scale-up offering predictive maintenance, network usage, monitoring and planning solutions for railway infrastructure.","Artificial Intelligence (AI), Information Technology, Machine Learning, Railroad, Software","Munich, Bayern, Germany, Europe",http://konux.com,$10M to $50M,130614117,USD,130614117,Late Stage Venture,11,4,2,Yes,
Series A - Eligo Bioscience,https://www.crunchbase.com/funding_round/eligo-bioscience-series-a--d555f67a,Eligo Bioscience,https://www.crunchbase.com/organization/eligo-bioscience,Series A,2017-09-26,18000000,USD,18000000,,"Khosla Ventures, Seventure Partners","Khosla Ventures, Seventure Partners","241,748",,,,Early Stage Venture,"Eligobiotics provides a new approach to explore, understand, and control bacterial ecosystems both in human and animals.","Biotechnology, Health Care, Medical","Paris, Ile-de-France, France, Europe",https://eligo.bio/,$1M to $10M,74706775,USD,74706775,Early Stage Venture,10,2,1,Yes,
Series B - DNA Script,https://www.crunchbase.com/funding_round/dna-script-series-b--99b95a76,DNA Script,https://www.crunchbase.com/organization/dna-script,Series B,2019-05-16,38500000,USD,38500000,,"Bpifrance, EQT Life Sciences","Bpifrance, EQT Life Sciences, Idinvest Partners, Illumina Ventures, Kurma Partners, Sofinnova Partners","241,082",,,,Early Stage Venture,DNA Script is a disruptive DNA synthesis company harnessing biology to accelerate breakthroughs in life science and human health.,"Biotechnology, Health Care, Life Science, Medical","Le Kremlin-bicêtre, Ile-de-France, France, Europe",https://www.dnascript.com,$50M to $100M,479844098,USD,479844098,Seed,11,6,4,Yes,
Series B - JustSpices,https://www.crunchbase.com/funding_round/justspices-series-b--2c7f8283,JustSpices,https://www.crunchbase.com/organization/justspices,Series B,2020-01-10,13000000,EUR,14457295,,"Coefficient Capital, Five Seasons Ventures","Bitburger Ventures, Coefficient Capital, Five Seasons Ventures","242,251",,,,Early Stage Venture,Just Spices is a spice-mix and meal-prep brand that manufactures and markets food products.,"Food and Beverage, Food Delivery, Food Processing","Düsseldorf, Nordrhein-Westfalen, Germany, Europe",https://www.justspices.de,$1M to $10M,14500000,EUR,16252806,M&A,5,3,,Yes,
Series A - Inofab Health,https://www.crunchbase.com/funding_round/inofabhealth-series-a--ca31a65b,Inofab Health,https://www.crunchbase.com/organization/inofabhealth,Series A,2021-01-06,1502000,USD,1502000,,,"ERT Clinical, F+ Ventures, Fark Labs, RePie Asset Management, Teknoloji Yatirim","243,171",,,,Early Stage Venture,"Inofab Health is a provider of digital health solutions for patients with Asthma, COPD, Cystic Fibrosis, and respiratory health.","Fitness, Health Care, Home Health Care, Internet, Personal Health, Wellness","Çankaya, Ankara, Turkey, Europe",https://www.inofab.health,$1M to $10M,3076769,USD,3076769,M&A,4,5,,Yes,
Series A - Moteefe,https://www.crunchbase.com/funding_round/moteefe-series-a--5cd4f788,Moteefe,https://www.crunchbase.com/organization/moteefe,Series A,2020-02-06,5000000,USD,5000000,,,"Force Over Mass Capital, Gresham House, Gresham House Ventures, Meyvn","243,582",,,,Early Stage Venture,Moteefe is an e commerce platform that allows anyone to sell customized merchandise through social media.,"3D Printing, Digital Marketing, E-Commerce, Internet, Printing","London, England, United Kingdom, Europe",https://www.moteefe.com,$1M to $10M,18970425,USD,18970425,Early Stage Venture,11,4,,Yes,
Series B - CarPrice.ru,https://www.crunchbase.com/funding_round/carprice-ru-series-b--40622122,CarPrice.ru,https://www.crunchbase.com/organization/carprice-ru,Series B,2015-07-23,40000000,USD,40000000,,"Almaz Capital, Baring Vostok Capital Partners","Almaz Capital, Baring Vostok Capital Partners","243,750",,,,Early Stage Venture,"CarPrice develops technology, infrastructure and services for used cars transactions between private sellers and professional buyers.","Automotive, Big Data, Direct Sales, E-Commerce","Moscow, Moscow City, Russian Federation, Europe",https://www.carprice.ru/,$1M to $10M,48000000,USD,48000000,,4,2,,Yes,
Series B - Mitigram,https://www.crunchbase.com/funding_round/mitigram-series-b--14871b5e,Mitigram,https://www.crunchbase.com/organization/mitigram,Series B,2023-06-06,11000000,USD,11000000,,,,"244,888",,,,Early Stage Venture,Trade finance. Made seamless.,"Banking, Financial Services, FinTech","Stockholm, Stockholms Lan, Sweden, Europe",http://mitigram.com/,$10M to $50M,28060897,USD,28060897,Early Stage Venture,5,,,Yes,
Series A - Scrona,https://www.crunchbase.com/funding_round/scrona-inc-series-a--ccfdffc3,Scrona,https://www.crunchbase.com/organization/scrona-inc,Series A,2022-02-15,6700000,USD,6700000,,AM Ventures,"AM Ventures, Manz GmbH Management Consulting, TRUMPF Venture, Verve Ventures","245,036",,,,Early Stage Venture,Scrona is a manufacturing company that focuses on developing a wide range of semiconductor products.,"Manufacturing, Printing, Semiconductor","Zürich, Zurich, Switzerland, Europe",http://www.scrona.com,$1M to $10M,15520206,USD,15520206,Early Stage Venture,8,4,1,Yes,
Series A - Inofab Health,https://www.crunchbase.com/funding_round/inofabhealth-series-a--66355c79,Inofab Health,https://www.crunchbase.com/organization/inofabhealth,Series A,2020-06-01,,,,,,"ERT Clinical, F+ Ventures, Fark Labs, Karel Electronics, RePie Asset Management, Teknoloji Yatirim","245,551",,,,Early Stage Venture,"Inofab Health is a provider of digital health solutions for patients with Asthma, COPD, Cystic Fibrosis, and respiratory health.","Fitness, Health Care, Home Health Care, Internet, Personal Health, Wellness","Çankaya, Ankara, Turkey, Europe",https://www.inofab.health,$1M to $10M,3076769,USD,3076769,M&A,4,6,,Yes,
Series B - Aire,https://www.crunchbase.com/funding_round/aire-series-b--49e55680,Aire,https://www.crunchbase.com/organization/aire,Series B,2019-02-04,11000000,USD,11000000,,Crane Venture Partners,"Aerion Partners, Crane Venture Partners, Experian Ventures, Heartcore Capital, Orange Ventures, White Star Capital","245,704",,,,Early Stage Venture,Aire provides a credit assessment and automation platform for underwriting decisions.,"Credit, FinTech","London, England, United Kingdom, Europe",https://aire.io,$1M to $10M,30699800,USD,30699800,Private Equity,10,6,2,Yes,
Series C - Ledger,https://www.crunchbase.com/funding_round/ledger-2-series-c--1f1c9902,Ledger,https://www.crunchbase.com/organization/ledger-2,Series C,2021-06-10,380000000,USD,380000000,,50T Funds,"50T Funds, Alliance Entreprendre, Ambel, Animoca Brands, Ascendant Capital, CapHorn Invest, Cardinal Capital Partners, Cathay Innovation, CITA Investissement, Crypto.com Capital, Crédit Agricole Centre Loire, Cygni Capital, Digital Currency Group, Draper Associates, Draper Dragon, Fabric Ventures, Felix Capital, FirstMark, Global Founders Capital, Groupe Arnault, iAngels, Inherent Group, Korelya Capital, Libertus Capital, MACSF, Marcy Venture Partners, Maze, Molten Ventures, Patrick Amiel, Rosemoor Capital Management, Scott Galloway, Techmind, Tekne Capital, Uphold, Warburg Serres Investments, Wicklow Capital","246,483",1120000000,USD,1120000000,Late Stage Venture,Ledger provides security and infrastructure solutions to critical digital assets for consumers and institutional investors.,"Cryptocurrency, Cyber Security, Infrastructure, SaaS","Paris, Ile-de-France, France, Europe",https://www.ledger.com,$10M to $50M,577004332,USD,577004332,Late Stage Venture,9,36,11,Yes,
Series C - Ravelin,https://www.crunchbase.com/funding_round/ravelin-series-c--05df123b,Ravelin,https://www.crunchbase.com/organization/ravelin,Series C,2020-07-15,16400000,GBP,20650880,,Molten Ventures,"Amadeus Capital Partners, BlackFin Tech, Molten Ventures, Passion Capital","246,722",,,,Late Stage Venture,Ravelin is a smart fraud detection and prevention platform that helps companies stop online payment fraud.,"Cyber Security, Fraud Detection, Payments, SaaS, Transaction Processing","London, England, United Kingdom, Europe",http://www.ravelin.com,$50M to $100M,28700000,GBP,36724274,M&A,5,4,4,Yes,
Series A - Leaf Space,https://www.crunchbase.com/funding_round/leafspace-series-a--936a94df,Leaf Space,https://www.crunchbase.com/organization/leafspace,Series A,2020-06-26,1500000,EUR,1682782,,Whysol Investments,"RedSeed Ventures, Whysol Investments","246,839",,,,Early Stage Venture,Leaf Space wants to simplify the access to Space for microsatellites’ operators.,"Aerospace, Satellite Communication, Space Travel","Milan, Lombardia, Italy, Europe",https://leaf.space,Less than $1M,42362063,EUR,47315573,Early Stage Venture,7,2,2,Yes,
Venture Round - Deeplink Medical,https://www.crunchbase.com/funding_round/deeplink-medical-series-unknown--9b85d3d6,Deeplink Medical,https://www.crunchbase.com/organization/deeplink-medical,Venture - Series Unknown,2019-12-03,5000000,EUR,5541253,,"BNP Paribas, Bpifrance, Investisseurs privés","BNP Paribas, Bpifrance, Investisseurs privés","247,656",,,,,Deeplink Medical is provides information technology (IT) solutions for telemedicine projects.,"Information Technology, Software","Lyon, Rhone-Alpes, France, Europe",https://www.deeplink-medical.com/en/home/,$1M to $10M,16000000,EUR,17313742,,4,3,,Yes,
Series A - INERATEC,https://www.crunchbase.com/funding_round/ineratec-series-a--9247106b,INERATEC,https://www.crunchbase.com/organization/ineratec,Series A,2022-01-20,20000000,EUR,22626021,,"Engie, MPC Capital, Safran Corporate Ventures","Engie, Extantia Capital, FO Holding, HTGF (High-Tech Gruenderfonds), MPC Capital, Planet A Ventures, Safran Corporate Ventures","247,919",,,,Early Stage Venture,NERATEC produces carbon-neutral synthetic fuels and chemicals for various applications.,"Chemical Engineering, Energy, Environmental Engineering, Renewable Energy","Karlsruhe, Baden-Wurttemberg, Germany, Europe",https://ineratec.de,$1M to $10M,208000000,EUR,224030673,Early Stage Venture,7,7,2,Yes,
Series A - B-Secur,https://www.crunchbase.com/funding_round/b-secur-series-a--31afe45b,B-Secur,https://www.crunchbase.com/organization/b-secur,Series A,2019-03-05,4000000,GBP,5262479,,"ADV, Kernel Capital, Wharton Asset Management Company Limited","ADV, Kernel Capital, Wharton Asset Management Company Limited","247,783",,,,Early Stage Venture,Experts in ECG Technology- from electrode design to Algorithms. We are on a mission to enable Medical- Grade ECG Everywhere.,"Biometrics, Health Care, Health Diagnostics, Medical, Security, Software, Wellness","Belfast, Belfast, United Kingdom, Europe",http://www.b-secur.com/,Less than $1M,20250000,GBP,27432938,,7,3,1,Yes,
Series A - Welcome to the Jungle,https://www.crunchbase.com/funding_round/welcome-to-the-jungle-series-a--749a7955,Welcome to the Jungle,https://www.crunchbase.com/organization/welcome-to-the-jungle,Series A,2018-05-15,8400000,USD,8400000,,"Bpifrance, Kima Ventures, XAnge","Bpifrance, Financiere Saint James, Jean-Paul Guisset, Kima Ventures, Michael Benabou, SGPA, XAnge","247,811",,,,Early Stage Venture,Welcome to the Jungle is a multichannel media and job board company that aims to inspire individuals to thrive in their professional lives.,"Advertising, Digital Media, E-Learning, Human Resources, Recruiting","Paris, Ile-de-France, France, Europe",https://www.welcometothejungle.com/en,$100M to $500M,87439171,USD,87439171,Late Stage Venture,5,7,1,Yes,
Series A - Capella BioScience,https://www.crunchbase.com/funding_round/capella-bioscience-series-a--ef45cf12,Capella BioScience,https://www.crunchbase.com/organization/capella-bioscience,Series A,2016-03-08,15500000,USD,15500000,,"Advent Life Sciences, Medicxi, OUP (Osage University Partners)","Advent Life Sciences, DCVC, Medicxi, OUP (Osage University Partners)","248,063",,,,Early Stage Venture,Capella Bioscience engages in the discovery and development of monoclonal antibodies.,"Biotechnology, Health Care, Pharmaceutical","London, England, United Kingdom, Europe",https://www.fdmdigital.co.uk/,$1M to $10M,15500000,USD,15500000,Early Stage Venture,2,4,1,Yes,
Venture Round - BRD,https://www.crunchbase.com/funding_round/brd-series-unknown--41747ac7,BRD,https://www.crunchbase.com/organization/brd,Venture - Series Unknown,2019-10-11,750000,USD,750000,,Xpring,Xpring,"249,175",,,,,BRD is a financial software company specializing in blockchain-enabled mobile applications for cryptocurrency management.,"Bitcoin, Cryptocurrency, Financial Services, FinTech, Mobile Payments, Software, Virtual Currency","Zürich, Zurich, Switzerland, Europe",https://brd.com/,$1M to $10M,54845792,USD,54845792,M&A,5,1,1,Yes,
Series B - Locatee,https://www.crunchbase.com/funding_round/locatee-series-b--970c87df,Locatee,https://www.crunchbase.com/organization/locatee,Series B,2021-09-22,7700000,CHF,8311260,,SmartFin,"Constructive Venture Fund, FYRFLY Venture Partners, SICTIC, SmartFin, Tomahawk.VC, Verve Ventures, Zürcher Kantonal Bank","248,884",,,,Early Stage Venture,Locatee is a workplace analytics solution that transforms data into space utilization insights.,"Analytics, Business Intelligence, Information Technology, Internet of Things, Property Management, SaaS, Smart Building, Software","Zürich, Zurich, Switzerland, Europe",http://www.locatee.com,$1M to $10M,15572321,USD,15572321,M&A,5,7,3,Yes,
Series A - Jodel,https://www.crunchbase.com/funding_round/jodel-series-a--54eb3e31,Jodel,https://www.crunchbase.com/organization/jodel,Series A,2017-04-21,6000000,EUR,6435317,,Floodgate,"Adam D’Angelo, Atlantic Labs, BLN Capital, Floodgate, Global Founders Capital, Janosch Kühn, Kima Ventures, RubyLight","248,901",,,,Early Stage Venture,"Jodel is a platform that enables its users to discover, follow, and participate in the most relevant conversations with people nearby.","Apps, Local, Mobile, Telecommunications","Berlin, Berlin, Germany, Europe",http://www.jodel.com,$1M to $10M,6000000,EUR,6435317,Early Stage Venture,4,8,,Yes,
Series A - Tracklib,https://www.crunchbase.com/funding_round/tracklib-series-a--0025cf4e,Tracklib,https://www.crunchbase.com/organization/tracklib,Series A,2021-09-21,12200000,USD,12200000,,Sony Innovation Fund,"Baron Davis, Bridford Group, Sony Innovation Fund, WndrCo","249,973",,,,Early Stage Venture,Tracklib is the world’s first record store with songs for sampling.,"Digital Entertainment, Music","Stockholm, Stockholms Lan, Sweden, Europe",https://www.tracklib.com/,Less than $1M,20850000,USD,20850000,Early Stage Venture,7,4,,Yes,
Series A - Shotgun,https://www.crunchbase.com/funding_round/shotgun-series-a--8426a684,Shotgun,https://www.crunchbase.com/organization/shotgun,Series A,2022-06-01,5000000,EUR,5325647,,OneRagtime,OneRagtime,"250,166",,,,Early Stage Venture,Shotgun is a global underground nightlife guide and ticketing solution.,"Internet, Nightlife, Ticketing","Paris, Ile-de-France, France, Europe",https://www.shotgun.live/events,$1M to $10M,6090000,EUR,6618103,Early Stage Venture,4,1,,Yes,
Series A - 3YOURMIND,https://www.crunchbase.com/funding_round/3yourmind-gmbh-series-a--05b7fcd9,3YOURMIND,https://www.crunchbase.com/organization/3yourmind-gmbh,Series A,2021-04-22,6900000,USD,6900000,,,"AM Ventures, coparion, EnBW New Ventures, Landesbank Baden Wurttemberg, LBBW VC, Saudi Aramco Energy Ventures, TRUMPF Venture, UVC Partners, Verve Ventures","252,227",,,,Early Stage Venture,"Automation software to manage additive manufacturing part selection, ordering and production workflows for Industry 4.0.","3D Printing, 3D Technology, Enterprise Software, Industrial Manufacturing, Manufacturing, Software","Berlin, Berlin, Germany, Europe",http://www.3yourmind.com,Less than $1M,27432675,USD,27432675,Early Stage Venture,7,9,1,Yes,
Series B - Nature Metrics,https://www.crunchbase.com/funding_round/nature-metrics-series-b--8cb44639,Nature Metrics,https://www.crunchbase.com/organization/nature-metrics,Series B,2022-05-26,14000000,EUR,15025780,,"2150, BNP Paribas","2150, Ananda Impact Ventures, Blue Oceans Partners, BNP Paribas, Green Angel Ventures, SYSTEMIQ","252,208",,,,Early Stage Venture,Nature Metrics is an award-winning technology start-up using cutting-edge genetic techniques to monitor biodiversity.,"Biotechnology, Life Science","Guildford, Surrey, United Kingdom, Europe",https://www.naturemetrics.co.uk/,$10M to $50M,40150511,USD,40150511,,5,6,4,Yes,
Series B - Rise Up,https://www.crunchbase.com/funding_round/rise-up-2272-series-b--62ecb509,Rise Up,https://www.crunchbase.com/organization/rise-up-2272,Series B,2022-05-03,30000000,EUR,31576322,,Connected Capital,"Connected Capital, Impact Partenaires, MAIF Avenir","254,673",,,,Early Stage Venture,Rise Up is a learning software solution designed to help organizations and their teams stay up-to-skill to be ready for challenges.,"E-Learning, Information Services, Information Technology","Paris, Ile-de-France, France, Europe",https://www.riseup.ai,$10M to $50M,35000000,EUR,37232648,Early Stage Venture,4,3,2,Yes,
Series B - Bmll Technologies,https://www.crunchbase.com/funding_round/bmll-technologies-1cec-series-b--cd2530f7,Bmll Technologies,https://www.crunchbase.com/organization/bmll-technologies-1cec,Series B,2022-10-25,26000000,USD,26000000,,Nasdaq Ventures,Nasdaq Ventures,"254,738",,,,Early Stage Venture,BMLL Technologies is the top independent source for Level 3 Historical Data and Analytics catering to participants in the Capital Markets.,"Analytics, Big Data, Cloud Computing, Machine Learning, Software","London, England, United Kingdom, Europe",https://bmlltechnologies.com,$1M to $10M,55043228,USD,55043228,Seed,5,1,,Yes,
Venture Round - Acquia Optimize,https://www.crunchbase.com/funding_round/monsido-series-unknown--eaea0ffa,Acquia Optimize,https://www.crunchbase.com/organization/monsido,Venture - Series Unknown,2020-01-27,16900000,USD,16900000,,"Level Equity Management, Vaekstfonden","Level Equity Management, Vaekstfonden","256,031",,,,,"Acquia Optimize offers a web governance platform that optimizes websites for accessibility, QA, and SEO.","CMS, Content, Marketing, SaaS, SEO, Software","Copenhagen, Hovedstaden, Denmark, Europe",https://www.acquia.com/products/acquia-optimize,$10M to $50M,18400000,USD,18400000,M&A,3,2,2,Yes,
Series B - Mimi Hearing Technologies,https://www.crunchbase.com/funding_round/mimi-hearing-technologies-series-b--75cc4a23,Mimi Hearing Technologies,https://www.crunchbase.com/organization/mimi-hearing-technologies,Series B,2021-12-15,25000000,USD,25000000,,"MIG Capital, Salvia","ABACON CAPITAL, Atlantic Labs, MIG Capital, Salvia","256,294",,,,Early Stage Venture,Mimi develops and licenses sound personalization technology to be integrated to all consumer electronic devices,"Consumer Electronics, Health Care, Medical Device","Berlin, Berlin, Germany, Europe",http://www.mimi.io,$10M to $50M,25000000,USD,25000000,Early Stage Venture,4,4,3,Yes,
Series A - Early Metrics,https://www.crunchbase.com/funding_round/early-metrics-series-a--625bfc03,Early Metrics,https://www.crunchbase.com/organization/early-metrics,Series A,2018-12-19,7000000,EUR,7970541,,"Pléiade Investissement, Raise Ventures","Pléiade Investissement, Raise Ventures","256,335",,,,Early Stage Venture,Early Metrics is the first startup rating agency.,"Business Development, Financial Services, Innovation Management, Marketing, Small and Medium Businesses, Venture Capital","London, England, United Kingdom, Europe",https://earlymetrics.com,$10M to $50M,12970541,USD,12970541,Early Stage Venture,2,2,,Yes,
Venture Round - Code Institute,https://www.crunchbase.com/funding_round/code-institute-series-unknown--7c9d07eb,Code Institute,https://www.crunchbase.com/organization/code-institute,Venture - Series Unknown,2020-03-30,1200000,EUR,1323468,,"Infinity Capital, Kernel Capital","Infinity Capital, Kernel Capital","257,046",,,,,Code Institute delivers intensive Full Stack web development training programmes.,"EdTech, Education, Higher Education, Training","Dublin, Dublin, Ireland, Europe",http://www.codeinstitute.net/,,1700000,EUR,1876137,,3,2,2,Yes,
Venture Round - Dentaltix,https://www.crunchbase.com/funding_round/dentared-series-unknown--7dc18278,Dentaltix,https://www.crunchbase.com/organization/dentared,Venture - Series Unknown,2019-07-17,500000,EUR,561383,,"Bewater Funds, Cabiedes & Partners","Bewater Funds, Cabiedes & Partners","257,047",,,,,Dentaltix is a StartUp founded in Madrid with the vision of transforming the world of dentistry.,"Dental, E-Commerce, Health Care, Private Social Networking","Madrid, Madrid, Spain, Europe",https://www.dentaltix.com,$1M to $10M,500000,EUR,561383,,2,2,1,Yes,
