Synetiq,https://www.crunchbase.com/organization/synetiq,Active,,"Advertising, Analytics, Artificial Intelligence (AI), Big Data, Broadcasting, Business Intelligence, Machine Learning, Market Research, Marketing, Media and Entertainment, Wearables","Budapest, Budapest, Hungary",Synetiq helps brands & media producers create high performing video ads from based on biometric data from their target audience.,"123,534","European Union (EU), Europe, Middle East, and Africa (EMEA)",1056,$1M to $10M,2014-08-01,month,,,,,For Profit,http://synetiq.net,http://twitter.com/synetiqlab,http://www.facebook.com/Synetiq,https://www.linkedin.com/company/synetiq/,"Synetiq helps brands & media producers create high performing video ads from based on biometric data from their target audience and machine learning. Short video: https://www.youtube.com/watch?v=hfO1rtCTGPw Clients include BBC, HBO, RTL, Viacom, AMC Networks, Belgian Television, Tesco, CBA, Spar, Telekom, Telenor, Vodafone, Egis, Merck, Heineken, IKEA, Raiffeisen Bank, CIB Bank, Auchan, EON Energy, MOL Oil, Béres, OTP Bank, K&H Bank, Molson Coors, Teva, Richter, MediaMarkt, Kantar TNS, Young & Rubicam, Havas Media, Mito among others.","Advertising, Artificial Intelligence (AI), Consumer Electronics, Data and Analytics, Design, Hardware, Media and Entertainment, Sales and Marketing, Science and Engineering, Software, Video",2,11-50,"David Ottlik, Ádám Divák",6,Seed,2020-12-17,484000,EUR,593466,Convertible Note,310000,USD,310000,Angel,977000,USD,977000,1670466,USD,1670466,"Google, Day One Capital, PortfoLion Capital Partners, Hiventures, Google Launchpad Accelerator",4,7,,,,,,,,,,,,,,Private,,,,,,,,,,,
Data Innovation Kft.,https://www.crunchbase.com/organization/data-innovation-kft,Active,,"Data Management, Database, Digital Marketing","Tiszakécske, Bacs-Kiskun, Hungary",Data Innovation Kft is an online advertising enterprise that gives special profiling the data in the database.,"124,035","European Union (EU), Europe, Middle East, and Africa (EMEA)",,Less than $1M,2018-01-08,day,,,,,For Profit,https://datainno.eu,,,,"Data Innovation Kft offers database construction, database, and campaign management, and targeted traffic diversion. They provide data-based marketing campaigns including email marketing, database management, viber, and sms.","Data and Analytics, Sales and Marketing, Software",,1-10,,3,Seed,2020-08-17,323000,EUR,383554,Seed,323000,EUR,383554,Seed,730000,EUR,842733,730000,EUR,842733,Hiventures,,1,,,,,,,,,,,,,,Private,,,,,,,,,,,
Thriveo Central Europe Kft.,https://www.crunchbase.com/organization/thriveo-central-europe-kft,Active,,"Advice, Consulting, Data Management, Management Consulting","Budapest, Budapest, Hungary",Sport clothing brand with innovative material use and appearance.,"124,683","European Union (EU), Europe, Middle East, and Africa (EMEA)",1031,Less than $1M,2017-01-01,year,,,,,For Profit,https://www.thriveo.com,,,https://www.linkedin.com/company/thriveo,"Thriveo was created to invest in and bridge the gap between ambition and practice, concept and success. It focuses on business-to-business business models, industry digitization, and software solutions. It manages data as a competitive advantage and by establishing the right plan that will bring together its clients' organization's resources to make a real impact.","Data and Analytics, Media and Entertainment, Professional Services",,1-10,,2,Seed,2021-12-16,150000000,HUF,461301,Seed,150000000,HUF,461301,Seed,215000000,HUF,670778,215000000,HUF,670778,Hiventures,,1,,,,,,,,,,,,,,Private,,,,,,,,,,,
FilmFinity Zrt.,https://www.crunchbase.com/organization/filmfinity-zrt,Active,,,"Budaörs, Pest, Hungary",FilmFinity  Zrt.,"124,841","European Union (EU), Europe, Middle East, and Africa (EMEA)",,,2018-10-16,day,,,,,For Profit,,,,,,,,1-10,,2,Seed,2020-04-01,435000,EUR,476396,Seed,435000,EUR,476396,Seed,483000,EUR,529731,483000,EUR,529731,Hiventures,,1,,,,,,,,,,,,,,Private,,,,,,,,,,,
iKont Kft,https://www.crunchbase.com/organization/ikont-kft,Active,,"Construction, Hardware, Physical Security, Smart Building, Software","Nadap, Fejer, Hungary",iKont Kft offers a unique hardware and software solution in the digitalization of the construction industry.,"125,230","European Union (EU), Europe, Middle East, and Africa (EMEA)",8097,,2018-01-01,year,,,,,For Profit,https://ikont.hu,,,https://www.linkedin.com/company/ikont,"iKont Kft creates digitized solutions for the construction industry. Its goal is to combine high-tech IT solutions with traditional tools, resulting in a product that is truly stable and reliable in the field. In addition to the current products, the company is working on the field application of many innovative technologies.","Administrative Services, Hardware, Privacy and Security, Real Estate, Software",2,11-50,"Peter Szabo, Sandor Juhasz",4,Seed,2021-12-13,500000000,HUF,1533284,Seed,500000000,HUF,1533284,Seed,1715405,USD,1715405,1715405,USD,1715405,Hiventures,,1,,,,,,,,,,,,,,Private,,,,,,,,,,,
Cleango,https://www.crunchbase.com/organization/cleango-kft,Active,,"GreenTech, Smart Cities","Budapest, Budapest, Hungary","Digitalized on demand, eco-friendly car washer.","125,639","European Union (EU), Europe, Middle East, and Africa (EMEA)",,,2018-05-18,day,,,,,For Profit,https://cleango.hu/home,,https://www.facebook.com/cleangohu,https://www.linkedin.com/company/cleangohu,Cleango offers innovative car wash service for it's B2B and B2C customers. After ordering the car wash through an app the washers arrive to the customers' location using electric scooters. Thanks to their waterless technology they can do their job even in the busiest parts of the city center.,"Real Estate, Sustainability",,1-10,,3,Seed,2021-06-01,57000000,HUF,201155,Pre-Seed,57000000,HUF,201155,Pre-Seed,301155,USD,301155,301155,USD,301155,"Oktogon Ventures, Hiventures, Baconsult, STRT Holding Nyrt",1,4,,,,,,,,,,,,,,Private,,,,,,,,,,,
Grinsect,https://www.crunchbase.com/organization/grinsect,Active,,"Agriculture, Alternative Protein, Animal Feed, Farming","Hodmezovasarhely, Csongrad, Hungary",Grinsect breeds and processes black soldier flies in an intensive vertical farming system.,"126,023","European Union (EU), Europe, Middle East, and Africa (EMEA)",6800,,2019-12-09,day,,,,,For Profit,https://grinsect.com/,,https://www.facebook.com/grinsect/,https://www.linkedin.com/company/grinsect/,"The rapidly growing, non-invasive black soldier fly larvae feed on organic waste, bringing a new, low-cost alternative to waste management. The bioconversion process brings back insect-based protein to modern animal feeding while restoring ecological balance. The larvae are capable to consume and convert any organic substance to high-quality protein and bio-fertiliser. Grown larvae - following the regulations - are either used alive or processed as nutritious animal feed. Insect meal is rich in essential amino acids, minerals, vitamins and has a high protein rate.  Our mission is to revolutionise organic waste management and bring sustainable protein products to a global level. We want to empower everyone who cares about the future of our planet: besides breeding black soldier flies, we are licensing Grinsect's insect farming technology as well.","Agriculture and Farming, Food and Beverage",,1-10,,1,Seed,2021-01-13,1600000,EUR,1945923,Seed,1600000,EUR,1945923,Seed,1600000,EUR,1945923,1600000,EUR,1945923,Impact Ventures Hungary,1,1,,,,,,,,,,,,,,Private,,,,,,,,,,,
DreamJo.bs,https://www.crunchbase.com/organization/dreamjo-bs,Active,,"Recruiting, Search Engine","Budapest, Budapest, Hungary",DreamJo.bs help you to really see the company you are applying for and to find a job that you will love!,"126,149","European Union (EU), Europe, Middle East, and Africa (EMEA)",1015,,2016-01-01,year,,,,,For Profit,https://dreamjo.bs/en,,https://www.facebook.com/pg/dreamjobsteam/,https://www.linkedin.com/company/dreamjo.bs/,"DreamJo.bs - the next generation job portal Find your dream job quickly and easily! With us, job hunting is a great experience. On DreamJo.bs companies are presented accurately - you can really get a picture of what kind of a workplace they are and who will you be working with. Join a team, not just a company! You can see what a typical day will be like, who your colleagues will be and what the corporate culture is like.","Internet Services, Professional Services",2,11-50,"Maria Balogh-Mazi, Peter Balogh",4,Seed,2020-09-10,323000,EUR,381932,Seed,323000,EUR,381932,Seed,981932,USD,981932,981932,USD,981932,"Hiventures, Baconsult, STRT Holding Nyrt",2,3,,,,,,,,,,,,,,Private,,,,,,,,,,,
Battlejungle,https://www.crunchbase.com/organization/battlejungle,Active,,"Gamification, Human Resources, SaaS","Budapest, Budapest, Hungary","Neverending, gamified online team building for happier, healthier, more engaged employees.","126,395","European Union (EU), Europe, Middle East, and Africa (EMEA)",1095,$1M to $10M,2016-06-01,month,,,,,For Profit,https://www.battlejungle.com,https://www.twitter.com/battlejunglecom,https://www.facebook.com/battlejungle,https://www.linkedin.com/company/10273547,"Battlejungle offers an innovative way to conduct team building activities in companies. Battlejungle offers an easy to use tool for boosting the team spirit with in house gaming events, social activities, and sport tournaments. Battlejungle helps companies organize and manage these activities to make employees happier and healthier.","Administrative Services, Gaming, Software",2,1-10,"Adam Drobinoha, Gergő Ambrusz",5,Seed,2021-10-30,,,,Grant,73000000,HUF,246428,Seed,884623,USD,884623,884623,USD,884623,"Space3ac, Hiventures, Virgo Ventures",1,3,,,,,,,,,,,,,,Private,,,,,,,,,,,
GEMIL PHARMA Zrt.,https://www.crunchbase.com/organization/gemil-pharma-zrt,Active,,"Health Care, Medical, Pharmaceutical","Debrecen, Debrecen, Hungary",GEMIL PHARMA develops and markets OTC and dietary supplement brands.,"126,728","European Union (EU), Europe, Middle East, and Africa (EMEA)",4033,,2018-01-01,year,,,,,For Profit,https://gemilpharma.com/,,,https://www.linkedin.com/company/gemil-pharma/,GEMIL PHARMA is a developer and marketer of branded and unique food supplements. The vegan capsule products are meant to be used in conjunction with food as food supplements and to provide sensory pleasures as well. It has redifined natural immune support with the power of antioxidants.,Health Care,1,1-10,Gergely Pasztor,3,Private Equity,2021-07-20,700000000,HUF,2295231,Private Equity,700000000,HUF,2295231,Private Equity,3766416,USD,3766416,3766416,USD,3766416,Hiventures,,1,,,,,,,,,,,,,,Private,,,,,,,,,,,
MITE-CHEM KFT.,https://www.crunchbase.com/organization/mite-chem-kft,Active,,"Agriculture, Chemical, Manufacturing","Nádudvar, Hajdu-Bihar, Hungary",MITE-CHEM KFT. is a manufacturer of pesticides and other agrochemical products.,"126,899","European Union (EU), Europe, Middle East, and Africa (EMEA)",,,2018-01-01,year,,,,,For Profit,http://www.mite-chem.hu/,,,,"MITE-CHEM KFT. develops flumite 200 product SC plant protection agent and the active ingredient diflovidazine molecule. They provide crop safety, which is one of the pillars of maintaining competitiveness for agricultural producers in the dynamically developing agricultural market.","Agriculture and Farming, Manufacturing, Science and Engineering",,1-10,,2,Seed,2021-10-01,1500000,EUR,1739092,Seed,1500000,EUR,1739092,Seed,4210000,EUR,4824300,4210000,EUR,4824300,Bonitás Ventures,1,1,,,,,,,,,,,,,,Private,,,,,,,,,,,
Biopesticide Ltd.,https://www.crunchbase.com/organization/biopeszticid-kft,Active,,Manufacturing,"Pécs, Pecs, Hungary",Biopesticide produces and sells biological pesticides.,"127,169","European Union (EU), Europe, Middle East, and Africa (EMEA)",,Less than $1M,2018-01-01,year,,,,,For Profit,https://www.biopesticide.eu/,,,,Biopesticide develops and markets bacteriophage-based products. They engaged in biopesticide research and trade services. They provide products that protect rice against the rice leaf blight disease.,Manufacturing,,1-10,,4,Seed,2021-09-20,1700000,EUR,1993569,Seed,1700000,EUR,1993569,Seed,1830000,EUR,2139256,1830000,EUR,2139256,"Hiventures, Bonitás Ventures",2,2,,,,,,,,,,,,,,Private,,,,,,,,,,,
Moonsyst Zrt,https://www.crunchbase.com/organization/moonsyst-zrt,Active,,Information Technology,"Bicske, Fejer, Hungary",Moonsyst develops cattle monitoring system that offers real-time information.,"127,286","European Union (EU), Europe, Middle East, and Africa (EMEA)",2060,,2014-01-01,year,,,,,For Profit,https://www.moonsyst.com/,,https://www.facebook.com/moonsyst/,https://www.linkedin.com/company/moonsyst/,"Moonsyst provides cloud-based software, which can be accessed on a phone or PC, that uses artificial intelligence to predict animal health and heat events. They concentrate on animal health and production.",Information Technology,1,1-10,Peter Gesler,2,Seed,2020-07-03,210000,EUR,236194,Seed,210000,EUR,236194,Seed,404000,EUR,458334,404000,EUR,458334,Hiventures,,1,,,,,,,,,,,,,,Private,,,,,,,,,,,
FomDigital,https://www.crunchbase.com/organization/fom-digital-kft,Active,,"SaaS, UX Design, Web Development","Budapest, Budapest, Hungary",FomDigital provides innovative technology solutions in the Central European region.,"127,383","European Union (EU), Europe, Middle East, and Africa (EMEA)",,Less than $1M,2017-10-24,day,,,,,For Profit,https://fomdigital.com,,,,"FomDigital provides innovative technology solutions in the Central European region. FomDigital offers a professional portfolio that includes a wide range of tech pursuits from website development through end-to-end startup and corporate application development to comprehensive design projects. The company was founded in 2017 and is based in Budapest, Hungary.","Design, Software",,11-50,,3,Seed,2021-12-07,105000000,HUF,322352,Seed,105000000,HUF,322352,Seed,569730,USD,569730,569730,USD,569730,Hiventures,,1,,,,,,,,,,,,,,Private,,,,,,,,,,,
Platio,https://www.crunchbase.com/organization/platio,Active,,"Energy, Green Building, GreenTech, Recycling, Renewable Energy, Smart Cities, Solar, Waste Management","Budapest, Budapest, Hungary","Platio is an unconventional, primarily outdoor energy producing paving system, optionally equipped with information technological functions.","127,660","European Union (EU), Europe, Middle East, and Africa (EMEA)",,$1M to $10M,2015-01-01,year,,,,,For Profit,https://platiosolar.com/,https://twitter.com/Platiopavings,https://www.facebook.com/platiopavings/,https://www.linkedin.com/company/platio/,"Platio is an unconventional, primarily outdoor energy producing, modular paving system optionally equipped with information technological functions.   Platio provides an aesthetic and space-saving off-grid renewable energy system by integrating high-performance solar cells into attractive sidewalk paving elements made of recycled plastic. Electricity generated during sunshine hours can be stored by energy saving units or be used to operate functions integrated into the pavement or nearby electric devices of public places (public lighting, traffic control systems, other energy consuming street contrivances) independently from the grid.","Energy, Natural Resources, Real Estate, Sustainability",2,11-50,"Imre Sziszak, Miklos Ilyes",2,Seed,2020-12-17,484000,EUR,593466,Seed,484000,EUR,593466,Seed,484000,EUR,593466,484000,EUR,593466,"Hiventures, Agile Accelerator",1,2,,,,,,,,,,,,,,Private,,,,,,,,,,,
SentryNode Robotics,https://www.crunchbase.com/organization/sdr-technologies-kft,Active,,Robotics,"Gyor, Gyor, Hungary","SentryNode creates hardware and software to capture environmental data safely, quickly, and accurately.","128,400","European Union (EU), Europe, Middle East, and Africa (EMEA)",9026,Less than $1M,2020-01-01,year,,,,,For Profit,https://sentrynode.com/,,,https://www.linkedin.com/company/sentrynode/,"SentryNode creates hardware and software to capture environmental data safely, quickly, and accurately.","Hardware, Science and Engineering, Software",3,1-10,"Alex Suta, Norbert Markó, Rudolf Krecht",1,Seed,2020-12-09,50000,EUR,60392,Pre-Seed,50000,EUR,60392,Pre-Seed,50000,EUR,60392,50000,EUR,60392,Hiventures,,1,,,,,,,,,,,,,,Private,,,,,,,,,,,
Statzup,https://www.crunchbase.com/organization/statzup,Active,,"Apps, Fantasy Sports, Gamification, Gaming, Internet, Mobile Apps, Online Games, Soccer, Social Media, Sports, Web Development","Budapest, Budapest, Hungary",Statzup is a developer and operator of various fantasy sports games and related products for different platforms.,"128,551","European Union (EU), Europe, Middle East, and Africa (EMEA)",1067,$1M to $10M,2014-04-04,day,2016-05-30,day,,,For Profit,http://statzup.com/,http://twitter.com/Statzup,http://www.facebook.com/Statzup,https://www.linkedin.com/company/statzup,"Statzup project is all about the passion of being a real football fanatic. With their apps and sites you will be able to follow your favorites to an extent you could not before: You get all the important news, statistics, records, pictures, you can guess the result of the games and compete with your friends using their brand new scorezup game. And on the top of that, you can set up and manage your own team using real players in their The Fantasy Football (TFF) game.","Apps, Gaming, Internet Services, Media and Entertainment, Mobile, Software, Sports",2,11-50,"Kristóf Simán, Tamás Varga",4,M&A,2017-10-14,110000,EUR,130023,Venture - Series Unknown,110000,EUR,130023,Venture - Series Unknown,1749021,USD,1749021,1749021,USD,1749021,"Day One Capital, PortfoLion Capital Partners, Cashline Group, Valor Capital Venture Capital Fund Management Ltd.",2,4,,Was Acquired,Statzup acquired by Cashline Group,https://www.crunchbase.com/acquisition/cashline-group-acquires-statzup--fb397e6a,Cashline Group,https://www.crunchbase.com/organization/cashline-group,2016-05-30,day,,,,Acquisition,,Private,,,,,,,,,,,
Access4you,https://www.crunchbase.com/organization/access4you,Active,,"Apps, Information Services, Local, Search Engine","Budapest, Budapest, Hungary",Access4you is an app that offers surveys and assessment request audits for property owners and companies.,"129,217","European Union (EU), Europe, Middle East, and Africa (EMEA)",,Less than $1M,2019-01-01,year,,,,,For Profit,https://access4you.io,,https://www.facebook.com/access4you.io,https://www.linkedin.com/company/access4you-io,,"Apps, Information Technology, Internet Services, Sales and Marketing, Software",,11-50,,1,Seed,2023-07-26,365000000,HUF,1058614,Seed,365000000,HUF,1058614,Seed,365000000,HUF,1058614,365000000,HUF,1058614,Hiventures,1,1,,,,,,,,,,,,,,Private,,,,,,,,,,,
Herbow International Kft,https://www.crunchbase.com/organization/herbow-international-kft,Active,,"Association, Cleaning Products","Nyíregyháza, Szabolcs-Szatmar-Bereg, Hungary",Herbow International Kft is a manufacturer and distributor of environmentally friendly and sustainable laundry detergent.,"129,657","European Union (EU), Europe, Middle East, and Africa (EMEA)",,$1M to $10M,2017-10-11,day,,,,,For Profit,https://herbow.hu/,,,https://www.linkedin.com/company/herbow-international-zrt,Herbow International Kft is a producer and distributor of laundry detergent created to offer a safe and environmentally friendly method of washing garments. Customers can get natural alternatives to conventional detergents from the company in the form of plant-based detergents with herbal and mineral ingredients.,"Consumer Goods, Other",,1-10,,2,Seed,2020-12-14,484000,EUR,588004,Seed,484000,EUR,588004,Seed,1036000,EUR,1247073,1036000,EUR,1247073,Hiventures,,1,,,,,,,,,,,,,,Private,,,,,,,,,,,
Scolvo,https://www.crunchbase.com/organization/scolvo-zrt,Active,,"Apps, Mobile Apps, Software, Software Engineering","Budapest, Budapest, Hungary",Scolvo is a mobile-specific application development platform.,"129,668","European Union (EU), Europe, Middle East, and Africa (EMEA)",1055,$1M to $10M,2016-01-29,day,,,,,For Profit,https://scolvo.com,,,https://www.linkedin.com/company/scolvo,"Scolvo is an app development company. They were designed to build enterprise mobile applications radically faster. The company's platform syncs data when the devices are online, enabling developers to cover all aspects of the development of their project from the front end, back end, database, and deployment.","Apps, Mobile, Science and Engineering, Software",1,11-50,Kalman Boda,5,Early Stage Venture,2021-08-23,70000000,HUF,234907,Series A,70000000,HUF,234907,Series A,1724541,USD,1724541,1724541,USD,1724541,Hiventures,,1,,,,,,,,,,,,,,Private,,,,,,,,,,,
Tell Me Kft.,https://www.crunchbase.com/organization/tell-me-kft,Active,,,"Tatabánya, Komarom-Esztergom, Hungary",Animation & Gaming,"130,428","European Union (EU), Europe, Middle East, and Africa (EMEA)",,,2020-12-08,day,,,,,For Profit,,,,,,,,1-10,,3,Seed,2021-09-14,45000000,HUF,151838,Pre-Seed,45000000,HUF,151838,Pre-Seed,253453,USD,253453,253453,USD,253453,"Hiventures, Drukka Startup Studio, Intellitext",,3,,,,,,,,,,,,,,Private,,,,,,,,,,,
Fuvar,https://www.crunchbase.com/organization/fuvar-hu-kft,Active,,"Last Mile Transportation, Software Engineering","Pécs, Pecs, Hungary","SaaS, AI/ML last-mile delivery for businesses and enterprises","131,132","European Union (EU), Europe, Middle East, and Africa (EMEA)",7626,$1M to $10M,2017-01-01,year,,,,,For Profit,https://fuvar.hu/,,,https://www.linkedin.com/company/fuvar-hu,"Fuvar is a seed stage software startup located in Budapest, Hungary that provides delivery management solutions for the last-mile. Our state-of-the-art, AI-driven route planning and optimisation algorithm offers significant efficiency gains to businesses that manage their delivery fleets with us. We are currently running a pilot with the Hungarian Post and rolling out the SaaS product autumn 2023.  This technology results in shorter routes, less fuel consumption and lower environmental impact. Meanwhile, recipients can enjoy the benefits of live map-based tracking and accurate ETA notifications. Our unfair advantage is capacity (vehicle+driver) booking and sharing capability for our users.","Science and Engineering, Software, Transportation",1,11-50,Szucsányi-Borza Sebestyén,9,Seed,2021-12-23,500000000,HUF,1530871,Seed,500000000,HUF,1530871,Seed,2440706,USD,2440706,2440706,USD,2440706,Hiventures,,1,,,,,,,,,,,,,,Private,,,,,,,,,,,
ViveLab Ergo Plc.,https://www.crunchbase.com/organization/vivelab-ergo-kft,Active,,"Information Technology, Telecommunications","Budapest, Budapest, Hungary",ViveLab Ergo does virtual testing and verification of product plans and simulate interactions between human and machine.,"131,239","European Union (EU), Europe, Middle East, and Africa (EMEA)",1118,,2017-09-01,day,,,,,For Profit,https://www.vivelab.cloud,,https://www.facebook.com/ViveLabInformation/,https://www.linkedin.com/company/vivelab/,"ViveLab Ergo is an ergonomic consulting company. They provide an evaluation of a planned workplace, workplace measurement, support, and mentoring services. They also provide ergonomic consultancy, analysis, and validation.","Hardware, Information Technology",3,11-50,"Csaba Szeredy, Laszlo Ordogh, Miklos Marton",5,Seed,2022-02-18,84000,EUR,95105,Seed,84000,EUR,95105,Seed,1724000,EUR,2016752,1724000,EUR,2016752,"Hiventures, StartupWorld, ViVeTech",3,3,,,,,,,,,,,,,,Private,,,,,,,,,,,
DisplayNOW,https://www.crunchbase.com/organization/displaynow-zrt,Active,,"Advertising, E-Commerce, Marketing","Szekszárd, Tolna, Hungary",DisplayNOW is an online advertising webshop that connects the advertiser with the publishing companies.,"131,564","European Union (EU), Europe, Middle East, and Africa (EMEA)",7100,Less than $1M,2020-03-06,day,,,,,For Profit,http://www.displaynow.net,,https://www.facebook.com/DisplayNOW.net,https://www.linkedin.com/company/displaynow-hu,"DisplayNOW offers online advertising services for businesses, which can be placed on domestic news and thematic websites. It is an online advertising shop that connects the advertiser with publishing companies. For inquiries, email, telephone numbers, and physical addresses are available on their website.","Advertising, Commerce and Shopping, Sales and Marketing",,1-10,,1,Seed,2020-09-23,323000,EUR,376508,Seed,323000,EUR,376508,Seed,323000,EUR,376508,323000,EUR,376508,Hiventures,,1,,,,,,,,,,,,,,Private,,,,,,,,,,,
Woodries Kft.,https://www.crunchbase.com/organization/woodries-kft,Active,,,"Siófok, Somogy, Hungary",Woodries Kft.,"132,894","European Union (EU), Europe, Middle East, and Africa (EMEA)",,,2018-01-01,year,,,,,,,,,,,,,1-10,,2,Seed,2020-06-09,129000,EUR,146187,Seed,129000,EUR,146187,Seed,387000,EUR,445769,387000,EUR,445769,Hiventures,,1,,,,,,,,,,,,,,Private,,,,,,,,,,,
