Plerdy,https://www.crunchbase.com/organization/plerdy,Active,,"Analytics, Internet, SaaS, SEO","Lviv, L'vivs'ka Oblast', Ukraine","Plerdy is an IT company that provides conversion rate optimization tools for CRO, SEO, and website UX audit services.","124,580","Europe, Middle East, and Africa (EMEA)",79017,Less than $1M,2017-01-01,year,,,,,For Profit,https://www.plerdy.com,https://twitter.com/plerdy_com,https://www.facebook.com/pg/PlerdyEN,https://www.linkedin.com/company/plerdy,"Plerdy - SaaS product for an effective data collection, relying on which you will build a winning strategy for a conversion raise and an increase in profits in your online store or website.","Data and Analytics, Internet Services, Sales and Marketing, Software",1,11-50,Andrew Chornyy,2,Seed,2020-11-04,20000,USD,20000,Pre-Seed,20000,USD,20000,Pre-Seed,40000,USD,40000,40000,USD,40000,Lviv Tech Angels,,1,,,,,,,,,,,,,,Private,,,,,,,,,,,2
findyIoT,https://www.crunchbase.com/organization/findy,Active,,"Agriculture, Consumer Electronics, Energy, Internet of Things, Manufacturing, Security, Shipping, Waste Management","Sofia, Grad Sofiya, Bulgaria",We deliver data. Findy deploys scaled IoT across industry verticals. We deliver industry grade connectivity for real world applications.,"125,571","European Union (EU), Europe, Middle East, and Africa (EMEA)",1612,Less than $1M,2010-03-03,day,,,,,For Profit,https://findy.eu,,https://www.facebook.com/findylab/,https://bg.linkedin.com/company/findy,"We deliver data. Findy deploys scaled IoT across industry verticals. We deliver the connectivity and data layers for mission critical, real world, applications.  Hardware is built and assembled by our own engineers. This provides our customers with a unique ability to concept test and deploy IoT tools within a fast decision making framework.  We have built a reputation as a go-to partner for rapid prototyping and product design. This rests on a commitment to iteration and a jargon free, personal, approach.  Our ability to build partnerships that have lasted for decades means we retain significant domain knowledge in manufacturing, agriculture, logistics, urban mobility, waste management, security, insurance and utilities.","Agriculture and Farming, Consumer Electronics, Energy, Hardware, Internet Services, Manufacturing, Privacy and Security, Sustainability, Transportation",1,11-50,Stoian Lilov,3,Early Stage Venture,2019-06-04,,,,Series A,,,,Series A,95000,EUR,106275,95000,EUR,106275,Eleven Ventures,,1,,,,,,,,,,,,,,Private,,,,,,,,,,,
Metrilo,https://www.crunchbase.com/organization/metrilo,Active,,"Analytics, Business Development, E-Commerce, Marketing, Software","Sofia, Grad Sofiya, Bulgaria",Metrilo is an IT company that offers an e-commerce analytics platform that helps online stores grow.,"125,682","European Union (EU), Europe, Middle East, and Africa (EMEA)",1000,Less than $1M,2014-04-01,day,2021-09-21,day,,,For Profit,https://www.metrilo.com/,http://twitter.com/GetMetrilo,http://www.facebook.com/getmetrilo,https://www.linkedin.com/company/metrilo,The Marketing Platform for eCommerce stores. Built from the ground up to solve marketing problems for eCommerce stores.,"Commerce and Shopping, Data and Analytics, Professional Services, Sales and Marketing, Software",2,11-50,"Murry Ivanoff, Peter Iliev",6,M&A,2020-10-01,50000,USD,50000,Seed,50000,USD,50000,Seed,1090494,USD,1090494,1147061,USD,1147061,"Speedinvest, Eleven Ventures, LAUNCHub Ventures",,3,,Was Acquired,Metrilo acquired by Brevo,https://www.crunchbase.com/acquisition/sendinblue-acquires-metrilo--9a634da6,Brevo,https://www.crunchbase.com/organization/sendinblue,2021-09-21,day,,,,Acquisition,,Private,,,,,,,,,,,
AMPnet,https://www.crunchbase.com/organization/ampnet,Active,,"Asset Management, Financial Services, Real Estate Investment","Zagreb, Grad Zagreb, Croatia",AMPnet is a financing platform and marketplace for renewable energy sources - making renewables viable for a new class of investors.,"125,803","European Union (EU), Europe, Middle East, and Africa (EMEA)",,Less than $1M,2018-01-01,year,,,,,For Profit,https://ampnet.io,https://twitter.com/ampnetio,https://www.facebook.com/ampnetproject,https://www.linkedin.com/company/ampnetio,"AMPnet provides every new or existing cooperative with a full set of tools to manage payments, invoicing, , smart metering, demand side management, crowdinvesting and community governance. AMPnet is an integrated hardware and software suite comprised of web applications, iOS & Android apps, blockchain payments and governance platform and an open source smart meter hardware specification. We provide a simple turnkey solution - reducing onboarding complexity and operating costs.","Financial Services, Real Estate",1,11-50,Ann Mbl,3,Seed,2020-07-01,400000,USD,400000,Seed,400000,USD,400000,Seed,714032,USD,714032,714032,USD,714032,"EIT InnoEnergy, AE Ventures",2,2,,,,,,,,,,,,,,Private,,,,,,,,,,,
StarTalers,https://www.crunchbase.com/organization/startalers,Active,,"Big Data, Financial Services, Wealth Management","Luxembourg, Luxembourg, Luxembourg",StarTalers is an online financial coach and roboadvisor that supports women willing to invest sustainably.,"125,964","European Union (EU), Europe, Middle East, and Africa (EMEA)",1724,$1M to $10M,2018-05-30,day,,,,,For Profit,http://startalers.com/,https://twitter.com/star_talers,http://www.facebook.com/startalers,https://www.linkedin.com/company/star-talers/,"Startalers offers all the services of a financial advisor, with a touch of extra intelligence to help you achieve your financial independence. StarTalers is an online financial coach and roboadvisor that supports women willing to invest sustainably.","Data and Analytics, Financial Services",2,1-10,"Gaëlle Haag, Thierry Smets",2,Seed,2021-06-28,820000,EUR,978170,Seed,820000,EUR,978170,Seed,1340000,EUR,1554223,1340000,EUR,1554223,"Seeder Fund, Luxembourg Stock Exchange, LeanSquare",3,3,,,,,,,,,,,,,,Private,,,,,,,,,,,
Dermico.care,https://www.crunchbase.com/organization/dermico-care,Active,,"Health Care, Health Diagnostics, Personal Health","Sofia, Grad Sofiya, Bulgaria",Dermico.care is a digital platform for dermatology services,"127,305","European Union (EU), Europe, Middle East, and Africa (EMEA)",,,2017-01-01,year,,,,,For Profit,https://dermico.care/home,,,,,Health Care,,,,1,Seed,2023-06-20,200000,EUR,218400,Seed,200000,EUR,218400,Seed,200000,EUR,218400,200000,EUR,218400,Innovation Capital,1,1,,,,,,,,,,,,,,Private,,,,,,,,,,,
MClimate,https://www.crunchbase.com/organization/melissa-climate,Active,,"Consumer Electronics, Energy Efficiency, Smart Building, Smart Cities, Smart Home","Sofia, Grad Sofiya, Bulgaria",MClimate designs and manufactures IoT devices and offers plug-and-play solutions to make buildings smart.,"127,496","European Union (EU), Europe, Middle East, and Africa (EMEA)",1784,$1M to $10M,2014-08-07,day,,,,,For Profit,http://mclimate.eu/,,https://www.facebook.com/MClimate,https://www.linkedin.com/company/mclimate/,"MClimate is an IoT company which designs and develops affordable and universally compatible building automation solutions with a focus on delivering enhanced comfort, security, and energy savings to its end users  In the Years 2017-2020 MClimate rapidly expanded its portfolio, which now has three main lines: 1) Energy Efficiency 2) Home Comfort 3) Security and protection. MClimate also based many of their products on the LoRaWAN Technology and now has numerous successful Smart City and Smart Building projects worldwide.","Consumer Electronics, Energy, Hardware, Real Estate, Sustainability",4,11-50,"Blagovest Dimitrov, Lyubomir Yanchev, Tzvetko Sabev, Violeta Mitsova",6,Seed,2020-11-01,100000,EUR,116418,Seed,100000,EUR,116418,Seed,1500000,EUR,1707899,1500000,EUR,1707899,Eleven Ventures,,1,,,,,,,,,,,,,,Private,,,,,,,,,,,1
Reface,https://www.crunchbase.com/organization/refaceai,Active,,"Artificial Intelligence (AI), Digital Entertainment, Generative AI, Machine Learning, Mobile Apps, Software","Kyiv, Kyyiv, Ukraine",Reface is a product company from Ukraine developing generative AI tools for content creation,"129,101","Europe, Middle East, and Africa (EMEA)",,$10M to $50M,2018-01-01,year,,,,,For Profit,https://reface.ai,https://twitter.com/reface_app,https://www.facebook.com/refaceapp,https://www.linkedin.com/company/refaceapp,"Reface is a Ukrainian product company that develops AI tools for empowering content creation. It was backed by Andreessen Horowitz and investors from the gaming industry (Ilkka Paananen, CEO of Supercell, David Helgason, founder of Unity Technologies) and the music industry (Scooter Braun, managing partner of TQ Ventures, and Adam Leber). Currently, Reface continues to democratize leading ML technologies and launch new products for content transformation using AI. As of March 2023, the company's portfolio includes the following products: * Reface — a mobile app that allows users to replace faces in videos and photos, voice-over content, and generate AI portraits from multiple selfies. Within 2 years after its launch, Reface has been downloaded 250 million times. * Revive — a mobile app for animating images. It allows users to instantly edit and animate photos, memes, or art portraits. * Memomet — a mobile app for creating Ukrainian memes. *Metahead — a technology for the neural rendering of 3D images based on 2D photos.","Apps, Artificial Intelligence (AI), Data and Analytics, Media and Entertainment, Mobile, Science and Engineering, Software",7,101-250,"Den Dmytrenko, Dima Shvets, Ivan Altsybieiev, Kyrylo Syhyda, Oles Petriv, Roman Mogylnyi, Yaroslav Boiko",4,Seed,2021-07-07,,,,Seed,,,,Seed,5500000,USD,5500000,5500000,USD,5500000,"Andreessen Horowitz, TQ Ventures, Illusian Founder Office, Ilkka Paananen, Angel Collective Opportunity Fund",1,10,,,,,,,,,,,,,,Private,,,,,,,,,,,
Plato Trade,https://www.crunchbase.com/organization/plato-trade,Closed,,"Bitcoin, Cryptocurrency, Trading Platform","Kyiv, Kyyiv, Ukraine",PlatoTrade is a trading platform that uses traditional technical analysis and indicators.,"131,993","Europe, Middle East, and Africa (EMEA)",,,2018-01-01,day,,,,none,For Profit,http://www.platotrade.com/,,https://www.facebook.com/platotrade/,https://www.linkedin.com/company/platotrade/,PlatoTrade is a cloud-based platform. They created it to increase the interactivity of trading using indicators. They display a trade signal on the dashboard that is impossible to miss based on trading indicators.,"Blockchain and Cryptocurrency, Financial Services, Lending and Investments, Payments, Software",2,11-50,"Kanan Hajizada, Vyacheslav Demchuk",1,Seed,2018-04-29,250000,USD,250000,Seed,250000,USD,250000,Seed,250000,USD,250000,250000,USD,250000,Seven Arrows Capital,,1,,,,,,,,,,,,,,Private,,,,,,,,,,,
AdScout,https://www.crunchbase.com/organization/adscout,Active,,"Marketing, Service Industry","Sofia, Grad Sofiya, Bulgaria",AdScout is a technology company that creates a network of trusted recommendations by connecting satisfied customers with companies.,"133,241","European Union (EU), Europe, Middle East, and Africa (EMEA)",,,2020-01-01,year,,,,,For Profit,https://adscout.io,,https://www.facebook.com/adscout.io,https://www.linkedin.com/company/adscout-io,AdScout is a technology company that creates a network of trusted recommendations by connecting satisfied customers with prominent companies.,"Other, Sales and Marketing",,1-10,,1,Seed,2024-02-21,300000,EUR,324610,Pre-Seed,300000,EUR,324610,Pre-Seed,300000,EUR,324610,300000,EUR,324610,New Vision 3,1,1,,,,,,,,,,,,,,Private,,,,,,,,,,,
Printivo Group Jsc,https://www.crunchbase.com/organization/printivo-d4fb,Active,,"3D Printing, Biopharma, Biotechnology, Health Care, Medical Device","Sofia, Grad Sofiya, Bulgaria",3D-bioprinting company in a mission to improve drug-testing and personalized medical therapies through complete printed human organ.,"133,253","European Union (EU), Europe, Middle East, and Africa (EMEA)",,Less than $1M,2016-04-07,day,,,,,For Profit,http://www.printivo.eu/,,https://www.facebook.com/printivoltd/,https://www.linkedin.com/company/printivo/,"Printivo is a 3D-bioprinting startup company in a mission to radically improve drug-testing and personalized medical therapies, paving the way to a complete printed human organ.Currently we are situated in Sofia, Bulgaria.   Our motto – “We print life” is the quintessence of our main goal namely to fabricate and design native-like human tissues and organs. Our inspiration is driven by the huge necessity of finding solutions for the growing humanitarian problem with shortage of organ transplants. Hundreds of people die each day, in this very minute in fact, failing to receive organ transplantation. This life-giving act must be accessible and affordable to each person and we are ready to take this difficult, uncertain and long way to fulfill their needs.","Biotechnology, Health Care, Manufacturing, Science and Engineering",1,11-50,Spas Kerimov,3,Seed,2021-03-31,200000,EUR,234547,Seed,200000,EUR,234547,Seed,500000,EUR,572720,500000,EUR,572720,Eleven Ventures,1,1,,,,,,,,,,,,,,Private,,,,,,,,,,,
OVO,https://www.crunchbase.com/organization/ovo-5d0a,Active,,"Consumer Goods, Delivery Service, Fruit","Kyiv, Kyyiv, Ukraine",OVO allows consumers to order and receive fruits and vegetables.,"133,285","Europe, Middle East, and Africa (EMEA)",,Less than $1M,2020-01-01,year,,,,,For Profit,https://ovo.market,,https://www.facebook.com/ovoua,https://www.linkedin.com/company/theovo,OVO allows consumers to order and receive fruits and vegetables in Kyiv and a 25-kilometer area outside the capital.,"Consumer Goods, Food and Beverage, Transportation",,1-10,,2,Seed,2021-06-16,350000,USD,350000,Seed,350000,USD,350000,Seed,350000,USD,350000,350000,USD,350000,"TA Ventures, Imperial Logistics, ICLUB VC, BRISE Capital, Fedoriv Group",1,5,,,,,,,,,,,,,,Private,,,,,,,,,,,
OVO,https://www.crunchbase.com/organization/ovo-b1fd,Active,,"Food and Beverage, Food Delivery, Grocery, Retail, Retail Technology","Kyiv, Kyyiv, Ukraine","OVO is a D2C, e-grocery platform that delivers consumer goods to customers' homes.","133,895","Europe, Middle East, and Africa (EMEA)",,,2020-04-22,day,,,,,For Profit,https://ovo.ua,,https://www.facebook.com/ovoua,https://www.linkedin.com/company/theovo,"OVO is a D2C, e-grocery platform that delivers consumer goods to customers' homes. OVO's goal is to deliver fresh fruits, vegetables, and herbs to customers. OVO values product freshness, so each order will be as if it were picked straight from the garden.","Commerce and Shopping, Food and Beverage, Hardware, Software, Transportation",1,11-50,Roman Melkumov,4,Seed,2021-06-17,350000,USD,350000,Seed,350000,USD,350000,Seed,925829,USD,925829,925829,USD,925829,"TA Ventures, ICLUB VC, Fedoriv Group, IClub Ventures",2,4,,,,,,,,,,,,,,Private,,,,,,,,,,,
A4Everyone,https://www.crunchbase.com/organization/a4everyone,Active,,"Analytics, Information Technology, InsurTech, Small and Medium Businesses, Software","Sofia, Grad Sofiya, Bulgaria","A4Everyone is an IT services company that offers credit scoring, sales forecasting, and data analytics.","134,506","European Union (EU), Europe, Middle East, and Africa (EMEA)",1784,$1M to $10M,2015-01-01,year,,,,,For Profit,https://www.a4everyone.com,https://twitter.com/A4_Everyone,https://www.facebook.com/a4everyone,https://www.linkedin.com/company/a4everyone,"Collecting data nowadays is easy and what all businesses do, one way or another. Using this data to their advantage, however, is another story. Some companies don't know the benefits, others are startled by the costs, infrastructure and complexity an analytical solution demands. Even in the highly digital world they live, feeding their data into powerful analytical engines is a privilege available only to the big ones. At A4E they believe that adding value to your data is easy and harnessing computing resources to boost your business should be a couple clicks away. They are intricately familiar to the science of analytics and over years of experience they've realized that providing affordable, easy to understand and use analytical solutions is not only possible, but the future of this industry.","Data and Analytics, Financial Services, Information Technology, Other, Software",4,1-10,"Alexander Efremov, Dimitar Atanasov, Hristo Hadjitchonev, Todor Kisov",4,Seed,2019-12-12,565000,EUR,631865,Convertible Note,200000,EUR,220369,Seed,310000,EUR,337283,1190000,EUR,1304361,"Eleven Ventures, Impetus Capital, UniCredit Bulbank, Georgi Kremenliev",1,4,,,,,,,,,,,,,,Private,,,,,,,,,,,
MultiNFT,https://www.crunchbase.com/organization/multinft,Active,,"Blockchain, Digital Entertainment, Metaverse, Virtual Reality, Web3","Kyiv, Kyyiv, Ukraine","Metaverse, Web3, NFT, Innovation, entertainment as a main POC","135,098","Europe, Middle East, and Africa (EMEA)",,,2018-01-01,year,,,,,For Profit,https://multinft.io,https://twitter.com/multinft,https://www.facebook.com/MultiNFT/,https://www.linkedin.com/company/cryptogamers/,"MultiNFT uses its deep understanding and proven experience in Metaverse and Web3 to serve both sides of the Metaverse equation and help bringing order to a ""wild wild west"" style industry: a) The users- The current web3 user is by default tech savvy, this is the result of an unintended barrier that arises in applying the principles of self ownership and using blockchain technology, and this destroys the adoption curve. MultiNFT places simple to use curated experiences at the centre of its activity with blockchain serving only as an infrastructure whilst partnering with renowned artists/athletes and brands to further increase the adoption and invite fans and more common users. b) The brands - the other side of the equation: Most working brands with fanbase and market share do not want to risk onboarding new avenues such as web3 due to its inherit risk and self education required to safety execute. MultiNFT helps brands, athletes, artists and other projects to utilize and join this new frontier without the need of becoming a blockchain organization. In short and layman's terms we create top experiences across all metaverse platforms with an exciting and easy to use NFT centred ecosystem, while serving brands/creators and making the web3 and Metaverse space accessible.","Blockchain and Cryptocurrency, Hardware, Internet Services, Media and Entertainment, Other, Software",1,11-50,Guy Goldenberg,2,Seed,2022-06-27,250000,USD,250000,Seed,250000,USD,250000,Seed,660000,USD,660000,660000,USD,660000,"Newchip Accelerator, Panda Venture Capital",1,2,,,,,,,,,,,,,,Private,,,,,,,,,,,
nexten.io,https://www.crunchbase.com/organization/nexten-io,Active,,"Human Resources, Internet, Recruiting, Software","Strassen, Luxembourg, Luxembourg",The matchmaking platform for CTOs hiring developers and tech experts.,"135,247","European Union (EU), Europe, Middle East, and Africa (EMEA)",8030,$1M to $10M,2018-03-14,day,2023-11-01,day,,,For Profit,https://nexten.io,https://twitter.com/nextenio,https://www.facebook.com/nexten.io/,https://www.linkedin.com/company/nexten-io/,"nexten.io is the leading subscription-free recruitment platform, connecting thousands of selected developers open to on site, remote or freelance opportunities with CTOs of the best tech companies across Europe.","Administrative Services, Internet Services, Professional Services, Software",1,11-50,Eric Busch,2,M&A,2020-04-10,600000,EUR,656190,Seed,600000,EUR,656190,Seed,1200000,EUR,1329328,1200000,EUR,1329328,Expon Capital,1,1,,Was Acquired,nexten.io acquired by Cyberr®,https://www.crunchbase.com/acquisition/cyberr-acquires-nexten-io--50286995,Cyberr®,https://www.crunchbase.com/organization/cyberr,2023-11-01,day,,,,Merger,,Private,,,,,,,,,,,
Eurosender,https://www.crunchbase.com/organization/eurosender,Active,,"B2B, E-Commerce Platforms, Freight Service, Logistics, SaaS, Shipping, Software, Transportation","Luxembourg, Luxembourg, Luxembourg","Eurosender is a digital platform, empowering companies to create their own digital logistics department and increase performance.","135,265","European Union (EU), Europe, Middle East, and Africa (EMEA)",L-1911,Less than $1M,2014-05-01,month,,,,,For Profit,https://www.eurosender.com/,https://twitter.com/Eurosender,https://www.facebook.com/Eurosender/,https://www.linkedin.com/company/eurosender,"Eurosender is a modern platform that combines advanced automation capabilities and can be used by companies of different scale as their own outsourced digital logistics department.  Eurosender’s mission is to empower companies to understand and manage their logistics process exclusively online - at no cost, to accumulate and analyse relevant information about their logistics operations, base their decisions on data and thus, increase their efficiency by anticipating possible disruptions. We complement robust logistics software with a team of logistics specialists who keep close to businesses’ problems and can address them by offering tailor-made solutions.  Eurosender is a global logistics marketplace, an effective link between transportation providers and businesses, using pricing and service technologies to help companies scale and optimize their operations. The company was founded in 2014 and it is headquartered in Luxembourg, having offices in London, Berlin, Ljubljana, Kiev and Gdynia.","Commerce and Shopping, Internet Services, Other, Software, Transportation",2,101-250,"Jan Stefe, Tim Potocnik",9,,2020-09-01,,,,Non-equity Assistance,,,,Venture - Series Unknown,652000,EUR,746280,652000,EUR,746280,"Fil Rouge Capital (FRC), Munich Re, Silicon Gardens, POST Luxembourg, ProSiebenSat.1 Accelerator",2,9,,,,,,,,,,,,,,Private,,,,,,,,,,,1
Podcasts for Startups,https://www.crunchbase.com/organization/podcasts-for-startups,Active,,"Internet, Podcast","Luxembourg, Luxembourg, Luxembourg","podcasts created by nfinitiv for startups to provide better insights. Hear it directly from VC's, Angel Investors and Startups.","135,299","European Union (EU), Europe, Middle East, and Africa (EMEA)",,,2019-02-03,day,2019-11-20,day,,,For Profit,https://podcastsforstartups.com,,,,"Here you will find series of podcasts created by nfinitiv for startups to provide better insights. Hear it directly from VC's, Angel Investors and Startups.","Internet Services, Media and Entertainment, Music and Audio",,1-10,,1,M&A,2019-05-01,1000000,USD,1000000,Seed,1000000,USD,1000000,Seed,1000000,USD,1000000,1000000,USD,1000000,nfinitiv funding,1,1,,Was Acquired,Podcasts for Startups acquired by nfinitiv,https://www.crunchbase.com/acquisition/nfinitiv-acquires-podcasts-for-startups--fb9ed605,nfinitiv,https://www.crunchbase.com/organization/nfinitiv,2019-11-20,day,,,,Acquisition,,Private,,,,,,,,,,,
Rebellious Software,https://www.crunchbase.com/organization/rebellious-software,Active,,"Information Technology, Software","Sofia, Grad Sofiya, Bulgaria",Software development company focused on making games that make you think.,"136,097","European Union (EU), Europe, Middle East, and Africa (EMEA)",,Less than $1M,2015-01-01,year,,,,,For Profit,http://www.rebellioussoftware.com,https://twitter.com/RebelliousSoft,https://www.facebook.com/rebellioussoftware,https://www.linkedin.com/company/rebellious-software,"Rebellious started as two software developers winning Bulgarian national software development competitions. They grew as a team and found ourselves winning the largest hackathon worldwide with over 9000 participants - NASA Space Apps Challenge in 2013, and on the next year’s edition their project made it in top 5. By that time they had already built a team of great professionals and they wanted to start working on their own ideas. They wanted to make games.","Information Technology, Software",1,1-10,Pavel Kolev,3,Seed,2021-03-31,100000,EUR,117274,Seed,100000,EUR,117274,Seed,550000,EUR,636388,550000,EUR,636388,Eleven Ventures,1,1,,,,,,,,,,,,,,Private,,,,,,,,,,,
Appzio,https://www.crunchbase.com/organization/appzio---engaging-experiences,Active,,"Android, Apps, Developer Tools, Enterprise Software, iOS, Mobile, Mobile Apps, Software","Sofia, Grad Sofiya, Bulgaria",Appzio is a platform that makes building native apps for Android & iOS radically faster and cost-effective.,"136,367","European Union (EU), Europe, Middle East, and Africa (EMEA)",1407,Less than $1M,2014-07-01,day,,,,,For Profit,http://appzio.com,https://twitter.com/appzio_com,https://www.facebook.com/appziocom,https://www.linkedin.com/company/appzio,"Appzio unlocks the door to server-driven mobile development. This is an approach in which the behavior of the app is controlled entirely from the backend. It allows launching high quality solutions faster compared to traditional methods, making maintenance and improvements much easier. Appzio provides multiple solutions to make its technology available for a wider audience. Developers who use popular languages to code can build on their own. On the other hand companies and individuals with no development resources can work with Appzio’s partners to deliver their custom app. ","Apps, Mobile, Platforms, Software",3,1-10,"Branimir Parashkevov, Simeon Mitev, Timo Railo",3,Seed,2017-10-18,450000,EUR,530756,Convertible Note,100000,EUR,108650,Seed,150000,EUR,163604,600000,EUR,694360,"Eleven Ventures, UniCredit Bulbank, Rune Sovndahl",1,3,,,,,,,,,,,,,,Private,,,,,,,,,,,
