Baggizmo,https://www.crunchbase.com/organization/baggizmo,Active,,"Fashion, Hardware, Internet of Things, Product Design","Zagreb, Grad Zagreb, Croatia",Baggizmo is a wearable tech-fashion brand that develops a unique gadget bag and the most technologically advanced smart wallet Wiseward.,"592,455","European Union (EU), Europe, Middle East, and Africa (EMEA)",10000,Less than $1M,2015-04-01,month,,,,,For Profit,https://baggizmo.me,https://twitter.com/baggizmo,https://www.facebook.com/Baggizmo,https://www.linkedin.com/company/baggizmo/,"Baggizmo is a wearable tech-fashion brand that develops a unique gadget bag and the most technologically advanced smart wallet Wiseward. Baggizmo gadget bag is everyday carry bag for all the gadgets and things you need to have at your fingertips at all times. Easy to wear, slim fit, made ergonomically with high-quality innovative materials and with a modern minimalistic design that can fit perfectly in different styles. Baggizmo Wiseward is a smart, stylish wallet designed to improve the security of credit cards, personal documents and spotting counterfeit currency using integrated technology. It's the world's smartest and most tech-advanced wallet with 10 smart functions that stay slim and pocket-sized with 15 cards, cash and all tech inside. Have a question or need assistance? Contact us here: info@baggizmo.me --- Discover more @ https://baggizmo.me/","Clothing and Apparel, Design, Hardware, Internet Services",1,1-10,Ladislav Juric,1,Seed,2018-12-21,,,,Pre-Seed,,,,Pre-Seed,,,,,,,Loyal VC,,1,,,,,,,,,,,,,,Private,,,,,,,,,,,1
Pablu,https://www.crunchbase.com/organization/pablu,Active,,"Commercial, E-Commerce, Marketing, Marketplace","Ljubljana, Ljubljana Urban Commune, Slovenia",Livestream shopping marketplace,"594,799","European Union (EU), Europe, Middle East, and Africa (EMEA)",1000,,2020-09-04,day,,,,,For Profit,https://www.pablu.tv,,,https://www.linkedin.com/company/pablutv,Weekly shopping shows with preselected sellers where visitors can buy pre-loved items directly inside the show.,"Commerce and Shopping, Other, Sales and Marketing",3,1-10,"Aljosa Zidan, Marko Balazic, Ziga Kerec",1,Seed,2021-03-01,,,,Pre-Seed,,,,Pre-Seed,,,,,,,Flat6Labs,,1,,,,,,,,,,,,,,Private,,,,,,,,,,,
Zeduki,https://www.crunchbase.com/organization/zeduki,Active,,"E-Learning, Internet, Marketplace","Sofia, Grad Sofiya, Bulgaria","Zeduki, a new learning solution This is the first marketplace for e-learning where you can find your tutor, reserve and pay online and have","607,877","European Union (EU), Europe, Middle East, and Africa (EMEA)",,$1M to $10M,2013-05-01,day,,,,,For Profit,http://zeduki.com,http://twitter.com/zeduki,http://www.facebook.com/zeduki,http://www.linkedin.com/company/zeduki,"Zeduki, a new learning solution  This is the first marketplace for e-learning where you can find your tutor, reserve and pay online and have your lesson directly live on the same web platform.  Zeduki is a facilitator to help tutors and students to meet online and have live online lessons. Every tutor is free to choose the price desired, the availability and the best method to teach.  We, at Zeduki, provides the most efficient and easy access between tutors and students.","Commerce and Shopping, Education, Internet Services, Software",3,1-10,"Alexandre Glas, Nicolas Galand, Zdravko Totinov",1,Seed,2014-09-16,30000,EUR,38859,Seed,30000,EUR,38859,Seed,30000,EUR,38859,30000,EUR,38859,LAUNCHub Ventures,,1,,,,,,,,,,,,,,Private,,,,,,,,,,,
Black Snow,https://www.crunchbase.com/organization/black-snow,Active,,"Digital Media, Gamification, Online Portals, Virtual Reality","Kharkiv, Sums'ka Oblast', Ukraine","Black Snow is a digital platform that provides cinematic virtual reality experiences for multiple industries including tourism, and gaming.","608,129","Europe, Middle East, and Africa (EMEA)",,,2017-01-01,year,,,,,For Profit,https://blacksnow.tv,https://x.com/BlackSnowAR,https://www.facebook.com/blacksnowgame,https://www.linkedin.com/company/black-snow-games,"Black Snow is a digital platform that provides a cinematic virtual reality experience beneficial for multiple industries including tourism, gaming, events, and advertising. It's a platform for the development of AR games and navigation, as well as a separate shooter game with elements of virtual reality, with the ability to participate in a battle anywhere in the world via a smartphone screen.","Gaming, Hardware, Internet Services, Media and Entertainment, Software",,11-50,,1,Seed,2019-01-01,,,,Seed,,,,Seed,,,,,,,Sigma Software Labs,,1,,,,,,,,,,,,,,Private,,,,,,,,,,,
B.GUARD,https://www.crunchbase.com/organization/b-guard,Active,,"Consumer Electronics, Electronics, Security","Sofia, Grad Sofiya, Bulgaria",B.GUARD is a smart bicycle anti-theft system which combines high technology with resistance to theft attacks.,"628,679","European Union (EU), Europe, Middle East, and Africa (EMEA)",1784,$1M to $10M,2015-01-01,day,,,,,For Profit,http://www.bguard.me,,,,"B.GUARD enables people to use their bicycles without limitations that fear of theft imposes.  It guards your bike while you are not there. In case of a theft attempt, B.GUARD alerts you on your smart phone and you are able to track GPS location of your bike on a map in real time. At the same time, loud audible alarm alerts the immediate surroundings. We have developed B.GUARD for people like us – people who love their bikes.","Consumer Electronics, Hardware, Privacy and Security",3,1-10,"Marko Zokovic, Silvija Renusa, Tomislav Sulekic",2,Seed,2015-06-01,105000,EUR,114732,Seed,105000,EUR,114732,Seed,130000,EUR,144847,130000,EUR,144847,Eleven Ventures,,1,,,,,,,,,,,,,,Private,,,,,,,,,,,
Open Source University,https://www.crunchbase.com/organization/open-source-university,Active,,Education,"Sofia, Grad Sofiya, Bulgaria",Higher Education,"642,500","European Union (EU), Europe, Middle East, and Africa (EMEA)",,,2015-01-01,year,,,,,For Profit,https://os.university,,,https://www.linkedin.com/company/9438803/,"The World's Academic & Career Development Ledger. Empowering 7 billion learners to connect to world's top academic education and professional development opportunities on the Ethereum blockchain. We apply principles of open source to re-engineer the current-state educational model by building a system to enable better business and education sectors collaboration. The OS.University DApp bridges the gap between businesses and education through blockchain, used for validating and verifying learners’ credentials, and smart contracts, which are managing content purchases, other marketplace transactions, as well as HR processes.",Education,,1-10,,1,Seed,2018-04-01,,,,Pre-Seed,,,,Pre-Seed,,,,,,,Blockchain Founders Fund,,1,,,,,,,,,,,,,,Private,,,,,,,,,,,
Stigni.bg,https://www.crunchbase.com/organization/stigni-bg,Active,,"Customer Service, Internet, Ticketing, Travel","Sofia, Grad Sofiya, Bulgaria",Stigni.bg is an online platform that enables users to find and buy bus tickets for rides around Europe.,"644,915","European Union (EU), Europe, Middle East, and Africa (EMEA)",,Less than $1M,2012-01-01,year,,,,,For Profit,http://stigni.bg/,https://www.twitter.com/stignibg,http://www.facebook.com/stigni.bg,http://www.linkedin.com/company/stigni-bg,Stigni.bg is an online platform that enables users to find and buy bus tickets for rides around Europe. The platform also offers its users information about various bus routes.. Travelers can get their paper tickets at the company’s several customer desks situated around and Europe.  Stigni.bg was founded in 2012.,"Events, Internet Services, Media and Entertainment, Other, Professional Services, Travel and Tourism",2,1-10,"Dobromir Ivanov, Ivaylo Iliev",2,Seed,2015-02-01,25000,EUR,28284,Seed,25000,EUR,28284,Seed,50000,EUR,62957,50000,EUR,62957,Eleven Ventures,,1,,,,,,,,,,,,,,Private,,,,,,,,,,,
Jumpido,https://www.crunchbase.com/organization/jumpido,Active,,"Children, Gaming","Sofia, Grad Sofiya, Bulgaria",Jumpido provides a series of educational games for primary school students aged 6 to 12.,"652,654","European Union (EU), Europe, Middle East, and Africa (EMEA)",1164,Less than $1M,2013-01-01,year,,,,,For Profit,http://www.jumpido.com,http://twitter.com/jumpido,http://www.facebook.com/Jumpido,http://www.linkedin.com/company/3192084,"Jumpido provides a series of math-related educational games for primary school students aged 6 to 12. Using Microsoft's Kinect motion-sensor, Jumpido combines intelligent thinking with physical gestures to create engaging activities in classrooms. Launched in May 2013, Jumpido was founded by Kiril Rusev, Nikola Kosev and Dilyan Rusev in May 2013. It received investment from LAUNCHub, a seed and acceleration fund located in Sofia, Bulgaria.","Community and Lifestyle, Gaming",3,1-10,"Dilyan Rusev, Kiril Rusev, Nikola Kosev",3,Seed,2014-12-10,61397,EUR,76419,Seed,61397,EUR,76419,Seed,291396,EUR,384384,291396,EUR,384384,LAUNCHub Ventures,,1,,,,,,,,,,,,,,Private,,,,,,,,,,,
Kartinka,https://www.crunchbase.com/organization/kartinka,Active,,"Advertising, E-Commerce, Image Recognition","Lviv, L'vivs'ka Oblast', Ukraine","Kartinka is an online service that transforms images on websites into interactive, social, and profitable assets.","663,948","Europe, Middle East, and Africa (EMEA)",79000,,2009-04-01,day,,,,,For Profit,http://www.kartinka.com.ua,https://x.com/kartinka_net,,https://www.linkedin.com/company/kartinka,"Kartinka is an online service that makes every image on any website interactive, social and profitable. It’s a technology that allows webmasters to tag their pictures with text, videos, links and advertisement, and users to share them in social media.","Advertising, Commerce and Shopping, Data and Analytics, Sales and Marketing, Software",2,1-10,"Alexander Shapalov, Serg Pokrovskyy",2,Seed,2012-07-01,5000,USD,5000,Seed,5000,USD,5000,Seed,55000,USD,55000,55000,USD,55000,"Eastlabs, Yaroslav Maxymovych",,2,,,,,,,,,,,,,,Private,,,,,,,,,,,
Good Gaming Group,https://www.crunchbase.com/organization/good-gaming-group,Active,,"Affiliate Marketing, Digital Marketing, Digital Media, Information Technology","Kyiv, Kyyiv, Ukraine",We creates and promotes affiliation websites and provides tier-1 iGaming operators with digital marketing services,"671,353","Europe, Middle East, and Africa (EMEA)",02000,,2020-01-01,year,,,,,For Profit,https://goodgaming.group,,,,Growing good gaming affiliate sites,"Advertising, Information Technology, Media and Entertainment, Sales and Marketing",,1-10,,1,Seed,2022-04-10,,,,Seed,,,,Seed,,,,,,,Netsolid Investments,1,1,,,,,,,,,,,,,,Private,,,,,,,,,,,
Equafy,https://www.crunchbase.com/organization/equafy,Active,,"Computer, Enterprise Software, Software","Sofia, Grad Sofiya, Bulgaria","Cross browser testing, faster and cheaper","675,934","European Union (EU), Europe, Middle East, and Africa (EMEA)",1000,$1M to $10M,2013-01-03,day,,,,,For Profit,https://www.equafy.com,http://twitter.com/equafy,http://www.facebook.com/equafy,http://www.linkedin.com/company/equafy-ltd,"Equafy - creating comprehensive cross-browser testing tools. Selenium cloud execution, automatic site validation, finding bugs at 3 different layers, automatic issues detection, business facing reporting are part of the functionalities included.","Consumer Electronics, Hardware, Software",3,1-10,"Lukian Tabandzhov, Slavy Slavov, Teodor Ivanov",2,Seed,2015-02-10,69906,EUR,79108,Seed,69906,EUR,79108,Seed,199905,EUR,255382,199905,EUR,255382,LAUNCHub Ventures,,1,,,,,,,,,,,,,,Private,,,,,,,,,,,
Equilibrium,https://www.crunchbase.com/organization/avsd,Closed,,"Architecture, Software","Sofia, Grad Sofiya, Bulgaria",Equilibrium is a Excellent software is based on good architecture.,"676,013","European Union (EU), Europe, Middle East, and Africa (EMEA)",,,2014-01-01,year,,,,none,For Profit,http://www.equilibrium3d.com/,https://twitter.com/avsdteam,https://www.facebook.com/avsdteam,,Equilibrium is a Enterprise architecture tool and services.,"Real Estate, Software",1,1-10,George Pavlov,3,Seed,2015-10-31,15000,EUR,16510,Convertible Note,25000,EUR,28284,Seed,50000,EUR,61107,65000,EUR,77617,Eleven Ventures,,1,,,,,,,,,,,,,,Private,,,,,,,,,,,
WareTeka,https://www.crunchbase.com/organization/wareteka,Active,,"E-Commerce, Logistics, Real Estate, Retail, Software, Warehousing","Kyiv, Kyyiv, Ukraine","Warehousing services digital ecosystem for small-, medium-sized businesses, and 3PLs","686,775","Europe, Middle East, and Africa (EMEA)",03150,,2019-09-01,day,,,,,For Profit,https://wareteka.com.ua/en/,,https://www.facebook.com/wareteka,https://www.linkedin.com/company/wareteka,"WareTeka is a digital warehouse provider to help businesses select and get qualitative logistics services. - The warehouse network of our partners covers the entire locations of Ukraine. - More than 100 types of warehouse services: from cross-docking to fulfillment. - Warehouses to store any goods: foodstuff, cosmetics, agricultural products, etc. - Temperature conditions of our partners’ warehouses — from -18 to +25 ° C. The platform works as an aggregator — combines information about vacant warehouse space and logistics providers’ services. We provide you with a full range of warehouse logistics services for business: from safe custody and fulfillment to cross-docking and integrated logistics. The task of the WareTeka platform is to select the optimal warehouse and logistics outsourcing services for business. If your company prefers to manage its logistics in-house, WareTeka will help you to find and rent a suitable warehouse.","Commerce and Shopping, Real Estate, Software, Transportation",1,11-50,Alex Isachenko,2,Seed,2020-07-10,,,,Pre-Seed,,,,Pre-Seed,,,,,,,QPDigital,1,1,,,,,,,,,,,,,,Private,,,,,,,,,,,2
Top Enterprise Solutions,https://www.crunchbase.com/organization/top-enterprise-solutions,Active,,"Business Development, Enterprise Software, Procurement","Kyiv, Kyyiv, Ukraine","Top Enterprise Solutions is a web-based platform that offers procurement, calculations, and analytics solutions for businesses.","689,905","Europe, Middle East, and Africa (EMEA)",,$1M to $10M,2013-09-01,day,,,,,For Profit,http://topes.com.ua,,https://www.facebook.com/pages/TOP-Enterprise-Solutions/1421156868095715?sk=photos_stream,https://www.linkedin.com/company/top-enterprise-solutions,"Top Enterprise Solutions provides corporate office management solutions for businesses. The company offers water delivery, coffee machine rental, office booking, food order, aquarium renting, office furniture, cleaning, and many other services. Top Enterprise Solutions was founded in September 2013 and is based in Kyiv, Ukraine.","Professional Services, Software, Transportation",2,11-50,"Alexander Gudkov, Andrew Zhyvolovych",1,Seed,2014-03-01,350000,USD,350000,Seed,350000,USD,350000,Seed,350000,USD,350000,350000,USD,350000,Imperious Group VC,,1,,,,,,,,,,,,,,Private,,,,,,,,,,,
Ready To Travel,https://www.crunchbase.com/organization/ready-to-travel,Active,,"Online Portals, Search Engine, Ticketing","Odessa, Odes'ka Oblast', Ukraine",Ready To Travel is a search engine platform designed to help users book travel tickets and plan routes effortlessly.,"701,192","Europe, Middle East, and Africa (EMEA)",,Less than $1M,2012-05-01,day,,,,,For Profit,https://readyto.travel/,,,https://www.linkedin.com/company/ready-to-travel/,Ready To Travel is a search engine platform designed to help users book travel tickets and plan routes effortlessly.,"Events, Internet Services, Media and Entertainment",2,1-10,"Jura Fitzgerald, Vladimir Dubinin",1,Seed,2013-05-01,250000,USD,250000,Seed,250000,USD,250000,Seed,250000,USD,250000,250000,USD,250000,WannaBiz,,1,,,,,,,,,,,,,,Private,,,,,,,,,,,
SuperDeal.com.ua,https://www.crunchbase.com/organization/superdeal-com-ua,Active,,"Internet, Marketing, Retail","Kyiv, Kyyiv, Ukraine",SuperDeal.com.ua is a deal-of-the-day website that offers coupons for discounts and promotions for users.,"702,193","Europe, Middle East, and Africa (EMEA)",04080,$1M to $10M,2015-01-01,year,,,,,For Profit,http://www.superdeal.com.ua/,,https://www.facebook.com/superdeal.ua/,,SuperDeal.com.ua is a deal-of-the-day website that offers coupons for discounts and promotions throughout Ukraine.,"Commerce and Shopping, Internet Services, Sales and Marketing",,11-50,,1,Seed,2011-01-01,,,,Seed,,,,Seed,,,,,,,Headline,,1,,,,,,,,,,,,,,Private,,,,,,,,,,,
Kidamom,https://www.crunchbase.com/organization/kidamom,Active,,"Children, Digital Media, Online Portals","Sofia, Grad Sofiya, Bulgaria",Kidamom is a digital media portal for kids.,"705,049","European Union (EU), Europe, Middle East, and Africa (EMEA)",,Less than $1M,2013-03-01,day,,,,,For Profit,http://www.kidamom.com,,http://www.facebook.com/Kidamom,https://www.linkedin.com/company/kidamom,We offer a subscription-based entertainment platform for kids (2-12 years old) with animated and educational movies. Our platform is available on all types of interactive digital devices. We offer a secured environment for kids with optional parental control. We are also source of additional revenue stream for content providers.,"Community and Lifestyle, Internet Services, Media and Entertainment",3,1-10,"Bogomil Iliev, Christian Petrov, Yavor Ivanov",3,Seed,2014-06-01,170000,EUR,231674,Seed,170000,EUR,231674,Seed,220000,EUR,297682,220000,EUR,297682,Eleven Ventures,,1,,,,,,,,,,,,,,Private,,,,,,,,,,,
TaxiMe,https://www.crunchbase.com/organization/taxime,Active,,"Apps, Taxi Service, Transportation","Sofia, Grad Sofiya, Bulgaria",TaxiMe is an application that offers mobile transport services.,"718,216","European Union (EU), Europe, Middle East, and Africa (EMEA)",1000,Less than $1M,2012-01-01,year,,,,,For Profit,http://www.taxime.to,http://twitter.com/taximeapp,http://www.facebook.com/TaxiMeApp,https://www.linkedin.com/company/taximeapp/about/,TaxiMe is App for call charges quickly and conveniently. Wherever and whenever you want. See how the car is coming. Travelling with selected drivers. Appreciate their service. And all for free,"Apps, Software, Transportation",2,11-50,"Hristo Chernev, Tihomir Petkov",5,Seed,2015-02-05,250000,USD,250000,Seed,250000,USD,250000,Seed,631312,USD,631312,665033,USD,665033,"Eleven Ventures, Rosslyn Capital Partners",1,2,,,,,,,,,,,,,,Private,,,,,,,,,,,
Fanbuster,https://www.crunchbase.com/organization/fanbuster,Active,,"Crowdfunding, Sports","Valletta, NA - Malta, Malta",Fanbuster operates an online communication.,"735,754","European Union (EU), Middle East and North Africa (MENA), Europe, Middle East, and Africa (EMEA)",1520,,2016-01-01,year,,,,,For Profit,https://www.fanbuster.com/,,https://www.facebook.com/fanbuster,,Fanbuster operates an online communication and crowdfunding platform for individual football fans and football clubs to share and support their ideas worldwide.,"Financial Services, Sports",,,,1,Seed,2018-01-01,,,,Seed,,,,Seed,,,,,,,GrowthUP,,1,,,,,,,,,,,,,,Private,,,,,,,,,,,
Peer Mountain,https://www.crunchbase.com/organization/peer-mountain,Active,,"Blockchain, Compliance, Financial Services, Identity Management, Information Technology","Luxembourg, Luxembourg, Luxembourg",Peer Mountain is an ecosystem for trust built on an interchain protocol.,"744,535","European Union (EU), Europe, Middle East, and Africa (EMEA)",,Less than $1M,2017-10-01,month,,,,,For Profit,https://www.peermountain.com/,https://twitter.com/peermountain,https://www.facebook.com/peermountaindotcom/,https://www.linkedin.com/company/peer-mountain/,"Peer Mountain serves consumers who want self-sovereign identity, service providers who need continuous, reliable compliance, and trust providers offering validation services who need trust interoperability and portability. It goes beyond providing users with ownership and control over their cryptographically secure identities.","Blockchain and Cryptocurrency, Financial Services, Information Technology, Other, Privacy and Security, Professional Services",1,1-10,Jedediah Grant,2,Seed,2018-09-05,,,,Seed,,,,Seed,,,,,,,coinIX,,1,,,,,,,,,,,,,,Private,,,,,,,,,,,
Budgy App,https://www.crunchbase.com/organization/budgy-app,Active,,"Apps, Finance, Personal Finance","Kyiv, Kyyiv, Ukraine",Budgy App is a finance app that allows users to track and split bills with friends while traveling.,"749,093","Europe, Middle East, and Africa (EMEA)",,,2017-01-01,year,,,,,For Profit,http://www.budgyapp.com/,https://x.com/AppBudgy,https://www.facebook.com/Budgyapps,,"Budgy App is a finance app that allows users to track and split bills with friends while traveling. It shows the amounts owed by users, gives personal and group expense statistics, compiles reports, and sends reminders to borrowers. Budgy App is operated from Kiev, Ukraine.","Apps, Financial Services, Software",,1-10,,1,Seed,2019-01-01,,,,Seed,,,,Seed,,,,,,,GrowthUP,,1,,,,,,,,,,,,,,Private,,,,,,,,,,,
Squee,https://www.crunchbase.com/organization/squee,Active,,"E-Commerce, Mobile, Product Design, Software","Sofia, Grad Sofiya, Bulgaria",Squee is an online dashboard for users to share and discover pictures of custom-designed products.,"750,107","European Union (EU), Europe, Middle East, and Africa (EMEA)",,Less than $1M,2013-01-07,day,,,,,For Profit,http://www.squee.it,http://twitter.com/Squee_it,http://www.facebook.com/squee.it,https://www.linkedin.com/company/squee,"Design inspiration in your pocket. Squee is an app for iOS. With daily product design updates. Squee is creating community of designers, with a goal to promote and monetize their creativity. We are curators, we know awesome design when we see it. Squee also want to help young designers making their dream products becoming reality.","Commerce and Shopping, Design, Mobile, Software",3,1-10,"Ivan Ivankovic, Ivan Kapulica, Krunoslav Klaric",2,Seed,2013-05-01,25000,EUR,32959,Seed,25000,EUR,32959,Seed,50000,EUR,65810,50000,EUR,65810,Eleven Ventures,,1,,,,,,,,,,,,,,Private,,,,,,,,,,,
Wi-Fino,https://www.crunchbase.com/organization/wi-fino,Active,,"Advertising, Affiliate Marketing, Digital Marketing, Marketing","Kyiv, Kyyiv, Ukraine",Platform allowing display ads during connected to public Wi-Fi networks,"751,845","Europe, Middle East, and Africa (EMEA)",,,2017-08-01,day,,,,,For Profit,https://wi-fino.com/,,https://www.facebook.com/WiFinoOfficial/,https://www.linkedin.com/company/wi-fino/,Wi-Fino - a marketing platform that allows you to display ads for your target audience connected to a Wi-Fi network Conectiko - a marketing platform that turns guest Wi-Fi into a tool for studying the target audience and serve as a channel for communicating with customers,"Advertising, Sales and Marketing",,11-50,,1,Seed,2019-05-01,,,,Seed,,,,Seed,,,,,,,Netsolid Investments,1,1,,,,,,,,,,,,,,Private,,,,,,,,,,,
Kabanchik,https://www.crunchbase.com/organization/kabanchik,Active,,"E-Commerce, Marketplace, Online Portals","Kyiv, Kyyiv, Ukraine",Kabanchik is an online marketplace that assists busy people and SMEs outsource small tasks and errands to entrepreneurial people.,"760,912","Europe, Middle East, and Africa (EMEA)",,$1M to $10M,2012-09-17,day,2015-02-16,day,,,For Profit,https://kabanchik.ua/,https://x.com/kabanchikom,https://www.facebook.com/kabanchik.ua/,,"Kabanchik.com.ua is an online marketplace that connects people and small-to-medium businesses with freelancers and specialists for one-time or temporary tasks. The platform helps individuals quickly find professionals to complete tasks, while also providing freelancers and unemployed individuals with opportunities to earn additional income in their areas of expertise.","Commerce and Shopping, Internet Services",2,11-50,"Alexander Yuryev, Roman Kirigetov",1,M&A,2013-04-08,20000,USD,20000,Seed,20000,USD,20000,Seed,20000,USD,20000,20000,USD,20000,Eastlabs,,1,,Was Acquired,Kabanchik acquired by Prom.ua,https://www.crunchbase.com/acquisition/prom-ua-acquires-kabanchik--a91c486a,Prom.ua,https://www.crunchbase.com/organization/prom-ua,2015-02-16,day,,,,Acquisition,,Private,,,,,,,,,,,
Yonderbound,https://www.crunchbase.com/organization/yonderbound,Active,,"Leisure, Tourism, Travel","Luxembourg, Luxembourg, Luxembourg",Yonderbound is a travel knowledge monetization platform.,"766,828","European Union (EU), Europe, Middle East, and Africa (EMEA)",1946,$1M to $10M,2012-01-01,year,,,,,For Profit,http://yonderbound.com,http://twitter.com/yondertribe,http://www.facebook.com/Yonderbound,https://www.linkedin.com/company/yonderbound/,"Yonderbound is a marketplace which makes complete travel stories bookable. Travelers can follow the footsteps of other travelers and book directly almost 400,000 items from their inventory. Their authors are incentivized to publish their stories thanks to a revenue share. For the same reason Travel Bloggers and other authors are distributing Yonderbound to their followers.","Community and Lifestyle, Travel and Tourism",2,1-10,"Barbara Biffi, Barbara Muckermann",2,Seed,2015-05-01,,,,Seed,,,,Seed,1150000,USD,1150000,1150000,USD,1150000,"Virtuoso, Metatron Global",1,2,,,,,,,,,,,,,,Private,,,,,,,,,,,1
