Organization Name,Organization Name URL,Operating Status,Stage,Industries,Headquarters Location,Description,CB Rank (Company),Headquarters Regions,Postal Code,Estimated Revenue Range,Founded Date,Founded Date Precision,Exit Date,Exit Date Precision,Closed Date,Closed Date Precision,Company Type,Website,Twitter,Facebook,LinkedIn,Full Description,Industry Groups,Number of Founders,Number of Employees,Founders,Number of Funding Rounds,Funding Status,Last Funding Date,Last Funding Amount,Last Funding Amount Currency,Last Funding Amount (in USD),Last Funding Type,Last Equity Funding Amount,Last Equity Funding Amount Currency,Last Equity Funding Amount (in USD),Last Equity Funding Type,Total Equity Funding Amount,Total Equity Funding Amount Currency,Total Equity Funding Amount (in USD),Total Funding Amount,Total Funding Amount Currency,Total Funding Amount (in USD),Top 5 Investors,Number of Lead Investors,Number of Investors,Number of Acquisitions,Acquisition Status,Transaction Name,Transaction Name URL,Acquired by,Acquired by URL,Announced Date,Announced Date Precision,Price,Price Currency,Price (in USD),Acquisition Type,Acquisition Terms,IPO Status,IPO Date,Money Raised at IPO,Money Raised at IPO Currency,Money Raised at IPO (in USD),Valuation at IPO,Valuation at IPO Currency,Valuation at IPO (in USD),Stock Symbol,Stock Symbol URL,Stock Exchange,Number of Events
SEON,https://www.crunchbase.com/organization/seon-security,Active,,"Fraud Detection, Identity Management, Machine Learning, Network Security","Budapest, Budapest, Hungary",SEON is an online fraud prevention platform that detects and stops fraud in real-time through transactional data analysis.,"1,982","European Union (EU), Europe, Middle East, and Africa (EMEA)",1072,$10M to $50M,2017-01-01,year,,,,,For Profit,https://seon.io,https://twitter.com/seon_tech,,https://www.linkedin.com/company/seon-tech,"SEON is a fraud prevention startup developing a fraud detection software to detect fraud in real-time through transactional data analysis. Its software uses machine learning and human intelligence algorithms to collect information about transactions and customers associated, integrates with a device fingerprinting module, and combines email verification and IP address analysis features to detect and report transactional and behavioral fraud patterns. It also allows businesses to detect and eliminate fraudulent activities and maintain data security. Founded in 2017, the company is based in Budapest, Hungary with commercial headquarters in London, UK.","Artificial Intelligence (AI), Data and Analytics, Financial Services, Information Technology, Payments, Privacy and Security, Software",2,251-500,"Bence Jendruszak, Tamas Kadar",6,Early Stage Venture,2022-04-19,94000000,USD,94000000,Series B,94000000,USD,94000000,Series B,107823964,USD,107823964,107823964,USD,107823964,"Creandum, IVP, VentureOut, PortfoLion Capital Partners, Discovery Ventures",3,14,1,Made Acquisitions,,,,,,,,,,,,Private,,,,,,,,,,,2
Riptides,https://www.crunchbase.com/organization/riptides,Active,,"Computer, Network Security","Budapest, Budapest, Hungary",Riptides is the non-human identity fabric for your workloads and AI agents.,"3,757","European Union (EU), Europe, Middle East, and Africa (EMEA)",,,2025-01-01,year,,,,,For Profit,https://riptides.io/,https://x.com/i/flow/login?redirect_after_login=%2Friptidesio,,https://www.linkedin.com/company/riptidesio/about/,"Riptides is the non-human identity fabric for your workloads and AI agents, and they trust Every Connection. Even the Autonomous Ones.","Consumer Electronics, Hardware, Information Technology, Privacy and Security",2,1-10,"Janos Matyas, Zsolt Varga",1,Seed,2025-04-23,3300000,USD,3300000,Pre-Seed,3300000,USD,3300000,Pre-Seed,3300000,USD,3300000,3300000,USD,3300000,"KAYA, PortfoLion Capital Partners",2,2,,,,,,,,,,,,,,Private,,,,,,,,,,,
Qneiform,https://www.crunchbase.com/organization/qneiform,Active,,"Analytics, Software","Budapest, Budapest, Hungary",Qneiform is a program that allows users to locate their perfect next recruit.,"10,976","European Union (EU), Europe, Middle East, and Africa (EMEA)",,$1M to $10M,2022-01-01,year,,,,,For Profit,https://qneiform.com,,,https://www.linkedin.com/company/qneiform,Qneiform is a program that allows users to locate their perfect next recruit by establishing a world-class product platform and utilizing the latest in AI technology to deliver all of the tools to their users,"Data and Analytics, Software",1,11-50,Thomas Percy,2,Seed,2025-03-11,3000000,EUR,3278291,Seed,3000000,EUR,3278291,Seed,3750000,EUR,4086615,3750000,EUR,4086615,"DFF Ventures, Day One Capital, PROfounders Capital, Slimmer AI, Keen Venture Partners",3,6,,,,,,,,,,,,,,Private,,,,,,,,,,,
Turbine,https://www.crunchbase.com/organization/turbine-2,Active,,"Artificial Intelligence (AI), Biopharma, Biotechnology","Budapest, Budapest, Hungary",Turbine's platform understands the inner mechanisms of cancer enabling the discovery of novel targets & precision medicinal therapies.,"14,143","European Union (EU), Europe, Middle East, and Africa (EMEA)",,$1M to $10M,2015-01-01,year,,,,,For Profit,http://turbine.ai,https://x.com/Turbine_AI,https://www.facebook.com/TurbineAI,https://www.linkedin.com/company/turbine-inc,"Turbine builds a platform to understand the inner mechanisms of cancer, enabling the discovery of novel protein targets, precision biomarkers, and better translation to patients. Turbine uses its proprietary Simulated Cell technology in combination with Artificial Intelligence to build a faster and deeper biological understanding of therapeutic targets or indications, untangling the complexity of cancer.","Artificial Intelligence (AI), Biotechnology, Data and Analytics, Health Care, Science and Engineering, Software",4,11-50,"Dániel Veres, Fabrice Boulle, Kristóf Zsolt Szalay, Szabolcs Nagy",6,,2024-05-16,,,,Venture - Series Unknown,,,,Venture - Series Unknown,34200000,EUR,36942408,34200000,EUR,36942408,"Accel, MassMutual Ventures, Atlantic Labs, Day One Capital, XTX Ventures",7,15,,,,,,,,,,,,,,Private,,,,,,,,,,,
Axoflow,https://www.crunchbase.com/organization/axoflow,Active,,"Cyber Security, Information Technology, Software","Budapest, Budapest, Hungary",Axoflow is a cybersecurity company specializing in an automatic security data curation pipeline to detect and respond to threats.,"15,668","European Union (EU), Europe, Middle East, and Africa (EMEA)",1037,$1M to $10M,2023-01-01,day,,,,,For Profit,https://axoflow.com,https://twitter.com/AxoFlowIO,,https://www.linkedin.com/company/axoflow/,"Axoflow is a company that operates in the cyber-security and information technology industries. It offers a platform that transforms on-premises and cloud logs, metrics, and traces into a cloud-native observability infrastructure. This infrastructure is designed to enhance compliance and security. Axoflow's software development includes AxoSyslog 4.3, which enables the receipt and sending of any OpenTelemetry logs, traces, and metrics using OTLP/gRPC. The company also provides syslog-ng container images for download.","Information Technology, Privacy and Security, Software",4,11-50,"Balázs Scheidler, Ferenc Hernadi, Neil Boyd, Sandor Guba",3,Seed,2025-01-21,6700000,EUR,6972659,Seed,6700000,EUR,6972659,Seed,10172659,USD,10172659,10172659,USD,10172659,"Credo Ventures, 500 Emerging Europe, Notion Capital, e2vc, EBRD Venture Capital",5,6,,,,,,,,,,,,,,Private,,,,,,,,,,,
PastPay,https://www.crunchbase.com/organization/pastpay,Active,,"B2B, Financial Services, FinTech, Payments","Budapest, Budapest, Hungary",PastPay is a FinTech startup that provides B2B payment solutions.,"19,984","European Union (EU), Europe, Middle East, and Africa (EMEA)",,,2019-03-01,month,,,,,For Profit,https://pastpay.com/,,,https://www.linkedin.com/company/pastpay/,"PastPay is a FinTech startup that provides B2B payment solutions. The company's Buy Now, Pay Later (BNPL) services enable flexible payment terms for business transactions, enhancing liquidity for small and medium enterprises across the European Union.","Financial Services, Other, Payments",2,1-10,"Benjamin Berényi, Bálint Réti",7,Early Stage Venture,2024-09-10,12000000,EUR,13224394,Series A,12000000,EUR,13224394,Series A,13280000,EUR,14705104,17080000,EUR,18786783,"Hiventures, Mark Ransford, 365.fintech, Jared Schrieber, Advance Global Capital",3,12,,,,,,,,,,,,,,Private,,,,,,,,,,,
scoutlabs,https://www.crunchbase.com/organization/scoutlabs-ag,Active,,"Agriculture, AgTech, Artificial Intelligence (AI), Data Management, Farming, Hardware, Information Technology, Internet of Things, Software","Budapest, Budapest, Hungary",Helping millions of farmers worldwide in predicting insect pest populations before they destroy their crop yield,"25,812","European Union (EU), Europe, Middle East, and Africa (EMEA)",4032,Less than $1M,2022-01-01,year,,,,,For Profit,https://scoutlabs.ag,https://x.com/scoutlabsag,,https://www.linkedin.com/company/scoutlabs-ag/,"We're building the world's densest digital trap network to accurately gauge insect pest pressure. This helps millions of farmers in precisely combating crop-eating insects, accelerating a transition to more sustainable methods. Good for the farmer, the environment and for our food security","Agriculture and Farming, Artificial Intelligence (AI), Data and Analytics, Hardware, Information Technology, Internet Services, Science and Engineering, Software",2,11-50,"Donát Posta, Jimmy Fong",5,Seed,2024-06-26,2000000,USD,2000000,Seed,2000000,USD,2000000,Seed,2000000,USD,2000000,2080000,USD,2080000,"SVG Ventures, Interactive Venture Partners, ESA, DEPO Ventures, Impact Ventures Hungary",4,6,,,,,,,,,,,,,,Private,,,,,,,,,,,
Deligo Vision Technologies,https://www.crunchbase.com/organization/deligo-vision,Active,,"Artificial Intelligence (AI), Computer Vision, Hospitality","Budapest, Budapest, Hungary",Frictionless AI self-checkout for food service & convenience stores,"36,053","European Union (EU), Europe, Middle East, and Africa (EMEA)",,$1M to $10M,2020-01-01,year,,,,,For Profit,https://www.deligovision.com/,,,https://www.linkedin.com/company/deligovision/,"Deligo is a leader in AI-powered self-checkout solutions for food service and convenience stores. We help our customers to: - Eliminate queues & drive revenue: Say goodbye to queues and hello to happier customers. The kiosks streamline the checkout process & enhance customer loyalty, driving more transactions and profits. ​- Reduce costs & improve operations: Battle staffing shortages and cut down on operational expenses by automating routine tasks. Redeploy cashier resources to higher-value interactions for greater efficiency. - Minimise shrinkage: The kiosk sees it all: products placed on the Kiosk are correctly recognised to help avoid intentional or unintentional theft. Status lights help associates track checkout activity.","Artificial Intelligence (AI), Data and Analytics, Hardware, Science and Engineering, Software, Travel and Tourism",2,11-50,"Balazs Haidekker, Istvan Haidekker",2,Seed,2024-05-06,3000000,USD,3000000,Seed,3000000,USD,3000000,Seed,4653253,USD,4653253,4653253,USD,4653253,"Frontline Ventures, Interactive Venture Partners, Angel Invest, Oktogon Ventures, Charlie Songhurst",2,14,,,,,,,,,,,,,,Private,,,,,,,,,,,
ROKSH,https://www.crunchbase.com/organization/weshop-kft,Active,,"E-Commerce, Fast-Moving Consumer Goods, Last Mile Transportation, Logistics, Marketplace, Retail, Retail Technology","Budapest, Budapest, Hungary",ROKSH is an AI-powered grocery delivery marketplace using personal shoppers to bring products from top retailers to your door fast.,"37,998","European Union (EU), Europe, Middle East, and Africa (EMEA)",,$1M to $10M,2018-01-15,day,,,,,For Profit,https://roksh.com,,,https://www.linkedin.com/company/roksh,"ROKSH is a B2C grocery delivery marketplace that transforms everyday shopping into a fast, convenient, and personalized experience. Operating in Hungary and Austria, ROKSH enables users to order from over 200,000 products across top retailers like ALDI, PENNY, and METRO, all delivered the same or next day by personal shoppers. The platform offers a unique hybrid model—combining a decentralized logistics network using partner stores (not warehouses or dark stores) with real-time, human-driven customer service. ROKSH’s personal shoppers not only pick and deliver groceries but also communicate with customers about product substitutions or quality issues, ensuring a high-touch, high-quality experience. Backed by AI, ROKSH offers intelligent shopping list creation, recipe recommendations, and real-time chat support to streamline the online grocery journey. With 360K+ orders delivered and €10M+ in GMV, ROKSH is the market leader in the CEE region and is now scaling to new European markets, aiming to redefine grocery shopping with speed, trust, and personalization.","Commerce and Shopping, Consumer Goods, Hardware, Real Estate, Software, Transportation",1,11-50,Máté Somogyi,9,Seed,2025-03-01,300000,EUR,311349,Seed,300000,EUR,311349,Seed,8579463,USD,8579463,8579463,USD,8579463,"Lead Ventures, Hiventures, STRT Holding Nyrt, Blue planet climate protection risk capital fund",2,4,,,,,,,,,,,,,,Private,,,,,,,,,,,
Recart,https://www.crunchbase.com/organization/ghostmonitor,Active,,E-Commerce,"Budapest, Budapest, Hungary",We believe you should sell more with your ecommerce store,"46,502","European Union (EU), Europe, Middle East, and Africa (EMEA)",1064,Less than $1M,2015-09-01,day,,,,,For Profit,https://recart.com,https://www.twitter.com/ghostmonitor,https://www.facebook.com/ghostmonitor-1433751980263147,https://www.linkedin.com/company/recartapp,Recart helps ecommerce merchants selling more with their store.,Commerce and Shopping,1,11-50,Soma Arnold Toth,2,Seed,2021-06-03,2800000,EUR,3396636,Seed,2800000,EUR,3396636,Seed,4696636,USD,4696636,4696636,USD,4696636,"Day One Capital, Oktogon Ventures, Lead Ventures",2,3,,,,,,,,,,,,,,Private,,,,,,,,,,,
DLC.link,https://www.crunchbase.com/organization/dlc-link,Active,,Cryptocurrency,"Budapest, Budapest, Hungary",DLC.link enables developers to use native Bitcoin in their DeFi applications,"49,270","European Union (EU), Europe, Middle East, and Africa (EMEA)",1061,,2021-10-01,month,,,,,For Profit,https://www.dlc.link/,https://twitter.com/dlc_link,,https://www.linkedin.com/company/dlc-link/,"Bitcoin has proven itself as a store of value. But to earn yield on their Bitcoin, users have to first send it to a centralized custodian. This is extremely risky, as over $40Bn has been lost to date due to custodial hacks and failures. The DLC.link platform lets users lock their Bitcoin in escrow, directly in their wallet. Users can supply their Bitcoin as collateral and earn a yield while maintaining full ownership. Currently only 2% of Bitcoin is utilized. Escrow will unlock the remaining 98%, making over $1 Trillion in Bitcoin liquidity available for lending on Ethereum and other blockchains.","Blockchain and Cryptocurrency, Financial Services, Payments, Software",2,1-10,"Aki Balogh, Jesse Eisenberg",3,Seed,2024-05-09,,,,Seed,,,,Seed,2000000,USD,2000000,2000000,USD,2000000,"Sequoia Capital, Chainlink, Stacks, OKX Ventures, SBX Capital",4,16,,,,,,,,,,,,,,Private,,,,,,,,,,,
Avatao,https://www.crunchbase.com/organization/avatao-com,Active,,"Cyber Security, DevOps, E-Learning, Software, Software Engineering, Training","Budapest, Budapest, Hungary","Interactive, job-relevant security training with real-life security labs to increase the security skills of development teams","52,467","European Union (EU), Europe, Middle East, and Africa (EMEA)",1117,$1M to $10M,2014-07-08,day,,,,,For Profit,https://www.avatao.com,https://twitter.com/theavatao,https://www.facebook.com/theavatao/,https://www.linkedin.com/company/avatao,"Avatao’s security training goes beyond simple tutorials and videos offering an interactive job-relevant learning experience to developer teams, security champions, pentesters, security analysts and DevOps teams. With 600+ challenges and tutorials in 10+ languages, the platform covers a wide range of security topics across the entire security stack from OWASP Top 10 to DevSecOps and Cryptography.  The platform immerses developers in high-profile cases and provides them with real, in-depth experience with challenging security breaches. Engineers will actually learn to hack and patch the bugs themselves. This way Avatao equips software engineering teams with a security mindset that increases their capability to reduce risks and react to known vulnerabilities faster. This in turn increases the security capability of a company to ship high-quality products.","Education, Information Technology, Privacy and Security, Science and Engineering, Software",3,11-50,"Gábor Pék, Levente Buttyan, Mark Felegyhazi",3,Early Stage Venture,2021-04-19,1300000,USD,1300000,Series A,1300000,USD,1300000,Series A,2400000,USD,2400000,2400000,USD,2400000,"Speedinvest, 500 Global, 212, FastVentures, Microsec",3,7,,,,,,,,,,,,,,Private,,,,,,,,,,,1
Volteum,https://www.crunchbase.com/organization/volteum,Active,,"Software, Transportation, Travel","Budapest, Budapest, Hungary",Enabling companies to operate EV fleets easily and cost-efficiently,"55,340","European Union (EU), Europe, Middle East, and Africa (EMEA)",,$1M to $10M,2020-01-29,day,,,,,For Profit,https://volteum.io,,https://facebook.com/volteumapp,https://www.linkedin.com/company/volteum,"Is there enough charge in the car for the next trip? When will the vehicle go out of charge? What is the optimal route? These are questions that arise every day when driving an EV. And these just get a lot worse if we are not talking about individual vehicles but 100s of them like electric van delivery fleets, public transport with e-buses or e-car company fleets. For them, electric vehicles are much more expensive and difficult to operate than normal petrol or diesel ones, not to mention the constant fear of running out of charge with 100s of vehicles at the same time. Volteum solves these issues for them every day. At Volteum our goal is to enable every company to use EVs as easily, effectively and economically as internal combustion engine vehicles. For this we are developing a software with which fleet operators can optimize their vehicles every day. The product has three main pillars: Firstly, we model and predict the energy consumption and the battery state of charge along the routes with our EV simulation engine. Secondly, based on this we plan optimal trips for the vehicles taking into account the charging needs, time, distance and costs as well. Thirdly, we also manage the daily tasks of the fleet and optimize their operation based on live data. With Volteum electric fleets save money as we optimize their fleet composition, the daily tasks, routes and the charging needs cost-effectively. They can also make sure none of the vehicles will go out of charge thanks to our simulation engine. Last but not least we save loads of human resources, manual calculations and planning with our algorithms. With this we can ensure that all tasks and routes will be covered just as easily and comfortably as with their old vehicles.","Software, Transportation, Travel and Tourism",3,11-50,"Dávid Kertész, Kornél Kálmán, Zsófia Tóth",2,Seed,2022-11-09,1250000,EUR,1252421,Seed,1250000,EUR,1252421,Seed,1372421,USD,1372421,1372421,USD,1372421,"Techstars, Day One Capital, Oktogon Ventures, Fiedler Capital, Jared Schrieber",2,10,,,,,,,,,,,,,,Private,,,,,,,,,,,
Prefixbox,https://www.crunchbase.com/organization/prefixbox,Active,,"Artificial Intelligence (AI), E-Commerce, Product Search, Retail, Retail Technology, SaaS, Search Engine, Semantic Search","Budapest, Budapest, Hungary",Prefixbox AI Search provides a state-of-the-art search and discovery solution for Enterprise retailers,"58,596","European Union (EU), Europe, Middle East, and Africa (EMEA)",1132,$1M to $10M,2014-10-07,day,,,,,For Profit,http://www.prefixbox.com,https://www.twitter.com/prefixbox,https://www.facebook.com/prefixbox,https://www.linkedin.com/company/prefixbox/,"Prefixbox’s AI Search, AI Navigation, AI Recommend, and Insights & Experimentation solutions improve the shopping experience for increased conversion rate and revenue. Prefixbox AI Search uses the latest search technology to understand meaning. By combining vector, large language models (LLMs) and GPT technology, it can extract the intent behind a general sentence in order to return relevant product results. Prefixbox AI Navigation's Related Products, Related Keywords and Related Categories modules increase engagement and help shoppers refine their search intent with just 1 click. Prefixbox AI Recommend inspires shoppers to explore your catalog with relevant recommendations that boost average order value. Prefixbox Insights can optimize your solution with insightful metrics, frequent A/B tests, and personalized search expert support.","Artificial Intelligence (AI), Commerce and Shopping, Data and Analytics, Hardware, Internet Services, Science and Engineering, Software",1,51-100,Istvan Simon,7,Early Stage Venture,2023-07-15,2000000,EUR,2247300,Series A,2000000,EUR,2247300,Series A,4819816,USD,4819816,4819816,USD,4819816,"Euroventures, Baconsult, STRT Holding Nyrt",2,3,,,,,,,,,,,,,,Private,,,,,,,,,,,
Mitzu Inc,https://www.crunchbase.com/organization/mitzu-inc,Active,,Software,"Budapest, Budapest, Hungary","Simple, warehouse native product analytics","61,301","European Union (EU), Europe, Middle East, and Africa (EMEA)",1053,Less than $1M,2023-07-01,day,,,,,For Profit,https://www.mitzu.io,,,https://www.linkedin.com/company/mitzu-io,Mitzu is a warehouse-native product analytics application. It enables stakeholders to directly access the company data warehouse without any technical skills.,Software,1,1-10,István Mészáros,1,Seed,2023-09-08,535000,USD,535000,Pre-Seed,535000,USD,535000,Pre-Seed,535000,USD,535000,535000,USD,535000,"Interactive Venture Partners, Oktogon Ventures",2,2,,,,,,,,,,,,,,Private,,,,,,,,,,,
Cytocast,https://www.crunchbase.com/organization/cytocast,Active,,"Bioinformatics, Biotechnology, Health Care, Medical Device, Pharmaceutical, Simulation","Budapest, Budapest, Hungary",Cytocast revolutionizes the fields of drug discovery and personalized treatment through a comprehensive cell simulator.,"63,298","European Union (EU), Europe, Middle East, and Africa (EMEA)",1052,$1M to $10M,2019-03-01,day,,,,,For Profit,http://www.cytocast.com/,https://twitter.com/cytocast,https://www.facebook.com/cytocast/,https://www.linkedin.com/company/cytocast,"Cytocast is leveraging the integration of bioinformatics databases and patient data within a computer model to create a groundbreaking cell simulation software. This software holds the potential to revolutionize patient treatment, significantly impact the drug development process, and enable the identification of optimal therapeutic options. The comprehensive cell model that forms the basis of the technology combines molecular knowledge of how healthy cells function to understand the effects of perturbations caused by diseases and predict how drugs can modify cellular health.","Biotechnology, Data and Analytics, Health Care, Science and Engineering, Software",3,11-50,"Attila Csikász-Nagy, Bence Keömley-Horváth, István Reguly",3,Seed,2023-05-15,1640000,EUR,1783254,Pre-Seed,1640000,EUR,1783254,Pre-Seed,1860000,EUR,2032273,1860000,EUR,2032273,"Bonitás Ventures, FastVentures, Futurmed, Creative Accelerator, Zoiros Ventures",2,6,,,,,,,,,,,,,,Private,,,,,,,,,,,
Quino,https://www.crunchbase.com/organization/quino,Active,,"Artificial Intelligence (AI), EdTech, Education, Machine Learning, Natural Language Processing, Software","Székesfehérvár, Fejer, Hungary",Learn Easy. Learn Fast. Quino is empowering students and researchers to study faster.,"64,730","European Union (EU), Europe, Middle East, and Africa (EMEA)",8000,,2023-10-01,month,,,,,For Profit,https://quino.ai/,,https://www.facebook.com/groups/quinoai,https://www.linkedin.com/company/quino-ai/,"Quino is a learning enhancement tool that makes studying more efficient and frictionless with the power of NLP. By processing large amounts of text it can help you expedite learning as well as evaluate your knowledge.  Quino offers automatic summaries, bullet point notes, semantic search, and question-answering tools to assist you with your studies. It also generates quiz questions to test your knowledge and identify your blind spots within the lessons. We also make it possible to learn collaboratively with your friends.","Artificial Intelligence (AI), Data and Analytics, Education, Science and Engineering, Software",4,1-10,"Gergő Sebestyén, Paul J. Boylan, Tamás Imets, Ákos Jakub",1,Seed,2024-01-18,840000,USD,840000,Pre-Seed,840000,USD,840000,Pre-Seed,840000,USD,840000,840000,USD,840000,"Solus Capital, STRT Holding Nyrt",1,2,,,,,,,,,,,,,,Private,,,,,,,,,,,
