Maven7,https://www.crunchbase.com/organization/maven7,Active,,"Analytics, Big Data, Business Intelligence, Software","Budapest, Budapest, Hungary",Maven7 integrates the latest results of Network Science and Data Mining into its business applications and services.,"194,010","European Union (EU), Europe, Middle East, and Africa (EMEA)",H-1007,Less than $1M,2009-01-01,year,,,,,For Profit,http://maven7.com,http://twitter.com/MavenSeven,http://www.facebook.com/maven7,https://www.linkedin.com/company/maven7/,"Maven7 supports business decisions by transforming large amounts of hard-to-interpret data into actionable business intelligence. Based on the methodologies of network analysis and data mining, Maven7 has developed its own proprietary network mapping tools, including OrgMapper and Diktio Labs, to conduct analyses in organizational development, social media, the pharmaceutical/medical industries and many other fields.","Data and Analytics, Software",2,11-50,"András Vicsek, Péter Ruppert",2,Early Stage Venture,2015-06-08,1558000,USD,1558000,Series A,1558000,USD,1558000,Series A,2346358,USD,2346358,2346358,USD,2346358,"Primus Capital, Perion Investment Fund",1,2,,,,,,,,,,,,,,Private,,,,,,,,,,,
VirtDB Zrt.,https://www.crunchbase.com/organization/virtdb,Active,,"Analytics, Big Data, Business Intelligence, Data Integration, Enterprise Software, Software","Budapest, Budapest, Hungary",VirtDB is a software company with a focus on IT infrastructure and database analytics.,"194,222","European Union (EU), Europe, Middle East, and Africa (EMEA)",1139,Less than $1M,2016-08-01,month,,,,,For Profit,http://www.virtdb.com,https://twitter.com/VirtDB,https://www.facebook.com/virtdb?fref=ts,https://www.linkedin.com/company/virtdb,"VirtDB creates simple and scalable data access technologies to both business and IT users, enabling one-click delivery of data from enterprise sources (like SAP) to targets (like Business Intelligence, Databases, BigData, Cloud, etc) in various formats. VirtDB is a natural supplement to Tableau, Qlikview, Microsoft, SAP, Google and Amazon data management services.","Data and Analytics, Information Technology, Software",1,1-10,Peter Csillag,2,Seed,2017-06-02,403000,EUR,454745,Seed,403000,EUR,454745,Seed,1383000,EUR,1547702,1383000,EUR,1547702,Hiventures,,1,,,,,,,,,,,,,,Private,,,,,,,,,,,
Sharonel Events Kft.,https://www.crunchbase.com/organization/sharonel-events-kft,Active,,"Event Management, Marketplace, Online Portals","Budapest, Budapest, Hungary",They are building a platform where event organisers can meet with customers.,"194,977","European Union (EU), Europe, Middle East, and Africa (EMEA)",1011,,2021-01-01,year,,,,,For Profit,https://www.sharonelevents.com/home,,,https://www.linkedin.com/company/sharonelevents/?lipi=urn%3Ali%3Apage%3Acompanies_company_about_index%3Bb688eefd-0acc-43bf-a015-fc5725d8fd82,"Sharonel Events is a marketplace that connects event organizers with customers. The company assists clients with everything from selecting the best vendors to accessing those elusive deals. With continuous access to their ideal clients, the company also helps vendors maintain a healthy bottom line. LSharonel Events helps to look for clients based on the services that the organizers provide and how those services fit with the client's requirements.","Commerce and Shopping, Events, Internet Services, Media and Entertainment",,1-10,,1,Seed,2021-07-21,15000000,HUF,49173,Pre-Seed,15000000,HUF,49173,Pre-Seed,15000000,HUF,49173,15000000,HUF,49173,Hiventures,,1,,,,,,,,,,,,,,Private,,,,,,,,,,,
CogniCone Kft.,https://www.crunchbase.com/organization/cognicone-kft,Active,,"Apps, Local Business, Sports, Training","Szolnok, Jasz-Nagykun-Szolnok, Hungary",CogniCone is a service for team sport coaches that provides various training programmes for players' cognitive development.,"195,662","European Union (EU), Europe, Middle East, and Africa (EMEA)",5000,,2020-01-01,year,,,,,For Profit,https://cognicone.com,,https://www.facebook.com/cognicone/,https://www.linkedin.com/company/cognicone/,CogniCone provides a variety of sports trainings for beginner to cognitive professional player development.Their accessories help create a changing game environment that forces players to use their cognitive skills with high frequency.,"Apps, Education, Sales and Marketing, Software, Sports",,1-10,,1,Seed,2021-11-12,15000000,HUF,46776,Pre-Seed,15000000,HUF,46776,Pre-Seed,15000000,HUF,46776,15000000,HUF,46776,Hiventures,,1,,,,,,,,,,,,,,Private,,,,,,,,,,,
Cashier Basket Kft.,https://www.crunchbase.com/organization/cashier-basket-kft,Active,,"Mobile Apps, Sensor, Shopping","Szeged, Szeged, Hungary",Cashier Basket Kft. is an application that provides smart cart self checkout solutions for instore businesses.,"195,862","European Union (EU), Europe, Middle East, and Africa (EMEA)",,,2021-01-01,year,,,,,For Profit,https://cashierbasket.com,,,https://www.linkedin.com/company/cashier-basket,"Cashier Basket Kft. provides shopping cart monitoring, sensors for product scanning without physical scanning, contactless payment solutions, product tracking, and easy payment. They also provide a mobile application that helps users track current and past purchases, promotions, discount offers, recommendations for a custom shopping list, and product recall notifications.","Apps, Commerce and Shopping, Hardware, Mobile, Software",,1-10,,1,Seed,2021-10-12,15000000,HUF,47975,Pre-Seed,15000000,HUF,47975,Pre-Seed,15000000,HUF,47975,15000000,HUF,47975,Hiventures,,1,,,,,,,,,,,,,,Private,,,,,,,,,,,
Swed Hungary Kft.,https://www.crunchbase.com/organization/swed-hungary-kft,Active,,"Architecture, Civil Engineering, Interior Design","Bátonyterenye, Nograd, Hungary",Indoor wall decoration producer company.,"196,571","European Union (EU), Europe, Middle East, and Africa (EMEA)",,,2021-01-01,year,,,,,For Profit,http://www.swed.hu,,,https://www.linkedin.com/company/s-w-e-d,,"Design, Real Estate, Science and Engineering",,,,1,Seed,2021-07-02,15000000,HUF,50601,Pre-Seed,15000000,HUF,50601,Pre-Seed,15000000,HUF,50601,15000000,HUF,50601,Hiventures,,1,,,,,,,,,,,,,,Private,,,,,,,,,,,
Healhop,https://www.crunchbase.com/organization/healhop-kft,Active,,"E-Commerce, Health Care","Debrecen, Debrecen, Hungary",Online marketplace of medical services,"196,647","European Union (EU), Europe, Middle East, and Africa (EMEA)",,$1M to $10M,2018-01-01,year,,,,,For Profit,https://www.healhop.com/,,https://www.facebook.com/HealhopCompany,https://www.linkedin.com/company/healhop/,,"Commerce and Shopping, Health Care",3,1-10,"Eszter Breuer, Gábor Kövesdi, Vince Sarkany",2,Seed,2019-07-30,100000,EUR,111582,Pre-Seed,100000,EUR,111582,Pre-Seed,130000,EUR,146582,130000,EUR,146582,Hiventures,,1,,,,,,,,,,,,,,Private,,,,,,,,,,,
Local's Lore Kft,https://www.crunchbase.com/organization/local-s-lore-kft,Active,,,"Budaörs, Pest, Hungary",Local's Lore is a travel guide company that provides location displays on a digital map for travelers.,"197,413","European Union (EU), Europe, Middle East, and Africa (EMEA)",2040,,2018-01-01,year,,,,,,,,,,,,1,1-10,Adrienn Suri,2,Seed,2019-03-11,100000,EUR,112589,Pre-Seed,100000,EUR,112589,Pre-Seed,130000,EUR,149562,130000,EUR,149562,Hiventures,,1,,,,,,,,,,,,,,Private,,,,,,,,,,,
Real-Deal Hungary Kft.,https://www.crunchbase.com/organization/real-deal-hungary-kft,Active,,"Apps, Software, Web Apps","Véménd, Baranya, Hungary",Real estate,"197,449","European Union (EU), Europe, Middle East, and Africa (EMEA)",7726,,2017-01-01,year,,,,,For Profit,,,,,,"Apps, Software",,1-10,,2,Seed,2020-11-27,100000,EUR,119634,Pre-Seed,100000,EUR,119634,Pre-Seed,150000,EUR,173881,150000,EUR,173881,Hiventures,,1,,,,,,,,,,,,,,Private,,,,,,,,,,,
Devobo,https://www.crunchbase.com/organization/devobo-kft,Active,,,"Székesfehérvár, Fejer, Hungary",Devobo Kft.,"199,207","European Union (EU), Europe, Middle East, and Africa (EMEA)",8000,,2019-01-01,year,,,,,For Profit,http://devobo.io,,,,,,,1-10,,1,Seed,2019-04-17,30000,EUR,33890,Pre-Seed,30000,EUR,33890,Pre-Seed,30000,EUR,33890,30000,EUR,33890,Hiventures,,1,,,,,,,,,,,,,,Private,,,,,,,,,,,
AR Analytics,https://www.crunchbase.com/organization/ar-analytics-kft,Active,,"Information Technology, Internet, Metaverse, Retail, Web3","Gyor, Gyor, Hungary","Building web3 and the metaverse, AR Analytics is creating immersive solutions (as SaaS or supporting DTC access) for our partners.","200,577","European Union (EU), Europe, Middle East, and Africa (EMEA)",9030,,2013-03-20,day,,,,,For Profit,http://www.areapp.net/,https://twitter.com/ARanalytics,https://www.facebook.com/ARethesmartest,https://www.linkedin.com/company/augmentyourbrand/,"Building web3 and the metaverse, AR Analytics is creating immersive solutions (as SaaS or supporting DTC access) for our partners in the creative sector.","Blockchain and Cryptocurrency, Commerce and Shopping, Information Technology, Internet Services, Media and Entertainment, Software",1,1-10,Etentuk Udeme,3,Seed,2021-05-25,,,,Pre-Seed,,,,Pre-Seed,163333,EUR,178953,163333,EUR,178953,Hiventures,,1,,,,,,,,,,,,,,Private,,,,,,,,,,,
Wedding manager Kft.,https://www.crunchbase.com/organization/wedding-manager-kft,Active,,"Events, Mobile Apps, Wedding","Mátraszentimre, Heves, Hungary",Wedding Manager is a platform for organizing weddings.,"200,876","European Union (EU), Europe, Middle East, and Africa (EMEA)",3235,,2020-01-01,year,,,,,Non-profit,https://www.weddingmanager.app,,,https://www.linkedin.com/company/weddingmanagerapp,"Wedding Manager is a wedding management platform designed to organise weddings online through a mobile application. It creates an algorithm for unique ideas that is an image-based, endlessly scrollable inspiration database summarising the products and services of providers and enabling wedding planning.","Apps, Community and Lifestyle, Events, Media and Entertainment, Mobile, Software",,1-10,,1,Seed,2021-05-25,15000000,HUF,52676,Pre-Seed,15000000,HUF,52676,Pre-Seed,15000000,HUF,52676,15000000,HUF,52676,Hiventures,,1,,,,,,,,,,,,,,Private,,,,,,,,,,,
Anon Kft.,https://www.crunchbase.com/organization/anon-kft-4df8,Closed,,,"Budapest, Budapest, Hungary",Anon Kft. is a Q&A-based social network app that provides a question and answers application for users.,"200,901","European Union (EU), Europe, Middle East, and Africa (EMEA)",,,2016-01-01,year,,,2019-04-25,day,For Profit,http://anon.pm/,,https://www.facebook.com/anonkft/,https://www.linkedin.com/company/anon-kft./,"Anon Kft. is a Q&A-based social network app that provides a question and answers application for users. Users can chat or ask questions from each other even anonymously. Their target group is between the age of 13 and 24, from secondary school to university. It was founded in 2016 and is based in Budapest, Hungary.",,3,1-10,"() (), Armin Tagscherer, Aron Kratochwill",4,Seed,2019-06-27,100000,EUR,113715,Pre-Seed,100000,EUR,113715,Pre-Seed,159018,USD,159018,159018,USD,159018,Hiventures,,1,,,,,,,,,,,,,,Private,,,,,,,,,,,
VDS LOG Kft,https://www.crunchbase.com/organization/vds-log-kft,Active,,Business Information Systems,"Kecskemét, Bacs-Kiskun, Hungary",VDS LOG Kft provides a freight monitoring and tracking solution for small and medium-sized businesses.,"201,166","European Union (EU), Europe, Middle East, and Africa (EMEA)",6000,,2018-04-19,day,,,,,For Profit,http://www.vdslog.eu/,,https://www.facebook.com/vdslog/,https://www.linkedin.com/company/vdslog,"VDS LOG Kft is a platform that application is able to display the process and consolidated extracts of the given shipping task on a variety of hardware. They provide driver application, doorman application, logistics coordinator, and transport organizer services.",Information Technology,1,1-10,Zoltán Szabó,2,Seed,2020-07-21,100000,EUR,115351,Pre-Seed,100000,EUR,115351,Pre-Seed,130000,EUR,150517,130000,EUR,150517,Hiventures,,1,,,,,,,,,,,,,,Private,,,,,,,,,,,
Rollin Docking,https://www.crunchbase.com/organization/rollin-technologies-kft,Active,,"Automotive, Electric Vehicle, Rental","Zalatárnok, Zala, Hungary",Rollin Docking is a mobility company that offers electric scooter chargers for e-mobility markets.,"201,866","European Union (EU), Europe, Middle East, and Africa (EMEA)",8947,Less than $1M,2020-02-10,day,,,,,For Profit,https://www.rollindocking.com,,,https://www.linkedin.com/company/rollindocking,"Rollin Docking is a mobility company that offers electric scooter chargers for e-mobility markets. It helps properties, corporates, sports venues, and shopping malls to offer lockable e-scooter parking for a cleaner future.","Commerce and Shopping, Transportation",,1-10,,1,Seed,2020-03-11,50000,EUR,56308,Pre-Seed,50000,EUR,56308,Pre-Seed,50000,EUR,56308,50000,EUR,56308,Hiventures,,1,,,,,,,,,,,,,,Private,,,,,,,,,,,
Agora Solutions,https://www.crunchbase.com/organization/agora-solutions-software-kft,Active,,Software,"Nyíregyháza, Szabolcs-Szatmar-Bereg, Hungary",Agora Solutions is a software development company that provides applications for real estate agents.,"201,887","European Union (EU), Europe, Middle East, and Africa (EMEA)",4551,Less than $1M,2019-01-01,year,,,,,For Profit,https://agorasoftwares.com/en/,,https://www.facebook.com/agora.solutions.software,https://www.linkedin.com/company/agorasolutions/,"Agora Solutions is a leading provider of cutting-edge technologies and services, offering scalable solutions for businesses of all sizes. Founded by a group of friends who started by scribbling their ideas on a piece of paper, today we offer smart, innovative services to dozens of clients worldwide.",Software,2,1-10,"Gábor Erményi, László Kindrusz",3,Seed,2021-02-01,,,,Non-equity Assistance,100000,EUR,112881,Pre-Seed,130000,EUR,147040,130000,EUR,147040,"Newchip Accelerator, Hiventures",,2,,,,,,,,,,,,,,Private,,,,,,,,,,,
Fundastik Kft,https://www.crunchbase.com/organization/fundastik-kft,Active,,"Banking, Crowdfunding, Financial Services","Veszprém, Veszprem, Hungary",Fundastik gives investors confidence by making the investment universe comprehensible and transparent.,"202,031","European Union (EU), Europe, Middle East, and Africa (EMEA)",8200,,2018-03-05,day,,,,,For Profit,https://fundastik.com/,,,https://www.linkedin.com/company/fundastikmarketplace/,,"Financial Services, Lending and Investments",7,1-10,"Akos Bartha, Akos Sallai, Arpad Ravetzky, Attila Halmai, Gabor Laszlo, Marton Kovacs, Zoard Gazmar",2,Seed,2018-11-15,100000,EUR,113250,Pre-Seed,100000,EUR,113250,Pre-Seed,130000,EUR,148630,130000,EUR,148630,Hiventures,,1,,,,,,,,,,,,,,Private,,,,,,,,,,,
PiggyBanx Kft.,https://www.crunchbase.com/organization/piggybanx-kft,Active,,,"Székesfehérvár, Fejer, Hungary",FinTech,"202,240","European Union (EU), Europe, Middle East, and Africa (EMEA)",8000,,2019-01-01,year,,,,,For Profit,http://www.piggybanx.com,,,https://www.linkedin.com/company/piggybanx,,,,1-10,,1,Seed,2019-11-27,50000,EUR,55026,Pre-Seed,50000,EUR,55026,Pre-Seed,50000,EUR,55026,50000,EUR,55026,Hiventures,,1,,,,,,,,,,,,,,Private,,,,,,,,,,,
GoOrderz Kft.,https://www.crunchbase.com/organization/goorderz-kft,Active,,"Food and Beverage, Mobile Apps, Software","Szentes, Csongrad, Hungary",GoOrderz is a developer of a restaurant digitizing and management platform intended to provide all brand awareness solutions.,"203,446","European Union (EU), Europe, Middle East, and Africa (EMEA)",6600,,2021-01-01,year,,,,,For Profit,https://www.goorderz.hu,,,,"GoOrderz is the creator of a restaurant digitization and management platform that aims to provide all brand awareness solutions in one location. The company's platform provides a simple order management system that makes inventory tracking and user perspective simpler, more knowledgeable, and more affordable than competitors, allowing restaurant businesses to save time and money while increasing speed and quality via a digital touch-free menu, order, and payment with a mobile phone.","Apps, Food and Beverage, Mobile, Software",,1-10,,1,Seed,2021-11-17,15000000,HUF,46581,Pre-Seed,15000000,HUF,46581,Pre-Seed,15000000,HUF,46581,15000000,HUF,46581,Hiventures,,1,,,,,,,,,,,,,,Private,,,,,,,,,,,
Poizo,https://www.crunchbase.com/organization/poizo-ltd-48d8,Active,,"Electronics, Hardware","Budapest, Budapest, Hungary",EDISON Light Up! competition winner. Innovative heating. ,"203,674","European Union (EU), Europe, Middle East, and Africa (EMEA)",,,2017-12-01,month,,,,,For Profit,https://www.poizo.co,,,https://www.linkedin.com/company/poizo-comfort-technologies,,"Consumer Electronics, Hardware",2,1-10,"Adam Miklosi, Daniel Fekete",1,Seed,2017-12-07,127000,EUR,149514,Pre-Seed,127000,EUR,149514,Pre-Seed,127000,EUR,149514,127000,EUR,149514,Smart Future Lab,1,1,,,,,,,,,,,,,,Private,,,,,,,,,,,
Timeless Solutions Kft.,https://www.crunchbase.com/organization/timeless-solutions-kft,Active,,,"Kápolnásnyék, Fejer, Hungary",Creates an application where customers can order at the table without the need of a waiter.,"204,010","European Union (EU), Europe, Middle East, and Africa (EMEA)",,,2021-01-01,year,,,,,For Profit,,,,,,,,,,1,Seed,2021-08-10,15000000,HUF,49733,Pre-Seed,15000000,HUF,49733,Pre-Seed,15000000,HUF,49733,15000000,HUF,49733,Hiventures,,1,,,,,,,,,,,,,,Private,,,,,,,,,,,
PetConnVet Kft.,https://www.crunchbase.com/organization/petconnvet-kft,Active,,"Health Care, Medical, Veterinary","Debrecen, Debrecen, Hungary",It creates a database about pets.,"204,450","European Union (EU), Europe, Middle East, and Africa (EMEA)",4025,Less than $1M,2021-01-01,year,,,,,For Profit,https://petconnvet.hu,,,https://www.linkedin.com/company/petconnvet,,Health Care,,1-10,,1,Seed,2021-08-04,15000000,HUF,50063,Pre-Seed,15000000,HUF,50063,Pre-Seed,15000000,HUF,50063,15000000,HUF,50063,Hiventures,,1,,,,,,,,,,,,,,Private,,,,,,,,,,,
Hunting Box Kft.,https://www.crunchbase.com/organization/hunting-box-kft,Active,,,"Kisherend, Baranya, Hungary",Sport&Travel,"204,498","European Union (EU), Europe, Middle East, and Africa (EMEA)",,,2020-01-01,year,,,,,For Profit,,,,,,,,11-50,,2,Seed,2021-04-01,,,,Pre-Seed,,,,Pre-Seed,50000,EUR,54503,50000,EUR,54503,Hiventures,1,1,,,,,,,,,,,,,,Private,,,,,,,,,,,
SmartCellar,https://www.crunchbase.com/organization/smartcellar-kft,Active,,"Manufacturing, Wine And Spirits, Winery","Szolnok, Jasz-Nagykun-Szolnok, Hungary",SmartCellar is a developer of a smart wine measuring device.,"204,865","European Union (EU), Europe, Middle East, and Africa (EMEA)",5000,,2020-01-01,year,,,,,For Profit,https://smartcellarwine.com,,https://www.facebook.com/p/SmartCellar-100063478496736,,"SmartCellar is a developer of cognitive wine-measuring equipment created for in-the-moment observation of the winemaking process. With the use of their company's product, winemakers can remotely monitor all the data in real-time while also saving time, effort, and money. This device integrates the trademarked alcohol measurement technology with the measurement techniques presently employed by wineries.","Food and Beverage, Manufacturing",,1-10,,1,Seed,2020-11-27,50000,EUR,59817,Pre-Seed,50000,EUR,59817,Pre-Seed,50000,EUR,59817,50000,EUR,59817,Hiventures,,1,,,,,,,,,,,,,,Private,,,,,,,,,,,
Moment App Kft,https://www.crunchbase.com/organization/moment-app-kft,Active,,,"Tolna, Tolna, Hungary",Moment App is a dating app that makes it easy to get to know people in real life by making it easy to connect with them.,"205,010","European Union (EU), Europe, Middle East, and Africa (EMEA)",,,2018-01-01,year,,,,,For Profit,https://momentapp.hu,,https://www.facebook.com/momentthedatingapp,,"Moment App helps them find new friends who match their interests. It is a dating app that makes it easy to get to know people in real life by making it easy to connect with them. It is easy to address the people around them, write to someone, and call them.",,,1-10,,2,Seed,2019-08-14,100000,EUR,111435,Pre-Seed,100000,EUR,111435,Pre-Seed,130000,EUR,148248,130000,EUR,148248,Hiventures,,1,,,,,,,,,,,,,,Private,,,,,,,,,,,
DecPlan Kft.,https://www.crunchbase.com/organization/decplan-kft,Active,,E-Commerce,"Kecskemét, Bacs-Kiskun, Hungary",DecPlan is an online webshop which helps B2B and B2C.,"205,660","European Union (EU), Europe, Middle East, and Africa (EMEA)",6000,,2021-01-01,year,,,,,For Profit,https://decplan.hu/,,https://www.facebook.com/decplanstore,,"DecPlan is an interior design system for utility and home furnishings items. Their clothing and accessories include women's t-shirts, men's t-shirts, children's t-shirts, sweaters, and more. Furnishings include bean bags, mug, curtains, lampshade, capsule holder, stickers, pillow, poster, and more.",Commerce and Shopping,,,,1,Seed,2021-05-13,20000000,HUF,67695,Pre-Seed,20000000,HUF,67695,Pre-Seed,20000000,HUF,67695,20000000,HUF,67695,Hiventures,,1,,,,,,,,,,,,,,Private,,,,,,,,,,,
GrainMonitor Kft.,https://www.crunchbase.com/organization/grainmonitor-kft,Active,,"Information Services, Information Technology","Paks, Tolna, Hungary",GrainMonitor is a company that specializes in agricultural technology.,"205,691","European Union (EU), Europe, Middle East, and Africa (EMEA)",7030,,2019-01-01,year,,,,,For Profit,https://www.grainmonitor.net/hu/,https://twitter.com/grainmonitorhu/,https://www.facebook.com/GrainMonitor/,https://www.linkedin.com/company/grainmonitor/,"GrainMonitor is a company that specializes in agricultural technology. Founded in 2019 and is based in Paks, Tolna, Hungary.",Information Technology,2,1-10,"Ferenc Mózsa, István German",3,Seed,2021-06-08,,,,Pre-Seed,,,,Pre-Seed,33333,EUR,36825,33333,EUR,36825,"Hiventures, Drukka Startup Studio, Intellitext",,3,,,,,,,,,,,,,,Private,,,,,,,,,,,
csapatot.hu,https://www.crunchbase.com/organization/csapatot-hu,Closed,,"Marketing, Professional Services","Budapest, Budapest, Hungary","SaaP, B2B, C2C, marketplace","205,849","European Union (EU), Europe, Middle East, and Africa (EMEA)",,,2020-01-01,year,2023-05-01,day,2023-01-01,year,For Profit,https://csapatot.hu,,https://www.facebook.com/csapatot.hu,https://www.linkedin.com/company/csapatot-hu,,"Other, Sales and Marketing",1,1-10,Ivan Ivanka,1,M&A,2020-05-01,10000000,HUF,31060,Pre-Seed,10000000,HUF,31060,Pre-Seed,10000000,HUF,31060,10000000,HUF,31060,Ivanka Capital,1,1,,Was Acquired,csapatot.hu acquired by i1x,https://www.crunchbase.com/acquisition/i1x-acquires-csapatot-hu--e491d964,i1x,https://www.crunchbase.com/organization/i1x,2023-05-01,day,,,,,,Private,,,,,,,,,,,
Enduraid,https://www.crunchbase.com/organization/enduraid,Active,,,"Budapest, Budapest, Hungary",Nutrition tracker for endurance sports,"205,924","European Union (EU), Europe, Middle East, and Africa (EMEA)",,,2017-01-01,year,,,,,For Profit,https://www.enduraid.me,,,,"Enduraid is a MOBILE APPLICATION which tells an athlete exactly what to eat and drink and when DURING the race and in training. Athletes use energy while exercising, and at the same time they also lose a large amount of water and electrolytes via sweating. Enduraid can accurately count on these losses.",,3,1-10,"Kindl Gabor, Kiss Melinda, Zahorecz Zsolt",2,Seed,2019-07-01,66000,USD,66000,Angel,66000,USD,66000,Angel,66000,USD,66000,66000,USD,66000,"Oktogon Ventures, Baconsult, STRT Holding Nyrt",2,3,,,,,,,,,,,,,,Private,,,,,,,,,,,
Mancsonline Kft.,https://www.crunchbase.com/organization/mancsonline-kft,Active,,"Apps, Online Portals, Pet","Kövegy, Csongrad, Hungary",Connects pet owners with service providers.,"206,870","European Union (EU), Europe, Middle East, and Africa (EMEA)",6912,,2021-01-01,year,,,,,For Profit,https://www.mancsonline.hu,,https://www.facebook.com/MancsOnline/,,,"Apps, Community and Lifestyle, Internet Services, Software",,,,1,Seed,2021-10-14,15000000,HUF,48439,Pre-Seed,15000000,HUF,48439,Pre-Seed,15000000,HUF,48439,15000000,HUF,48439,Hiventures,,1,,,,,,,,,,,,,,Private,,,,,,,,,,,
Pharma Monitoring Technologies Kft.,https://www.crunchbase.com/organization/pharma-monitoring-technologies-kft,Active,,,"Lovas, Veszprem, Hungary",Pharma Monitoring Technologies Kft. is a med-tech service company.,"207,326","European Union (EU), Europe, Middle East, and Africa (EMEA)",8228,,2020-01-01,year,,,,,For Profit,http://www.pharmontech.com,,,,Pharma Monitoring Technologies Kft. is a med-tech service company.,,,1-10,,1,Seed,2020-09-18,50000,EUR,59202,Pre-Seed,50000,EUR,59202,Pre-Seed,50000,EUR,59202,50000,EUR,59202,Hiventures,,1,,,,,,,,,,,,,,Private,,,,,,,,,,,
Smart Babee Technologies,https://www.crunchbase.com/organization/s-babee-kft,Active,,"Apps, Baby, Furniture","Szeged, Szeged, Hungary",Smart Babee Technologies develops smart devices that monitor life fuctions of the baby.,"208,718","European Union (EU), Europe, Middle East, and Africa (EMEA)",6723,Less than $1M,2020-01-01,month,,,,,For Profit,https://www.smart-babee.com/,,,https://www.linkedin.com/company/smart-babee-technologies,"Smart Babee Technologies is a coordinated solution on the market for baby monitoring systems that meets the requirements of the parents while ensuring the security of the child. Users of their application can keep an eye on the child at any time, and it will look after the child even if there is a power outage. If necessary, it sends notifications and alarms to users' devices.","Apps, Community and Lifestyle, Consumer Goods, Software",,1-10,,2,Seed,2021-03-18,,,,Pre-Seed,,,,Pre-Seed,50000,EUR,55225,50000,EUR,55225,Hiventures,1,1,,,,,,,,,,,,,,Private,,,,,,,,,,,
