Finloup,https://www.crunchbase.com/organization/finloup,Active,,"Financial Services, FinTech","Athens, Attiki, Greece","Technology leasing for businesses and individuals, powered by Open Banking.","69,945","European Union (EU), Europe, Middle East, and Africa (EMEA)",,$1M to $10M,2020-08-01,month,,,,,For Profit,https://finloup.com,,https://www.facebook.com/finloup/,https://www.linkedin.com/company/finloup/,"Finloup offers technology leasing services to businesses and individuals, powered by Open Banking.",Financial Services,4,11-50,"Antonis Prentzas, Kyriakos Georgiou, Marios Noutsos, Stelios Gasparinatos",3,,2024-02-16,1000000,EUR,1077691,Venture - Series Unknown,1000000,EUR,1077691,Venture - Series Unknown,2020000,EUR,2172426,2020000,EUR,2172426,"Genesis Ventures, Genesis Ventures, Velocity Partners, Nicky Goulimis, Velocity Partners",1,7,,,,,,,,,,,,,,Private,,,,,,,,,,,
Tekmon,https://www.crunchbase.com/organization/tekmon,Active,,"Collaboration, Enterprise Software, Mobile, Productivity Tools, Unified Communications","Ioánnina, Ioannina, Greece",Tekmon operates a mobile first cloud based platform for the daily operations and critical communications of the non-desk workforce.,"76,092","European Union (EU), Europe, Middle East, and Africa (EMEA)",45332,$1M to $10M,2015-10-20,day,,,,,For Profit,https://www.tekmon.com/,https://twitter.com/TEKMON_com,https://www.facebook.com/TekmonGeomatics/,https://www.linkedin.com/company/tekmon/,"Tekmon is a cloud-based platform that boosts frontline teams’ productivity, through the digitization of processes. Teams can fill out forms and gather information anytime, anywhere with Tekmon. Additionally, it allows users to retrieve accurate data quickly, highlight important problems, minimize data entry mistakes, validate responses, add conditional logic, approve stages, and more.","Information Technology, Internet Services, Messaging and Telecommunications, Mobile, Other, Software",1,11-50,Panos Mitsios,4,Seed,2021-05-21,1000000,EUR,1218000,Seed,1000000,EUR,1218000,Seed,1350000,EUR,1619478,1650000,EUR,1963959,Uni.Fund,1,1,,,,,,,,,,,,,,Private,,,,,,,,,,,
Protio,https://www.crunchbase.com/organization/protio,Active,,"PropTech, Real Estate","Athens, Attiki, Greece",Protio is proptech startup reinventing the process of buying & selling real estate.,"79,118","European Union (EU), Europe, Middle East, and Africa (EMEA)",,,2021-01-01,year,,,,,For Profit,https://protio.gr/,,https://www.facebook.com/protio.gr/,https://www.linkedin.com/company/protio/,Protio is proptech startup reinventing the process of buying & selling real estate.,Real Estate,,11-50,,1,Seed,2022-07-11,2000000,EUR,2009220,Pre-Seed,2000000,EUR,2009220,Pre-Seed,2000000,EUR,2009220,2000000,EUR,2009220,"SeedBlink, Genesis Ventures, Neogen Capital, Lars Rasmussen",1,4,,,,,,,,,,,,,,Private,,,,,,,,,,,
BibeCoffee,https://www.crunchbase.com/organization/bibecoffee,Active,,"Big Data, Coffee, Hardware, Internet of Things, Software","Athens, Attiki, Greece",BibeCoffee is an IoT real-time remote management and monitoring solution company.,"79,428","European Union (EU), Europe, Middle East, and Africa (EMEA)",15124,$1M to $10M,2019-01-01,year,,,,,For Profit,http://bibecoffee.com/,,,https://www.linkedin.com/company/19172258,BibeCoffee is an IoT real-time monitoring solution that transforms every professional coffee machine to a smart connected terminal minimizing revenue Loss and safeguarding brand quality image,"Data and Analytics, Food and Beverage, Hardware, Internet Services, Software",3,11-50,"Kostas Sigalas, Panos Vrettos, Vasilis Apostolopoulos",3,Seed,2023-01-25,2100000,EUR,2293305,Seed,2100000,EUR,2293305,Seed,4000000,EUR,4493752,4000000,EUR,4493752,"Eleven Ventures, VentureFriends, Uni.Fund",2,3,,,,,,,,,,,,,,Private,,,,,,,,,,,
Think Silicon,https://www.crunchbase.com/organization/think-silicon-2,Active,,"Computer Vision, Internet of Things, Semiconductor","Patras, Akhaia, Greece","Think Silicon offers a range of Graphics (GPUs) and Display Processors for the IoT, wearable and broader display devices markets.","84,776","European Union (EU), Europe, Middle East, and Africa (EMEA)",26504,$1M to $10M,2007-06-01,month,2020-05-04,day,,,For Profit,http://www.think-silicon.com/index.php,https://twitter.com/ThinkSilicon,,https://www.linkedin.com/company/206927,"Think Silicon offers a range of graphics IP semiconductor modules and display processors for the Internet of Things, wearable, and broader display devices markets. The company also offers drivers and API software, SDKs including easy-to-use GUI design tools, evaluation and development kits, FPGA-based implementations, and more. Think Silicon was founded in 2007 and is based in Patras Science Park, Greece.","Hardware, Internet Services, Science and Engineering, Software",2,11-50,"George Sidiropoulos, Iakovos Stamoulis",3,M&A,2019-06-28,600000,EUR,682749,Seed,600000,EUR,682749,Seed,600000,EUR,682749,1966341,EUR,2211030,"EASME, Metavallon VC, Envolve Entrepreneurship, Christos Makiyama",2,4,,Was Acquired,Think Silicon acquired by Applied Materials,https://www.crunchbase.com/acquisition/applied-materials-acquires-think-silicon-2--38216fa7,Applied Materials,https://www.crunchbase.com/organization/applied-materials,2020-05-04,day,,,,Acquisition,,Private,,,,,,,,,,,1
Accusonus,https://www.crunchbase.com/organization/accusonus,Active,,"Audio, Music","Patras, Akhaia, Greece",Accusonus is a high technology start-up focused on innovation in digital audio technologies.,"84,785","European Union (EU), Europe, Middle East, and Africa (EMEA)",26441,Less than $1M,2012-01-01,year,,,,,For Profit,http://accusonus.com/,https://twitter.com/accusonus,https://www.facebook.com/accusonus,https://www.linkedin.com/company/accusonus,"Accusonus was founded in 2012 by Alexandros Tsilfidis and Elias Kokkinis. The company's vision was to commercialize the founders’ breakthrough research in audio technologies to make an impact in the global digital audio and speech technology market. In 2013, accusonus formed into an S.A. organization and accepted an angel round of investment from Michael Tzannes, who also joined the Board of Directors.  In 2016, accusonus, Inc was formed as a C-Corporation in Massachusetts adding Michael Tzannes as a founder.  accusonus, S.A. is a subsidiary of accusonus, Inc. The company's headquarters are in Lexington, MA and operations are in Patras, Greece. The company's premises also include a fully equipped professional recording studio in the center of Patras, ideal for acoustic experiments and testing. Accusonus has a unique team of engineers and qualified scientists, with proven professional skills and excellent problem-solving capabilities.","Media and Entertainment, Music and Audio",3,11-50,"Alexandros Tsilfidis, Elias K. Kokkinis, Michael Tzannes",2,Early Stage Venture,2019-11-01,3300000,USD,3300000,Series A,3300000,USD,3300000,Series A,3899979,USD,3899979,3899979,USD,3899979,"VentureFriends, Big Pi Ventures, PJ Tech Catalyst, IQbility, PJ Tech",1,5,,,,,,,,,,,,,,Private,,,,,,,,,,,
Clio Muse Tours,https://www.crunchbase.com/organization/clio-muse,Active,,"Apps, Travel","Athens, Attiki, Greece",Access more than 500 self-guided and skip-the-line tours in 24 countries worldwide through your smartphone.,"85,118","European Union (EU), Europe, Middle East, and Africa (EMEA)",10561,Less than $1M,2014-10-02,day,,,,,For Profit,http://cliomusetours.com/,,http://www.facebook.com/cliomusetours,https://www.linkedin.com/company/clio-muse/,"We are a multifaceted VC-funded IT company with a strong focus on tourism and the cultural sector. We have cooperated with leading cultural institutions in Greece and abroad in order to create top-rated cultural tourism experiences. Our products are available on the world's leading marketplaces such as travel agencies such as Expedia, booking.com, Viator - TripAdvisor and KLOOK. Clio Muse Tours was founded in 2014 with the vision to generate universal cultural awareness and guide people in every part of the world, utilizing pioneering technology. Nowadays, we have created over 300 top-selling audio and skip-the-line tours as well as virtual tour experiences for both indoor and outdoor attractions in 11 countries including Greece, Italy, Spain, Turkey and the Netherlands. From history and mythology to gastronomy and architecture, our thematic audio tours cover a wide range of topics unraveling historical facts and unknown stories.  Clio Muse Tours has collaborated with numerous world-class cultural institutions creating and curating over 300 audio tours. Both our audio and virtual tours are available for Android and iOS devices and can be used in offline mode.  In 2019 we saw a 12 times growth in our revenue and the highest sales on our audio tours serving 50,000 travelers from all over the world. Due to the COVID-19 outbreak, we were forced to slow down our plans for expansion to new destinations. However, we managed to create an additional revenue stream that completes our business model and enhances our financial growth. We collaborate with even more museums to create digital tours.  Moreover, in 2020 we fully automated our Customer Care Department, which combined with the unlimited availability of our audio tours can really lead the distributors of our products to compensate for the reduced revenues of the previous year. - 10 international awards for our sustainable business model and content methodology  - Served 50K travelers in 2019","Apps, Software, Travel and Tourism",3,11-50,"Andreas Fatouros, Daphne Tsevreni, Yiannis Nikolopoulos",1,Seed,2018-11-14,500000,EUR,565619,Pre-Seed,500000,EUR,565619,Pre-Seed,500000,EUR,565619,500000,EUR,565619,Uni.Fund,1,1,,,,,,,,,,,,,,Private,,,,,,,,,,,
Douleutaras,https://www.crunchbase.com/organization/douleutaras,Active,,"Information Technology, Internet, Professional Networking","Athens, Attiki, Greece",Douleutaras is the professional services market leader in Greece and Cyprus,"87,353","European Union (EU), Europe, Middle East, and Africa (EMEA)",,$1M to $10M,2015-08-21,day,,,,,For Profit,https://www.douleutaras.gr,http://twitter.com/douleutarasgr,http://www.facebook.com/Douleutaras,http://www.linkedin.com/company/douleutaras,"Douleutaras (Greek name)/Easyhero (international name) is the professional services market leader in Greece and Cyprus.  Having solved the biggest industry growth barrier and created the best-in-class product, the company has initiated its international expansion, going after the €250B market in Europe.","Community and Lifestyle, Information Technology, Internet Services, Professional Services",2,11-50,"Andreas Grammatis, Ioannis Pouloupatis",3,,2017-10-19,1800000,EUR,2132742,Venture - Series Unknown,1800000,EUR,2132742,Venture - Series Unknown,3158000,EUR,3604548,3158000,EUR,3604548,"VentureFriends, AddVenture, PJ Tech Catalyst, Jason Manolopoulos",,4,,,,,,,,,,,,,,Private,,,,,,,,,,,
Workearly,https://www.crunchbase.com/organization/workearly,Active,,"EdTech, Education, Skill Assessment","Athens, Attiki, Greece",Workearly is an AI-powered EdTech platform for reskilling and upskilling.,"92,213","European Union (EU), Europe, Middle East, and Africa (EMEA)",15233,,2019-01-01,year,,,,,For Profit,https://www.workearly.gr/,https://x.com/workearly1,https://www.facebook.com/workearlygr/,https://www.linkedin.com/company/workearlygr/,"Workearly powered by Reatcode Group is the most popular edTech AI upskilling and reskilling platform both in Greece and in the world's largest tech hubs. In its 3 years of operation, the company has managed to train over 17,000 candidates, having helped in the upskilling of professionals, company trainings and in the career change of candidates.","Education, Software",,11-50,,1,Seed,2024-06-29,1100000,EUR,1179219,Seed,1100000,EUR,1179219,Seed,1100000,EUR,1179219,1100000,EUR,1179219,Metavallon VC,1,1,,,,,,,,,,,,,,Private,,,,,,,,,,,
EdenCore Technologies,https://www.crunchbase.com/organization/edencore-technologies-private-company,Active,,"Agriculture, AgTech, Artificial Intelligence (AI), Machine Learning, Robotics, Software","Athens, Attiki, Greece",Precision agriculture services,"93,462","European Union (EU), Europe, Middle East, and Africa (EMEA)",10441,,2021-06-01,day,,,,,For Profit,https://www.edencore.ai,,https://www.facebook.com/EdenLibraryAI,https://www.linkedin.com/company/edenlib/?viewAsMember=true,"EDENCORE is an agtech company developing Viewer; a  system for visual monitoring and automation in high-value crops (HVC). Viewer leverages AI to analyze the status of each plant, and can provide detailed information for the treatments required, saving up to 40% in fertilizers and pesticides from the pinpoint accuracy of every field operation.","Agriculture and Farming, Artificial Intelligence (AI), Data and Analytics, Hardware, Science and Engineering, Software",2,1-10,"Nikolaos Mylonas, Spyridon Fountas",1,Seed,2024-10-11,400000,EUR,437724,Pre-Seed,400000,EUR,437724,Pre-Seed,400000,EUR,437724,400000,EUR,437724,Uni.Fund,1,1,,,,,,,,,,,,,,Private,,,,,,,,,,,
Moverse,https://www.crunchbase.com/organization/moverse-022e,Active,,"Analytics, Artificial Intelligence (AI), Machine Learning, Motion Capture, Software","Thessaloníki, Thessaloniki, Greece","AI Software, Motion Capture Solution, Body Capture, Human Digitization","94,715","European Union (EU), Europe, Middle East, and Africa (EMEA)",,,2023-01-06,day,,,,,For Profit,https://moverse.ai/,https://twitter.com/moverseai,,https://www.linkedin.com/company/moverseai,"We revolutionize human body digitization and perception by delivering next-generation, optimized, and power-efficient software tools and services.","Artificial Intelligence (AI), Data and Analytics, Media and Entertainment, Science and Engineering, Software, Video",,1-10,,1,Seed,2023-02-07,300000,EUR,321928,Pre-Seed,300000,EUR,321928,Pre-Seed,300000,EUR,321928,300000,EUR,321928,TECS Capital,1,1,,,,,,,,,,,,,,Private,,,,,,,,,,,
BIOPIX-T,https://www.crunchbase.com/organization/biopix-t,Active,,"Biotechnology, Health Care, Health Diagnostics","Heraklion, Iraklion, Greece",Molecular Diagnostics,"99,086","European Union (EU), Europe, Middle East, and Africa (EMEA)",70013,$1M to $10M,2019-12-12,day,,,,,For Profit,https://biopix-t.com/,https://twitter.com/Biopix_T,https://www.facebook.com/BIOPIX-DNA-TECHNOLOGY-PC-102072568691153/?hc_ref=ARTg1fpWBoM5FCcit-3OSQ85PxC1luYWZYSICdCDkxhYNVhP7k9YEj4_PF50K6fbu9g&fref=nf&__tn__=kC-R,https://www.linkedin.com/company/biopix-dna-technology-p-c/?viewAsMember=true,Molecular Diagnostics for the Point Of Care,"Biotechnology, Health Care, Science and Engineering",5,11-50,"Alexandros Pantazis, Electra Gizeli, Geroge Papadakis, Nikolaos Fikas, Sergios Katsaros",1,Seed,2020-09-09,1450000,EUR,1711593,Seed,1450000,EUR,1711593,Seed,1450000,EUR,1711593,1450000,EUR,1711593,"Eleven Ventures, Metavallon VC",1,2,,,,,,,,,,,,,,Private,,,,,,,,,,,
Agritrack,https://www.crunchbase.com/organization/agritrack-9601,Active,,"Agriculture, AgTech, Food and Beverage","Athens, Attiki, Greece","Agritrack is an agriculture process automation platform that tracks quality from farm to fork, aiming to reduce food loss and food fraud.","99,225","European Union (EU), Europe, Middle East, and Africa (EMEA)",,,2020-01-01,year,,,,,For Profit,http://www.agritrack.io,https://twitter.com/Agritrack_SA,,https://www.linkedin.com/company/agritrack-sa/,"A post-harvest automation platform that optimises perishable food value chains such as fish & dairy, improving food safety & quality, reducing costs and securing traceability compliance. The company was founded in 2020 and is based in Athens, Attica.","Agriculture and Farming, Food and Beverage",,11-50,,1,Seed,2022-02-14,383000,EUR,433020,Pre-Seed,383000,EUR,433020,Pre-Seed,383000,EUR,433020,383000,EUR,433020,Startup Wise Guys,,1,,,,,,,,,,,,,,Private,,,,,,,,,,,
Classter,https://www.crunchbase.com/organization/classter,Active,,"Consumer, Education, Information Technology, Management Information Systems, Software","Kavála, Kavala, Greece",Classter is a robust single-platform school management solution offering a holistic approach in education. ,"100,016","European Union (EU), Europe, Middle East, and Africa (EMEA)",,$1M to $10M,2015-01-01,year,,,,,For Profit,https://www.classter.com/,https://twitter.com/ClassterCom,https://www.facebook.com/ClassterPage/,https://www.linkedin.com/company/classter/?originalSubdomain=in,"Classter is a robust single-platform school management solution offering a holistic approach in education. Fully integrated with Office 365 and Moodle this end-to-end system can be used by any school, from K-12 to colleges and universities, to cover your entire school management needs.   Classter is the rebrand of schoolmanagement.eu which has been successfully implemented to diverse educational institutions since 2009. Our solution offers a wide range of features that gives any school the power to manage their academic, finance, transportation and library operations with measurable results and to build updated communications with controlled access to teachers, students and parents. Accessible via web or mobile, Classter incorporates best practices into processes and into any school’s culture. ","Education, Information Technology, Other, Software",1,11-50,Nikolaos Nikou,1,Seed,2016-02-19,550000,EUR,612194,Seed,550000,EUR,612194,Seed,550000,EUR,612194,550000,EUR,612194,Odyssey Ventures L.P.,1,1,,,,,,,,,,,,,,Private,,,,,,,,,,,1
CollegeLink,https://www.crunchbase.com/organization/collegelink,Active,,"Human Resources, Marketplace, Recruiting","Athen, Attiki, Greece",User and value-driven recruitment platform specializing in efficiently connecting highly-specialized tech talents with their ideal roles,"101,277","European Union (EU), Europe, Middle East, and Africa (EMEA)",,Less than $1M,2016-04-01,day,,,,,For Profit,https://collegelink.gr,,https://www.facebook.com/atcollegelink,https://www.linkedin.com/company/collegelink,"CollegeLink is revolutionizing the recruitment landscape by tackling the talent shortage head-on. With a focus on flipping traditional recruitment processes that often fail both employers and candidates, we offer a cost-effective and efficient product that has a proven track record of success. As we set our sights on growth and expansion, we're committed to making a significant impact in the industry. Our mission is to seamlessly connect talent with job opportunities, prioritizing efficiency for all parties involved. Leveraging the power of data and technology, we are user and value-driven, dedicated to matching highly-specialized talents with their ideal roles. We serve the wider tech ecosystem, supporting startups, scale-ups, and corporates in hiring for roles in Engineering, Operations, and Commercial sectors. With a focus on mid and senior-level tech candidates, we're the go-to platform for decision-makers in medium and enterprise-level companies looking to unlock unparalleled opportunities in the job market.","Administrative Services, Commerce and Shopping, Professional Services",2,11-50,"Stefanos Alkidis, Yannis Imelos",3,,2021-09-01,200000,EUR,236830,Undisclosed,200000,EUR,236830,Undisclosed,350000,EUR,408892,350000,EUR,408892,"Uni.Fund, Envolve Entrepreneurship",2,2,,,,,,,,,,,,,,Private,,,,,,,,,,,
bespot.,https://www.crunchbase.com/organization/bespot,Active,,"Advertising, Analytics, Geospatial, Information Technology, Location Based Services, Market Research","Athens, Attiki, Greece","bespot. is an information technology company that provides mobile marketing, market research, and location analytics services.","102,132","European Union (EU), Europe, Middle East, and Africa (EMEA)",,$1M to $10M,2018-01-01,year,,,,,For Profit,https://bespot.com/,https://twitter.com/bespotapp,https://www.facebook.com/bespot.me/,https://www.linkedin.com/company/bespot/,"bespot. offers indoor location tracking and analytics, outdoor location data and analytics, and transactional analytics. With plug-and-play options, they provide apps with the ability to determine the location and provide customers with experiences in stores. They analyze the data and combine it with third-party location data to present analyses of consumer and competitor behavior. They analyze transaction data and assist in understanding shopper behavior and opportunities using the Shopmind platform.","Advertising, Data and Analytics, Design, Information Technology, Internet Services, Navigation and Mapping, Sales and Marketing",,11-50,,2,Seed,2021-02-17,1000000,EUR,1204674,Seed,1000000,EUR,1204674,Seed,1000000,EUR,1204674,1000000,EUR,1204674,Uni.Fund,1,1,,,,,,,,,,,,,,Private,,,,,,,,,,,
Uplodio,https://www.crunchbase.com/organization/uplodio,Active,,"Artificial Intelligence (AI), Digital Marketing, Software","Athens, Attiki, Greece",Uplodio helps Bands & Marketing Agencies find and manage User-generated content (UGC) creators for their campaigns.,"107,983","European Union (EU), Europe, Middle East, and Africa (EMEA)",,,2024-06-01,day,,,,,For Profit,https://uplodio.com,,,https://www.linkedin.com/company/uplodio,,"Artificial Intelligence (AI), Data and Analytics, Sales and Marketing, Science and Engineering, Software",,1-10,,1,Seed,2024-11-15,150000,EUR,158182,Pre-Seed,150000,EUR,158182,Pre-Seed,150000,EUR,158182,150000,EUR,158182,Genesis Ventures,1,1,,,,,,,,,,,,,,Private,,,,,,,,,,,
Aidplex,https://www.crunchbase.com/organization/aidplex,Active,,"Health Care, Information Technology, Medical Device","Thessaloníki, Thessaloniki, Greece",AidPlex is a MedTech startup aiming at disrupting the orthopedics sector by offering patient-centered products.,"114,377","European Union (EU), Europe, Middle East, and Africa (EMEA)",54623,,2018-09-13,day,,,,,For Profit,https://www.aidplex.com/,https://twitter.com/AidPlex,https://www.facebook.com/aidplex/,https://www.linkedin.com/company/aidplex/,"Aidplex is a MedTech startup aiming at disrupting the orthopedics sector by offering patient-centered products and revolutionizing the monitoring of patients. Aidplex is incorporated both in the US & in Greece. The majority of orthopedics products have not been improved for decades and do not support the integration of biometric sensors. Aidplex's mission is to change that. Aidplex's designs are patient-centered, combining effectiveness with comfort. The Aidplex team makes use of innovative technologies in the orthopedic field, giving the opportunity for 24/7 monitoring capabilities.","Health Care, Information Technology",5,1-10,"Anargyros Mouratidis, Anastasios Anastasiadis, Dimitris Moustakas, Harry Yeremtzes, Konstantinos Paraskevas",5,Seed,2023-01-31,340000,USD,340000,Pre-Seed,340000,USD,340000,Pre-Seed,340000,USD,340000,513729,USD,513729,"MassChallenge Switzerland, TECS Capital",2,2,,,,,,,,,,,,,,Private,,,,,,,,,,,
Useberry,https://www.crunchbase.com/organization/useberry,Active,,"Analytics, Information Technology, Product Design, Software","Athens, Attiki, Greece",Useberry is a codeless prototype analytics where users test feedback and rich analytics.,"115,302","European Union (EU), Europe, Middle East, and Africa (EMEA)",,Less than $1M,2018-01-01,year,,,,,For Profit,https://www.useberry.com,https://twitter.com/useberryhq,https://www.facebook.com/useberry,https://www.linkedin.com/company/useberry,"Useberry is a codeless prototype analytics where users test feedback and rich analytics. Its platform offers fast, automated, and data-driven UX optimization tools to companies developing mobile and web applications. Founded in 2018, Useberry is headquartered in Athens, Greece.","Data and Analytics, Design, Information Technology, Software",2,11-50,"Teo Tokis, Vasilis Kirimkiridis",1,Seed,2018-09-18,200000,EUR,233540,Pre-Seed,200000,EUR,233540,Pre-Seed,200000,EUR,233540,200000,EUR,233540,Metavallon VC,1,1,,,,,,,,,,,,,,Private,,,,,,,,,,,
Brive,https://www.crunchbase.com/organization/brive-0635,Active,,"EdTech, Higher Education","Athens, Attiki, Greece",One-stop destination platform for prospective international students,"116,335","European Union (EU), Europe, Middle East, and Africa (EMEA)",15231,Less than $1M,2020-01-01,year,,,,,For Profit,https://brive.com/,,https://www.facebook.com/bebriver,https://www.linkedin.com/company/bebrive/,"Brive connects students with the entire world of education, aspiring to consolidate a groundbreaking method of student recruitment. At Brive, we: • transform the complex search, selection & admission process for students into a streamlined and fun experience • promote free and conscious choices by empowering students with thousands of bachelor’s & master’s programmes from all over the world • recommend study options that truly fit into the student’s career orientation, skills & preferences • give students the ability to submit their applications on multiple programmes in an easy way while they save time and money • increase the students’ chances of admission to the ideal programme for them • create independent and self-confident students and, subsequently, happy and successful professionals & global citizens who fulfil their dreams","Education, Software",2,11-50,"Dimitris Kremmydas, Petros Styliaras",4,Seed,2023-01-13,205000,EUR,222353,Pre-Seed,205000,EUR,222353,Pre-Seed,985557,USD,985557,985557,USD,985557,"Newchip Accelerator, Develop Greece, Manolis Lagogiannis, George Veronis",,4,,,,,,,,,,,,,,Private,,,,,,,,,,,
