InAccel,https://www.crunchbase.com/organization/inaccel,Active,,"Cloud Computing, Field-Programmable Gate Array (FPGA), Machine Learning, Software","Athens, Attiki, Greece",InAccel provides high performance accelerators for Machine Learning & Analytics applications based on novel FPGA engines as IP blocks,"117,893","European Union (EU), Europe, Middle East, and Africa (EMEA)",,Less than $1M,2018-05-01,month,2024-03-05,day,,,For Profit,https://www.inaccel.com/,https://twitter.com/inaccel,https://www.facebook.com/innaccel/,https://www.linkedin.com/company/inaccel/,InAccel develops hardware accelerators that are compatible with the Amazon AWS F1 platform. Customers use our accelerators-as-a-service to seamlessly speed up machine learning and analytical workloads on Apache Spark. Customers benefit from a 2-10x speed-up increase with minimal to zero changes in their application codes boosting performance gains and reducing cloud costs.,"Artificial Intelligence (AI), Data and Analytics, Hardware, Internet Services, Software",3,1-10,"Christoforos Kachris, Elias Koromilas, Ioannis Stamelos",1,M&A,2018-07-05,600000,USD,600000,Seed,600000,USD,600000,Seed,600000,USD,600000,600000,USD,600000,Marathon Venture Capital,1,1,,Was Acquired,InAccel acquired by Intel,https://www.crunchbase.com/acquisition/intel-acquires-inaccel--1809f5a3,Intel,https://www.crunchbase.com/organization/intel,2024-03-05,day,,,,Acquisition,,Private,,,,,,,,,,,3
MyJobNow,https://www.crunchbase.com/organization/myjobnow,Active,,"Apps, Internet","Athens, Attiki, Greece",MyJobNow is help you to find a job near you in 24 hours.,"118,048","European Union (EU), Europe, Middle East, and Africa (EMEA)",,Less than $1M,2018-01-01,year,2021-01-26,day,,,For Profit,https://www.myjobnow.com,,https://www.facebook.com/myjobnow/,https://www.linkedin.com/company/myjobnow/,MyJobNow is to help you to find a job near you in 24 hours.,"Apps, Internet Services, Software",1,1-10,Stefanos Katsimpas,2,M&A,2019-04-04,530000,EUR,594925,Seed,530000,EUR,594925,Seed,530000,EUR,594925,530000,EUR,594925,"VentureFriends, Velocity Partners, Envolve Entrepreneurship",2,3,,Was Acquired,MyJobNow acquired by Skroutz.gr,https://www.crunchbase.com/acquisition/skroutz-gr-acquires-myjobnow--90cb8b8b,Skroutz.gr,https://www.crunchbase.com/organization/skroutz-gr,2021-01-26,day,,,,Acquisition,,Private,,,,,,,,,,,
Intale,https://www.crunchbase.com/organization/intale,Active,,"Big Data, Point of Sale, Retail, SaaS","Athens, Attiki, Greece",Intale digitises convenience retailers and connects them with their suppliers.,"119,455","European Union (EU), Europe, Middle East, and Africa (EMEA)",,$1M to $10M,2013-05-01,day,,,,,For Profit,http://intale.com,http://twitter.com/intale,https://www.facebook.com/intale.com,https://www.linkedin.com/company/intale,"Intale brings CPG corporations closer to the fragmented retail channel, such as grocery and convenience stores connecting and streamlining the retail industry via its cloud retail platform.  It was founded in 2010 and is headquartered in Athens, Greece.","Commerce and Shopping, Data and Analytics, Software",3,11-50,"Fanis Koutouvelis, Konstantinos Kazanis, Orestis Tzanetis",2,Seed,2015-10-29,2500000,USD,2500000,Seed,2500000,USD,2500000,Seed,2950000,USD,2950000,2950000,USD,2950000,"Alexander Rittweger, PJ Tech Catalyst, European Investor Gate, Dimitris Vranopoulos",1,4,,,,,,,,,,,,,,Private,,,,,,,,,,,
Agroverse,https://www.crunchbase.com/organization/agroverse,Active,,"Agriculture, Robotics, Technical Support","Thessaloníki, Thessaloniki, Greece",Agroverse is an agriculture robots as a service company.,"119,597","European Union (EU), Europe, Middle East, and Africa (EMEA)",54500,,2022-09-14,day,,,,,For Profit,https://www.agroverse.tech/,,,https://www.linkedin.com/company/agroverse-pc/,"Agroverse is a provider of agriculture robots designed to relieve farmers of heavy work. The company offers its agriculture robots as a service, assisting farmers in producing high-quality food in a sustainable and effortless manner.","Agriculture and Farming, Hardware, Information Technology, Other, Science and Engineering, Software",,1-10,,1,Seed,2023-01-14,200000,EUR,216870,Pre-Seed,200000,EUR,216870,Pre-Seed,200000,EUR,216870,200000,EUR,216870,TECS Capital,1,1,,,,,,,,,,,,,,Private,,,,,,,,,,,
Fieldscale,https://www.crunchbase.com/organization/fieldscale,Active,,"Analytics, Simulation, Software","Thessaloníki, Thessaloniki, Greece","Simpler, better, faster, cloud-based capacitive touch sensor simulation","122,458","European Union (EU), Europe, Middle East, and Africa (EMEA)",54250,$1M to $10M,2014-01-01,year,,,,,For Profit,http://fieldscale.com/,https://twitter.com/Fieldscale_com,https://www.facebook.com/fieldscalecom/,https://www.linkedin.com/company/fieldscale,"Fieldscale is the company behind SENSE. Sense offers state-of-the-art capacitive touch sensor cloud simulation software, for electric design and analysis, built from ground-up to support the constantly growing demands of engineers for accuracy and efficiency.  Its cutting-edge algorithms are integrated within a simple, intuitive user environment to support the effortless design of great touch screen products.  Fieldscale solvers expand the boundaries of electric simulation as we know them today, enabling very complex simulations. With  thousands or even millions of analyses and different scenarios and get the results the same day. Fieldscale finally enables the possibility for you to realize optimal design easier and faster than your competitors. Fieldscale was founded in 2015 and is based in Thessaloniki, Greece.","Data and Analytics, Software",2,11-50,"George Bouzianas, Yiorgos Bontzios",5,Early Stage Venture,2018-10-01,1000000,EUR,1157710,Series A,1000000,EUR,1157710,Series A,2450000,EUR,2850824,2450000,EUR,2850824,"Big Pi Ventures, Openfund, PJ Tech Catalyst, Panagiotis Chatzakos",2,4,,,,,,,,,,,,,,Private,,,,,,,,,,,
e-table.gr,https://www.crunchbase.com/organization/e-table-gr,Active,,"Food and Beverage, Online Forums, Restaurants, Software","Moskháton, Attiki, Greece","An innovative online service that helps users to find restaurants and close easily and quickly table, 24 hours a day.","132,209","European Union (EU), Europe, Middle East, and Africa (EMEA)",18345,$1M to $10M,2014-09-01,day,,,,,For Profit,https://www.e-table.gr/en,https://twitter.com/etablegr,https://www.facebook.com/etablegr,https://www.linkedin.com/company/5310672,"e-table is an innovative online service that helps users to find restaurants and make reservations online easily and quickly, 24/7. The service is totally free, does not require credit card and guarantees exclusive privileges and discounts to its users. More people - especially the younger generation - want to be able to plan and share the fun through their computer, tablet or smartphone as technology can add value and convenience to the customer’s experience. Nevertheless, there is still a big gap between what customers want and what the restaurants have to offer with regard to new technologies and the internet. e-table is the medium to bridge this gap by offering a highly sophisticated platform that provides customers with new opportunities in the restaurant scene and restaurants to take advantage of the new era of digital marketing with minimal effort and cost. e-table was founded by George Arfaras & Kostas Saridakis on September 1, 2014, and is headquartered in Moschato, Greece.","Community and Lifestyle, Food and Beverage, Internet Services, Software",2,11-50,"George Arfaras, Konstantinos Saridakis",4,Seed,2017-12-01,1000000,EUR,1189300,Seed,1000000,EUR,1189300,Seed,3500000,EUR,4055956,3500000,EUR,4055956,VentureFriends,1,1,,,,,,,,,,,,,,Private,,,,,,,,,,,
Project Agora,https://www.crunchbase.com/organization/project-agora,Active,,"Digital Media, Enterprise Software, SaaS","Athens, Attiki, Greece",Project Agora is an Integration as a Service platform that automates profitability for Media Owners worldwide.,"132,217","European Union (EU), Europe, Middle East, and Africa (EMEA)",14654,$1M to $10M,2014-11-01,day,,,,,For Profit,http://www.projectagora.com,,https://www.facebook.com/ProjectAgoraCom,https://www.linkedin.com/company/projectagora,"Project Agora builds technology that empowers 3.000 Media Owners across the globe automate the discovery, integration, and monitoring of the platforms they need, to turn their business profitable.​ ​ In 2022 & 2023 the company was selected as one of the fastest growing companies in Europe by the Financial Times.","Media and Entertainment, Software",2,101-250,"Alex Karageorgis, Odysseas Ntotsikas",2,Seed,2017-09-07,300000,EUR,360846,Seed,300000,EUR,360846,Seed,500000,EUR,585856,500000,EUR,585856,VentureFriends,1,1,,,,,,,,,,,,,,Private,,,,,,,,,,,1
UniStudents,https://www.crunchbase.com/organization/unistudents-b3a0,Active,,"Higher Education, Mobile Apps","Athens, Attiki, Greece",The easiest way to manage your studies at university,"133,002","European Union (EU), Europe, Middle East, and Africa (EMEA)",,,2023-01-01,year,,,,,For Profit,https://unistudents.app/,,,https://www.linkedin.com/company/unistudentsapp,"UniStudents, launched in 2020, is reshaping university life in Greece. Already supporting 24 public universities and empowering 220,000 students annually, our app centralizes courses, calendars, grades, and deadlines—all in one place. Award-winning and featured as a top impactful app in Greece by the Google Play Store in 2023, UniStudents is your gateway to a stress-free, integrated campus experience. Join us in leading the future of education.","Apps, Education, Mobile, Software",1,1-10,Nikos Sklavounos,1,Seed,2023-09-15,135000,EUR,144053,Pre-Seed,135000,EUR,144053,Pre-Seed,135000,EUR,144053,135000,EUR,144053,Genesis Ventures,1,1,,,,,,,,,,,,,,Private,,,,,,,,,,,
ClicktoTherapy,https://www.crunchbase.com/organization/clicktotherapy,Active,,"Health Care, Mental Health","Athens, Attiki, Greece",ClicktoTherapy is an online mental health platform that is giving the opportunity for psychotherapy to everyone who needs it.,"133,900","European Union (EU), Europe, Middle East, and Africa (EMEA)",10554,,2020-11-25,day,,,,,For Profit,https://clicktotherapy.gr/,,,https://gr.linkedin.com/company/clicktotherapy,"ClicktoTherapy is an online mental healthcare platform created to give users immediate access to behavioral and mental health services. The business specializes in online communication, including video with psychologists, chats with the psychologist, selecting the correct psychologist, and personal psychology, giving people simple online access to a psychologist at any time and from any location.",Health Care,2,1-10,"Afrodite Kapsaridi, Panagiotis Charamis",1,Seed,2022-09-15,200000,EUR,199750,Pre-Seed,200000,EUR,199750,Pre-Seed,200000,EUR,199750,200000,EUR,199750,Genesis Ventures,1,1,,,,,,,,,,,,,,Private,,,,,,,,,,,
Workathlon,https://www.crunchbase.com/organization/workathlon,Active,,"Artificial Intelligence (AI), Software","Athens, Attiki, Greece","Workathlon is an AI-powered hospitality recruitment solution to help companies find, nurture, and hire the very best talent.","136,603","European Union (EU), Europe, Middle East, and Africa (EMEA)",15124,$100M to $500M,2017-11-16,day,,,,,For Profit,http://www.workathlon.com,,http://facebook.com/workathlon/,https://www.linkedin.com/company/workathlon/?viewAsMember=true,"Workathlon is An AI-powered hospitality recruitment solution augmented by marketing tools and practices to help companies find, nurture and hire the very best talent. It has become the go-to destination for the next generation of the hospitality workforce to research companies and apply for jobs. Over thirty thousand hospitality professionals have trusted us with their careers, while over 350 companies have searched for their next talent through our software. Clients include hotels, tour operators, villas, restaurants, cruising companies and yachts in Greece, Cyprus, Germany, Malta, UAE and Switzerland.","Artificial Intelligence (AI), Data and Analytics, Science and Engineering, Software",1,1-10,Katerina Santikou,2,Seed,2020-01-27,120000,USD,120000,Seed,120000,USD,120000,Seed,590708,USD,590708,590708,USD,590708,Techstars,1,1,,,,,,,,,,,,,,Private,,,,,,,,,,,
ShipReality,https://www.crunchbase.com/organization/shipreality,Active,,"Metaverse, Shipping, Software","Athens, Attiki, Greece",Industrial metaverse platform for marine sustainability and the green energy transition in shipping,"136,745","European Union (EU), Europe, Middle East, and Africa (EMEA)",10432,Less than $1M,2018-07-12,day,,,,,For Profit,http://www.shipreality.com/,,,https://www.linkedin.com/company/18721970/admin/,"ShipReality develops an industrial metaverse platform for marine sustainability with: (i) Generative 3D Design with XR Visualization for fast & optimal emission reduction ship retrofits, (ii) VR/AR/MR Enabled Remote Operations., and (iii) Ship Energy Efficiency Automated Planning & Compliance.","Media and Entertainment, Software, Transportation",4,1-10,"Alexandros Ginnis, Christos Papadopoulos, Georgios Bourtzos, Lambros Kaiktsis",2,Seed,2019-12-01,100000,USD,100000,Seed,100000,USD,100000,Seed,250000,USD,250000,250000,USD,250000,"Creative Destruction Lab (CDL), Katapult Ocean",1,2,,,,,,,,,,,,,,Private,,,,,,,,,,,
Purposeful,https://www.crunchbase.com/organization/purposeful-092d,Active,,"Artificial Intelligence (AI), Data Mining, Pharmaceutical","Athens, Attiki, Greece",Purposeful discovers alternative effects for existing drugs using its advanced computational workflow.,"140,040","European Union (EU), Europe, Middle East, and Africa (EMEA)",,Less than $1M,2018-01-01,year,,,,,For Profit,http://www.purposeful.eu/,,,https://www.linkedin.com/company/purposeful-eu/,Purposeful discovers new treatments and develops pharmaceutical products for rare diseases by repurposing previously marketed drugs. Their vision is to fully utilize AI repurposing and revisit rare and common diseases to reverse disease phenotypes. It collaborates with FRAXA and FRAXA-DVI to identify drug repurposing candidates for Fragile X Syndrome. They also identify drug repurposing candidates for Glioblastoma.,"Artificial Intelligence (AI), Data and Analytics, Health Care, Information Technology, Science and Engineering, Software",2,1-10,"Charalampos Chomenidis, George Drakakis",1,Seed,2018-10-18,200000,USD,200000,Pre-Seed,200000,USD,200000,Pre-Seed,200000,USD,200000,200000,USD,200000,Metavallon VC,1,1,,,,,,,,,,,,,,Private,,,,,,,,,,,
Loctio,https://www.crunchbase.com/organization/loctio,Active,,"Information Technology, Machine Learning, Software","Aegaleo, Attiki, Greece",A Locations as a Service (Laas) technology provider willing to democratize precise location capabilities for IoT devices,"141,292","European Union (EU), Europe, Middle East, and Africa (EMEA)",GR-12244,Less than $1M,2019-06-26,day,,,,,For Profit,http://www.loctio.com,https://twitter.com/LoctioPC,,https://www.linkedin.com/company/loctio/,"Loctio offers location estimation services in a Location as a Service (LaaS) model for IoT devices. The company’s solution has the ability to provide integral (chip/ module enabled) precise position estimation services to numerous applications while offering unprecedented power efficiency and phenomenal accuracy. The underlying technology uses solely Radio Frequency (RF) and digitalization circuitry for capturing the Global Navigation Satellite System (GNSS) signals and other signals of opportunity (cellular, BLE). The result prolongs the lifespan of IoT device batteries by migrating to the Cloud or Edge the vast majority of power-consuming calculations for reckoning location. Offering on top an advanced GNSS anti-spoofing shield, Loctio enhances its LaaS model with security capabilities that dovetail perfectly with any IoT deployment. This, in turn, makes location estimation flexible, generic, secure, cheaper and most importantly so power streamlined that it can be efficiently used in numerous IoT enabled devices as yet constrained or excluded.  Designed to be largely scalable and resilient, it addresses the global GNSS equipment & augmentation services market which is projected to reach approx. $175 Bn by 2029.Loctio foresees a universe of numerous interconnected devices each of them gifted with the charisma to accurately know or provide the means for determining its precise position. For a continuous consistent seamless location detection experience in both indoor and outdoor environments even amid harsh conditions a single technology is not enough thus multiple approaches shall be chained together. For reckoning timely and securely the position with acceptable precision, confidence and integrity apart from GNSS, localization methods and data from other terrestrial sources like but not limited to 5G and IMUs shall be baked in accompanied by advanced Machine Learning, Crowdsourcing-Fingerprinting or Collective Perception. Loctio is willing to render all this sophisticated IP processing throughout it's Cloud and Edge LaaS offering.","Artificial Intelligence (AI), Data and Analytics, Information Technology, Software",1,1-10,Lazaros Kapsias,1,Seed,2020-03-19,500000,EUR,532758,Seed,500000,EUR,532758,Seed,500000,EUR,532758,500000,EUR,532758,Metavallon VC,1,1,,,,,,,,,,,,,,Private,,,,,,,,,,,
Oliveex,https://www.crunchbase.com/organization/oliveex,Active,,"Analytics, Internet of Things","Vólos, Magnisia, Greece","Oliveex IIoT Platform, focusing on F&B industries, transforms existing industrial setups into industry 4.0-ready with zero hardware cost.","141,311","European Union (EU), Europe, Middle East, and Africa (EMEA)",38221,Less than $1M,2020-08-31,day,,,,,For Profit,https://www.oliveex.io,,,https://www.linkedin.com/company/oliveex,"Oliveex’s IIoT platform (SaaS) integrates software-only modules into production lines to real-time analyze them and allow them to be data-driven. The platform provides several AI-enabled mechanisms focusing on fully-automated digital traceability & production reporting, production transparency enhancement, and predictive data analytics focusing on sustainability improvement. The platform is being used by F&B industries, helping them reduce working hours, automate workflows and improve quality.","Data and Analytics, Internet Services",2,1-10,"Dimitris Garagounis, Konstantinos Akrivos",2,Seed,2022-03-15,320000,USD,320000,Pre-Seed,320000,USD,320000,Pre-Seed,320000,USD,320000,350000,USD,350000,"EIT Food, EIT Digital, TECS Capital",2,3,,,,,,,,,,,,,,Private,,,,,,,,,,,
Metabio BG,https://www.crunchbase.com/organization/metabio-bg,Active,,"Big Data, Health Care","Thessaloníki, Thessaloniki, Greece","Metabio BG designs, develops, and implements IT solutions for the life science industry.","142,704","European Union (EU), Europe, Middle East, and Africa (EMEA)",,,2014-01-01,year,,,,,For Profit,https://metab.io,https://twitter.com/Metabio1,https://www.facebook.com/metabio2015/,https://www.linkedin.com/company/metabio/,"Metabio BG designs, develops, and implements IT solutions for the life science industry; combines and maintains data from all sector organizations; and delivers valuable services.","Data and Analytics, Health Care",,1-10,,2,Seed,2024-07-31,117000,EUR,126639,Grant,50000,EUR,54602,Pre-Seed,50000,EUR,54602,167000,EUR,181241,"European Commission, Innovation Capital",2,2,,,,,,,,,,,,,,Private,,,,,,,,,,,
BIOEMTECH,https://www.crunchbase.com/organization/bioemtech,Active,,,"Athens, Attiki, Greece",BIOEMTECH is a biotech company that manufactures medical imaging systems.,"144,036","European Union (EU), Europe, Middle East, and Africa (EMEA)",11472,,2013-01-01,year,,,,,For Profit,https://bioemtech.com/who-we-are-our-team/,,,https://www.linkedin.com/company/bioemtech,"BIOEMTECH is a biotech firm that makes medical imaging systems. They created and commercialized the first desktop cameras capable of imaging PET and SPECT isotopes in mice in real-time. They conduct complete studies for evaluating new compounds in their authorized laboratories, which include an animal facility, an in vitro lab, a radiochemistry lab, and in vivo imaging with microPET, SPECT, CT, and optical imaging.",,3,11-50,"George Loudos, Maria Georgiou, Panagiotis Papadimitroulas",1,Seed,2019-08-23,400000,EUR,449035,Seed,400000,EUR,449035,Seed,400000,EUR,449035,400000,EUR,449035,Metavallon VC,1,1,,,,,,,,,,,,,,Private,,,,,,,,,,,
LaughtApp,https://www.crunchbase.com/organization/basanizomai,Active,,Internet,"Lárissa, Larisa, Greece","Mobile app, Social network","145,657","European Union (EU), Europe, Middle East, and Africa (EMEA)",,,2022-09-07,day,,,,,For Profit,https://www.laughtapp.com,,https://www.facebook.com/basanizomai,,"An AI federated learning social network, based on humor & ephemeral chatting",Internet Services,1,1-10,Dimitris Eleftheriou,3,Seed,2023-07-04,,,,Pre-Seed,,,,Pre-Seed,190272,USD,190272,190272,USD,190272,Angel Investment Network,,1,,,,,,,,,,,,,,Private,,,,,,,,,,,
Loceye,https://www.crunchbase.com/organization/loceye,Active,,"Advertising, Brand Marketing, Computer Vision, Marketing, Software, UX Design","Thessaloníki, Thessaloniki, Greece",Loceye is a biometric platform for Eye Tracking analysis helping marketers catch the attention of their users.,"153,436","European Union (EU), Europe, Middle East, and Africa (EMEA)",,Less than $1M,2017-02-01,day,2022-04-11,day,,,For Profit,http://www.loceye.io,https://twitter.com/Loceye_io,https://www.facebook.com/loceye.io,https://www.linkedin.com/company/loceye,"Loceye is a biometric eye tracking platform, which enables your team to design with confidence, optimize digital assets like website content, images, emails, ad creatives, videos, and more to help you achieve the highest visual and emotional impact.","Advertising, Design, Hardware, Sales and Marketing, Software",4,1-10,"Costas Alexoglou, Dimitris Raptis, Konstantinos Xanthopoulos, Nikolaos Paschos",4,M&A,2018-11-01,300000,EUR,342075,Pre-Seed,300000,EUR,342075,Pre-Seed,300000,EUR,342075,313000,EUR,356744,"Velocity Partners, COSMOTE Mobile Telecommunications, Anatolia College, Dimitrios Kourtesis",1,4,,Was Acquired,Loceye acquired by Neurons,https://www.crunchbase.com/acquisition/neurons-acquires-loceye--d3fb4063,Neurons,https://www.crunchbase.com/organization/neurons,2022-04-11,day,,,,Acquisition,,Private,,,,,,,,,,,1
Forky,https://www.crunchbase.com/organization/forky,Active,,"Food Processing, Logistics","Athens, Attiki, Greece",Forky is a mobile application that offers healthy and delicious dishes.,"156,625","European Union (EU), Europe, Middle East, and Africa (EMEA)",19094,$1M to $10M,2014-08-01,day,2017-11-03,day,,,For Profit,https://www.forky.gr/,,https://www.facebook.com/forky.gr,https://www.linkedin.com/company/forky,"Forky is a mobile app. Their menu includes dishes, salads, accompaniments, refreshments, and ice cream. They deliver food from restaurants and help people. They provide food delivery and payment method services.","Food and Beverage, Transportation",2,11-50,"Michalis Gkontas, Petros Pitsilis",3,M&A,2016-11-18,,,,Convertible Note,1600000,EUR,1738448,Venture - Series Unknown,2400000,EUR,2604204,2400000,EUR,2604204,"Blue Wire Capital, Leon Yohai, Panos Papadopoulos, Openfund, Dimitris Vranopoulos",2,7,,Was Acquired,Forky acquired by Vivartia,https://www.crunchbase.com/acquisition/vivartia-acquires-forky--bd717d4e,Vivartia,https://www.crunchbase.com/organization/vivartia,2017-11-03,day,,,,Acquisition,,Private,,,,,,,,,,,
Hosthub,https://www.crunchbase.com/organization/hosthub,Active,,"B2B, Hospitality, Real Estate, SaaS, Software, Travel, Vacation Rental","Athens, Attiki, Greece",Channel Manager and PMS for short term rentals,"158,112","European Union (EU), Europe, Middle East, and Africa (EMEA)",,$10M to $50M,2017-01-01,month,,,,,For Profit,https://www.hosthub.com,https://twitter.com/HosthubOfficial,https://www.facebook.com/hosthub/,https://www.linkedin.com/company/hosthub-official,"Hosthub is a software platform that helps vacation rental owners and managers list their properties on multiple channels like Airbnb, Vrbo, Booking.com, Expedia, etc, and then makes sure they never get double bookings by keeping on their calendars synchronized. Besides channel management, Hosthub offers a wide range of tools and products that fall under the general category of PMS (Property Management System) that help hosts across 82 countries manage their properties more efficiently and save time from repetitive tasks.","Other, Real Estate, Software, Travel and Tourism",2,11-50,"Alexander Caravitis, Petros Ziogas",4,Seed,2025-01-10,360000,USD,360000,Pre-Seed,360000,USD,360000,Pre-Seed,1170000,USD,1170000,1170000,USD,1170000,"Velocity Partners, Trado",2,2,,,,,,,,,,,,,,Private,,,,,,,,,,,3
M-hospitality,https://www.crunchbase.com/organization/m-hospitality,Active,,"Apps, Hospitality, Information Technology, Mobile","Ellinikón, Attiki, Greece",M-hospitality is a mobile platform for the hospitality industry that focuses on covering the needs of hotel managers.,"162,082","European Union (EU), Europe, Middle East, and Africa (EMEA)",,Less than $1M,2014-05-26,day,,,,,For Profit,http://www.m-hospitality.com,https://www.twitter.com/m_hospitality,https://www.facebook.com/mhospitality,https://www.linkedin.com/company/m-hospitality,M-hospitality is a mobile platform for the hospitality industry that focuses on covering the needs of hotel managers.,"Apps, Information Technology, Mobile, Software, Travel and Tourism",2,11-50,"Stavros Habakis, Tria Sarafidis",2,Seed,2018-11-14,400000,EUR,452495,Seed,400000,EUR,452495,Seed,400000,EUR,452495,450000,EUR,508559,"EASME, Uni.Fund",1,2,,,,,,,,,,,,,,Private,,,,,,,,,,,
