Funkmartini,https://www.crunchbase.com/organization/funkmartini,Active,,Beauty,"Athens, Attiki, Greece",Funkmartini is an online booking platform for beauty services that enables its users to make their beauty appointments online.,"164,010","European Union (EU), Europe, Middle East, and Africa (EMEA)",10562,$1M to $10M,2013-11-01,day,,,,,For Profit,http://www.funkmartini.gr,https://www.twitter.com/funkmartini,http://www.facebook.com/Funkmartini.gr,https://www.linkedin.com/company/9354178?trk=tyah&trkInfo=clickedVertical%3Acompany%2CclickedEntityId%3A9354178%2Cidx%3A1-1-1%2CtarId%3A1457509380908%2Ctas%3AFUNKMARTINI,"Funkmartini is an online booking platform for beauty services that provides an opportunity for its users to make their beauty appointments online via their computers, tablets, or mobiles. It currently collaborates with more than 1000 beauty salons and professionals.  Funkmartini is based in Athens, Attiki.",Consumer Goods,4,11-50,"Alexia Kotsi, Christodoulos Papachristou, Gregory Stamatopoulos, Grigorios Stamatopoulos",3,,2017-10-26,,,,Undisclosed,,,,Undisclosed,710000,EUR,803062,710000,EUR,803062,"VentureFriends, Uala",1,2,,,,,,,,,,,,,,Private,,,,,,,,,,,
MusicArtMagazine - The Art Social Network,https://www.crunchbase.com/organization/musicartmagazine-the-art-social-network,Active,,"Art, Music","Athens, Attiki, Greece",Mag - The art Social Network Music Art Magazine has been actively involved in the Art industry since 2016,"165,330","European Union (EU), Europe, Middle East, and Africa (EMEA)",11851,,2016-01-05,day,,,,,For Profit,https://www.musicartmagazine.com,https://twitter.com/MusicArtMagazin,https://web.facebook.com/Musicartmagazinemag/,https://www.linkedin.com/company/64523656/admin/,"Mag - The art Social Network Music Art Magazine has been actively involved in the Art industry since 2016 in a supportive manner towards artists, venues and their audience, through the organization of events such as the collective “Art for Change Festival”, the preservation of the MAG Art Blog and a parallel promotion of artistic work via common social networking channels. A need to create an online portal, where artists and venues will be presenting their work and activities, but also have the ability to engage in a specialized network that portrays and promotes the Arts, has emerged through the above activity and is becoming more and more urgent. MAG wishes to bring together cultural carriers and the driving force of culture in an aesthetically pleasing virtual space with the purpose of facilitating its members and the existing market by providing customized services.Finally, MAG wants to create a strong core of human potential, with the help of which it will remodel Art interaction and raise the value of artistic work for the benefit of the artists and the market they represent. The MAG portal will be supporting artistic expression and its digitization in a way that the works and services of the artists and their supporters are accessible from every corner of the earth, safeguarding the immediate, safe and respectful interaction between its members.","Media and Entertainment, Music and Audio",,1-10,,1,Seed,2020-11-14,340000,USD,340000,Seed,340000,USD,340000,Seed,340000,USD,340000,340000,USD,340000,FasterCapital,1,1,,,,,,,,,,,,,,Private,,,,,,,,,,,
Managi,https://www.crunchbase.com/organization/mana-gi-smpc,Active,,"E-Commerce, Food and Beverage, Supply Chain Management","Attikí, Attiki, Greece",Managi has developed an online platform for selling and exporting Food and Beverage products.,"166,008","European Union (EU), Europe, Middle East, and Africa (EMEA)",131 22,$1M to $10M,2017-01-01,year,,,,,For Profit,https://www.managi.eu/,,https://www.facebook.com/TheManaGiProject,https://www.linkedin.com/company/managi/,Managi has developed an online platform for selling and exporting Food and Beverage products.,"Commerce and Shopping, Food and Beverage, Transportation",,1-10,,1,Seed,2020-10-22,50000,USD,50000,Seed,50000,USD,50000,Seed,50000,USD,50000,50000,USD,50000,"Hesham Zreik, FasterCapital, Bashar Hamood",1,3,,,,,,,,,,,,,,Private,,,,,,,,,,,
Nannuka,https://www.crunchbase.com/organization/nannuka,Active,,"Child Care, E-Commerce, Elder Care","Athens, Attiki, Greece","Nannuka.com has been committed to solving the care challenges that impact families, caregivers, employers and care service companies. ","167,504","European Union (EU), Europe, Middle East, and Africa (EMEA)",11523,$1M to $10M,2014-06-01,day,,,,,For Profit,https://www.nannuka.com,http://twitter.com/nannukagr,http://www.facebook.com/Nannuka.gr,https://www.linkedin.com/company/5059553/,"Since launching in 2014, Nannuka.com has been committed to solving the care challenges that impact families, caregivers, employers and care service companies. Started off as the project of three entrepreneurs and mothers who turned their need to find trustworthy child care experts into a thriving online market place and today, Nannuka.com is one of the largest online destination for finding and managing family care, counting thousands registered members in three markets including Greece, Italy and the UK. Providing child care to senior care, housekeeping and more, we provide a variety of services for families and caregivers to find care or find employment. What makes its services unique is its philosophy towards family's safety and customers’ support, both very significant factors of its trustworthiness and success. Nannuka is not yet another database filled with profile listings, with no further elaboration but a safe place where every carer has undergone the Profile Verification procedure consisted of a one to one interview and verification of all their official papers and diplomas. For enterprise clients, Nannuka.com builds employers customized benefits packages covering child care, back up care and senior care  through Nannuka@Work business and serves care businesses with marketing and recruiting support.  Headquartered in Dublin, Ireland, Nannuka.com has offices in Athens, Milan and London area.","Commerce and Shopping, Health Care",3,11-50,"Catherine Lambrou, Lela Dritsa, Natalie Levy",4,Early Stage Venture,2017-09-01,,,,Series A,,,,Series A,795000,EUR,892880,795000,EUR,892880,"VentureFriends, Apostolos Apostolakis, Philipp BRINKMANN",,3,1,Made Acquisitions,,,,,,,,,,,,Private,,,,,,,,,,,
ComeTogether,https://www.crunchbase.com/organization/cometogether,Active,,"Collectibles, Concerts, Music, Ticketing","Thessaloníki, Thessaloniki, Greece",Re-imagine ticketing for maximum revenue and fan engagement,"169,044","European Union (EU), Europe, Middle East, and Africa (EMEA)",,Less than $1M,2018-10-01,month,,,,,For Profit,https://cometogether.network/,https://twitter.com/ComeTogether_RN,https://www.facebook.com/cometogether.network/,https://www.linkedin.com/company/18949918/,ComeTogether’s ticketing solution provides three pillars of innovation to supercharge your next event: - Safe secondary market resale and protection from ticket fraud - Community event marketing tools - let your fans be a marketing channel - Upsell/Cross-sell capability - drive additional revenue opportunities,"Commerce and Shopping, Events, Media and Entertainment, Music and Audio",3,1-10,"Lazaros Penteridis, Stathis Mitskas, Stavros Antoniadis",2,Seed,2025-05-06,,,,Debt Financing,,,,Pre-Seed,,,,,,,"Praxia Capital, TECS Capital",2,2,,,,,,,,,,,,,,Private,,,,,,,,,,,
nup,https://www.crunchbase.com/organization/nup,Active,,"Audio, Social Media, Social Media Marketing","Athens, Attiki, Greece","Nup is an avatar-based app where students can live stream, chat, and connect with like-minded people, from different campuses.","170,176","European Union (EU), Europe, Middle East, and Africa (EMEA)",,,2021-01-04,day,,,,,For Profit,https://www.nupapp.com/,,,https://www.linkedin.com/company/nup/,"nup is a group and one-to-one audio and text social app exclusively for college students. They are on a mission to reinvent how college students communicate. This is their great opportunity to improve how they live, join new communities, and explore different cultures without the boundaries of physical space. They are building a live audio and text universe exclusively for people with .edu emails. nup is based in Athens, Greece and was founded in 2021.","Internet Services, Media and Entertainment, Music and Audio, Sales and Marketing",3,1-10,"Konstantinos Reppas, Sotiris Kaniras, Themis Drakonakis",1,Seed,2021-10-01,275000,USD,275000,Pre-Seed,275000,USD,275000,Pre-Seed,275000,USD,275000,275000,USD,275000,Realize Tech Fund,,1,,,,,,,,,,,,,,Private,,,,,,,,,,,
Nanoplasmas,https://www.crunchbase.com/organization/nanoplasmas,Active,,Nanotechnology,"Agía Paraskeví, Ioannina, Greece",Nanoplasmas is a spin-out company of NCSR Demokritos,"174,229","European Union (EU), Europe, Middle East, and Africa (EMEA)",60037,$1M to $10M,2016-01-01,year,,,,,For Profit,http://www.nanoplasmas.com/,,,https://www.linkedin.com/company/nanoplasmas/,"Nanoplasmas is a spin-out company of NCSR Demokritos, with expertise in micro-nanotechnology and surface engineering, preparing high-end consumables for health, food safety, agricultural and environmental applications.",Science and Engineering,6,1-10,"Dr. Angeliki Tserepi, Dr. Evangelos Gogolides, Dr. Katerina Tsougeni, Dr. Kosmas Ellinas, Dr. Panagiota Petrou, Dr. Sotiris Kakabakos",1,Seed,2019-04-04,150000,EUR,168375,Pre-Seed,150000,EUR,168375,Pre-Seed,150000,EUR,168375,150000,EUR,168375,Uni.Fund,1,1,,,,,,,,,,,,,,Private,,,,,,,,,,,
Ircab,https://www.crunchbase.com/organization/ircab,Active,,"Automotive, Rental, Transportation","Hydra, Attiki, Greece",Ircab is a VTC transport application.,"176,557","European Union (EU), Europe, Middle East, and Africa (EMEA)",,,2021-01-01,year,,,,,For Profit,https://www.ir-cab.com/,,,,"Ircab provides a VTC transport application that offers the possibility of moving even without the internet for their family and business. They serve in the travel, hospitality, auto, transportation, and logistics technology markets.","Commerce and Shopping, Transportation",,11-50,,1,Seed,2022-08-01,50000,USD,50000,Pre-Seed,50000,USD,50000,Pre-Seed,50000,USD,50000,50000,USD,50000,Algerian Startup Fund,1,1,,,,,,,,,,,,,,Private,,,,,,,,,,,
PLiN Nanotechnology,https://www.crunchbase.com/organization/plin-nanotechnology,Active,,Nanotechnology,"Thérmi, Thessaloniki, Greece",PLiN Nanotechnology S.A. is a technology-driven spin-off company,"177,432","European Union (EU), Europe, Middle East, and Africa (EMEA)",57001,,2015-01-01,year,,,,,For Profit,http://www.plin-nanotechnology.com/,,https://www.facebook.com/plinnanotechnology,https://www.linkedin.com/company/plin-nanotechnology-s-a,"Founded in May 2015, PLiN Nanotechnology S.A. is a technology-driven spin-off company of the Aristotle University of Thessaloniki (AUTH), commercializing on decades of R&D. Having access to the latest research and knowledge available, PLiN’s award-winning team has developed a strong portfolio of high-quality nanomaterials for several industry sectors. Recently, PLiN’s focus has been directed towards a line of para-pharmaceuticals, debuting in a brand of nano-enhanced pet products, launched under the trademark NanoSanitasTM, products that are already exported to 9 countries. The Uni.Fund’s investment of €350K will be used for exiting new markets but also for the development of new products.",Science and Engineering,3,1-10,"Alexander Tsouknidas, Dimitrios Papadopoulos, Nikolaos Michailidis",1,Seed,2018-10-23,350000,EUR,401478,Seed,350000,EUR,401478,Seed,350000,EUR,401478,350000,EUR,401478,Uni.Fund,1,1,,,,,,,,,,,,,,Private,,,,,,,,,,,
Pockee,https://www.crunchbase.com/organization/pockee-coupon,Active,,"Advertising, Coupons, E-Commerce, Mobile, Mobile Apps","Athens, Attiki, Greece","Pockee is a mobile coupon platform that brings together FMCG brands & retailers, enabling consumers to get discounts on grocery shopping.","177,669","European Union (EU), Europe, Middle East, and Africa (EMEA)",15344,$1M to $10M,2014-03-01,day,,,,,For Profit,http://www.pockee.com,http://twitter.com/pockeeapp,https://www.facebook.com/pockeeApp,https://www.linkedin.com/company/pockee,"Pockee is a unique mobile coupon platform that brings together FMCG brands with retailers, eventually enabling consumers to get real discounts on their everyday grocery shopping, all on their mobile phone, not having to print or collect paper coupons. Pockee provides to brands & retailers the tools to connect with their consumers in the critical moments of truth (from zero to first to second moment of truth), where the brand & retailer preference choices are made. Founded in Greece, Pockee received its first seed funding in April 2014 and launched its operations in August.","Advertising, Apps, Commerce and Shopping, Mobile, Sales and Marketing, Software",2,1-10,"Kostas Douvras, Zissis Tsairelis",3,Seed,2016-01-01,700000,EUR,760076,Seed,700000,EUR,760076,Seed,1200000,EUR,1328846,1200000,EUR,1328846,"VentureFriends, Melih Odemis, Openfund",2,3,,,,,,,,,,,,,,Private,,,,,,,,,,,
GuestFlip,https://www.crunchbase.com/organization/guestflip,Active,,Internet,"Athens, Attiki, Greece",GuestFlip offers an online reputation management solution for hotels.,"178,297","European Union (EU), Europe, Middle East, and Africa (EMEA)",105 59,,2018-02-22,day,,,,,For Profit,https://guestflip.io,,https://www.facebook.com/guestflip/,https://www.linkedin.com/company/guestflip,GuestFlip is a platform that monitors all reviews in one place and responds to reviews automatically through their AI-generated suggestions. The company's contact modes are mail and physical address.,Internet Services,2,1-10,"Aris P., Stratos Botis",1,Seed,2019-03-27,200000,EUR,225045,Pre-Seed,200000,EUR,225045,Pre-Seed,200000,EUR,225045,200000,EUR,225045,Metavallon VC,1,1,,,,,,,,,,,,,,Private,,,,,,,,,,,
ParkAround,https://www.crunchbase.com/organization/park-around,Active,,"Android, iOS, Mobile, Parking, Public Transportation, Software","Athens, Attiki, Greece",ParkAround helps users to easily find parking spaces in the area that are convenient for them.,"186,356","European Union (EU), Europe, Middle East, and Africa (EMEA)",,Less than $1M,2013-01-01,year,,,,,For Profit,http://www.parkaround.com,http://twitter.com/parkaround,http://www.facebook.com/parkaround,https://www.linkedin.com/company/universal-laminating-and-converting,"ParkAround in an online marketplace that enables drivers to find, book & pay parking spaces online in places like airports, ports & the city center. It's available in Greece (Athens & 4 more cities) and Spain (Barcelona & Malaga). Furthermore, ParkAround recently launched the 1st purely online, SaaS software for car parks named ParkAround CRM.","Mobile, Platforms, Software, Transportation",1,1-10,John Katsiotis,6,Seed,2016-03-16,110000,EUR,123342,Seed,110000,EUR,123342,Seed,550000,EUR,678330,550000,EUR,678330,"Rockstart, PJ Tech Catalyst, Chrysanthos Chrysanthou, Dimitris Vranopoulos, Alexis Pantazis",,6,,,,,,,,,,,,,,Private,,,,,,,,,,,
Hotelgenius,https://www.crunchbase.com/organization/hotelgenius,Active,,"Hotel, Information Technology, Internet, Management Consulting, SaaS","Athens, Attiki, Greece","Hotelgenius is a Digital Management Suite that brings your hotel a unique way to combine online bookings, guest engagement.","186,810","European Union (EU), Europe, Middle East, and Africa (EMEA)",106 80,,2014-01-01,year,,,,,For Profit,https://hotelgenius.co/?lang=en,https://twitter.com/thehotelgenius,https://www.facebook.com/HotelGenius,https://www.linkedin.com/company/hotelgenius,"Hotelgenius is an online platform that brings your hotel a unique way to combine online bookings, guest engagement, and striking website themes.  A world first, Hotelgenius simplifies your online operations by allowing you to use and control  three fundamental features from just one user-friendly, quick to implement and fully integrated management suite. A unified solution that’s cost-effective, easier-than-ever to use, and exactly what your hotel needs to stand out from competition. With a Dashboard as your go-to platform and your Digital Management Suite’s framework, Hotelgenius maximizes your hotel’s revenue potential by uniting:","Information Technology, Internet Services, Professional Services, Software, Travel and Tourism",1,11-50,Theodoros Theodoropoulos,1,Seed,2016-01-29,570000,EUR,617353,Seed,570000,EUR,617353,Seed,570000,EUR,617353,570000,EUR,617353,Elikonos Capital Partners,,1,,,,,,,,,,,,,,Private,,,,,,,,,,,
DIB-IN,https://www.crunchbase.com/organization/dib-in,Active,,"E-Commerce, Online Auctions, Online Games","Sérres, Serrai, Greece",Dib-in.com is the world's first real price dropping auction game in the world.,"189,991","European Union (EU), Europe, Middle East, and Africa (EMEA)",62100,,2021-01-26,day,,,,,For Profit,https://dib-in.com,,https://www.facebook.com/gaming/dibincom,https://www.linkedin.com/company/53503861/admin/,,"Commerce and Shopping, Gaming",,1-10,,1,Seed,2021-02-22,18000,USD,18000,Pre-Seed,18000,USD,18000,Pre-Seed,18000,USD,18000,18000,USD,18000,"Hesham Zreik, FasterCapital, Bashar Hamood",1,3,,,,,,,,,,,,,,Private,,,,,,,,,,,
Do it for me P.C,https://www.crunchbase.com/organization/do-it-for-me-p-c,Active,,Digital Marketing,"Vólos, Magnisia, Greece",Doitforme.eu generates customers that are ready to buy for small businesses and service providers.,"195,134","European Union (EU), Europe, Middle East, and Africa (EMEA)",38333,,2019-04-01,day,,,,,For Profit,https://app.doitforme.eu/,,https://www.facebook.com/doitforme.eu/,https://www.linkedin.com/company/doitforme-eu/,"Doitforme.eu is an online tool that helps solopreneurs & small businesses generate valuable leads.  Small businesses, solopreneurs and service providers without marketing knowledge answer some questionnaires and doitforme ""converts"" those answers to running advertisement campaigns on Facebook, Instagram & Google. Our aim is to revolutionize the Digital Marketing Industry for solopreneurs & small businesses by disrupting the need of digital agencies.",Sales and Marketing,1,11-50,Luigi - Dimitrios Goulianos,1,Seed,2019-02-12,100000,USD,100000,Seed,100000,USD,100000,Seed,100000,USD,100000,100000,USD,100000,FasterCapital,1,1,,,,,,,,,,,,,,Private,,,,,,,,,,,
e-NIOS,https://www.crunchbase.com/organization/e-nios,Active,,"Analytics, Enterprise Software, Genetics, Health Care, Information Technology","Kallithéa, Attiki, Greece",e-NIOS delivers unsupervised interpretation of genomic data,"200,804","European Union (EU), Europe, Middle East, and Africa (EMEA)",17671,$1M to $10M,2014-01-01,year,,,,,For Profit,http://www.e-nios.com/,https://www.twitter.com/e_nios,https://www.facebook.com/enioscom,https://www.linkedin.com/company/e-nios,"e-NIOS develops a platform for unsupervised analysis and interpretation of  Genomics data of multiple sources (multi -omics), with applications in Biotechnology, Drug Discovery and Personalized Medicine. ","Biotechnology, Data and Analytics, Health Care, Information Technology, Software",3,1-10,"Aristotelis Chatziioannou, Eleftherios Pilalis, Ioannis Valavanis",2,Seed,2016-01-10,100000,EUR,109312,Seed,100000,EUR,109312,Seed,200000,EUR,233373,200000,EUR,233373,"PJ Tech Catalyst, IQbility",1,2,,,,,,,,,,,,,,Private,,,,,,,,,,,
Speen,https://www.crunchbase.com/organization/speen,Active,,"Consumer Electronics, Energy, Hardware, Internet of Things, Transportation","Athens, Attiki, Greece",Design and manufacture of e-bike systems,"201,429","European Union (EU), Europe, Middle East, and Africa (EMEA)",,Less than $1M,2017-07-06,day,,,,,For Profit,http://speenbikes.com/,,https://www.facebook.com/speenbikes/,https://www.linkedin.com/company/speenbikes/?viewAsMember=true,"Speen develops cutting-edge electric bike systems. Its latest product line-up of e-bike conversion kits, the seamless Flow Series, is class-leading in energy density worldwide, offering an optimal balance among range, weight and volume. The next generation, will incorporate an intuitive IoT setup with the adoption of advanced sensory systems that monitor and promote product performance, personal health, and urban living. Speen already collaborates with established bike manufacturers and joins forces with key players in the green energy and mobility sectors to generate a unique pull model towards sustainable personal transport and smarter ecosystems.","Consumer Electronics, Energy, Hardware, Internet Services, Transportation",3,1-10,"Iakovos Dimitriou, Nikolas Charalampous, Spyros Kitos",1,Seed,2018-07-24,200000,EUR,233692,Pre-Seed,200000,EUR,233692,Pre-Seed,200000,EUR,233692,200000,EUR,233692,Metavallon VC,1,1,,,,,,,,,,,,,,Private,,,,,,,,,,,
FoodOxys,https://www.crunchbase.com/organization/foodoxys,Active,,,"Lárisa, Larisa, Greece",FoodOxys is a developer of an antioxidant measuring device designed for preventing disease.,"213,707","European Union (EU), Europe, Middle East, and Africa (EMEA)",41335,,2018-02-01,month,,,,,For Profit,https://www.foodoxys.com,,,https://www.linkedin.com/company/foodoxyspcspinoff,"FoodOxys is the creator of antioxidant-measuring equipment intended to prevent disease. Their device combines a colorimeter and an application to evaluate the antioxidant capacity and the status of human blood, enabling users to create personalized diet plans.",,2,1-10,"Dimitris Kouretas, Fotios Tekos",1,Seed,2019-09-17,250000,EUR,276848,Pre-Seed,250000,EUR,276848,Pre-Seed,250000,EUR,276848,250000,EUR,276848,Uni.Fund,1,1,,,,,,,,,,,,,,Private,,,,,,,,,,,
Ferto,https://www.crunchbase.com/organization/ferto,Active,,"Delivery, Delivery Service, Grocery, Last Mile Transportation, Logistics","Athens, Attiki, Greece",Ferto is a q-commerce & logistics as a service platform that delivers whatever-you-can-think-of from local merchants within 30 minutes.,"225,592","European Union (EU), Europe, Middle East, and Africa (EMEA)",16675,$1M to $10M,2021-06-05,day,,,,,For Profit,https://ferto.app/,https://twitter.com/Fertoapp,https://www.facebook.com/fertoapp,https://www.linkedin.com/company/ferto-app,Ferto is an on-demand delivery platform that connects consumers with local stores through a crowdsourced courier network.,"Administrative Services, Food and Beverage, Transportation",2,11-50,"Ekin Burak Ozturk, Michael Sfictos",1,Seed,2022-01-13,,,,Seed,,,,Seed,,,,,,,Plug and Play,1,1,,,,,,,,,,,,,,Private,,,,,,,,,,,
HOMLI,https://www.crunchbase.com/organization/homli,Active,,"Consumer, Real Estate, Real Estate Brokerage","Athína, Attiki, Greece","HOMLI is a modern, scalable real estate brokerage that helps European consumers sell, rent, and buy real estate.","228,426","European Union (EU), Europe, Middle East, and Africa (EMEA)",118 54,,2021-01-01,year,,,,,For Profit,https://thehomli.com,,https://web.facebook.com/thehomli,https://www.linkedin.com/company/homli,"Founded in late 2021, HOMLI is a modern, scalable real estate brokerage that helps European consumers sell, rent, and buy real estate. We are building Europe's first 'Zestimate' platform to finally bring transparency around property prices and neighborhood dynamics to all consumers across Europe. We couple that with an in-house brokerage team that is more effective, more productive, and more pleasant to work with. We combine the most advanced technological innovations with a holistically new approach to operations to re-invent a brokerage industry that hasn't evolved in decades, and introduce a brand new real estate experience for European consumers.","Other, Real Estate",3,11-50,"Antonis Mitropoulos, Nikos Legbelos, Tim Ioannidis",3,Seed,2024-05-21,,,,Angel,,,,Angel,,,,,,,"Y Combinator, Plug and Play, Goodwater Capital, Liquid 2 Ventures, Roman Smolevskiy",,6,,,,,,,,,,,,,,Private,,,,,,,,,,,
Ex Machina,https://www.crunchbase.com/organization/weatherxm,Active,,"Apps, Information Services, Information Technology","Athens, Attiki, Greece",Building smarter solutions with Internet of Things technologies,"230,448","European Union (EU), Europe, Middle East, and Africa (EMEA)",,Less than $1M,2015-01-01,year,,,,,For Profit,http://exm.gr/,http://twitter.com/WeatherXM,http://www.facebook.com/weatherxm,http://www.linkedin.com/company/weather-ex-machina,"Ex Machina (EXM P.C.) is a Private Company founded in 2015 to solve challenging problems that matter, and to participate in the IoT revolution with innovative approaches enabled by open source technologies and community engagement.","Apps, Information Technology, Software",3,1-10,"Manolis Nikiforakis, Stratos Theodorou, Vassilis Chrysos",4,Seed,2018-09-26,,,,Seed,,,,Seed,10000,EUR,11113,46000,EUR,50793,"SOSV, HAX",,2,,,,,,,,,,,,,,Private,,,,,,,,,,,
