Morbax HR,https://www.crunchbase.com/organization/morbax-hr,Active,,"Analytics, Artificial Intelligence (AI), B2B, Big Data, Human Resources, Machine Learning, Neuroscience, Recruiting, Skill Assessment, Staffing Agency","Kyiv, Kyyiv, Ukraine","Morbax HR is a digital talent management platform that offers candidates sourcing, assessment, and individual career development services.","197,485","Europe, Middle East, and Africa (EMEA)",03037,Less than $1M,2016-01-01,year,,,,,For Profit,http://www.morbax.com/,https://x.com/Morbax_HR,https://www.facebook.com/morbax/,https://www.linkedin.com/company/morbax-hr/,"Morbax develops HRM platform based on neuroscience technology to transform the way companies source, evaluate, making decisions and hire candidates and provide personal digital career development for talents. Morbax HR is powered by the technology of machine learning and applies candidate data from various sources and put it together creating Digital Talent Profile updating data 24/7 & helping HR-people to review future talents better. Morbax automatically collects and verify Company, Employees, ideal candidate on market and ideal employee data, analyze it and use when Company has an open position to short-list best-match evaluated talents to a recruiter within 1-minute after request.","Administrative Services, Artificial Intelligence (AI), Biotechnology, Data and Analytics, Education, Other, Professional Services, Science and Engineering, Software",1,11-50,Mamed Khalilov,1,Seed,2018-01-15,150000,USD,150000,Seed,150000,USD,150000,Seed,150000,USD,150000,150000,USD,150000,Quake Capital Partners,1,1,1,Made Acquisitions,,,,,,,,,,,,Private,,,,,,,,,,,1
CoinyPay,https://www.crunchbase.com/organization/coinypay,Active,,"Chatbot, Financial Services, FinTech, Internet of Things, Software","Kyiv, Kyyiv, Ukraine",CoinyPay is a technology company that offers chatbot solutions for banks and payment service providers to enable one-tap transactions.,"197,917","Europe, Middle East, and Africa (EMEA)",01001,,2017-01-01,year,,,,,For Profit,https://coinypay.com/,https://x.com/coinypay,https://www.facebook.com/coinypay/,https://www.linkedin.com/company/coinypay/,CoinyPay is a chatbot technology provider for Banks and Payment Service Providers that enables one-tap payments.,"Financial Services, Internet Services, Software",1,1-10,Michael Skrychevsky,1,Seed,2018-03-06,20000,EUR,24832,Pre-Seed,20000,EUR,24832,Pre-Seed,20000,EUR,24832,20000,EUR,24832,Startup Wise Guys,1,1,,,,,,,,,,,,,,Private,,,,,,,,,,,
SnackArt,https://www.crunchbase.com/organization/snackart,Active,,Food and Beverage,"Sofia, Grad Sofiya, Bulgaria",SnackArt is a manufacturer of handmade snacks and bars.,"198,641","European Union (EU), Europe, Middle East, and Africa (EMEA)",,,2016-01-19,day,,,,,For Profit,https://scala.bg/,,https://www.facebook.com/scalasnacks/?locale=bg_BG,,"SnackArt is a food product manufacturer with a concentration on handmade snacks and pickles. The company sells healthy, one-of-a-kind sweet and savory snacks that provide balanced nutrition and energy when consumed in between meals.",Food and Beverage,,11-50,,1,Seed,2020-12-10,40000,EUR,48574,Seed,40000,EUR,48574,Seed,40000,EUR,48574,40000,EUR,48574,Innovation Capital,1,1,,,,,,,,,,,,,,Private,,,,,,,,,,,
The Case,https://www.crunchbase.com/organization/the-case,Active,,,"Sofia, Grad Sofiya, Bulgaria",Art gallery franchise organizing Paint&Wine events.,"199,242","European Union (EU), Europe, Middle East, and Africa (EMEA)",,,2018-01-01,year,,,,,For Profit,https://dalivino.bg/,,,https://www.linkedin.com/company/dali-vino/a,,,,11-50,,1,Seed,2021-07-22,50000,EUR,58863,Pre-Seed,50000,EUR,58863,Pre-Seed,50000,EUR,58863,50000,EUR,58863,Innovation Capital,1,1,,,,,,,,,,,,,,Private,,,,,,,,,,,
RE3D,https://www.crunchbase.com/organization/re3d,Active,,"3D Printing, Manufacturing","Varna, Varna, Bulgaria",Manufacturer of 3D printing materials that offer high performance and durability while considering the environment as an important factor.,"201,023","European Union (EU), Europe, Middle East, and Africa (EMEA)",,,2017-01-01,year,,,,,For Profit,https://re3d.eu/en/,,,https://www.linkedin.com/company/re3d/,,Manufacturing,,1-10,,1,Seed,2022-08-18,25000,EUR,25223,Pre-Seed,25000,EUR,25223,Pre-Seed,25000,EUR,25223,25000,EUR,25223,Innovation Capital,,1,,,,,,,,,,,,,,Private,,,,,,,,,,,
worig,https://www.crunchbase.com/organization/worig,Active,,"Financial Services, FinTech, InsurTech, Rental Property","Zagreb, Grad Zagreb, Croatia",Worig is a finance company that builds trust between landlords and tenants by providing secure downpayment options and credit scores.,"201,400","European Union (EU), Europe, Middle East, and Africa (EMEA)",10000,,2019-04-01,month,,,,,For Profit,https://worig.com,https://twitter.com/worigapp,https://facebook.com/worigapp,https://www.linkedin.com/company/worig/,Worig is a platform that builds trust between landlords and tenants by providing secure down payment options and verifiable credit scores. The company was founded by Nino Ćosić and Deni Ćosić in 2019.,"Financial Services, Real Estate",2,11-50,"Deni Ćosić, Nino Cosic",2,Seed,2019-09-01,50000,EUR,54952,Seed,50000,EUR,54952,Seed,65000,EUR,71647,65000,EUR,71647,"Fil Rouge Capital (FRC), EIT Digital Accelerator",2,2,,,,,,,,,,,,,,Private,,,,,,,,,,,
COMA.CO Atelier,https://www.crunchbase.com/organization/coma-co-atelier,Active,,"Apparel, E-Commerce, Fashion, Fast-Moving Consumer Goods, Handmade","Sofia, Grad Sofiya, Bulgaria",Bulgarian brand for high quality hand made products.,"202,600","European Union (EU), Europe, Middle East, and Africa (EMEA)",,,2020-01-01,year,,,,,For Profit,https://comacoatelier.com/en-bg,,,,,"Clothing and Apparel, Commerce and Shopping, Consumer Goods, Design, Real Estate",,,,1,Seed,2023-11-01,25000,EUR,26466,Pre-Seed,25000,EUR,26466,Pre-Seed,25000,EUR,26466,25000,EUR,26466,Innovation Capital,1,1,,,,,,,,,,,,,,Private,,,,,,,,,,,
Kinestica,https://www.crunchbase.com/organization/kinestica,Active,,"Health Care, Manufacturing, Medical Device, Robotics","Ljubljana, Ljubljana Urban Commune, Slovenia","Kinestica designs, creates, and globally distributes innovative medical devices.","202,893","European Union (EU), Europe, Middle East, and Africa (EMEA)",1000,$1M to $10M,2012-01-01,year,,,,,For Profit,http://kinestica.com/,https://twitter.com/kinestica,https://www.facebook.com/kinestica,http://www.linkedin.com/company/kinestica,"Kinestica designs, creates, and globally distributes innovative medical devices. Its portfolio includes sensor based and virtual reality-aided therapeutic systems primarily designed for neurorehabilitation.  Its banner product is Bimeo. Its story began in 2009 when a first prototype is successfully tested with a hemiparetic patient. In late 2010 a positive international patent search report is issued for the invention of the Bimeo system. After that two more Bimeo prototypes are developed and tested in a preclinical study at the University rehabilitation institute - Soca. Several case studies have been conducted in cooperation with the Faculty of health science, UL. Kinestica company was founded in the early 2012. Their mission: to bring this amazing technology to the market and help patients with neuromotoric disorders to improve quality of their lives. Kinestica acquired all intellectual property rights for the invention of the BiMeo system in late 2012 and won several awards for the development of innovative products throughout 2012 and 2013. Most of Kinestica’s core team people have been members of the Laboratory of robotics - RoboLab at the Faculty of electrical engineering, UL. RoboLab has a more than forty year long tradition of biomedical research and engineering. In 2013 Kinestica has filed patent applications in European union, USA, Japan and China. At the end of the same year they have started certification process according to 93/42 eec medical device directive which is mandatory for all medical device manufacturers entering European market. Their plan is to launch BiMeo in late 2014.","Hardware, Health Care, Manufacturing, Science and Engineering, Software",3,1-10,"Aleš Hribar, Jaka Ziherl, Matjaž Mihelj",4,Seed,2016-12-01,50000,EUR,53319,Grant,450000,EUR,520583,Seed,450000,EUR,520583,582000,EUR,681251,"LAUNCHub Ventures, Day One Capital, EASME, Healthbox, Microsoft ScaleUp Tel Aviv",2,6,,,,,,,,,,,,,,Private,,,,,,,,,,,
TrenerGo,https://www.crunchbase.com/organization/trenergo,Active,,Training,"Sofia, Grad Sofiya, Bulgaria",TrenerGo provides people with online fitness training.,"202,926","European Union (EU), Europe, Middle East, and Africa (EMEA)",,,2019-11-22,day,,,,,For Profit,https://trenergo.com,,https://www.facebook.com/trenergoapp,https://www.linkedin.com/company/trenergo,"TrenerGo is a web platform dedicated to fitness professionals, helping them deliver improved online coaching through sport. They help instructors create, edit, and monetize workout videos. They offer tech support via chat and email, as well as video and pricing services.",Education,,1-10,,1,Seed,2020-11-02,25000,EUR,29104,Pre-Seed,25000,EUR,29104,Pre-Seed,25000,EUR,29104,25000,EUR,29104,Innovation Capital,1,1,,,,,,,,,,,,,,Private,,,,,,,,,,,
Sensika Technologies,https://www.crunchbase.com/organization/sensika-technologies,Active,,"Cloud Computing, Enterprise Software, Information Technology, Software","Sofia, Grad Sofiya, Bulgaria",The Fastest External Intelligence Solution,"203,717","European Union (EU), Europe, Middle East, and Africa (EMEA)",1517,$1M to $10M,2011-01-01,year,,,,,For Profit,http://www.sensika.com,http://twitter.com/SensikaTech,https://www.facebook.com/sensikatechnologies,https://www.linkedin.com/company/sensika-technologies/,"Sensika is a unique media monitoring solution that combines the capabilities of an advanced software platform with the expertise of a team of developers, AI specialists and media analysts. By turning media content from various sources into actionable, timely insights, Sensika empowers people to make informed decisions.","Information Technology, Internet Services, Software",6,11-50,"Aleksandar Kanchev, Atanas Youroukov, Konstantin Christoff, Nenko Ivanov, Stayko Shivarov, Vassil Velichkov",7,,2023-10-18,,,,Venture - Series Unknown,,,,Venture - Series Unknown,496000,EUR,654819,521000,EUR,681390,"Eleven Ventures, HR Capital, Bakalov Investment Group",1,3,,,,,,,,,,,,,,Private,,,,,,,,,,,
NM Term,https://www.crunchbase.com/organization/nm-term,Active,,,"Sofia, Grad Sofiya, Bulgaria",Termo paint,"204,010","European Union (EU), Europe, Middle East, and Africa (EMEA)",,,2020-12-21,day,,,,,For Profit,,,,,,,,,,1,Seed,2021-01-14,25000,EUR,30377,Pre-Seed,25000,EUR,30377,Pre-Seed,25000,EUR,30377,25000,EUR,30377,Innovation Capital,1,1,,,,,,,,,,,,,,Private,,,,,,,,,,,
Healthyco Pathology,https://www.crunchbase.com/organization/healthyco-pathology,Active,,Health Care,"Sofia, Grad Sofiya, Bulgaria",Digital pathology service offering digitisation of pathology samples for further analysis by accredited professionals.,"204,066","European Union (EU), Europe, Middle East, and Africa (EMEA)",,,2019-01-01,year,,,,,For Profit,,,,https://www.linkedin.com/company/healthyco-pathology/about/,,Health Care,,1-10,,1,Seed,2021-11-05,25000,EUR,28879,Pre-Seed,25000,EUR,28879,Pre-Seed,25000,EUR,28879,25000,EUR,28879,Innovation Capital,1,1,,,,,,,,,,,,,,Private,,,,,,,,,,,
Yanado,https://www.crunchbase.com/organization/yanado,Active,,"Information Services, Product Design, Project Management","Sofia, Grad Sofiya, Bulgaria",Task management & team collaboration inside Gmail.,"204,397","European Union (EU), Europe, Middle East, and Africa (EMEA)",1000,,2013-01-01,year,,,,,For Profit,http://www.yanado.com/,http://twitter.com/YanadoTool,http://www.facebook.com/yanado.tool,https://www.linkedin.com/in/tihomirleka,"Yanado is a task management and collaboration tool built on top of the Gmail and Google apps. People live in their email client. Instead of taking them out of it, we bring everything they need to get the job done within their Gmail. Yanado improves the way you work by integrating task management with your Gmail. It also improves the team collaboration within your Gmail, the place you live in. It's deeply integrated with Gmail and Google apps. It looks like a Gmail and it feels like a Gmail.","Administrative Services, Design, Information Technology, Other",2,1-10,"Ivan Mojsilovic, Prvoslav Savic",4,Seed,2015-12-01,100000,EUR,106286,Seed,100000,EUR,106286,Seed,150000,EUR,174814,200000,EUR,237179,Eleven Ventures,,1,,,,,,,,,,,,,,Private,,,,,,,,,,,
2Parts,https://www.crunchbase.com/organization/2parts,Active,,Software,"Sofia, Grad Sofiya, Bulgaria",2Parts is a software company that offers an automated document processing tool.,"204,759","European Union (EU), Europe, Middle East, and Africa (EMEA)",,,2020-10-05,day,,,,,For Profit,http://2parts.tech,,,https://www.linkedin.com/company/2parts/,2Parts operates as a software development company that uses artificial intelligence software for day-to-day accounting processes. They provide an automated document processing tool that enables businesses to efficiently reduce accounts payable costs.,Software,,,,1,Seed,2021-01-19,50000,EUR,60698,Pre-Seed,50000,EUR,60698,Pre-Seed,50000,EUR,60698,50000,EUR,60698,Innovation Capital,1,1,,,,,,,,,,,,,,Private,,,,,,,,,,,
Econic One,https://www.crunchbase.com/organization/eljoy-bikes,Active,,"E-Commerce, Electric Vehicle, Retail, Sporting Goods","Varna, Varna, Bulgaria",Econic One is an electric bicycles company.,"204,873","European Union (EU), Europe, Middle East, and Africa (EMEA)",9000,,2014-01-01,year,,,,,For Profit,https://econicone.come-com,,,https://www.linkedin.com/company/econic-one/,"Econic One creates high-tech electric bikes that provide complete mobility. It is a perfect combination of a genuine riding experience and innovative technology to take you anywhere. It is app enabled, equipped with smart security features, and extremely versatile.","Commerce and Shopping, Sports, Transportation",2,11-50,"Galin Bonev, Vladimir Davchev",3,Early Stage Venture,2022-06-24,1700000,EUR,1794519,Series A,1700000,EUR,1794519,Series A,2255000,EUR,2401495,2255000,EUR,2401495,"Eleven Ventures, Innovation Capital, Integral Venture Partners",2,3,,,,,,,,,,,,,,Private,,,,,,,,,,,
Goopi,https://www.crunchbase.com/organization/goopi,Active,,"Advertising, Digital Media, Marketing","Foetz, Luxembourg, Luxembourg","Goopi is a cloud based portal allowing to create and customize professional video ads, in less than 10 min for a fraction of the price.","205,755","European Union (EU), Europe, Middle East, and Africa (EMEA)",L-3895,$1M to $10M,2014-01-01,day,,,,,For Profit,http://goopi.tv/,https://twitter.com/goopitv,https://www.facebook.com/goopitv/?ref=hl,https://www.linkedin.com/company/goopi?trk=biz-companies-cym,"Goopi is a cloud based portal allowing to create and customize professional video ads, in less than 10 min for a fraction of the price. Goopi is a patented technology which lives in the cloud and like many cloud services, improves in performance the more computers are connected to it.","Advertising, Media and Entertainment, Sales and Marketing",3,1-10,"Eran Tal, Rami Bahar, Yoram Ben Porat",3,Seed,2016-03-01,50000,GBP,69781,Seed,50000,GBP,69781,Seed,1550000,GBP,2350477,1550000,GBP,2350477,"Seedrs, Collider",2,2,,,,,,,,,,,,,,Private,,,,,,,,,,,
Swayde,https://www.crunchbase.com/organization/swayde,Active,,"Freelance, Social Network, Web Apps","Sofia, Grad Sofiya, Bulgaria",Swayde is a platform designed for musicians to connect and share opportunities for freelance work.,"205,807","European Union (EU), Europe, Middle East, and Africa (EMEA)",,,2020-07-30,day,,,,,For Profit,https://swayde.app/home,,,,"Swayde is an app-design company. They provide services for musicians, and engineers to connect people. An online inquiry form is available on the company's website.","Apps, Internet Services, Professional Services, Software",,11-50,,1,Seed,2020-10-22,25000,EUR,29537,Pre-Seed,25000,EUR,29537,Pre-Seed,25000,EUR,29537,25000,EUR,29537,Innovation Capital,1,1,,,,,,,,,,,,,,Private,,,,,,,,,,,
Coherent Labs,https://www.crunchbase.com/organization/coherent-labs,Active,,"Computer, Internet, Online Games, Software","Sofia, Grad Sofiya, Bulgaria","Coherent UI, a product of Coherant Labs, helps game developers without any programming knowledge implement user interfaces more easily.","205,901","European Union (EU), Europe, Middle East, and Africa (EMEA)",1505,Less than $1M,2012-01-01,year,,,,,For Profit,http://coherent-labs.com,http://twitter.com/CoherentLabs,http://www.facebook.com/CoherentLabs,http://www.linkedin.com/company/coherent-labs,"Coherent Labs was founded in 2012 and provides advanced technology and tools for game developers. Developers are saving time and effort using Coherent Labs middleware solutions, and can focus on gameplay, content and other important aspects of their games. As a company, we heavily invest in R&D and support to make sure our customers always have access to the best tools and first-class experience.","Consumer Electronics, Gaming, Hardware, Internet Services, Software",4,11-50,"Dimitar Trendafilov, Georgi Petrov, Nikola Vasilev, Stoyan Nikolov",2,Seed,2015-10-05,200000,EUR,223798,Seed,200000,EUR,223798,Seed,500000,EUR,613701,500000,EUR,613701,"LAUNCHub Ventures, Bogomil Balkansky",,2,,,,,,,,,,,,,,Private,,,,,,,,,,,2
E2P,https://www.crunchbase.com/organization/e2p-db7c,Active,,"Digital Entertainment, Gamification, Gaming, Software","Sofia, Grad Sofiya, Bulgaria","E2P is an unique multi-platform MMA gaming experience, combining RPG and TCG systems with sports-manager elements.","206,329","European Union (EU), Europe, Middle East, and Africa (EMEA)",,,2017-01-01,year,,,,,For Profit,http://eskape2play.com,,,,"E2P is an unique multi-platform MMA gaming experience, combining RPG and TCG systems with sports-manager elements.","Gaming, Media and Entertainment, Software",,1-10,,1,Seed,2021-10-13,25000,EUR,28992,Pre-Seed,25000,EUR,28992,Pre-Seed,25000,EUR,28992,25000,EUR,28992,Innovation Capital,1,1,,,,,,,,,,,,,,Private,,,,,,,,,,,
2Polyglot,https://www.crunchbase.com/organization/2polyglot,Active,,"Copywriting, Freelance, Translation Service, Tutoring","Dnipropetrovsk, Dnipropetrovs'ka Oblast', Ukraine","2Polyglot is a freelance platform that offers translation, copywriting, tutoring marketplace, and affiliate program services.","206,906","Europe, Middle East, and Africa (EMEA)",49000,$1M to $10M,2015-03-24,day,,,,,For Profit,https://2polyglot.com,https://www.twitter.com/polyglotservice,https://www.facebook.com/2polyglot,https://www.linkedin.com/company/2polyglot,"2Polyglot is a new website which was created to bring translators, copywriters, guides and tutors into one platform. The main idea of the project is to make freelancing easier and more effective for translators and others who work with foreign languages. Registered users will have four optional tabs (Translator, Copywriter, Guide and Tutor) where they can fill in the boxes with basic info, upload their portfolios with translations, unique texts, photos, certificates and other supporting documents. Copywriters will have an extra SHOP option to upload their unique texts for customers to browse and purchase. For copyright protection, all texts will only have an extract of 30 words available for free browsing. 2Polyglot was created for easy and effective work for both Lingualancers and Customers. The project team has developed very user-friendly website design with handy info boxes. It will take a Customer only 10 seconds to fully browse and evaluate a Lingualancer’s profile. There is also a special SAFE DEAL option created for quality control of orders. All monies will be withheld before Customer’s confirmation of an order completion. In case of a failed order all monies will be reimbursed. 2Polyglot also developed a system of order evaluation and profile ranking. The platform will be a great advantage for young lingualancers who will have a chance to earn high profile rankings under equal conditions with experienced professionals. 2Polyglot will run in English, German, French, Spanish, Italian, Russian, Ukraininan, Polish and Chinese. The platform will keep being free of charge after the launch. The 2Polyglot team includes experienced linguists and translators whose main goal is to create a perfect system for effective work in the translations field.","Content and Publishing, Education, Professional Services",1,11-50,Andrey Prudko,1,Seed,2016-03-18,94000,USD,94000,Seed,94000,USD,94000,Seed,94000,USD,94000,94000,USD,94000,"FasterCapital, Hesham Zreik",1,2,,,,,,,,,,,,,,Private,,,,,,,,,,,
Green Charger,https://www.crunchbase.com/organization/green-charger,Active,,Charging Infrastructure,"Sofia, Grad Sofiya, Bulgaria",Green Charger is an electric vehicle charging platform.,"206,987","European Union (EU), Europe, Middle East, and Africa (EMEA)",,,2017-08-15,day,,,,,For Profit,https://www.greencharger.net,,,https://www.linkedin.com/company/green-charger,"Green Charger Network is a charging station. They integrate CPOs and MSPs to enable mutual identification and payment methods. Their services include making payments, ensuring safe transactions, accounting, and reporting.",Transportation,,,,1,Seed,2020-10-22,25000,EUR,29537,Pre-Seed,25000,EUR,29537,Pre-Seed,25000,EUR,29537,25000,EUR,29537,Innovation Capital,1,1,,,,,,,,,,,,,,Private,,,,,,,,,,,
Edoms,https://www.crunchbase.com/organization/tool-domains-2,Active,,"Advertising, Affiliate Marketing, Information Technology, Internet, Marketing, Marketplace, Personal Branding, SEM, Web Development, Web Hosting","Sofia, Grad Sofiya, Bulgaria","Edoms is a startup disrupting the domain name market. Current revenue is $600,000 per month. Looking for funding to increase market share.","207,181","European Union (EU), Europe, Middle East, and Africa (EMEA)",1463,Less than $1M,2014-01-01,year,,,,,For Profit,https://edoms.com/,http://twitter.com/ToolDomains,https://www.facebook.com/edomscom,https://www.linkedin.com/company/edoms/,"Edoms group is a complete domains research company, backed by a database of (almost) all domain names that exist or existed (ever). Its Seo.Domains brand is the largest provider of authority expired domain names for SEO purposes. Edoms owns 200,000+ valuable domains. Over 35,000 domains have been sold and the monthly revenue of the company is $600,000+","Advertising, Commerce and Shopping, Information Technology, Internet Services, Sales and Marketing, Software",2,101-250,"Kalin Karakehayov, Metodi Darzev",2,Seed,2015-08-25,99999,EUR,115238,Seed,99999,EUR,115238,Seed,149998,EUR,181837,149998,EUR,181837,LAUNCHub Ventures,,1,,,,,,,,,,,,,,Private,,,,,,,,,,,
Kool and Konscious,https://www.crunchbase.com/organization/kool-and-konscious,Active,,,"Sofia, Grad Sofiya, Bulgaria",Kool and Konscious is a global marketplace for ethical fashion brands.,"208,467","European Union (EU), Europe, Middle East, and Africa (EMEA)",1000,,2019-01-01,year,,,,,For Profit,http://koolandkonscious.com,https://twitter.com/KoolnKonscious,https://www.facebook.com/koolandkonscious/,https://www.linkedin.com/company/kool-and-konscious/,Kool and Konscious is a B2B global platform that connects modern-day shoppers with sustainable and ethical fashion brands. They provide an AI platform to make sustainable shopping as easy as going to the shop next door.,,3,1-10,"Boryana Uzunova, Eva Vucheva, Ufuk Inci",1,Seed,2019-11-18,200000,EUR,221470,Seed,200000,EUR,221470,Seed,200000,EUR,221470,200000,EUR,221470,Eleven Ventures,1,1,,,,,,,,,,,,,,Private,,,,,,,,,,,
Kaya Foods,https://www.crunchbase.com/organization/kaya-foods,Active,,"Alternative Protein, E-Commerce, Food and Beverage, Food Processing, Organic Food, Plant-Based Foods, Retail","Radnevo, Stara Zagora, Bulgaria",Evolved Foods is an online retail store that manufactures and delivers plant based proteins and non-dairy products for local vegan cuisines.,"209,240","European Union (EU), Europe, Middle East, and Africa (EMEA)",,,2017-01-01,year,,,,,For Profit,https://www.kayafoods.eu/,,https://www.facebook.com/kayafoods.eu/,,,"Commerce and Shopping, Food and Beverage",,,,1,Seed,2022-03-25,25000,EUR,27459,Pre-Seed,25000,EUR,27459,Pre-Seed,25000,EUR,27459,25000,EUR,27459,Innovation Capital,1,1,,,,,,,,,,,,,,Private,,,,,,,,,,,
Price radar,https://www.crunchbase.com/organization/price-radar,Active,,,"Sofia, Grad Sofiya, Bulgaria",AI based platform for real estate valuations.,"210,876","European Union (EU), Europe, Middle East, and Africa (EMEA)",,,2020-11-24,day,,,,,For Profit,,,,,,,,,,1,Seed,2021-02-08,50000,EUR,60255,Pre-Seed,50000,EUR,60255,Pre-Seed,50000,EUR,60255,50000,EUR,60255,Innovation Capital,1,1,,,,,,,,,,,,,,Private,,,,,,,,,,,
